"","ocurrenceID","database","collectionCode","basisOfRecord","scientificName","genus","specificEpithet","eventDate","year","month","day","startDayOfYear","dayCode","phenology","buds","flowers","fruit","vegetative","unknown","phenologyNotes","generalNotes","stateProvince","county","municipality","locality","decimalLatitude","decimalLongitude","coordinateUncertaintyInMeters","picture","pictureChecked","inBCBrange","phenOne","phenTwo","phenThree","PhenFour","locationNotes","coordinateSource","coordinateUncertaintySource","compiler"
"1",1019966,"NE","A","specimen","Chelone glabra","Chelone","glabra","8/18/1983",1983,8,18,230,1983230,"flowering","unknown","Y","N"," "," ","","","Vermont","Orleans","Westfield","ca 9.6 km (6 miles) SE of vermont route 118 on vermont route 58, just nw of the lowell-westfield town line",44.838762,-72.498774,4000,"Y","Y","Y","Yes","Flowering","","","","town","best estimate","JA"
"2",3848605,"MW","APSC","specimen","Chelone glabra","Chelone","glabra","9/6/1984",1984,9,6,250,1984250,"flowering","unknown","Y","N"," "," ","","","Tennessee","Stewart","","Land Between the Lakes. Across from old Hopewell Church site, upper Bear Creek. Large stand in wet thickets.",36.575809,-87.902616,4000,"Y","Y","Y","Yes","Flowering","","","couldn't find exact locality","locality","best estimate","JA"
"3",3848606,"MW","APSC","specimen","Chelone glabra","Chelone","glabra","9/21/1985",1985,9,21,264,1985264,"flowering","unknown","Y","N"," "," ","","","Kentucky","Trigg","","Land Between the Lakes. Hematite Lake. Scattered all around lake in mesic-swampy thickets.",36.895547,-88.044618,800,"Y","Y","Y","Yes","Flowering","","","","locality","best estimate","JA"
"4",3848607,"MW","APSC","specimen","Chelone glabra","Chelone","glabra","9/17/1988",1988,9,17,261,1988261,"buds ","Y","N","N"," "," ","","","Tennessee","Stewart","","Land Between the Lakes. Wet woods at Crockett Bay. Infrequent.",36.66294,-87.922213,900,"Y","Y","Y","Yes","Flowering","Early","","","locality","best estimate","JA"
"5",3848609,"MW","APSC","specimen","Chelone glabra","Chelone","glabra","9/30/2011",2011,9,30,273,2011273,"flowering","unknown","Y","N"," "," ","","","Tennessee","Lewis","","Dry branch seep.",35.527281,-87.493096,24485,"Y","Y","Y","Yes","Flowering","","","couldn't find locality, used county","county","geolocate","JA"
"6",3848612,"MW","APSC","specimen","Chelone glabra","Chelone","glabra","10/15/1947",1947,10,15,288,1947288,"buds","Y","N","N"," "," ","","","Tennessee","Montgomery","","Marks' Slough, 7 mi. SE of Clarksville, moist shaded border of swamp.",36.435836,-87.311514,18081,"Y","Y","Y","Yes","Flowering","Early","","need to change latlon based on new locality info?. couldn't find exact locality. Said sse in online record, other picture actually has sse on paper","town+direction+distance","geolocate","JA"
"7",3848613,"MW","APSC","specimen","Chelone glabra","Chelone","glabra","9/23/1949",1949,9,23,266,1949266,"flowering","unknown","Y","N"," "," ","","","Tennessee","Montgomery","","Marks' Slough, 7 mi. SSE of Clarksville, wet ground near spring.",36.435836,-87.311514,18081,"Y","Y","Y","Yes","Flowering","","","see note 3848613. couldn't find exact locality","town+direction+distance","geolocate","JA"
"8",3848614,"MW","APSC","specimen","Chelone glabra","Chelone","glabra","9/28/1967",1967,9,28,271,1967271,"flowering","unknown","Y","N"," "," ","","","Tennessee","Montgomery","","Foster's Cave Creek; on bank next to water.",36.496858,-87.382887,32425,"Y","Y","Y","Yes","Flowering","","","couldn't find locality, used county","county","geolocate","JA"
"9",3848615,"MW","APSC","specimen","Chelone glabra","Chelone","glabra","9/10/1979",1979,9,10,253,1979253,"flowering and fruit???","unknown","Y","Y"," "," ","recheck phenology: very unsure","same day/place, different phenology?","Tennessee","Robertson","","Cedar Hill Swamp east of Cedar Hill. Infrequent in wet woods south of railroad.",36.546065,-86.992282,1000,"Y","Y","Y","Yes","Both","","","","locality","best estimate","JA"
"10",3848616,"MW","APSC","specimen","Chelone glabra","Chelone","glabra","9/12/1991",1991,9,12,255,1991255,"flowering","unknown","Y","N"," "," ","","","Tennessee","Stewart","","Elk Creek Swamp between Carlisle and Dover, within the Cross Creeks National Wildlife Refuge. Dense herbaceous vegetation with scattered shrubs-trees, mostly in shallow water or boggy soil. Frequent.",36.47927,-87.737497,7000,"Y","Y","Y","Yes","Flowering","","","couldn't find exact locality","locality","best estimate","JA"
"11",3848617,"MW","APSC","specimen","Chelone glabra","Chelone","glabra","9/30/2002",2002,9,30,273,2002273,"flowering","unknown","Y","N"," "," ","","","Tennessee","Humphreys","","Low woods at Possum Creek off of Cuba Landing Road and intersection of Rustic Valley Road; TN national wildlife refuge, duck river unit",35.889445,-87.911408,1700,"Y","Y","Y","Yes","Flowering","","","need to change latlon based on new locality info? (name of wildlife refuge)","locality","best estimate","JA"
"12",3848619,"MW","APSC","specimen","Chelone glabra","Chelone","glabra","10/10/1976",1976,10,10,284,1976284,"flowering and fruit","unknown","Y","Y"," "," ","","","Tennessee","Polk","Reliance","Along S. bank of Hiwassee R. ca. 2 mi. E. of jct. Hwy 30 and co. rd. 2518 in Reliance.",35.181084,-84.469798,2000,"Y","Y","Y","Yes","Both","","","","locality","best estimate","JA"
"13",3848622,"MW","APSC","specimen","Chelone glabra","Chelone","glabra","9/20/1968",1968,9,20,264,1968264,"flowering","unknown","Y","N"," "," ","","same day/place, some have different phenology","North Carolina","Watauga","","Roadbanks and deciduous woods along Co. Rt. 1102, on Rich Mt., 3.4 mi. west of Howard's Knob.",NA,NA,NA,"Y","Y","Y","Yes","Flowering","","","","","","JA"
"14",3848623,"MW","APSC","specimen","Chelone glabra","Chelone","glabra","10/1/1981",1981,10,1,274,1981274,"fruit","N","N","Y"," "," ","description: ""flowering, Sterile staminode whitish."" Picture: fruit","same day/place, different phenology","Georgia","Gilmer","","Rich Mountain Wildlife Management Area. Roadside at Stanley Gap. Beside small stream, wet soil. Near Stanley Gap. ",34.78056,-84.312407,400,"Y","Y","Y","Yes","Flowering","","","","locality","best estimate","JA"
"15",3848905,"MW","APSC","specimen","Chelone glabra","Chelone","glabra","9/23/1971",1971,9,23,266,1971266,"flowering and ?","maybe","Y","maybe"," "," ","recheck phenology: unsure","","Tennessee","Montgomery","","Austin Peay State University Farm. Swampy woods below recreation area. Not common.",36.570677,-87.33947,800,"Y","Y","Y","Yes","Flowering","","","","locality","best estimate","JA"
"16",15420728,"MW","APSC","specimen","Chelone glabra","Chelone","glabra","9/21/2011",2011,9,21,264,2011264,"flowering and ???","maybe","Y","maybe"," "," ","recheck phenology: very unsure","","Tennessee","Polk","","from W84?31'52.551"", N35?5'31.818; to  W84°30'19.377"" N35?4'25.569;",35.09217,-84.53126,NA,"Y","Y","Y","Yes","Flowering","","","need to change latlon based on new locality info (between two lat lon points)","provided by observer","","JA"
"17",8491837,"MW","AVCH","specimen","Chelone glabra","Chelone","glabra","10/6/2003",2003,10,6,279,2003279,"flowering","unknown","Y","N"," "," ","","","Virginia","Alexandria (City)","alexandria","dora kelley nature park, deep ravine north of main trail (sanger avenue trail) between terminus of sangar avenue and the chambliss tributary",38.830913,-77.132106,400,"Y","Y","Y","Yes","Flowering","","","","locality","best estimate","JA"
"18",1523651,"NE","BART","specimen","Chelone glabra","Chelone","glabra","9/19/2009",2009,9,19,262,2009262,"flowering","unknown","Y","N"," "," ","","","Connecticut","Fairfield","Brookfield","41.43.10N, 73.38.09W",41.46753,-73.39235,5427,"Y","Y","Y","Yes","Flowering","","","has coordinates from observer, but they are for wrong state","provided","provided","JA"
"19",1523652,"NE","BART","specimen","Chelone glabra","Chelone","glabra","9/26/2006",2006,9,26,269,2006269,"flowering and fruit?","unknown","Y","Y"," "," ","recheck phenology: unsure","","Connecticut","Fairfield","Stamford","Bartlett Arboretum Forest 41?08.103N, 73?32.896W (translates to 41.16194444, -73.78222222)",41.134412,-73.551015,NA,"Y","Y","Y","Yes","Both","",""," coordinates provided by observer don't match up with location description: used description for location","locality","","JA"
"20",1523657,"NE","BART","specimen","Chelone glabra","Chelone","glabra","8/22/1979",1979,8,22,234,1979234,"flowering","unknown","Y","N"," "," ","","","Connecticut","Fairfield","Stamford","Bartlett Arboretum. Edge of stream, north of pond",41.133584,-73.550013,300,"Y","Y","Y","Yes","Flowering","","","","locality","best estimate","JA"
"21",7719603,"MW","BDI","specimen","Chelone glabra","Chelone","glabra","9/28/1890",1890,9,28,271,1890271,NA,"unknown","unknown","unknown"," "," ","","","Iowa","Muscatine","Lake","Lake twp.",41.4544,-91.1786,3000,"N",NA,"Y","Not Scorable","","","","","town","geolocate","JA"
"22",7719604,"MW","BDI","specimen","Chelone glabra","Chelone","glabra","8/30/1920",1920,8,30,243,1920243,NA,"unknown","unknown","unknown"," "," ","","","Iowa","Cerro Gordo","","Mason City. Buffalo Slough.",43.170984,-93.177082,400,"N",NA,"Y","Not Scorable","","","","","locality","best estimate","JA"
"23",7719605,"MW","BDI","specimen","Chelone glabra","Chelone","glabra","9/17/1950",1950,9,17,260,1950260,NA,"unknown","unknown","unknown"," "," ","","","Iowa","Muscatine","","left hand side of road from rt. 61 to Pine Mill",41.4787,-91.033636,11000,"N",NA,"Y","Not Scorable","","","","","locality","best estimate","JA"
"24",7719606,"MW","BDI","specimen","Chelone glabra","Chelone","glabra","9/21/1953",1953,9,21,264,1953264,NA,"unknown","unknown","unknown"," "," ","","","Iowa","Muscatine","Lake","SW1/4 Sec. 15. Lake Twp.",NA,NA,NA,"N",NA,"Y","Not Scorable","","","","PLSS","","","JA"
"25",7719607,"MW","BDI","specimen","Chelone glabra","Chelone","glabra","8/13/1954",1954,8,13,225,1954225,NA,"unknown","unknown","unknown"," "," ","","","Iowa","Muscatine","Lake","Lindell's Woods. Lake twp.",41.4544,-91.1786,3000,"N",NA,"Y","Not Scorable","","","","couldn't find locality, used town","town","geolocate","JA"
"26",7719608,"MW","BDI","specimen","Chelone glabra","Chelone","glabra","9/3/1954",1954,9,3,246,1954246,NA,"unknown","unknown","unknown"," "," ","","","Iowa","Muscatine","Lake","Sec. 15 Lake Twp.",NA,NA,NA,"N",NA,"Y","Not Scorable","","","","PLSS","","","JA"
"27",7719609,"MW","BDI","specimen","Chelone glabra","Chelone","glabra","9/2/1961",1961,9,2,245,1961245,NA,"unknown","unknown","unknown"," "," ","","","Iowa","Scott","","Credit Island. west of pond.",41.49434,-90.6196,700,"N",NA,"Y","Not Scorable","","","","","locality","best estimate","JA"
"28",7719614,"MW","BDI","specimen","Chelone glabra","Chelone","glabra","8/30/1886",1886,8,30,242,1886242,NA,"unknown","unknown","unknown"," "," ","","","Maryland","","","McDonogh",39.391217,-76.764419,3036,"N",NA,"Y","Not Scorable","","",""," may not be right","locality","geolocate","JA"
"29",7719615,"MW","BDI","specimen","Chelone glabra","Chelone","glabra","8/20/1890",1890,8,20,232,1890232,NA,"unknown","unknown","unknown"," "," ","","","Michigan","Gratiot","Alma","",43.37892,-84.659727,3201,"N",NA,"Y","Not Scorable","","","","","town","geolocate","JA"
"30",7719617,"MW","BDI","specimen","Chelone glabra","Chelone","glabra","9/7/1891",1891,9,7,250,1891250,NA,"unknown","unknown","unknown"," "," ","","","Massachusetts","Franklin","","Leverett",42.452033,-72.501476,3036,"N",NA,"Y","Not Scorable","","","","","town","geolocate","JA"
"31",7719618,"MW","BDI","specimen","Chelone glabra","Chelone","glabra","7/13/1892",1892,7,13,195,1892195,NA,"unknown","unknown","unknown"," "," ","","","New Hampshire","Grafton","Lincoln","near The Flume",44.102811,-71.652724,2000,"N",NA,"Y","Not Scorable","","","","","locality","best estimate","JA"
"32",14418627,"MW","BENN","specimen","Chelone glabra","Chelone","glabra","8/23/1975",1975,8,23,235,1975235,"flowering","unknown","Y","N"," "," ","","","Vermont","Bennington","Bennington","Marl swamp off the Silk Road, in Bennington.",42.897098,-73.222502,3410,"Y","Y","Y","Yes","Flowering","","","","provided","provided","JA"
"33",1304986,"NE","BRU","specimen","Chelone glabra","Chelone","glabra","8/17/1942",1942,8,17,229,1942229,"flowering","unknown","Y","N"," "," ","","","Rhode Island","Providence","","edge of marsh, butler''s asylum",41.843393,-71.380437,300,"Y","Y","Y","Yes","Flowering","","","","locality","best estimate","JA"
"34",1309451,"NE","BRU","specimen","Chelone glabra","Chelone","glabra","10/3/2014",2014,10,3,276,2014276,"flowering and fruit","unknown","Y","Y"," "," ","","","Rhode Island","Providence","lime rock","",41.928555,-71.449706,NA,"Y","Y","Y","Yes","Both","","","","town","","JA"
"35",1315807,"NE","BRU","specimen","Chelone glabra","Chelone","glabra","8/25/1906",1906,8,25,237,1906237,"flowering and fruit???","unknown","Y","Y"," "," ","recheck phenology: very unsure","","Rhode Island","Washington","south kingston","great swamp, near fighting ground",41.467956,-71.594331,4000,"Y","Y","Y","Yes","Both","","","","locality","best estimate","JA"
"36",1318211,"NE","BRU","specimen","Chelone glabra","Chelone","glabra","9/24/1893",1893,9,24,267,1893267,"flowering","unknown","Y","N"," "," ","","","Rhode Island","Providence","cranston","randall's pond, cranston",41.788418,-71.468788,300,"Y","Y","Y","Yes","Flowering","","","","locality","best estimate","JA"
"37",1319115,"NE","BRU","specimen","Chelone glabra","Chelone","glabra","9/14/1900",1900,9,14,257,1900257,"flowering and fruit?","unknown","Y","Y"," "," ","recheck phenology: unsure","","Rhode Island","Providence","","cat swamp",41.8326002,-71.388111,NA,"Y","Y","Y","Yes","Both","","","","locality","","JA"
"38",1320203,"NE","BRU","specimen","Chelone glabra","Chelone","glabra","9/11/1878",1878,9,11,254,1878254,"flowering and ???","maybe","Y","maybe"," "," ","recheck phenology: very unsure","","Rhode Island","Providence","N. scituate","",41.832626,-71.587111,NA,"Y","Y","Y","Yes","Flowering","","","","town","","JA"
"39",1322969,"NE","BRU","specimen","Chelone glabra","Chelone","glabra","8/27/1885",1885,8,27,239,1885239,"flowering and ???","maybe","Y","maybe"," "," ","recheck phenology: very unsure","","Rhode Island","Providence","cranston","",41.779823,-71.43728,8927,"Y","Y","Y","Yes","Flowering","","","","town","geolocate","JA"
"40",1501237,"NE","BSN","specimen","Chelone glabra","Chelone","glabra","9/2/1911",1911,9,2,245,1911245,"flowering","unknown","Y","N"," "," ","","","Massachusetts","Middlesex","Sherborn","",42.238986,-71.369781,NA,"Y","Y","Y","Yes","Flowering","","","","town","","JA"
"41",1501241,"NE","BSN","specimen","Chelone glabra","Chelone","glabra","9/11/1908",1908,9,11,255,1908255,"flowering","unknown","Y","N"," "," ","","","Massachusetts","Norfolk","Cohasset","",42.241768,-70.803654,3036,"Y","Y","Y","Yes","Flowering","","","","town","geolocate","JA"
"42",1501243,"NE","BSN","specimen","Chelone glabra","Chelone","glabra","9/1/1901",1901,9,1,244,1901244,"flowering","unknown","Y","N"," "," ","","","Massachusetts","Bristol","Fall River","Steep Brook",41.7420771,-71.1291145,NA,"Y","Y","Y","Yes","Flowering","","","","locality","","JA"
"43",1501245,"NE","BSN","specimen","Chelone glabra","Chelone","glabra","8/14/1911",1911,8,14,226,1911226,"vegetative","N","N","N","Y"," ","","","Massachusetts","Dukes","Chilmark","",41.343169,-70.74475,3036,"Y","Y","Y","No","","","","","town","geolocate","JA"
"44",10157553,"MW","BUT","specimen","Chelone glabra","Chelone","glabra","9/17/1949",1949,9,17,260,1949260,"flowering","unknown","Y","N"," "," ","","","Indiana","Fulton","","Southwest corner of Bruce Lake.",41.073697,-86.465007,1000,"N",NA,"Y","Yes","Flowering","","","","locality","best estimate","JA"
"45",10157554,"MW","BUT","specimen","Chelone glabra","Chelone","glabra","10/6/1945",1945,10,6,279,1945279,"flowering","unknown","Y","N"," "," ","","","Indiana","Carroll","","North side of Rd. 25, 2.0 miles northeast of Delphi.",40.608029,-86.648017,1000,"N",NA,"Y","Yes","Flowering","","","","town+direction+distance","best estimate","JA"
"46",10157581,"MW","BUT","specimen","Chelone glabra","Chelone","glabra","9/8/1945",1945,9,8,251,1945251,"flowering","unknown","Y","N"," "," ","","same day/close together, same phenology","Indiana","Henry","","ca. 1.0 mile east of Moreland.",39.997545,-85.232157,2928,"N",NA,"Y","Yes","Flowering","","","","town+direction+distance","geolocate","JA"
"47",10157616,"MW","BUT","specimen","Chelone glabra","Chelone","glabra","9/20/1941",1941,9,20,263,1941263,"flowering","unknown","Y","N"," "," ","","","Indiana","Miami","","South side of Mississinewa River, 0.5 mile south of Peoria.",40.724886,-85.959803,3479,"N",NA,"Y","Yes","Flowering","","","","town+direction+distance+locality","geolocate","JA"
"48",10158552,"MW","BUT","specimen","Chelone glabra","Chelone","glabra","9/11/1929",1929,9,11,254,1929254,"flowering","unknown","Y","N"," "," ","","","Indiana","Lake","","Near Gary.",41.59337,-87.346427,11196,"N",NA,"Y","Yes","Flowering","","","","town","geolocate","JA"
"49",10158621,"MW","BUT","specimen","Chelone glabra","Chelone","glabra","9/19/1936",1936,9,19,263,1936263,"flowering","unknown","Y","N"," "," ","","","Indiana","","","Melfolfa.",NA,NA,NA,"N",NA,"Y","Yes","Flowering","","","can't find locality","","","JA"
"50",10158623,"MW","BUT","specimen","Chelone glabra","Chelone","glabra","9/7/1925",1925,9,7,250,1925250,"flowering","unknown","Y","N"," "," ","","","Indiana","Porter","Tremont","Dunes at Tremont.",41.648649,-87.043644,3036,"N",NA,"Y","Yes","Flowering","","","","town","geolocate","JA"
"51",10161574,"MW","BUT","specimen","Chelone glabra","Chelone","glabra","9/2/1930",1930,9,2,245,1930245,"flowering","unknown","Y","N"," "," ","","same day/close together, same phenology","Indiana","Jackson","","4 miles south of Seymore.",38.901234,-85.890255,10417,"N",NA,"Y","Yes","Flowering","","","","town+direction+distance","geolocate","JA"
"52",10164554,"MW","BUT","specimen","Chelone glabra","Chelone","glabra","9/13/1933",1933,9,13,256,1933256,"flowering","unknown","Y","N"," "," ","","","Indiana","Porter","","Just west of Dunes State Park.",41.634539,-87.110518,5000,"N",NA,"Y","Yes","Flowering","","","","locality","best estimate","JA"
"53",10164611,"MW","BUT","specimen","Chelone glabra","Chelone","glabra","10/11/1936",1936,10,11,285,1936285,"flowering","unknown","Y","N"," "," ","","","Indiana","Morgan","","4 miles east of Rd. 37 about 15 miles southeast of Martinsville.",39.274771,-86.446992,5000,"N",NA,"Y","Yes","Flowering","","","","locality","best estimate","JA"
"54",10173641,"MW","BUT","specimen","Chelone glabra","Chelone","glabra","9/17/1938",1938,9,17,260,1938260,"flowering","unknown","Y","N"," "," ","","","Indiana","Jefferson","","2.6 miles north of Bryantsburg.",38.923582,-85.374404,5320,"N",NA,"Y","Yes","Flowering","","","","town+direction+distance","geolocate","JA"
"55",10173724,"MW","BUT","specimen","Chelone glabra","Chelone","glabra","8/22/1938",1938,8,22,234,1938234,"flowering","unknown","Y","N"," "," ","","","Indiana","","","Back of Baptist Church, Tenants Harbor.",NA,NA,NA,"N",NA,"Y","Yes","Flowering","","","can't find locality","","","JA"
"56",10176592,"MW","BUT","specimen","Chelone glabra","Chelone","glabra","9/11/1930",1930,9,11,254,1930254,"flowering","unknown","Y","N"," "," ","","same day/close together, different phenology?","Indiana","","","7.5 miles northwest of Greenfield Mills.",41.827402,-85.328527,NA,"N",NA,"Y","Yes","Flowering","","","7.5 miles nnw of Greenfield Mills put location in Michigan-recorded coordinates anyway","town+direction+distance","","JA"
"57",10183622,"MW","BUT","specimen","Chelone glabra","Chelone","glabra","9/17/1993",1993,9,17,260,1993260,"flowering","unknown","Y","N"," "," ","","","Indiana","Allen","Lafayette ","Fogwell Forest Nature Preserve: end of Whippoorwill Dr., 1.5 miles east of I-69 via Lower Huntington Rd.; northeast corner of Lafayette Twp., southeast of Ft. Wayne.",41.000056,-85.238998,1200,"N",NA,"Y","Yes","Flowering","","","","locality","best estimate","JA"
"58",10183626,"MW","BUT","specimen","Chelone glabra","Chelone","glabra","9/12/1942",1942,9,12,255,1942255,"flowering","unknown","Y","N"," "," ","","","Indiana","Porter","","Along Nickel Plate RR., about 1 mile east of Valparaiso, just east of Rd. 49.",41.47683,-87.015931,500,"N",NA,"Y","Yes","Flowering","","","","locality","best estimate","JA"
"59",10190620,"MW","BUT","specimen","Chelone glabra","Chelone","glabra","9/16/1939",1939,9,16,259,1939259,"flowering","unknown","Y","N"," "," ","","","Indiana","Kosciusko","","South end of Loon Lake, 4 miles west of Silver Lake.",41.080967,-85.966499,400,"N",NA,"Y","Yes","Flowering","","","","locality","best estimate","JA"
"60",10197468,"MW","BUT","specimen","Chelone glabra","Chelone","glabra","9/2/1944",1944,9,2,246,1944246,"flowering","unknown","Y","N"," "," ","","same day/close together, same phenology","Indiana","Randolph","","East side of Rd. 1, 6.2 miles north of Modoc.",40.135185,-85.126354,7911,"N",NA,"Y","Yes","Flowering","","","","town+direction+distance+locality","geolocate","JA"
"61",10197518,"MW","BUT","specimen","Chelone glabra","Chelone","glabra","9/29/1935",1935,9,29,272,1935272,"flowering","unknown","Y","N"," "," ","","","Indiana","Morgan","","16 miles southeast of Martinsville.",39.263637,-86.216015,12230,"N",NA,"Y","Yes","Flowering","","","","town+direction+distance","geolocate","JA"
"62",10197522,"MW","BUT","specimen","Chelone glabra","Chelone","glabra","9/12/1929",1929,9,12,255,1929255,"flowering","unknown","Y","N"," "," ","","","Indiana","Warren","West Lebanon.","",40.270037,-87.38668,1622,"N",NA,"Y","Yes","Flowering","","","","town","geolocate","JA"
"63",10198033,"MW","BUT","specimen","Chelone glabra","Chelone","glabra","9/13/1930",1930,9,13,256,1930256,"flowering","unknown","Y","N"," "," ","","same day/place, same phenology","Indiana","Morgan","","Waverly Marsh.",39.556992,-86.271379,3036,"N",NA,"Y","Yes","Flowering","","","assuming that waverly is the place in morgan county","town","geolocate","JA"
"64",10198339,"MW","BUT","specimen","Chelone glabra","Chelone","glabra","9/25/1943",1943,9,25,268,1943268,"flowering","unknown","Y","N"," "," ","","","Indiana","Shelby","","1.3 miles northeast of Blue Ridge.",39.532538,-85.618258,3450,"N",NA,"Y","Yes","Flowering","","","","town+direction+distance","geolocate","JA"
"65",10198436,"MW","BUT","specimen","Chelone glabra","Chelone","glabra","9/8/1945",1945,9,8,251,1945251,"flowering","unknown","Y","N"," "," ","","same day/close together, same phenology","Indiana","Randolph","","At Cabin Creek and Rd. 1, 6 miles north of Modoc.",40.138831,-85.127316,200,"N",NA,"Y","Yes","Flowering","","","","locality","best estimate","JA"
"66",10198459,"MW","BUT","specimen","Chelone glabra","Chelone","glabra","9/14/1940",1940,9,14,258,1940258,"flowering","unknown","Y","N"," "," ","","","Indiana","Kosciusko","","2 miles northeast of Atwood.",41.281368,-85.948012,5042,"N",NA,"Y","Yes","Flowering","","","","town+direction+distance","geolocate","JA"
"67",10198671,"MW","BUT","specimen","Chelone glabra","Chelone","glabra","9/4/1931",1931,9,4,247,1931247,"flowering","unknown","Y","N"," "," ","","","Indiana","Pulaski","Medaryville.","",41.080595,-86.891963,887,"N",NA,"Y","Yes","Flowering","","","","town","geolocate","JA"
"68",10198971,"MW","BUT","specimen","Chelone glabra","Chelone","glabra","9/28/1935",1935,9,28,271,1935271,"flowering","unknown","Y","N"," "," ","","","Indiana","Henry","","2.6 miles north of Newcastle.",39.96662,-85.370248,5926,"N",NA,"Y","Yes","Flowering","","","","town+direction+distance","geolocate","JA"
"69",5605063,"MW","CALVIN","specimen","Chelone glabra","Chelone","glabra","10/21/2004",2004,10,21,295,2004295,"fruit","N","N","Y"," "," ","","","Michigan","Kent","Kentwood","N side of Plaster Creek, 1/2 mi W of Shaffer Ave. city of kentwood.sec 22. T6N, R11W",42.888628,-85.596833,400,"Y","Y","Y","Yes","Fruiting","","","","PLSS/locality","best estimate","JA"
"70",11036623,"MW","CALVIN","specimen","Chelone glabra","Chelone","glabra","9/16/2014",2014,9,16,259,2014259,NA,"unknown","unknown","unknown"," "," ","","didn't see record when went back to check picture","Michigan","Kent","","just east of village of Cannonsburg near jct. Ramsdell Ave. and Cannonsburg Rd.",43.053366,-85.467147,200,"Y","?","Y","Not Scorable","","","","","locality","best estimate","JA"
"71",113004,"NE","CBS","specimen","Chelone glabra","Chelone","glabra","8/12/1972",1972,8,12,225,1972225,"flowering","unknown","Y","N"," "," ","","","Connecticut","","Bethlehem","Green Hill Road, on land of A. Harger",41.33129,-72.6229,12311,"Y","Y","Y","Yes","Flowering","","","need to change latlon based on new locality info -online record said town was madison, county was new haven","provided","provided","JA"
"72",113005,"NE","CBS","specimen","Chelone glabra","Chelone","glabra","9/30/1972",1972,9,30,274,1972274,"flowering","unknown","Y","N"," "," ","","","Connecticut","Litchfield","Canaan","Roadside - Route 7 & 163",41.95988,-73.31005,6688,"Y","Y","Y","Yes","Flowering","","","","provided","provided","JA"
"73",113007,"NE","CBS","specimen","Chelone glabra","Chelone","glabra","8/8/1903",1903,8,8,220,1903220,"flowering","unknown","Y","N"," "," ","","","Connecticut","New Haven","North Guilford","",41.367,-72.717,5062,"Y","Y","Y","Yes","Flowering","","","","provided","provided","JA"
"74",113008,"NE","CBS","specimen","Chelone glabra","Chelone","glabra","9/8/1906",1906,9,8,251,1906251,"flowering","unknown","Y","N"," "," ","","","Connecticut","New Haven","North Guilford","",41.367,-72.717,5062,"Y","Y","Y","Yes","Flowering","","","","provided","provided","JA"
"75",113009,"NE","CBS","specimen","Chelone glabra","Chelone","glabra","9/7/1907",1907,9,7,250,1907250,"flowering","unknown","Y","N"," "," ","","same day/place, same phenology","Connecticut","Hartford","Hartford","Gully Brook region",41.766,-72.68343,5423,"Y","Y","Y","Yes","Flowering","","","","provided","provided","JA"
"76",113011,"NE","CBS","specimen","Chelone glabra","Chelone","glabra","8/30/1893",1893,8,30,242,1893242,"flowering","unknown","Y","N"," "," ","","same day/place, same phenology","Connecticut","Hartford","Rocky Hill","",41.6571,-72.6633,5282,"Y","Y","Y","Yes","Flowering","","","","provided","provided","JA"
"77",113012,"NE","CBS","specimen","Chelone glabra","Chelone","glabra","9/6/1915",1915,9,6,249,1915249,"flowering","unknown","Y","N"," "," ","","","Connecticut","Windham","Scotland","",41.6979,-72.088,5661,"Y","Y","Y","Yes","Flowering","","","","provided","provided","JA"
"78",113013,"NE","CBS","specimen","Chelone glabra","Chelone","glabra","9/14/1898",1898,9,14,257,1898257,"flowering and fruit","unknown","Y","Y"," "," ","","same day/place, same phenology","Connecticut","Hartford","Southington","Andrews Street",41.60489,-72.88003,7659,"Y","Y","Y","Yes","Both","","","","provided","provided","JA"
"79",113014,"NE","CBS","specimen","Chelone glabra","Chelone","glabra","9/11/1948",1948,9,11,255,1948255,"flowering","unknown","Y","N"," "," ","","","Connecticut","Hartford","Suffield","Beech swamp",41.9945,-72.6788,8341,"Y","Y","Y","Yes","Flowering","","","need to change latlon based on new locality info? Not sure if name of swamp or description","provided","provided","JA"
"80",113015,"NE","CBS","specimen","Chelone glabra","Chelone","glabra","8/31/1940",1940,8,31,244,1940244,"flowering and fruit?","unknown","Y","Y"," "," ","recheck phenology: unsure","same day/place, some have different phenology","Connecticut","Hartford","Suffield","Beech swamp",41.9945,-72.6788,8341,"Y","Y","Y","Yes","Both","","","need to change latlon based on new locality info? Not sure if name of swamp or description","provided","provided","JA"
"81",113016,"NE","CBS","specimen","Chelone glabra","Chelone","glabra","8/24/1931",1931,8,24,236,1931236,"flowering","unknown","Y","N"," "," ","","","Connecticut","Hartford","Suffield","",41.9945,-72.6788,8341,"Y","Y","Y","Yes","Flowering","","","","provided","provided","JA"
"82",113017,"NE","CBS","specimen","Chelone glabra","Chelone","glabra","8/20/1902",1902,8,20,232,1902232,"flowering","unknown","Y","N"," "," ","","date: given as August 20-25, 1902","Connecticut","Tolland","Union","",41.993,-72.1603,7295,"Y","Y","Y","Yes","Flowering","","","coordinates from town","provided","provided","JA"
"83",113018,"NE","CBS","specimen","Chelone glabra","Chelone","glabra","9/7/1907",1907,9,7,250,1907250,"flowering","unknown","Y","N"," "," ","","","Connecticut","New Haven","Waterbury","",41.5583,-73.036,6630,"Y","Y","Y","Yes","Flowering","","","","provided","provided","JA"
"84",113019,"NE","CBS","specimen","Chelone glabra","Chelone","glabra","9/1/1908",1908,9,1,245,1908245,"flowering","unknown","Y","N"," "," ","","","Connecticut","Hartford","Windsor","Poquonnock",41.87129,-72.67366,7828,"Y","Y","Y","Yes","Flowering","","","coordinates from town","provided (town level)","provided","JA"
"85",113020,"NE","CBS","specimen","Chelone glabra","Chelone","glabra","8/15/1946",1946,8,15,227,1946227,NA,"unknown","unknown","unknown"," "," ","","","Connecticut","Windham","Woodstock","",41.9694,-72.0221,9799,"N",NA,"Y","Not Scorable","","","","","provided","provided","JA"
"86",270333,"NE","CBS","specimen","Chelone glabra","Chelone","glabra","9/11/2015",2015,9,11,254,2015254,"flowering","unknown","Y","N"," "," ","","","Connecticut","New London","Franklin","",41.6153,-72.1432,6011,"Y","Y","Y","Yes","Flowering","","","","provided","provided","JA"
"87",270334,"NE","CBS","specimen","Chelone glabra","Chelone","glabra","9/16/1910",1910,9,16,259,1910259,"flowering and ?","maybe","Y","maybe"," "," ","recheck phenology: unsure","","Connecticut","Fairfield","Wilton","",41.2069,-73.4399,6445,"Y","Y","Y","Yes","Flowering","","","","provided","provided","JA"
"88",1125556,"NE","CCNL","specimen","Chelone glabra","Chelone","glabra","9/4/1895",1895,9,4,247,1895247,"flowering","unknown","Y","N"," "," ","","","Connecticut","New London","Waterford","valley of (muillars brook?) ",41.3417,-72.13597,3036,"Y","Y","Y","Yes","Flowering","",""," couldn't read locality on sheet, lat lon found from town","town","geolocate","JA"
"89",1127510,"NE","CCNL","specimen","Chelone glabra","Chelone","glabra","9/19/2007",2007,9,19,262,2007262,"flowering and fruit???","unknown","Y","Y"," "," ","recheck phenology: very unsure","","Connecticut","New Haven","New London","stones ranch millitary reservation, roadside and opening N end of transect ca. 605 m nw of rappeling tower ca. 1.5 km N of airstrip (UTM and then six sets of numbers)",41.377959,-72.259148,300,"Y","Y","Y","Yes","Both","",""," also has UTM coordinates-couldn't figure them out","locality","best estimate","JA"
"90",1128177,"NE","CCNL","specimen","Chelone glabra","Chelone","glabra","9/27/1987",1987,9,27,270,1987270,"flowering","unknown","Y","N"," "," ","","","Connecticut","New Haven","New London","arb. pond swamp",41.377797,-72.112013,600,"Y","Y","Y","Yes","Flowering","","","","provided","provided","JA"
"91",985468,"NE","CCSU","specimen","Chelone glabra","Chelone","glabra","9/26/1982",1982,9,26,269,1982269,"flowering","unknown","Y","N"," "," ","","","Connecticut","Hartford","Rocky Hill","wet woods next to rocky hill dump (landfill)",41.678625,-72.639766,1500,"Y","Y","Y","Yes","Flowering","","","","locality","best estimate","JA"
"92",985485,"NE","CCSU","specimen","Chelone glabra","Chelone","glabra","9/25/1967",1967,9,25,268,1967268,"flowering","unknown","Y","N"," "," ","","","Connecticut","Hartford","New Britain","Batterson Pond - Could be New Britain or Farmington (pond is between towns) ""on back of stream, s side of batterson""",41.706332,-72.793683,700,"Y","Y","Y","Yes","Flowering","","","","locality","best estimate","JA"
"93",985486,"NE","CCSU","specimen","Chelone glabra","Chelone","glabra","8/13/1969",1969,8,13,225,1969225,"flowering","unknown","Y","N"," "," ","","","New Hampshire","Coos","Sargents Purchase","roadside at about 3000 ft on Mt. Washington",44.255411,-71.305985,6000,"Y","Y","Y","Yes","Flowering","","","","locality","best estimate","JA"
"94",985487,"NE","CCSU","specimen","Chelone glabra","Chelone","glabra","9/16/1968",1968,9,16,260,1968260,"flowering","unknown","Y","N"," "," ","","same day/place, same phenology?","Connecticut","Litchfield","Woodbury","the parker farm-ruth & sterling parker",41.54454,-73.209002,3036,"Y","Y","Y","Yes","Flowering","",""," couldn't find locality, used town","town","geolocate","JA"
"95",985488,"NE","CCSU","specimen","Chelone glabra","Chelone","glabra","9/12/1978",1978,9,12,255,1978255,"flowering","unknown","Y","N"," "," ","","","Connecticut","Middlesex","Haddam","",41.477321,-72.512033,3036,"Y","Y","Y","Yes","Flowering","","","","town","geolocate","JA"
"96",985490,"NE","CCSU","specimen","Chelone glabra","Chelone","glabra","9/6/1967",1967,9,6,249,1967249,"flowering","unknown","Y","N"," "," ","","","Connecticut","Tolland","Coventry","Grant Hill Rd",41.826671,-72.37647,NA,"Y","Y","Y","Yes","Flowering","","","","provided","","JA"
"97",985491,"NE","CCSU","specimen","Chelone glabra","Chelone","glabra","9/25/1982",1982,9,25,268,1982268,"flowering (and fruit???) ","unknown","Y","maybe"," "," ","recheck phenology: unsure","","Connecticut","Hartford","Rocky Hill","N. of Rocky Hill Ferry",41.666395,-72.630045,NA,"Y","Y","Y","Yes","Flowering","","","","provided","","JA"
"98",985509,"NE","CCSU","specimen","Chelone glabra","Chelone","glabra","8/17/1903",1903,8,17,229,1903229,"flowering","unknown","Y","N"," "," ","","","Connecticut","New London","Norwich","",41.524265,-72.07591,7898,"Y","Y","Y","Yes","Flowering","","","","town","geolocate","JA"
"99",4377305,"MW","CHIC","specimen","Chelone glabra","Chelone","glabra","9/21/1988",1988,9,21,265,1988265,"flowering","unknown","Y","N"," "," ","","","Illinois","Cook","","NE corner of Turnbull Woods Forest Preserve west of green bay road and south of lake-cook rd, south pond edge",42.148331,-87.791545,900,"Y","Y","Y","Yes","Flowering","","","","locality","best estimate","JA"
"100",4377306,"MW","CHIC","specimen","Chelone glabra","Chelone","glabra","9/10/1990",1990,9,10,253,1990253,NA,"unknown","unknown","unknown"," "," ","","","Illinois","Cook","","Cook County Forest Preserve, south of Caldwell Ave, east of Central Ave, along Milwaukee RR right-of-way at northeast edge of tracks",41.993083,-87.763278,700,"N",NA,"Y","Not Scorable","","","","","locality","best estimate","JA"
"101",4377307,"MW","CHIC","specimen","Chelone glabra","Chelone","glabra","9/5/1996",1996,9,5,249,1996249,"flowering???","unknown","Y","maybe"," "," ","recheck phenology: very unsure","","Illinois","Cook","","CBG, Glencoe: McDonald Woods. West side of main woodland pond",42.147089,-87.786061,1200,"Y","Y","Y","Yes","Flowering","","","","locality","best estimate","JA"
"102",4377308,"MW","CHIC","specimen","Chelone glabra","Chelone","glabra","10/12/2012",2012,10,12,286,2012286,"fruit","N","N","Y"," "," ","","","Illinois","Cook","","harms woods",42.059292,-87.769718,1200,"Y","Y","Y","Yes","Fruiting","","","","locality","best estimate","JA"
"103",4393077,"MW","CHIC","specimen","Chelone glabra","Chelone","glabra","10/4/1991",1991,10,4,277,1991277,"flowering and fruit?","unknown","Y","Y"," "," ","recheck phenology: unsure","","Kentucky","Adair","","On Masi property 3 miles east of Breeding, KY. 3/4 miles south of Independance Ridge Rd. On Casey Creek",36.949833,-85.378829,6954,"Y","Y","Y","Yes","Both","","","couldn't find exact locality","town+direction+distance+locality","geolocate","JA"
"104",4393079,"MW","CHIC","specimen","Chelone glabra","Chelone","glabra","10/27/2010",2010,10,27,300,2010300,"fruit","N","N","Y"," "," ","","","Missouri","Washington","","Fen adjacent to Old Mines Creek, northwest corner of intersection of Highway 47 and Highway 21, Washington County, MO. Lat lon provided",38.07711667,-90.73722222,NA,"Y","Y","Y","Yes","Fruiting","","","","provided","","JA"
"105",219421,"NE","CHRB:Observations","observation","Chelone glabra","Chelone","glabra","9/26/2011",2011,9,26,269,2011269,"flowering","unknown","Y","N"," "," ","","picture is of the plant in the wild","New Jersey","Middlesex","","Rutgers Gardens, pond across the street from bamboo forest, 40.472987  -74.426322",40.472987,-74.426322,NA,"Y","Y","Y","Yes","Flowering","","","","provided by observer","","JA"
"106",1116009,"NE","CHRB:Observations","observation","Chelone glabra","Chelone","glabra","9/12/2015",2015,9,12,255,2015255,"flowering","unknown","Y","N"," "," ","","picture is just plant, no info","New Jersey","Middlesex","","Helyar Woods, Cook Campus, Rutgers, on shore of weston's mill pond, 40.475428  -74.417796",40.475428,-74.417796,NA,"Y","Y","Y","Yes","Flowering","","","","provided by observer","","JA"
"107",3741874,"MW","CLEMS","specimen","Chelone glabra","Chelone","glabra","9/24/1974",1974,9,24,267,1974267,"mature","maybe","maybe","maybe"," ","Y","","","South Carolina","Pickens","","",34.887516,-82.725316,34932,"N",NA,"Y","Yes","","","","","county","geolocate","JA"
"108",3741875,"MW","CLEMS","specimen","Chelone glabra","Chelone","glabra","10/18/1975",1975,10,18,291,1975291,"mature","maybe","maybe","maybe"," ","Y","","","South Carolina","Pickens","","",34.887516,-82.725316,34932,"N",NA,"Y","Yes","","","","","county","geolocate","JA"
"109",3741876,"MW","CLEMS","specimen","Chelone glabra","Chelone","glabra","10/7/1971",1971,10,7,280,1971280,"mature","maybe","maybe","maybe"," ","Y","","","South Carolina","Pickens","","",34.887516,-82.725316,34932,"N",NA,"Y","Yes","","","","","county","geolocate","JA"
"110",3741877,"MW","CLEMS","specimen","Chelone glabra","Chelone","glabra","10/9/1988",1988,10,9,283,1988283,"mature","maybe","maybe","maybe"," ","Y","","","South Carolina","Oconee","","",34.753512,-83.065883,39489,"N",NA,"Y","Yes","","","","","county","geolocate","JA"
"111",3741878,"MW","CLEMS","specimen","Chelone glabra","Chelone","glabra","10/7/1978",1978,10,7,280,1978280,"mature","maybe","maybe","maybe"," ","Y","","","North Carolina","Jackson","","",35.287424,-83.140812,35775,"N",NA,"Y","Yes","","","","","county","geolocate","JA"
"112",3741880,"MW","CLEMS","specimen","Chelone glabra","Chelone","glabra","9/22/1996",1996,9,22,266,1996266,"mature","maybe","maybe","maybe"," ","Y","","","Georgia","Rabun","","",34.881724,-83.402071,32632,"N",NA,"Y","Yes","","","","","county","geolocate","JA"
"113",3741882,"MW","CLEMS","specimen","Chelone glabra","Chelone","glabra","10/12/2002",2002,10,12,285,2002285,"flowering","unknown","Y","N"," "," ","","","South Carolina","Allendale","","Allendale, Small stream swamp forest with mixed hardwood/Taxodium canopy along Rock Creek, a small, clear, spring-fed tributary of Dead River(oxbow) at the margin of the savannah River floodplain.,USGS Bull Pond 7.5' quad.,32 59' 25.34"" N, 81 29' 05.71"" W.",32.990956,-81.490419,1200,"N",NA,"Y","Yes","Flowering","",""," couldn't find exact locality","locality","best estimate","JA"
"114",3741883,"MW","CLEMS","specimen","Chelone glabra","Chelone","glabra","9/26/1986",1986,9,26,269,1986269,"mature","maybe","maybe","maybe"," ","Y","","","South Carolina","Oconee","","",34.753512,-83.065883,39489,"N",NA,"Y","Yes","","","","","county","geolocate","JA"
"115",3741884,"MW","CLEMS","specimen","Chelone glabra","Chelone","glabra","10/10/1986",1986,10,10,283,1986283,"mature","maybe","maybe","maybe"," ","Y","","","South Carolina","Oconee","","",34.753512,-83.065883,39489,"N",NA,"Y","Yes","","","","","county","geolocate","JA"
"116",3741889,"MW","CLEMS","specimen","Chelone glabra","Chelone","glabra","10/3/1974",1974,10,3,276,1974276,"mature","maybe","maybe","maybe"," ","Y","","","South Carolina","Anderson","","",34.519091,-82.637885,43272,"N",NA,"Y","Yes","","","","","county","geolocate","JA"
"117",3741890,"MW","CLEMS","specimen","Chelone glabra","Chelone","glabra","10/13/1979",1979,10,13,286,1979286,"mature","maybe","maybe","maybe"," ","Y","","","South Carolina","Anderson","","",34.519091,-82.637885,43272,"N",NA,"Y","Yes","","","","","county","geolocate","JA"
"118",3741892,"MW","CLEMS","specimen","Chelone glabra","Chelone","glabra","9/19/1981",1981,9,19,262,1981262,"mature","maybe","maybe","maybe"," ","Y","","","South Carolina","Oconee","","",34.753512,-83.065883,39489,"N",NA,"Y","Yes","","","","","county","geolocate","JA"
"119",3741893,"MW","CLEMS","specimen","Chelone glabra","Chelone","glabra","9/28/1973",1973,9,28,271,1973271,"mature","maybe","maybe","maybe"," ","Y","","","South Carolina","Oconee","","",34.753512,-83.065883,39489,"N",NA,"Y","Yes","","","","","county","geolocate","JA"
"120",3741894,"MW","CLEMS","specimen","Chelone glabra","Chelone","glabra","10/16/1979",1979,10,16,289,1979289,"mature","maybe","maybe","maybe"," ","Y","","","South Carolina","Oconee","","",34.753512,-83.065883,39489,"N",NA,"Y","Yes","","","","","county","geolocate","JA"
"121",3741896,"MW","CLEMS","specimen","Chelone glabra","Chelone","glabra","10/7/1969",1969,10,7,280,1969280,"mature","maybe","maybe","maybe"," ","Y","","","South Carolina","Pickens","","",34.887516,-82.725316,34932,"N",NA,"Y","Yes","","","","","county","geolocate","JA"
"122",3741897,"MW","CLEMS","specimen","Chelone glabra","Chelone","glabra","10/23/1969",1969,10,23,296,1969296,"mature","maybe","maybe","maybe"," ","Y","","","South Carolina","Pickens","","",34.887516,-82.725316,34932,"N",NA,"Y","Yes","","","","","county","geolocate","JA"
"123",3741898,"MW","CLEMS","specimen","Chelone glabra","Chelone","glabra","10/5/1971",1971,10,5,278,1971278,"mature","maybe","maybe","maybe"," ","Y","","","South Carolina","Pickens","","",34.887516,-82.725316,34932,"N",NA,"Y","Yes","","","","","county","geolocate","JA"
"124",3741900,"MW","CLEMS","specimen","Chelone glabra","Chelone","glabra","10/2/1975",1975,10,2,275,1975275,"mature","maybe","maybe","maybe"," ","Y","","","South Carolina","Pickens","","",34.887516,-82.725316,34932,"N",NA,"Y","Yes","","","","","county","geolocate","JA"
"125",3741901,"MW","CLEMS","specimen","Chelone glabra","Chelone","glabra","9/12/1985",1985,9,12,255,1985255,"mature","maybe","maybe","maybe"," ","Y","","","South Carolina","Oconee","","",34.753512,-83.065883,39489,"N",NA,"Y","Yes","","","","","county","geolocate","JA"
"126",3741902,"MW","CLEMS","specimen","Chelone glabra","Chelone","glabra","10/1/1983",1983,10,1,274,1983274,"mature","maybe","maybe","maybe"," ","Y","","","North Carolina","Henderson","","",35.336275,-82.479939,27464,"N",NA,"Y","Yes","","","","","county","geolocate","JA"
"127",3741905,"MW","CLEMS","specimen","Chelone glabra","Chelone","glabra","9/14/1975",1975,9,14,257,1975257,"mature","maybe","maybe","maybe"," ","Y","","","West Virginia","Monongalia","","",39.630284,-80.046544,33966,"N",NA,"Y","Yes","","","","","county","geolocate","JA"
"128",3741906,"MW","CLEMS","specimen","Chelone glabra","Chelone","glabra","9/27/1959",1959,9,27,270,1959270,"mature","maybe","maybe","maybe"," ","Y","","","West Virginia","Monongalia","","",39.630284,-80.046544,33966,"N",NA,"Y","Yes","","","","","county","geolocate","JA"
"129",3741907,"MW","CLEMS","specimen","Chelone glabra","Chelone","glabra","9/6/1975",1975,9,6,249,1975249,"mature","maybe","maybe","maybe"," ","Y","","","West Virginia","Monongalia","","",39.630284,-80.046544,33966,"N",NA,"Y","Yes","","","","","county","geolocate","JA"
"130",3741908,"MW","CLEMS","specimen","Chelone glabra","Chelone","glabra","8/10/1958",1958,8,10,222,1958222,"mature","maybe","maybe","maybe"," ","Y","","","West Virginia","Tucker","","",39.113595,-79.564974,30009,"N",NA,"Y","Yes","","","","","county","geolocate","JA"
"131",3741909,"MW","CLEMS","specimen","Chelone glabra","Chelone","glabra","8/11/1957",1957,8,11,223,1957223,"mature","maybe","maybe","maybe"," ","Y","","","West Virginia","Pocahontas","","",38.331795,-80.007752,54074,"N",NA,"Y","Yes","","","","","county","geolocate","JA"
"132",3741910,"MW","CLEMS","specimen","Chelone glabra","Chelone","glabra","1/9/1964",1964,1,9,9,1964009,"mature","maybe","maybe","maybe"," ","Y","","date: day and month switched?","West Virginia","Barbour","","Barbour",39.132934,-80.003029,25915,"N",NA,"Y","Yes","","","","","county","geolocate","JA"
"133",3741911,"MW","CLEMS","specimen","Chelone glabra","Chelone","glabra","9/5/1983",1983,9,5,248,1983248,"mature","maybe","maybe","maybe"," ","Y","","","Wisconsin","Shawano","","Shawano",NA,NA,NA,"N",NA,"Y","Yes","","","","","","","JA"
"134",14418124,"MW","CLEMS","specimen","Chelone glabra","Chelone","glabra","10/17/2000",2000,10,17,291,2000291,"flowering","unknown","Y","N"," "," ","","","South Carolina","Berkeley","","growing along edge of SC-44 at mepkin creek, southeast of road and creek crossing",33.13364,-79.951606,500,"Y","Y","Y","Yes","Flowering","","","","locality","best estimate","JA"
"135",12249506,"MW","CM","specimen","Chelone glabra","Chelone","glabra","8/18/1965",1965,8,18,230,1965230,NA,"unknown","unknown","unknown"," "," ","","","Pennsylvania","Potter","","Coudersport to Sugar Bush Lab",41.774788,-78.02056,3524,"N",NA,"Y","Not Scorable","","",""," couldn’t find locality, used town","town","geolocate","JA"
"136",12249518,"MW","CM","specimen","Chelone glabra","Chelone","glabra","8/17/1965",1965,8,17,229,1965229,NA,"unknown","unknown","unknown"," "," ","","","Pennsylvania","Elk","","off Rt 219, Weedville",41.297807,-78.681298,14000,"N",NA,"Y","Not Scorable","","","","","locality","best estimate","JA"
"137",12249603,"MW","CM","specimen","Chelone glabra","Chelone","glabra","8/24/1976",1976,8,24,237,1976237,NA,"unknown","unknown","unknown"," "," ","","","Pennsylvania","Elk","","along Rt 555, at Medix Run",41.29006,-78.397239,NA,"N",NA,"Y","Not Scorable","","","","","locality","","JA"
"138",12249702,"MW","CM","specimen","Chelone glabra","Chelone","glabra","8/14/1963",1963,8,14,226,1963226,NA,"unknown","unknown","unknown"," "," ","","","Pennsylvania","Potter","","Tumble Run Farms, Coudersport",41.765358,-78.026533,NA,"N",NA,"Y","Not Scorable","","","","","provided","","JA"
"139",12249851,"MW","CM","specimen","Chelone glabra","Chelone","glabra","9/7/1977",1977,9,7,250,1977250,NA,"unknown","unknown","unknown"," "," ","","","Pennsylvania","Jefferson","","ca 3 mi W of Sigel along Rt. 36",41.275049,-79.170937,6954,"N",NA,"Y","Not Scorable","","","","","provided","provided","JA"
"140",12257924,"MW","CM","specimen","Chelone glabra","Chelone","glabra","8/6/1976",1976,8,6,219,1976219,NA,"unknown","unknown","unknown"," "," ","","","Pennsylvania","Potter","","ca 5 mi N of Coudersport on Rt. 44",41.847235,-78.02056,9405,"N",NA,"Y","Not Scorable","","","","","provided","provided","JA"
"141",12257925,"MW","CM","specimen","Chelone glabra","Chelone","glabra","10/5/1972",1972,10,5,279,1972279,NA,"unknown","unknown","unknown"," "," ","","","Pennsylvania","Clearfield","","along Rt 53, halfway between Madera and Glen Hope",40.818548,-78.470018,1000,"N",NA,"Y","Not Scorable","","","","","locality","best estimate","JA"
"142",12257926,"MW","CM","specimen","Chelone glabra","Chelone","glabra","7/23/1975",1975,7,23,204,1975204,NA,"unknown","unknown","unknown"," "," ","","","Pennsylvania","Potter","","along Rt 607, at Austin",41.631176,-78.091394,1900,"N",NA,"Y","Not Scorable","","","","","locality","best estimate","JA"
"143",12257927,"MW","CM","specimen","Chelone glabra","Chelone","glabra","8/8/1970",1970,8,8,220,1970220,NA,"unknown","unknown","unknown"," "," ","","","Pennsylvania","Elk","","0.5 mi N of Highland Corners",41.567584,-78.850866,3479,"N",NA,"Y","Not Scorable","","","","","provided","provided","JA"
"144",12257928,"MW","CM","specimen","Chelone glabra","Chelone","glabra","8/27/1970",1970,8,27,239,1970239,NA,"unknown","unknown","unknown"," "," ","","","Pennsylvania","Venango","","along Rt 322, at Sugar Creek",41.422448,-79.874648,800,"N",NA,"Y","Not Scorable","","","","","locality","best estimate","JA"
"145",12257931,"MW","CM","specimen","Chelone glabra","Chelone","glabra","9/6/1937",1937,9,6,249,1937249,NA,"unknown","unknown","unknown"," "," ","","","Pennsylvania","McKean","","Smethport",41.811175,-78.444741,1907,"N",NA,"Y","Not Scorable","","","","","provided","provided","JA"
"146",12257932,"MW","CM","specimen","Chelone glabra","Chelone","glabra","8/31/1954",1954,8,31,243,1954243,NA,"unknown","unknown","unknown"," "," ","","same day/close together, NA phenology","Pennsylvania","Venango","","along E Sandy Creek, on Rt 257, 2.5 mi S of Cranberry",41.313972,-79.722968,1500,"N",NA,"Y","Not Scorable","","","","","town+direction+distance+locality","best estimate","JA"
"147",12257933,"MW","CM","specimen","Chelone glabra","Chelone","glabra","8/21/1954",1954,8,21,233,1954233,NA,"unknown","unknown","unknown"," "," ","","","Pennsylvania","Venango","","3 mi N of Wesley",41.271587,-79.961168,6954,"N",NA,"Y","Not Scorable","","","","","provided","provided","JA"
"148",12257934,"MW","CM","specimen","Chelone glabra","Chelone","glabra","9/13/1956",1956,9,13,257,1956257,NA,"unknown","unknown","unknown"," "," ","","same day/close together, NA phenology","Pennsylvania","Clarion","","Clarion River, 0.5 mi NW of Callensburg",NA,NA,NA,"N",NA,"Y","Not Scorable","","","","","","","JA"
"149",12257935,"MW","CM","specimen","Chelone glabra","Chelone","glabra","9/11/1940",1940,9,11,255,1940255,NA,"unknown","unknown","unknown"," "," ","","","Pennsylvania","Clarion","","3 mi N of New Bethlehem",41.045206,-79.33143,5366,"N",NA,"Y","Not Scorable","","","","","provided","provided","JA"
"150",12257936,"MW","CM","specimen","Chelone glabra","Chelone","glabra","9/16/1967",1967,9,16,259,1967259,NA,"unknown","unknown","unknown"," "," ","","","Pennsylvania","Fulton","","near Maryland line along Big Tonoloway Creek",39.72255,-78.14843,5000,"N",NA,"Y","Not Scorable","","","","","provided","provided","JA"
"151",12257937,"MW","CM","specimen","Chelone glabra","Chelone","glabra","8/2/1934",1934,8,2,214,1934214,NA,"unknown","unknown","unknown"," "," ","","","Pennsylvania","Cambria","","near Somerset Co line, Cedar Swamp",40.247063,-78.865252,17500,"N",NA,"Y","Not Scorable","","",""," couldn't find swamp, used county line","county line","best estimate","JA"
"152",12257938,"MW","CM","specimen","Chelone glabra","Chelone","glabra","9/11/1954",1954,9,11,254,1954254,NA,"unknown","unknown","unknown"," "," ","","","Pennsylvania","Cambria","","1.3 mi W of Nicktown",40.613399,-78.828178,4086,"N",NA,"Y","Not Scorable","","","","","provided","provided","JA"
"153",12257939,"MW","CM","specimen","Chelone glabra","Chelone","glabra","10/21/1922",1922,10,21,294,1922294,NA,"unknown","unknown","unknown"," "," ","","","Pennsylvania","Westmoreland","","Chestnut Ridge, above Hillside",40.380234,-79.246837,4000,"N",NA,"Y","Not Scorable","","","","","town+direction+locality","best estimate","JA"
"154",12257940,"MW","CM","specimen","Chelone glabra","Chelone","glabra","8/28/1927",1927,8,28,240,1927240,NA,"unknown","unknown","unknown"," "," ","","","Pennsylvania","Westmoreland","Rector","State Forest Rd, Rock Run",40.158373,-79.233223,7000,"N",NA,"Y","Not Scorable","","",""," used rock run, not state forest road","locality","best estimate","JA"
"155",12257941,"MW","CM","specimen","Chelone glabra","Chelone","glabra","8/21/1923",1923,8,21,233,1923233,NA,"unknown","unknown","unknown"," "," ","","","Pennsylvania","Westmoreland","","Chestnut Ridge, above Hillside",40.380234,-79.246837,4000,"N",NA,"Y","Not Scorable","","","","","town+direction+locality","best estimate","JA"
"156",12257942,"MW","CM","specimen","Chelone glabra","Chelone","glabra","9/19/1936",1936,9,19,263,1936263,NA,"unknown","unknown","unknown"," "," ","","","Pennsylvania","Westmoreland","","below Swimming Pool, South Greensburg",40.278403,-79.544762,1181,"N",NA,"Y","Not Scorable","","","","","town","geolocate","JA"
"157",12257943,"MW","CM","specimen","Chelone glabra","Chelone","glabra","9/7/1935",1935,9,7,250,1935250,NA,"unknown","unknown","unknown"," "," ","","","Pennsylvania","Westmoreland","","on tributary to Slate Creek, Co I Rifle Range, 2.5 mi SE of Greensburg",40.278852,-79.507379,900,"N",NA,"Y","Not Scorable","","",""," couldn’t find exact locality","town+direction+distance+locality","best estimate","JA"
"158",12257944,"MW","CM","specimen","Chelone glabra","Chelone","glabra","9/6/1927",1927,9,6,249,1927249,NA,"unknown","unknown","unknown"," "," ","","","Pennsylvania","Westmoreland","","Rock River, Laurel Hill Mountains, S of Rector",40.17099,-79.189371,5500,"N",NA,"Y","Not Scorable","","","","","town+direction+locality","best estimate","JA"
"159",12257945,"MW","CM","specimen","Chelone glabra","Chelone","glabra","8/21/1919",1919,8,21,233,1919233,NA,"unknown","unknown","unknown"," "," ","","","Pennsylvania","Westmoreland","","slopes and crest of laurel hill mts, east of new florence",40.380422,-78.982753,8000,"N",NA,"Y","Not Scorable","","","","","town+direction+locality","best estimate","JA"
"160",12257946,"MW","CM","specimen","Chelone glabra","Chelone","glabra","9/23/1949",1949,9,23,266,1949266,NA,"unknown","unknown","unknown"," "," ","","","Pennsylvania","Crawford","","along Conneaut Lake outlet, E of Geneva",41.603435,-80.295365,NA,"N",NA,"Y","Not Scorable","","","","","locality","","JA"
"161",12257947,"MW","CM","specimen","Chelone glabra","Chelone","glabra","7/24/1948",1948,7,24,206,1948206,NA,"unknown","unknown","unknown"," "," ","","","Pennsylvania","Crawford","","Clear Lake, at Spartansburg",41.826659,-79.686499,NA,"N",NA,"Y","Not Scorable","","","","","provided","","JA"
"162",12257948,"MW","CM","specimen","Chelone glabra","Chelone","glabra","8/19/1904",1904,8,19,232,1904232,NA,"unknown","unknown","unknown"," "," ","","","Pennsylvania","Crawford","","Pymatuning Swamp",41.58777,-80.38296,7669,"N",NA,"Y","Not Scorable","","","","","provided","provided","JA"
"163",12257949,"MW","CM","specimen","Chelone glabra","Chelone","glabra","9/22/1924",1924,9,22,266,1924266,NA,"unknown","unknown","unknown"," "," ","","","Pennsylvania","Butler","","Powder Mill Run woods, between Petersville and Renfrew",40.815826,-79.987129,2200,"N",NA,"Y","Not Scorable","","",""," just used between the two towns for locality","towns","best estimate","JA"
"164",12257950,"MW","CM","specimen","Chelone glabra","Chelone","glabra","9/5/1951",1951,9,5,248,1951248,NA,"unknown","unknown","unknown"," "," ","","","Pennsylvania","Butler","","along Black Run, 1.5 mi SE of Jacksville",41.010917,-80.086529,2300,"N",NA,"Y","Not Scorable","","","","","town+direction+distance+locality","best estimate","JA"
"165",12257951,"MW","CM","specimen","Chelone glabra","Chelone","glabra","9/14/1941",1941,9,14,257,1941257,NA,"unknown","unknown","unknown"," "," ","","same day/close together, NA phenology","Pennsylvania","Butler","","1.5 mi W of West Liberty",41.00881,-80.08447,3061,"N",NA,"Y","Not Scorable","","","","","provided","provided","JA"
"166",12257954,"MW","CM","specimen","Chelone glabra","Chelone","glabra","9/6/1940",1940,9,6,250,1940250,NA,"unknown","unknown","unknown"," "," ","","","Pennsylvania","Butler","","2 mi W of West Liberty",41.009083,-80.086169,NA,"N",NA,"Y","Not Scorable","","","","","provided","","JA"
"167",12257955,"MW","CM","specimen","Chelone glabra","Chelone","glabra","9/15/1937",1937,9,15,258,1937258,NA,"unknown","unknown","unknown"," "," ","","","Pennsylvania","Butler","","Watsons Run, 2 mi S of Leasureville",40.718025,-79.703661,6033,"N",NA,"Y","Not Scorable","","",""," couldn’t find locality","town+direction+distance","geolocate","JA"
"168",12257956,"MW","CM","specimen","Chelone glabra","Chelone","glabra","9/14/1941",1941,9,14,257,1941257,NA,"unknown","unknown","unknown"," "," ","","same day/close together, NA phenology","Pennsylvania","Butler","","on Rt 8, 5-6 mi SE of Slippery Rock, vicinity of Stone House",41.002441,-79.974904,NA,"N",NA,"Y","Not Scorable","","","","","provided","","JA"
"169",12257959,"MW","CM","specimen","Chelone glabra","Chelone","glabra","9/1/1922",1922,9,1,244,1922244,NA,"unknown","unknown","unknown"," "," ","","","Pennsylvania","Butler","","2 mi S of Whitestown",40.847748,-80.042003,6033,"N",NA,"Y","Not Scorable","","","","","provided","provided","JA"
"170",12257961,"MW","CM","specimen","Chelone glabra","Chelone","glabra","8/13/1922",1922,8,13,225,1922225,NA,"unknown","unknown","unknown"," "," ","","","Pennsylvania","Butler","","Wolf Creek, N of Slippery Rock",41.093881,-80.069585,7000,"N",NA,"Y","Not Scorable","","","","","town+direction+locality","best estimate","JA"
"171",12257962,"MW","CM","specimen","Chelone glabra","Chelone","glabra","9/26/1951",1951,9,26,269,1951269,NA,"unknown","unknown","unknown"," "," ","","","Pennsylvania","Washington","","along Buffalo Creek, 2 mi NW of Taylortown",40.17036,-80.38654,2390,"N",NA,"Y","Not Scorable","","","","","provided","provided","JA"
"172",12257963,"MW","CM","specimen","Chelone glabra","Chelone","glabra","9/12/1926",1926,9,12,255,1926255,NA,"unknown","unknown","unknown"," "," ","","date: given as 11-13 Sep 1926","Pennsylvania","Potter","","Camp Site 5, South Fork Hollow and W slope, 5 mi N of Costello",41.665848,-78.059448,9021,"N",NA,"Y","Not Scorable","","","","","provided","provided","JA"
"173",12257964,"MW","CM","specimen","Chelone glabra","Chelone","glabra","8/12/1954",1954,8,12,224,1954224,NA,"unknown","unknown","unknown"," "," ","","","Pennsylvania","Potter","","above Kettle Creek, Cross Fork",41.483399,-77.814436,1000,"N",NA,"Y","Not Scorable","","","","","locality","best estimate","JA"
"174",12257969,"MW","CM","specimen","Chelone glabra","Chelone","glabra","9/1/1934",1934,9,1,244,1934244,NA,"unknown","unknown","unknown"," "," ","","","Pennsylvania","Forest","","Howe Twp, Blue Jay and Watsontown Run Rds",41.580601,-79.044911,3000,"N",NA,"Y","Not Scorable","","","","","locality","best estimate","JA"
"175",12257971,"MW","CM","specimen","Chelone glabra","Chelone","glabra","9/4/1941",1941,9,4,247,1941247,NA,"unknown","unknown","unknown"," "," ","","","Pennsylvania","Huntingdon","","Alan Seegar Monument",40.694436,-77.755222,2000,"N",NA,"Y","Not Scorable","","","","","locality","best estimate","JA"
"176",12257972,"MW","CM","specimen","Chelone glabra","Chelone","glabra","9/21/1968",1968,9,21,265,1968265,NA,"unknown","unknown","unknown"," "," ","","","Pennsylvania","Blair","","between Canoe Creek and Williamsburg",40.470963,-78.235101,3300,"N",NA,"Y","Not Scorable","","","","","locality","best estimate","JA"
"177",12257974,"MW","CM","specimen","Chelone glabra","Chelone","glabra","8/24/1924",1924,8,24,237,1924237,NA,"unknown","unknown","unknown"," "," ","","","Pennsylvania","Fayette","","Indian Creek floodplain, Indian Head",40.024796,-79.395035,300,"N",NA,"Y","Not Scorable","","","","","locality","best estimate","JA"
"178",12257975,"MW","CM","specimen","Chelone glabra","Chelone","glabra","9/11/1966",1966,9,11,254,1966254,NA,"unknown","unknown","unknown"," "," ","","","Pennsylvania","Erie","","3 mi E of McLane",41.936152,-80.068013,6954,"N",NA,"Y","Not Scorable","","","","","provided","provided","JA"
"179",12257976,"MW","CM","specimen","Chelone glabra","Chelone","glabra","9/8/1951",1951,9,8,251,1951251,NA,"unknown","unknown","unknown"," "," ","","","Pennsylvania","Erie","","1.75 mi E of Ohio line, along Lake Erie",41.987047,-80.493562,200,"N",NA,"Y","Not Scorable","","","","","locality","best estimate","JA"
"180",12257977,"MW","CM","specimen","Chelone glabra","Chelone","glabra","9/11/1927",1927,9,11,254,1927254,NA,"unknown","unknown","unknown"," "," ","","","Pennsylvania","Erie","","E of Erie, railroad track",42.144037,-80.017351,3000,"N",NA,"Y","Not Scorable","","","","","locality","best estimate","JA"
"181",12257978,"MW","CM","specimen","Chelone glabra","Chelone","glabra","8/11/1933",1933,8,11,223,1933223,NA,"unknown","unknown","unknown"," "," ","","","Pennsylvania","Erie","","Lake Pleasant",42.004364,-79.897629,500,"N",NA,"Y","Not Scorable","","","","","locality","best estimate","JA"
"182",12257979,"MW","CM","specimen","Chelone glabra","Chelone","glabra","7/31/1928",1928,7,31,213,1928213,NA,"unknown","unknown","unknown"," "," ","","","Pennsylvania","Erie","","Hummell Farm, 1.5 mi E of Wattsburg",42.003661,-79.781638,2454,"N",NA,"Y","Not Scorable","","","","","provided","provided","JA"
"183",12257980,"MW","CM","specimen","Chelone glabra","Chelone","glabra","8/4/1928",1928,8,4,217,1928217,NA,"unknown","unknown","unknown"," "," ","","","Pennsylvania","Erie","","Presque Isle",42.163531,-80.101233,3500,"N",NA,"Y","Not Scorable","","","","","locality","best estimate","JA"
"184",12257981,"MW","CM","specimen","Chelone glabra","Chelone","glabra","9/2/1967",1967,9,2,245,1967245,NA,"unknown","unknown","unknown"," "," ","","","Pennsylvania","Lawrence","","Plain Grove Bog",41.054228,-80.142838,3036,"N",NA,"Y","Not Scorable","","","","","town","geolocate","JA"
"185",12257982,"MW","CM","specimen","Chelone glabra","Chelone","glabra","9/18/1919",1919,9,18,261,1919261,NA,"unknown","unknown","unknown"," "," ","","same day/close together, NA phenology","Pennsylvania","Lawrence","","Slippery Rock Creek at Kennedys Mill, E of New Castle",NA,NA,NA,"N",NA,"Y","Not Scorable","","","","","","","JA"
"186",12257983,"MW","CM","specimen","Chelone glabra","Chelone","glabra","9/18/1919",1919,9,18,261,1919261,NA,"unknown","unknown","unknown"," "," ","","same day/close together, NA phenology","Pennsylvania","Lawrence","","Breakneck Bridge along Slippery Rock Creek, SE of New Castle",40.937457,-80.178482,200,"N",NA,"Y","Not Scorable","","","","","locality","best estimate","JA"
"187",12257984,"MW","CM","specimen","Chelone glabra","Chelone","glabra","10/15/1910",1910,10,15,288,1910288,NA,"unknown","unknown","unknown"," "," ","","","Pennsylvania","Lawrence","","Ellwood City, Rock Point",40.858638,-80.315901,1000,"N",NA,"Y","Not Scorable","","","","","locality","best estimate","JA"
"188",12257985,"MW","CM","specimen","Chelone glabra","Chelone","glabra","10/3/1914",1914,10,3,276,1914276,NA,"unknown","unknown","unknown"," "," ","","","Pennsylvania","Lawrence","","Connoquenessing Gorge, Rock Point",40.858638,-80.315901,1000,"N",NA,"Y","Not Scorable","","","","","locality","best estimate","JA"
"189",12257986,"MW","CM","specimen","Chelone glabra","Chelone","glabra","9/9/1945",1945,9,9,252,1945252,NA,"unknown","unknown","unknown"," "," ","","","Pennsylvania","Allegheny","","along Rt 910, 3 mi SE of Bakerstown",40.62015,-79.895924,5342,"N",NA,"Y","Not Scorable","","","","","provided","provided","JA"
"190",12257987,"MW","CM","specimen","Chelone glabra","Chelone","glabra","10/1/1927",1927,10,1,274,1927274,NA,"unknown","unknown","unknown"," "," ","","","Pennsylvania","Allegheny","","valley above Groveton",40.503957,-80.140335,3036,"N",NA,"Y","Not Scorable","","","","","town","geolocate","JA"
"191",12257989,"MW","CM","specimen","Chelone glabra","Chelone","glabra","9/9/1922",1922,9,9,252,1922252,NA,"unknown","unknown","unknown"," "," ","","","Pennsylvania","Allegheny","","Groveton",40.503957,-80.140335,3036,"N",NA,"Y","Not Scorable","","","","","provided","provided","JA"
"192",12257990,"MW","CM","specimen","Chelone glabra","Chelone","glabra","8/29/1904",1904,8,29,242,1904242,NA,"unknown","unknown","unknown"," "," ","","","Pennsylvania","Allegheny","","Aspinwall",40.49082,-79.89832,1775,"N",NA,"Y","Not Scorable","","","","","provided","provided","JA"
"193",12257991,"MW","CM","specimen","Chelone glabra","Chelone","glabra","9/27/1924",1924,9,27,271,1924271,NA,"unknown","unknown","unknown"," "," ","","","Pennsylvania","Allegheny","","Montour Run, Groveton",40.467012,-80.155827,90,"N",NA,"Y","Not Scorable","","","","","provided","provided","JA"
"194",12257992,"MW","CM","specimen","Chelone glabra","Chelone","glabra","9/22/1900",1900,9,22,265,1900265,NA,"unknown","unknown","unknown"," "," ","","","Pennsylvania","Allegheny","","Fern Hollow, Frick Park",40.43398,-79.903307,NA,"N",NA,"Y","Not Scorable","","","","","locality","","JA"
"195",12257993,"MW","CM","specimen","Chelone glabra","Chelone","glabra","9/6/1919",1919,9,6,249,1919249,NA,"unknown","unknown","unknown"," "," ","","","Pennsylvania","Allegheny","","Toms Run, Dixmont",40.515902,-80.115057,NA,"N",NA,"Y","Not Scorable","","","","","locality","","JA"
"196",12257994,"MW","CM","specimen","Chelone glabra","Chelone","glabra","10/12/1930",1930,10,12,285,1930285,NA,"unknown","unknown","unknown"," "," ","","","Pennsylvania","Allegheny","","Wildwood",40.59668,-79.97008,1326,"N",NA,"Y","Not Scorable","","","","","town","geolocate","JA"
"197",12257995,"MW","CM","specimen","Chelone glabra","Chelone","glabra","8/22/1918",1918,8,22,234,1918234,"flowering","unknown","Y","N"," "," ","","","Pennsylvania","Allegheny","","Bailiff farm, 0.5 mi N of Glenshaw",40.540092,-79.967554,3479,"N",NA,"Y","Yes","Flowering","","","","provided","provided","JA"
"198",12257996,"MW","CM","specimen","Chelone glabra","Chelone","glabra","8/22/1973",1973,8,22,234,1973234,NA,"unknown","unknown","unknown"," "," ","","","Pennsylvania","Cameron","","along Sinnemahoning Creek, ca 6 mi S of Sinnemahoning",41.232286,-78.096393,10121,"N",NA,"Y","Not Scorable","","",""," creek wasn't south of town","town+direction+distance","geolocate","JA"
"199",12257997,"MW","CM","specimen","Chelone glabra","Chelone","glabra","9/16/1970",1970,9,16,259,1970259,NA,"unknown","unknown","unknown"," "," ","","","Pennsylvania","Clinton","","halfway between Grove and Keating along Rt. 120",41.295523,-78.036154,4000,"N",NA,"Y","Not Scorable","","","","","locality","best estimate","JA"
"200",12257998,"MW","CM","specimen","Chelone glabra","Chelone","glabra","10/15/1972",1972,10,15,289,1972289,NA,"unknown","unknown","unknown"," "," ","","","Pennsylvania","Huntingdon","","Pearth estate, Coles Summit, ca 2.5 mi NW of Saltillo",40.219906,-78.036366,3000,"N",NA,"Y","Not Scorable","","","","","locality","best estimate","JA"
"201",12257999,"MW","CM","specimen","Chelone glabra","Chelone","glabra","8/16/1972",1972,8,16,229,1972229,NA,"unknown","unknown","unknown"," "," ","","","Pennsylvania","McKean","","Rt 46 and 146, 1.5 mi S of Colegrove",41.70694,-78.38585,4260,"N",NA,"Y","Not Scorable","","","","","provided","provided","JA"
"202",12258000,"MW","CM","specimen","Chelone glabra","Chelone","glabra","8/9/1972",1972,8,9,222,1972222,NA,"unknown","unknown","unknown"," "," ","","","Pennsylvania","Elk","","along Rt 555, at Medix Run",41.29006,-78.397239,NA,"N",NA,"Y","Not Scorable","","","","","locality","","JA"
"203",12258001,"MW","CM","specimen","Chelone glabra","Chelone","glabra","8/23/1972",1972,8,23,236,1972236,NA,"unknown","unknown","unknown"," "," ","","","Pennsylvania","Blair","","Rattlesnake Alley, 5.2 mi N of Tipton",40.711258,-78.295848,7602,"N",NA,"Y","Not Scorable","","","","","provided","provided","JA"
"204",12258002,"MW","CM","specimen","Chelone glabra","Chelone","glabra","8/11/1967",1967,8,11,223,1967223,NA,"unknown","unknown","unknown"," "," ","","","Pennsylvania","Cameron","","near entrance to Sizerville State Park, N of Sizerville",41.603239,-78.186425,1500,"N",NA,"Y","Not Scorable","","","","","locality","best estimate","JA"
"205",12258003,"MW","CM","specimen","Chelone glabra","Chelone","glabra","8/21/1925",1925,8,21,233,1925233,NA,"unknown","unknown","unknown"," "," ","","","Pennsylvania","Elk","Ridgeway","",41.42607,-78.73076,2068,"N",NA,"Y","Not Scorable","","","","","provided","provided","JA"
"206",12258004,"MW","CM","specimen","Chelone glabra","Chelone","glabra","9/10/1953",1953,9,10,253,1953253,NA,"unknown","unknown","unknown"," "," ","","same day/close together, NA phenology","Pennsylvania","Jefferson","","along Perrysville Run, 0.5 mi N of Hamilton",40.93293,-79.08256,1415,"N",NA,"Y","Not Scorable","","","","","provided","provided","JA"
"207",12258006,"MW","CM","specimen","Chelone glabra","Chelone","glabra","9/10/1953",1953,9,10,253,1953253,NA,"unknown","unknown","unknown"," "," ","","","Pennsylvania","Armstrong","","5.5 N of Dayton at Rt. 839",40.95023,-79.22617,1698,"N",NA,"Y","Not Scorable","","","","","provided","provided","JA"
"208",12258007,"MW","CM","specimen","Chelone glabra","Chelone","glabra","9/27/1909",1909,9,27,270,1909270,NA,"unknown","unknown","unknown"," "," ","","","Pennsylvania","Armstrong","","Kittanning",40.82246,-79.52733,2108,"N",NA,"Y","Not Scorable","","","","","provided","provided","JA"
"209",12258008,"MW","CM","specimen","Chelone glabra","Chelone","glabra","10/23/1921",1921,10,23,296,1921296,NA,"unknown","unknown","unknown"," "," ","","","Pennsylvania","Armstrong","","Watson Run",40.702601,-79.606085,210,"N",NA,"Y","Not Scorable","","","","","provided","provided","JA"
"210",12258009,"MW","CM","specimen","Chelone glabra","Chelone","glabra","8/27/1962",1962,8,27,239,1962239,NA,"unknown","unknown","unknown"," "," ","","","Pennsylvania","Bedford","","0.87 mi ENE of Ryot",40.150736,-78.621445,3091,"N",NA,"Y","Not Scorable","","","","","provided","provided","JA"
"211",12258010,"MW","CM","specimen","Chelone glabra","Chelone","glabra","9/2/1939",1939,9,2,245,1939245,NA,"unknown","unknown","unknown"," "," ","","","Pennsylvania","Bedford","","Black Valley, S of Everett",39.9921,-78.373076,NA,"N",NA,"Y","Not Scorable","","","","","locality","","JA"
"212",12258011,"MW","CM","specimen","Chelone glabra","Chelone","glabra","10/3/1936",1936,10,3,277,1936277,NA,"unknown","unknown","unknown"," "," ","","","Pennsylvania","Somerset","","Primeval Forest, near Buckstown",40.07119,-78.861689,3036,"N",NA,"Y","Not Scorable","","","","","town","geolocate","JA"
"213",12258013,"MW","CM","specimen","Chelone glabra","Chelone","glabra","7/30/1872",1872,7,30,212,1872212,NA,"unknown","unknown","unknown"," "," ","","","Pennsylvania","Somerset","","near Shanksville",40.017857,-78.907246,671,"N",NA,"Y","Not Scorable","","","","","town","geolocate","JA"
"214",12258015,"MW","CM","specimen","Chelone glabra","Chelone","glabra","9/30/1958",1958,9,30,273,1958273,NA,"unknown","unknown","unknown"," "," ","","","Pennsylvania","Somerset","","along Rt 31, E edge of Bakersville",40.042789,-79.217676,1200,"N",NA,"Y","Not Scorable","","","","","locality","best estimate","JA"
"215",12258016,"MW","CM","specimen","Chelone glabra","Chelone","glabra","8/11/1948",1948,8,11,224,1948224,NA,"unknown","unknown","unknown"," "," ","","","Pennsylvania","Warren","","few mi NE of Warren",41.843949,-79.145044,3365,"N",NA,"Y","Not Scorable","","","","","town","geolocate","JA"
"216",12258017,"MW","CM","specimen","Chelone glabra","Chelone","glabra","8/13/1944",1944,8,13,226,1944226,NA,"unknown","unknown","unknown"," "," ","","","Pennsylvania","Warren","","North Warren",41.87621,-79.15327,2044,"N",NA,"Y","Not Scorable","","","","","provided","provided","JA"
"217",12258018,"MW","CM","specimen","Chelone glabra","Chelone","glabra","9/12/1946",1946,9,12,255,1946255,NA,"unknown","unknown","unknown"," "," ","","same day/close together, NA phenology","Pennsylvania","Mercer","","off Rt 208, 0.5 mi S of Schollard",41.133967,-80.210543,NA,"N",NA,"Y","Not Scorable","","","","","provided","","JA"
"218",12258019,"MW","CM","specimen","Chelone glabra","Chelone","glabra","9/18/1954",1954,9,18,261,1954261,NA,"unknown","unknown","unknown"," "," ","","","Pennsylvania","Mercer","","off Rt 62, 1 mi W of Mercer-Venango Co line, Reeds Furnace",41.334223,-80.004781,NA,"N",NA,"Y","Not Scorable","","","","","locality","","JA"
"219",12258020,"MW","CM","specimen","Chelone glabra","Chelone","glabra","9/16/1950",1950,9,16,259,1950259,NA,"unknown","unknown","unknown"," "," ","","","Pennsylvania","Mercer","","N of Osgood along Crooked Creek",41.44534,-80.36398,4453,"N",NA,"Y","Not Scorable","","","","","provided","provided","JA"
"220",12258021,"MW","CM","specimen","Chelone glabra","Chelone","glabra","9/16/1950",1950,9,16,259,1950259,NA,"unknown","unknown","unknown"," "," ","","","Pennsylvania","Mercer","","4 mi NE of Clarksville",41.342758,-80.365846,4000,"N",NA,"Y","Not Scorable","","",""," estimated location of town flooded by reservoir","town+direction+distance","best estimate","JA"
"221",12258022,"MW","CM","specimen","Chelone glabra","Chelone","glabra","9/10/1906",1906,9,10,253,1906253,NA,"unknown","unknown","unknown"," "," ","","","Pennsylvania","Beaver","","New Galilee",40.835697,-80.400181,NA,"N",NA,"Y","Not Scorable","","","","","provided","","JA"
"222",12258025,"MW","CM","specimen","Chelone glabra","Chelone","glabra","9/6/1900",1900,9,6,249,1900249,NA,"unknown","unknown","unknown"," "," ","","","Pennsylvania","Beaver","","Beaver Falls",40.75201,-80.31923,NA,"N",NA,"Y","Not Scorable","","","","","town","","JA"
"223",12258026,"MW","CM","specimen","Chelone glabra","Chelone","glabra","10/9/1921",1921,10,9,282,1921282,NA,"unknown","unknown","unknown"," "," ","","","Pennsylvania","Beaver","","near junction of Big Traverse and Raccoon Creek",40.510198,-80.364559,400,"N",NA,"Y","Not Scorable","","","","","locality","best estimate","JA"
"224",12258027,"MW","CM","specimen","Chelone glabra","Chelone","glabra","8/2/1938",1938,8,2,214,1938214,"flowering","unknown","Y","N"," "," ","","","Pennsylvania","Schuylkill","","along Catawissa Creek, 1-1.5 mi N of Girard Manor",40.888924,-76.103226,NA,"N",NA,"Y","Yes","Flowering","","","","provided","","JA"
"225",12258029,"MW","CM","specimen","Chelone glabra","Chelone","glabra","9/1/1907",1907,9,1,244,1907244,NA,"unknown","unknown","unknown"," "," ","","","Pennsylvania","Lackawanna","","Eddy Creek",41.448578,-75.576965,NA,"N",NA,"Y","Not Scorable","","","","","provided","","JA"
"226",12258037,"MW","CM","specimen","Chelone glabra","Chelone","glabra","9/2/1920",1920,9,2,246,1920246,NA,"unknown","unknown","unknown"," "," ","","","Pennsylvania","Lycoming","","Cedar Run",41.523937,-77.448206,NA,"N",NA,"Y","Not Scorable","","","","","provided","","JA"
"227",12258039,"MW","CM","specimen","Chelone glabra","Chelone","glabra","9/22/1925",1925,9,22,265,1925265,NA,"unknown","unknown","unknown"," "," ","","","Pennsylvania","Delaware","","S of Bortondale",39.901778,-75.406028,3036,"N",NA,"Y","Not Scorable","","","","","town","geolocate","JA"
"228",12258040,"MW","CM","specimen","Chelone glabra","Chelone","glabra","7/20/1901",1901,7,20,201,1901201,NA,"unknown","unknown","unknown"," "," ","","","Pennsylvania","Sullivan","","Lopez to Bella Sylva, Shady Nook",41.457854,-76.333549,43000,"N",NA,"Y","Not Scorable","","",""," used coordinates for lopez, uncertainty for county, has same location description (original one said sullivan-wyoming county (see label of other one)) as 16244376 but different date","town","best estimate","JA"
"229",12258041,"MW","CM","specimen","Chelone glabra","Chelone","glabra","9/17/1927",1927,9,17,260,1927260,NA,"unknown","unknown","unknown"," "," ","","","Pennsylvania","Bucks","","Ringing Rocks",40.563081,-75.126813,NA,"N",NA,"Y","Not Scorable","","","","","provided","","JA"
"230",12258043,"MW","CM","specimen","Chelone glabra","Chelone","glabra","9/13/1886",1886,9,13,256,1886256,NA,"unknown","unknown","unknown"," "," ","","","Pennsylvania","Northampton","Easton","",40.688432,-75.220732,6646,"N",NA,"Y","Not Scorable","","","","","town","geolocate","JA"
"231",12258044,"MW","CM","specimen","Chelone glabra","Chelone","glabra","8/25/1963",1963,8,25,237,1963237,NA,"unknown","unknown","unknown"," "," ","","","Pennsylvania","Lycoming","","Mann Cottage, Pine Creek, at Ramsey",41.284516,-77.324418,NA,"N",NA,"Y","Not Scorable","","","","","locality","","JA"
"232",12258046,"MW","CM","specimen","Chelone glabra","Chelone","glabra","9/10/1953",1953,9,10,253,1953253,NA,"unknown","unknown","unknown"," "," ","","same day/close together, NA phenology","Pennsylvania","Jefferson","","along Mahoning Creek, 1 mi N of Valier",40.925632,-79.045102,5241,"N",NA,"Y","Not Scorable","","","","","provided","provided","JA"
"233",12258047,"MW","CM","specimen","Chelone glabra","Chelone","glabra","7/18/1904",1904,7,18,200,1904200,NA,"unknown","unknown","unknown"," "," ","","","Pennsylvania","Jefferson","","Falls Creek",41.145062,-78.804475,NA,"N",NA,"Y","Not Scorable","","","","","town","","JA"
"234",12258048,"MW","CM","specimen","Chelone glabra","Chelone","glabra","8/10/1949",1949,8,10,222,1949222,NA,"unknown","unknown","unknown"," "," ","","","Pennsylvania","Forest","","Buzzard Swamp region, 4 mi E of Marienville",41.468925,-79.045744,7959,"N",NA,"Y","Not Scorable","","","","","town+direction+distance+locality","geolocate","JA"
"235",12258049,"MW","CM","specimen","Chelone glabra","Chelone","glabra","8/29/1964",1964,8,29,242,1964242,NA,"unknown","unknown","unknown"," "," ","","","Pennsylvania","Forest","","along Hunter Run, across from Tionesta",41.498621,-79.465221,700,"N",NA,"Y","Not Scorable","","","","","locality","best estimate","JA"
"236",12258050,"MW","CM","specimen","Chelone glabra","Chelone","glabra","9/6/1972",1972,9,6,250,1972250,NA,"unknown","unknown","unknown"," "," ","","","Pennsylvania","McKean","","along Rt 346, 3 mi NW of Bradford",41.986625,-78.685247,5196,"N",NA,"Y","Not Scorable","","","","","provided","provided","JA"
"237",12258051,"MW","CM","specimen","Chelone glabra","Chelone","glabra","9/24/1953",1953,9,24,267,1953267,NA,"unknown","unknown","unknown"," "," ","","","Pennsylvania","Jefferson","","0.25 mi S of Big Run",40.963083,-78.878165,1536,"N",NA,"Y","Not Scorable","","","","","town+direction+distance","geolocate","JA"
"238",12258052,"MW","CM","specimen","Chelone glabra","Chelone","glabra","8/11/1953",1953,8,11,223,1953223,NA,"unknown","unknown","unknown"," "," ","","","Pennsylvania","Jefferson","","0.8 mi W of Allens Mills",41.199505,-78.92294,3688,"N",NA,"Y","Not Scorable","","","","","provided","provided","JA"
"239",12258053,"MW","CM","specimen","Chelone glabra","Chelone","glabra","9/13/1956",1956,9,13,257,1956257,NA,"unknown","unknown","unknown"," "," ","","same day/close together, NA phenology","Pennsylvania","Clarion","","along Clarion River, 3 mi S of Wentling Corners, S of Knox",41.14895,-79.547152,6954,"N",NA,"Y","Not Scorable","","","","","town+direction+distance+locality","geolocate","JA"
"240",12258054,"MW","CM","specimen","Chelone glabra","Chelone","glabra","8/24/1950",1950,8,24,236,1950236,NA,"unknown","unknown","unknown"," "," ","","","Pennsylvania","Clarion","","Cook Forest",41.35691,-79.22092,4630,"N",NA,"Y","Not Scorable","","","","","provided","provided","JA"
"241",12258055,"MW","CM","specimen","Chelone glabra","Chelone","glabra","9/4/1921",1921,9,4,247,1921247,NA,"unknown","unknown","unknown"," "," ","","","Pennsylvania","Clarion","","Clarion",41.214785,-79.385322,2192,"N",NA,"Y","Not Scorable","","","","","provided","provided","JA"
"242",12258056,"MW","CM","specimen","Chelone glabra","Chelone","glabra","9/17/1949",1949,9,17,260,1949260,NA,"unknown","unknown","unknown"," "," ","","","Pennsylvania","Bedford","","Tussey Mountain, SE of Rainsburg",39.879528,-78.500191,7000,"N",NA,"Y","Not Scorable","","","","","locality","best estimate","JA"
"243",12258057,"MW","CM","specimen","Chelone glabra","Chelone","glabra","8/25/1962",1962,8,25,237,1962237,NA,"unknown","unknown","unknown"," "," ","","","Pennsylvania","Somerset","","just W of Somerset interchange on Pennsylvania turnpike,  swampy area along stream",40.020305,-79.085368,800,"N",NA,"Y","Not Scorable","","","","","locality","best estimate","JA"
"244",12258058,"MW","CM","specimen","Chelone glabra","Chelone","glabra","9/8/1942",1942,9,8,251,1942251,NA,"unknown","unknown","unknown"," "," ","","","Pennsylvania","Somerset","","Mill Creek, 1 mi NW of Berlin",39.927566,-78.977283,700,"N",NA,"Y","Not Scorable","","","","","town+direction+distance+locality","best estimate","JA"
"245",12258059,"MW","CM","specimen","Chelone glabra","Chelone","glabra","9/6/1952",1952,9,6,250,1952250,"flowering","unknown","Y","N"," "," ","","","Pennsylvania","Somerset","","1 mi NW of West Salisbury",39.764497,-79.108359,4807,"N",NA,"Y","Yes","Flowering","","","","town+direction+distance","geolocate","JA"
"246",12258061,"MW","CM","specimen","Chelone glabra","Chelone","glabra","9/1/1902",1902,9,1,244,1902244,NA,"unknown","unknown","unknown"," "," ","","","Pennsylvania","Somerset","Johnsburg","",39.869527,-78.843355,3036,"N",NA,"Y","Not Scorable","","","","","provided","provided","JA"
"247",12258062,"MW","CM","specimen","Chelone glabra","Chelone","glabra","9/14/1946",1946,9,14,257,1946257,NA,"unknown","unknown","unknown"," "," ","","","Pennsylvania","Somerset","","2-3 mi N of Bakersville",40.085779,-79.21642,NA,"N",NA,"Y","Not Scorable","","","","","provided","","JA"
"248",12258063,"MW","CM","specimen","Chelone glabra","Chelone","glabra","9/9/1947",1947,9,9,252,1947252,NA,"unknown","unknown","unknown"," "," ","","","Pennsylvania","Somerset","","4 mi SW of Somerset",39.967404,-79.131605,5989,"N",NA,"Y","Not Scorable","","","","","provided","provided","JA"
"249",12258064,"MW","CM","specimen","Chelone glabra","Chelone","glabra","9/16/1909",1909,9,16,259,1909259,NA,"unknown","unknown","unknown"," "," ","","date: given as 16-17 Sep 1909","Pennsylvania","Westmoreland","","below Hillside",40.368125,-79.26059,3036,"N",NA,"Y","Not Scorable","","","","","town","geolocate","JA"
"250",12258065,"MW","CM","specimen","Chelone glabra","Chelone","glabra","8/23/1902",1902,8,23,235,1902235,NA,"unknown","unknown","unknown"," "," ","","","Pennsylvania","Westmoreland","","near New Alexandria",40.398679,-79.421983,4500,"N",NA,"Y","Not Scorable","","","","","town","best estimate","JA"
"251",12258066,"MW","CM","specimen","Chelone glabra","Chelone","glabra","9/2/1919",1919,9,2,245,1919245,NA,"unknown","unknown","unknown"," "," ","","","Pennsylvania","Westmoreland","","near Smithton",40.153961,-79.741154,2100,"N",NA,"Y","Not Scorable","","","","","town","best estimate","JA"
"252",12258067,"MW","CM","specimen","Chelone glabra","Chelone","glabra","9/10/1907",1907,9,10,253,1907253,NA,"unknown","unknown","unknown"," "," ","","date: given as 9-12 Sep 1907","Pennsylvania","Westmoreland","","J.R. Mellon Estate, Rachelwood, New Florence",40.292295,-79.096696,3036,"N",NA,"Y","Not Scorable","","",""," couldn't find locality, used town","town","geolocate","JA"
"253",12258068,"MW","CM","specimen","Chelone glabra","Chelone","glabra","9/13/1941",1941,9,13,256,1941256,NA,"unknown","unknown","unknown"," "," ","","","Pennsylvania","Westmoreland","","Shades Ravine, ca 3 mi NE of Trafford",40.416362,-79.718572,4651,"N",NA,"Y","Not Scorable","","","","","provided","provided","JA"
"254",12258069,"MW","CM","specimen","Chelone glabra","Chelone","glabra","8/20/1949",1949,8,20,232,1949232,NA,"unknown","unknown","unknown"," "," ","","","Pennsylvania","Erie","","4 mi NE of Union City, Boleratz farm",41.9442,-79.8142,NA,"N",NA,"Y","Not Scorable","","","","same farm has different directions (NE vs NW)","provided","","JA"
"255",12258070,"MW","CM","specimen","Chelone glabra","Chelone","glabra","9/12/1962",1962,9,12,255,1962255,NA,"unknown","unknown","unknown"," "," ","","","Pennsylvania","Mercer","","on Rt 285, 0.25 mi E of New Lebanon",41.41003,-80.07108,1283,"N",NA,"Y","Not Scorable","","","","","provided","provided","JA"
"256",12258071,"MW","CM","specimen","Chelone glabra","Chelone","glabra","9/8/1956",1956,9,8,252,1956252,NA,"unknown","unknown","unknown"," "," ","","","Pennsylvania","Mercer","","8.7 mi N of Mercer on Rt. 19, woods at road side park",41.352261,-80.224595,1600,"N",NA,"Y","Not Scorable","","","","","town+direction+distance+locality","best estimate","JA"
"257",12258072,"MW","CM","specimen","Chelone glabra","Chelone","glabra","9/8/1956",1956,9,8,252,1956252,NA,"unknown","unknown","unknown"," "," ","","","Pennsylvania","Mercer","","along Pymatuning Creek, 4 mi NW of Clarksville",41.327285,-80.488445,NA,"N",NA,"Y","Not Scorable","","",""," estimated location of town flooded by reservoir","town+direction+distance","","JA"
"258",12258073,"MW","CM","specimen","Chelone glabra","Chelone","glabra","9/12/1946",1946,9,12,255,1946255,NA,"unknown","unknown","unknown"," "," ","","same day/close together, NA phenology","Pennsylvania","Mercer","","along Rt 258, 1.5 mi S of London",41.121934,-80.148672,4260,"N",NA,"Y","Not Scorable","","","","","provided","provided","JA"
"259",12258074,"MW","CM","specimen","Chelone glabra","Chelone","glabra","9/14/1951",1951,9,14,257,1951257,NA,"unknown","unknown","unknown"," "," ","","","Pennsylvania","Butler","","Muddy Creek, along Rt 422, 12 mi NW of Butler",40.939176,-80.094707,NA,"N",NA,"Y","Not Scorable","","",""," not along muddy creek","locality","","JA"
"260",12258075,"MW","CM","specimen","Chelone glabra","Chelone","glabra","9/4/1927",1927,9,4,247,1927247,NA,"unknown","unknown","unknown"," "," ","","","Pennsylvania","Butler","","Thorn Creek, McBride",40.797383,-79.924787,NA,"N",NA,"Y","Not Scorable","","","","","locality","","JA"
"261",12258077,"MW","CM","specimen","Chelone glabra","Chelone","glabra","9/27/1904",1904,9,27,271,1904271,NA,"unknown","unknown","unknown"," "," ","","","Pennsylvania","Butler","","Valencia",40.674789,-79.989502,1109,"N",NA,"Y","Not Scorable","","","","","provided","provided","JA"
"262",12258078,"MW","CM","specimen","Chelone glabra","Chelone","glabra","9/5/1946",1946,9,5,248,1946248,NA,"unknown","unknown","unknown"," "," ","","","Pennsylvania","Butler","","Andersons Run, tributary of Glade Run, 2 mi NW of Cooperstown",40.733969,-79.958143,5042,"N",NA,"Y","Not Scorable","","","","","town+direction+distance","geolocate","JA"
"263",12258080,"MW","CM","specimen","Chelone glabra","Chelone","glabra","8/27/1944",1944,8,27,240,1944240,NA,"unknown","unknown","unknown"," "," ","","","Pennsylvania","Allegheny","","along Rt 910, 3 mi SE of Bakerstown",40.62015,-79.895924,5342,"N",NA,"Y","Not Scorable","","","","","provided","provided","JA"
"264",12258081,"MW","CM","specimen","Chelone glabra","Chelone","glabra","8/19/1944",1944,8,19,232,1944232,NA,"unknown","unknown","unknown"," "," ","","","Pennsylvania","Allegheny","","0.5 mi NE of Ben Avon Heights",40.518803,-80.066372,886,"N",NA,"Y","Not Scorable","","","","","town+direction+distance","geolocate","JA"
"265",12258083,"MW","CM","specimen","Chelone glabra","Chelone","glabra","9/13/1885",1885,9,13,256,1885256,NA,"unknown","unknown","unknown"," "," ","","","Pennsylvania","Allegheny","","Homewood",40.451458,-79.907828,3036,"N",NA,"Y","Not Scorable","","","","","provided","provided","JA"
"266",12258084,"MW","CM","specimen","Chelone glabra","Chelone","glabra","9/23/1916",1916,9,23,267,1916267,NA,"unknown","unknown","unknown"," "," ","","","Pennsylvania","Allegheny","","1 mi S of Logans Ferry, floodplain near pond",40.523353,-79.766714,5241,"N",NA,"Y","Not Scorable","","","","","locality","geolocate","JA"
"267",12258086,"MW","CM","specimen","Chelone glabra","Chelone","glabra","9/11/1969",1969,9,11,254,1969254,NA,"unknown","unknown","unknown"," "," ","","same day/close together, NA phenology","Pennsylvania","Butler","","along Findlay Run at Pipestem Rd, 3 mi NW of West Sunbury",41.03889,-79.92467,2042,"N",NA,"Y","Not Scorable","","","","","provided","provided","JA"
"268",12258087,"MW","CM","specimen","Chelone glabra","Chelone","glabra","9/13/1969",1969,9,13,256,1969256,NA,"unknown","unknown","unknown"," "," ","","","Pennsylvania","Venango","","between Freedom and Allegheny River",41.234664,-79.752488,45000,"N",NA,"Y","Not Scorable","","",""," couldn't find exact locality","locality","best estimate","JA"
"269",12258088,"MW","CM","specimen","Chelone glabra","Chelone","glabra","9/11/1969",1969,9,11,254,1969254,NA,"unknown","unknown","unknown"," "," ","","same day/close together, NA phenology","Pennsylvania","Butler","","S of Rt 138, 1.5 mi NW of Queen Junction",40.984599,-79.9493,3504,"N",NA,"Y","Not Scorable","","","","","provided","provided","JA"
"270",12258089,"MW","CM","specimen","Chelone glabra","Chelone","glabra","8/23/1955",1955,8,23,235,1955235,NA,"unknown","unknown","unknown"," "," ","","","Pennsylvania","Elk","","7 mi NE of Millstone",41.42579,-78.97676,5106,"N",NA,"Y","Not Scorable","","","","","provided","provided","JA"
"271",12258091,"MW","CM","specimen","Chelone glabra","Chelone","glabra","9/2/1965",1965,9,2,245,1965245,NA,"unknown","unknown","unknown"," "," ","","","Pennsylvania","Venango","","along Allegheny River, E edge of Emlenton",41.176116,-79.705492,500,"N",NA,"Y","Not Scorable","","","","","locality","best estimate","JA"
"272",12258092,"MW","CM","specimen","Chelone glabra","Chelone","glabra","8/31/1954",1954,8,31,243,1954243,NA,"unknown","unknown","unknown"," "," ","","same day/close together, NA phenology","Pennsylvania","Venango","","intersection of Rt 62 and 965, along Sandy Creek",41.354623,-79.939958,800,"N",NA,"Y","Not Scorable","","","","","locality","best estimate","JA"
"273",12258093,"MW","CM","specimen","Chelone glabra","Chelone","glabra","9/4/1958",1958,9,4,247,1958247,NA,"unknown","unknown","unknown"," "," ","","","Pennsylvania","Venango","","on Rt 964, 1 mi S of Utica",41.42432,-79.97862,1730,"N",NA,"Y","Not Scorable","","","","","provided","provided","JA"
"274",12258094,"MW","CM","specimen","Chelone glabra","Chelone","glabra","9/3/1952",1952,9,3,247,1952247,NA,"unknown","unknown","unknown"," "," ","","","Pennsylvania","Indiana","","along Yellow Creek at Rt. 259",40.574342,-79.008125,1000,"N",NA,"Y","Not Scorable","","","","","locality","best estimate","JA"
"275",12258095,"MW","CM","specimen","Chelone glabra","Chelone","glabra","9/16/1952",1952,9,16,260,1952260,NA,"unknown","unknown","unknown"," "," ","","same day/close together, NA phenology","Pennsylvania","Indiana","","along Crooked Creek, 2 mi NE of Shelocta",40.65731,-79.274976,2649,"N",NA,"Y","Not Scorable","","","","","town+direction+distance+locality","geolocate","JA"
"276",12258096,"MW","CM","specimen","Chelone glabra","Chelone","glabra","9/16/1952",1952,9,16,260,1952260,NA,"unknown","unknown","unknown"," "," ","","same day/close together, NA phenology","Pennsylvania","Indiana","","along Sides Run, 1 mi E of Pine Flats",40.660392,-78.8975,NA,"N",NA,"Y","Not Scorable","","","","","provided","","JA"
"277",12258097,"MW","CM","specimen","Chelone glabra","Chelone","glabra","9/10/1955",1955,9,10,253,1955253,NA,"unknown","unknown","unknown"," "," ","","same day/close together, NA phenology","Pennsylvania","Armstrong","","1-2 mi WNW of Mahoning",40.94365,-79.494654,NA,"N",NA,"Y","Not Scorable","","","","","provided","","JA"
"278",12258098,"MW","CM","specimen","Chelone glabra","Chelone","glabra","9/10/1955",1955,9,10,253,1955253,NA,"unknown","unknown","unknown"," "," ","","same day/close together, NA phenology","Pennsylvania","Armstrong","","1 mi NE of Templeton, edge of stream",40.92745,-79.4479,2564,"N",NA,"Y","Not Scorable","","","","","town+direction+distance","geolocate","JA"
"279",12258100,"MW","CM","specimen","Chelone glabra","Chelone","glabra","8/24/1941",1941,8,24,236,1941236,NA,"unknown","unknown","unknown"," "," ","","","Pennsylvania","Fayette","","Indian Head",40.024,-79.39863,1004,"N",NA,"Y","Not Scorable","","","","","provided","provided","JA"
"280",12258101,"MW","CM","specimen","Chelone glabra","Chelone","glabra","9/13/1947",1947,9,13,256,1947256,NA,"unknown","unknown","unknown"," "," ","","","Pennsylvania","Fayette","","4-5 mi SE of Haydentown, Wymps Gap",39.742829,-79.710584,4661,"N",NA,"Y","Not Scorable","","","","","town+direction+distance","geolocate","JA"
"281",12258103,"MW","CM","specimen","Chelone glabra","Chelone","glabra","7/30/1955",1955,7,30,211,1955211,NA,"unknown","unknown","unknown"," "," ","","","Pennsylvania","Warren","","5 mi S of Sugar Grove along Rt. 37",41.910112,-79.338662,7817,"N",NA,"Y","Not Scorable","","","","","provided","provided","JA"
"282",12258104,"MW","CM","specimen","Chelone glabra","Chelone","glabra","9/7/1957",1957,9,7,250,1957250,NA,"unknown","unknown","unknown"," "," ","","","Pennsylvania","Crawford","","near Crystal Lake, at Hartstown",41.552793,-80.377383,600,"N",NA,"Y","Not Scorable","","","","","locality","best estimate","JA"
"283",12258105,"MW","CM","specimen","Chelone glabra","Chelone","glabra","9/20/1961",1961,9,20,263,1961263,NA,"unknown","unknown","unknown"," "," ","","","Pennsylvania","Lawrence","","Buchanan Run, NE edge of Pulaski",41.125239,-80.396478,900,"N",NA,"Y","Not Scorable","","","","","locality","best estimate","JA"
"284",12258106,"MW","CM","specimen","Chelone glabra","Chelone","glabra","9/22/1954",1954,9,22,265,1954265,NA,"unknown","unknown","unknown"," "," ","","","Pennsylvania","Lawrence","","along Neshannock Creek, at Volant",41.111757,-80.258346,596,"N",NA,"Y","Not Scorable","","","","","locality","geolocate","JA"
"285",12258107,"MW","CM","specimen","Chelone glabra","Chelone","glabra","9/9/1952",1952,9,9,253,1952253,NA,"unknown","unknown","unknown"," "," ","","","Pennsylvania","Lawrence","","along Neshannock Creek, 2.5 mi W of Eastbrook",41.040678,-80.314097,5218,"N",NA,"Y","Not Scorable","","","","","town+direction+distance+locality","geolocate","JA"
"286",12258108,"MW","CM","specimen","Chelone glabra","Chelone","glabra","9/14/1951",1951,9,14,257,1951257,NA,"unknown","unknown","unknown"," "," ","","","Pennsylvania","Lawrence","","0.12 mi W of Rose Point",40.969959,-80.188855,NA,"N",NA,"Y","Not Scorable","","","","","provided","","JA"
"287",12258109,"MW","CM","specimen","Chelone glabra","Chelone","glabra","9/1/1951",1951,9,1,244,1951244,NA,"unknown","unknown","unknown"," "," ","","","Pennsylvania","Beaver","","Independence Twp, 0.5 mi from Allegheny Co line, along Reardons Run",40.515845,-80.320742,4900,"N",NA,"Y","Not Scorable","","",""," couldn’t find exact locality","locality","best estimate","JA"
"288",12258110,"MW","CM","specimen","Chelone glabra","Chelone","glabra","9/22/1951",1951,9,22,265,1951265,NA,"unknown","unknown","unknown"," "," ","","","Pennsylvania","Beaver","","Hanover Twp, ca 1-2.5 mi E of Rt 18, near Little Traverse Creek",40.528273,-80.392246,1000,"N",NA,"Y","Not Scorable","","","","","locality","best estimate","JA"
"289",12258111,"MW","CM","specimen","Chelone glabra","Chelone","glabra","9/20/1947",1947,9,20,263,1947263,NA,"unknown","unknown","unknown"," "," ","","","Pennsylvania","Beaver","","along Ohio River, 5 mi NW of Midland",40.683784,-80.513971,5480,"N",NA,"Y","Not Scorable","","","","","provided","provided","JA"
"290",12258112,"MW","CM","specimen","Chelone glabra","Chelone","glabra","9/19/1956",1956,9,19,263,1956263,NA,"unknown","unknown","unknown"," "," ","","","Pennsylvania","Beaver","","along Rt 351, 0.5 mi SE of Enon Valley",40.850279,-80.449946,NA,"N",NA,"Y","Not Scorable","","","","","town+direction+distance+locality","","JA"
"291",12258113,"MW","CM","specimen","Chelone glabra","Chelone","glabra","9/12/1957",1957,9,12,255,1957255,NA,"unknown","unknown","unknown"," "," ","","","Pennsylvania","Washington","","along Rt 231, 5 mi S of Claysville",40.045382,-80.410344,7423,"N",NA,"Y","Not Scorable","","","","","provided","provided","JA"
"292",12258115,"MW","CM","specimen","Chelone glabra","Chelone","glabra","9/19/1953",1953,9,19,262,1953262,"fruit","N","N","Y"," "," ","","","Pennsylvania","Erie","","along Hubbard Run, 3.5 mi SE of Wattsburg",41.967797,-79.76263,2617,"N",NA,"Y","Yes","Fruiting","","","","provided","provided","JA"
"293",12258117,"MW","CM","specimen","Chelone glabra","Chelone","glabra","8/19/1873",1873,8,19,231,1873231,NA,"unknown","unknown","unknown"," "," ","","","Pennsylvania","Somerset","Stoystown","",40.10252,-78.95579,584,"N",NA,"Y","Not Scorable","","","","","provided","provided","JA"
"294",12258118,"MW","CM","specimen","Chelone glabra","Chelone","glabra","9/19/1899",1899,9,19,262,1899262,"flowering","unknown","Y","N"," "," ","","","Pennsylvania","Allegheny","","N of Aspinwall",40.491458,-79.904773,1010,"N",NA,"Y","Yes","Flowering","","","","town","geolocate","JA"
"295",12265130,"MW","CM","specimen","Chelone glabra","Chelone","glabra","8/26/1935",1935,8,26,238,1935238,"flowering","unknown","Y","N"," "," ","","","Vermont","Windham","","Jamaica",43.100356,-72.77843,3036,"N",NA,"Y","Yes","Flowering","","","","provided","provided","JA"
"296",12268813,"MW","CM","specimen","Chelone glabra","Chelone","glabra","8/14/1912",1912,8,14,227,1912227,"flowering","unknown","Y","N"," "," ","","","Ontario","Thunder Bay District","West Fort William"," along river-flat",48.359843,-89.287189,2500,"N",NA,"Y","Yes","Flowering","","","","locality","best estimate","JA"
"297",12268814,"MW","CM","specimen","Chelone glabra","Chelone","glabra","8/22/1968",1968,8,22,235,1968235,"flowering","unknown","Y","N"," "," ","","","Quebec","Wolfe","","Mont Big Ham, canton d'Ham Sud, baissière humide enter les deux pics du sommet",46.783036,-71.286222,NA,"N",NA,"Y","Yes","Flowering","","","lat lon copied from messed up list: is wrong","provided","","JA"
"298",12268815,"MW","CM","specimen","Chelone glabra","Chelone","glabra","8/9/1968",1968,8,9,222,1968222,"flowering","unknown","Y","N"," "," ","","","Quebec","Richmond","","Lac Brompton, canton de Brompton, sud de la petite baie Brompton,  bord marécageux",46.783036,-71.286222,NA,"N",NA,"Y","Yes","Flowering","","","lat lon copied from messed up list: is wrong","provided","","JA"
"299",12268816,"MW","CM","specimen","Chelone glabra","Chelone","glabra","8/15/1966",1966,8,15,227,1966227,"flowering","unknown","Y","N"," "," ","","","Quebec","Wolfe","","Disraeli, lac Aylmer, canton de Garthby, fossé de la voie ferrée longeant le lac",45.660357,-72.148355,NA,"N",NA,"Y","Yes","Flowering","","","lat lon copied from messed up list, got more detailed location from description","provided","","JA"
"300",12268821,"MW","CM","specimen","Chelone glabra","Chelone","glabra","9/3/1925",1925,9,3,246,1925246,"flowering and fruit","unknown","Y","Y"," "," ","","same day/place, different phenology, date: given as september 3-4, 1925","Maryland","Wicomico","Salisbury","",38.360674,-75.599369,6757,"N",NA,"Y","Yes","Both","","","","provided","provided","JA"
"301",12268822,"MW","CM","specimen","Chelone glabra","Chelone","glabra","8/28/1941",1941,8,28,240,1941240,"flowering","unknown","Y","N"," "," ","","","Massachusetts","Berkshire","Mount Washington","Northrop Camp",42.12161,-73.475053,NA,"N",NA,"Y","Yes","Flowering","","","","locality","","JA"
"302",12268824,"MW","CM","specimen","Chelone glabra","Chelone","glabra","8/16/1946",1946,8,16,228,1946228,"flowering and fruit","unknown","Y","Y"," "," ","","","Massachusetts","Berkshire","","top of Hoosac Mountain, on Rt. 2",42.699433,-73.042416,NA,"N",NA,"Y","Yes","Both","","","","locality","","JA"
"303",12268825,"MW","CM","specimen","Chelone glabra","Chelone","glabra","9/19/1893",1893,9,19,262,1893262,"flowering","unknown","Y","N"," "," ","","","Missouri","Butler","","Poplar Bluff",36.756999,-90.392888,5854,"N",NA,"Y","Yes","Flowering","","","","provided","provided","JA"
"304",12268827,"MW","CM","specimen","Chelone glabra","Chelone","glabra","9/3/1953",1953,9,3,246,1953246,"flowering and fruit","unknown","Y","Y"," "," ","","","New York","","","35 mi E of Silver Lake",42.693943,-77.33216,NA,"N",NA,"Y","Yes","Both","","","check location","town+direction","","JA"
"305",12268828,"MW","CM","specimen","Chelone glabra","Chelone","glabra","9/7/1854",1854,9,7,250,1854250,"flowering and fruit","unknown","Y","Y"," "," ","","","New Jersey","Hudson","","Secaucus",40.789545,-74.05653,4648,"N",NA,"Y","Yes","Both","","","","provided","provided","JA"
"306",12268829,"MW","CM","specimen","Chelone glabra","Chelone","glabra","9/9/1974",1974,9,9,252,1974252,"flowering","unknown","Y","N"," "," ","","","New York","Niagara","","Somerset Twp., 10 mi E of Olcott along Lake Ontario",43.365816,-78.520293,NA,"N",NA,"Y","Yes","Flowering","","","","town","","JA"
"307",12268830,"MW","CM","specimen","Chelone glabra","Chelone","glabra","9/20/1927",1927,9,20,263,1927263,"flowering","unknown","Y","N"," "," ","","","North Carolina","Burke","","0.5 mi N of Bridgewater",35.718768,-81.862603,3479,"N",NA,"Y","Yes","Flowering","","","","provided","provided","JA"
"308",12268831,"MW","CM","specimen","Chelone glabra","Chelone","glabra","9/12/1959",1959,9,12,255,1959255,"flowering","unknown","Y","N"," "," ","","","Ohio","Carroll","","Specht Marsh, 3 mi S of Augusta Station",40.642417,-81.020926,6954,"N",NA,"Y","Yes","Flowering","","","","town+direction+distance+locality","geolocate","JA"
"309",12268832,"MW","CM","specimen","Chelone glabra","Chelone","glabra","9/12/1942",1942,9,12,255,1942255,"flowering","unknown","Y","N"," "," ","","","Ohio","Coshocton","","North Appalachian Experimental Watershed, near Coshocton",40.364235,-81.791519,NA,"N",NA,"Y","Yes","Flowering","","","","locality","","JA"
"310",12268833,"MW","CM","specimen","Chelone glabra","Chelone","glabra","9/15/1928",1928,9,15,259,1928259,"flowering","unknown","Y","N"," "," ","","","Ohio","Lucas","","",41.684186,-83.468264,53092,"N",NA,"Y","Yes","Flowering","","","","county","geolocate","JA"
"311",12268834,"MW","CM","specimen","Chelone glabra","Chelone","glabra","9/26/1884",1884,9,26,270,1884270,"fruit","N","N","Y"," "," ","","","Ohio","Mahoning","","near Petersburg",40.912561,-80.530347,3036,"N",NA,"Y","Yes","Fruiting","","","","town","geolocate","JA"
"312",12268835,"MW","CM","specimen","Chelone glabra","Chelone","glabra","8/20/1895",1895,8,20,232,1895232,"flowering and fruit","unknown","Y","Y"," "," ","","","Ohio","Richland","Mansfield","",40.75839,-82.515447,10323,"N",NA,"Y","Yes","Both","","","","provided","provided","JA"
"313",12268836,"MW","CM","specimen","Chelone glabra","Chelone","glabra","9/21/1969",1969,9,21,264,1969264,"flowering","unknown","Y","N"," "," ","","","Ohio","Trumbull","","Rt. 534, 1 mi S of Newton Falls",41.173899,-80.978147,4865,"N",NA,"Y","Yes","Flowering","","","","provided","provided","JA"
"314",12268837,"MW","CM","specimen","Chelone glabra","Chelone","glabra","8/12/1922",1922,8,12,224,1922224,"flowering","unknown","Y","N"," "," ","","","Vermont","Rutland","","Brandon",43.79812,-73.087612,2804,"N",NA,"Y","Yes","Flowering","","","","provided","provided","JA"
"315",12268838,"MW","CM","specimen","Chelone glabra","Chelone","glabra","8/23/1944",1944,8,23,236,1944236,"flowering","unknown","Y","N"," "," ","","","Vermont","Windsor","Bethel","",43.8334,-72.63399,3036,"N",NA,"Y","Yes","Flowering","","","","town","geolocate","JA"
"316",12268839,"MW","CM","specimen","Chelone glabra","Chelone","glabra","8/24/1963",1963,8,24,236,1963236,"flowering","unknown","Y","N"," "," ","","","Vermont","Rutland","Mt. Holly","near Summit Station, cliffs along RR cut",43.450451,-72.786174,3200,"N",NA,"Y","Yes","Flowering","",""," couldn't find exact locality","locality","best estimate","JA"
"317",12268840,"MW","CM","specimen","Chelone glabra","Chelone","glabra","9/7/1951",1951,9,7,250,1951250,"flowering and fruit","unknown","Y","Y"," "," ","","","West Virginia","Greenbrier","","along Otter Creek 0.5 mi from Meadow Bluff",37.896298,-80.653657,3036,"N",NA,"Y","Yes","Both","","","","locality","geolocate","JA"
"318",12268841,"MW","CM","specimen","Chelone glabra","Chelone","glabra","9/20/1958",1958,9,20,263,1958263,"flowering and fruit","unknown","Y","Y"," "," ","","same day/place, different phenology","West Virginia","Pocahontas","","northernly part of plateau on Black Mt",38.235118,-80.238128,2000,"N",NA,"Y","Yes","Both","","","","locality","best estimate","JA"
"319",12268843,"MW","CM","specimen","Chelone glabra","Chelone","glabra","9/2/1910",1910,9,2,245,1910245,"flowering","unknown","Y","N"," "," ","","","West Virginia","Tucker","","Davis",39.128719,-79.464774,2109,"N",NA,"Y","Yes","Flowering","","","","provided","provided","JA"
"320",12268844,"MW","CM","specimen","Chelone glabra","Chelone","glabra","9/2/1937",1937,9,2,245,1937245,"flowering","unknown","Y","N"," "," ","","","Newfoundland and Labrador","Newfoundland","","near Spout Pond",47.98442,-66.970827,NA,"N",NA,"Y","Yes","Flowering","","","","provided","","JA"
"321",12268845,"MW","CM","specimen","Chelone glabra","Chelone","glabra","8/10/1937",1937,8,10,222,1937222,"flowering and fruit","unknown","Y","Y"," "," ","","","Newfoundland and Labrador","Newfoundland","","Salmonier",47.064167,-55.209444,301,"N",NA,"Y","Yes","Both","","","","town","geolocate","JA"
"322",12268846,"MW","CM","specimen","Chelone glabra","Chelone","glabra","8/31/1947",1947,8,31,243,1947243,"flowering","unknown","Y","N"," "," ","","","Quebec","","","Metapedia",47.036063,-52.967718,NA,"N",NA,"Y","Yes","Flowering","","","lat lon copied from messed up list ","provided","","JA"
"323",12268847,"MW","CM","specimen","Chelone glabra","Chelone","glabra","8/6/1931",1931,8,6,218,1931218,"flowering","unknown","Y","N"," "," ","","","Quebec","Gaspe","","Chandler",48.333333,-64.666667,3036,"N",NA,"Y","Yes","Flowering","","","","provided","provided","JA"
"324",12268848,"MW","CM","specimen","Chelone glabra","Chelone","glabra","7/24/1935",1935,7,24,205,1935205,"flowering","unknown","Y","N"," "," ","","","Quebec","Terrebonne","","Killarney Rd at Devils River, Lac Mercier",45.645003,-73.653522,NA,"N",NA,"Y","Yes","Flowering","","","lat lon copied from messed up list-is wrong","provided","","JA"
"325",12268849,"MW","CM","specimen","Chelone glabra","Chelone","glabra","8/19/1928",1928,8,19,232,1928232,"flowering","unknown","Y","N"," "," ","","","Quebec","","","Ancienne Lorette, le long du C.N.R. en bas de Sainte-Foye",45.645003,-73.653522,NA,"N",NA,"Y","Yes","Flowering","","","lat lon copied from messed up list-is wrong ","provided","","JA"
"326",12268850,"MW","CM","specimen","Chelone glabra","Chelone","glabra","8/17/1936",1936,8,17,230,1936230,"flowering","unknown","Y","N"," "," ","","","Maine","Waldo","","roadside ditch, west slope near north end of megunticook mt",44.23812,-69.067917,2000,"N",NA,"Y","Yes","Flowering","","","","locality","best estimate","JA"
"327",12268852,"MW","CM","specimen","Chelone glabra","Chelone","glabra","8/22/1878",1878,8,22,234,1878234,"flowering","unknown","Y","N"," "," ","","","Maryland","Garrett","","Deer Park",39.423707,-79.325041,1386,"N",NA,"Y","Yes","Flowering","","","","provided","provided","JA"
"328",12268853,"MW","CM","specimen","Chelone glabra","Chelone","glabra","8/2/1971",1971,8,2,214,1971214,"flowering","unknown","Y","N"," "," ","","","New Hampshire","Belknap","","SteelHill, town of Sanbornton",43.489243,-71.582298,3036,"N",NA,"Y","Yes","Flowering","","","","town","geolocate","JA"
"329",12268854,"MW","CM","specimen","Chelone glabra","Chelone","glabra","8/7/1971",1971,8,7,219,1971219,"flowering","unknown","Y","N"," "," ","","","New Hampshire","Grafton","","on Greely Park Trail, White Mt. National Forest",44.148619,-71.453007,NA,"N",NA,"Y","Yes","Flowering","","","","locality","","JA"
"330",12268855,"MW","CM","specimen","Chelone glabra","Chelone","glabra","9/13/1958",1958,9,13,256,1958256,"flowering","unknown","Y","N"," "," ","","","Ohio","Columbiana","","1 mi N of New Garden on Rt. 9",40.809829,-80.926198,5241,"N",NA,"Y","Yes","Flowering","","","","provided","provided","JA"
"331",12268858,"MW","CM","specimen","Chelone glabra","Chelone","glabra","9/14/1952",1952,9,14,258,1952258,"flowering","unknown","Y","N"," "," ","","","West Virginia","Greenbrier","","Bear Wallow 0.25 mi from Strawberry Knob on Cross Mountains",38.204695,-80.423547,7000,"N",NA,"Y","Yes","Flowering","","","","locality","best estimate","JA"
"332",12268859,"MW","CM","specimen","Chelone glabra","Chelone","glabra","9/20/1958",1958,9,20,263,1958263,"flowering","unknown","Y","N"," "," ","","same day/place, different phenology","West Virginia","Pocahontas","","northerly part of plateau on Black Mt",NA,NA,NA,"N",NA,"Y","Yes","Flowering","","","","","","JA"
"333",12268860,"MW","CM","specimen","Chelone glabra","Chelone","glabra","8/30/1946",1946,8,30,242,1946242,"flowering","unknown","Y","N"," "," ","","","West Virginia","Randolph","","1 mi SW of Cheat Bridge, in Cheat Mt. area",38.601528,-79.887349,4807,"N",NA,"Y","Yes","Flowering","","","","provided","provided","JA"
"334",12268861,"MW","CM","specimen","Chelone glabra","Chelone","glabra","8/30/1947",1947,8,30,242,1947242,"flowering","unknown","Y","N"," "," ","","","West Virginia","Randolph","","Cheat Mt., vicinity of Red Run",38.627629,-79.904396,5000,"N",NA,"Y","Yes","Flowering","","","","locality","best estimate","JA"
"335",12268862,"MW","CM","specimen","Chelone glabra","Chelone","glabra","8/18/1950",1950,8,18,230,1950230,"flowering","unknown","Y","N"," "," ","","","West Virginia","Randolph","","Cheat Bridge",38.61178,-79.874229,3036,"N",NA,"Y","Yes","Flowering","","","","provided","provided","JA"
"336",12268864,"MW","CM","specimen","Chelone glabra","Chelone","glabra","9/13/1952",1952,9,13,257,1952257,"flowering","unknown","Y","N"," "," ","","","West Virginia","Randolph","","Shavers Fork R. at Rt. 250, bordering heavy herbage, wet ground, riverbank",38.626308,-79.869344,1000,"N",NA,"Y","Yes","Flowering","","","","locality","best estimate","JA"
"337",12268865,"MW","CM","specimen","Chelone glabra","Chelone","glabra","8/14/1924",1924,8,14,227,1924227,"flowering","unknown","Y","N"," "," ","","","West Virginia","Greenbrier","","Lewisburg",37.801788,-80.44563,3458,"N",NA,"Y","Yes","Flowering","","","","provided","provided","JA"
"338",12268866,"MW","CM","specimen","Chelone glabra","Chelone","glabra","7/15/1878",1878,7,15,196,1878196,"flowering","unknown","Y","N"," "," ","","","West Virginia","Randolph","","Helvetia",38.705939,-80.201188,3036,"N",NA,"Y","Yes","Flowering","","","","provided","provided","JA"
"339",12268867,"MW","CM","specimen","Chelone glabra","Chelone","glabra","8/12/1932",1932,8,12,225,1932225,"flowering","unknown","Y","N"," "," ","","","Ontario","Bruce","Sauble Beach","Bruce Peninsula",44.63623,-81.26913,301,"N",NA,"Y","Yes","Flowering","","","","town","geolocate","JA"
"340",12268868,"MW","CM","specimen","Chelone glabra","Chelone","glabra","8/30/1927",1927,8,30,242,1927242,"fruit","N","N","Y"," "," ","","","Indiana","Steuben","","E of Pokogon Park, James Lake",41.702685,-85.035521,800,"N",NA,"Y","Yes","Fruiting","","","lat lon copied from messed up list ","locality","best estimate","JA"
"341",12268871,"MW","CM","specimen","Chelone glabra","Chelone","glabra","8/27/1948",1948,8,27,240,1948240,"flowering","unknown","Y","N"," "," ","","","Michigan","Iosco","","East Tawas",44.279461,-83.490252,2492,"N",NA,"Y","Yes","Flowering","","","","provided","provided","JA"
"342",12268873,"MW","CM","specimen","Chelone glabra","Chelone","glabra","9/20/1913",1913,9,20,263,1913263,"flowering","unknown","Y","N"," "," ","","","Ohio","Portage","Kent","",41.153667,-81.357886,4157,"N",NA,"Y","Yes","Flowering","","","","provided","provided","JA"
"343",12268874,"MW","CM","specimen","Chelone glabra","Chelone","glabra","8/28/1913",1913,8,28,240,1913240,"flowering","unknown","Y","N"," "," ","","","Ohio","Portage","Kent","",41.153667,-81.357886,4157,"N",NA,"Y","Yes","Flowering","","","","provided","provided","JA"
"344",12268876,"MW","CM","specimen","Chelone glabra","Chelone","glabra","8/16/1911",1911,8,16,228,1911228,"flowering","unknown","Y","N"," "," ","","","Ohio","Geauga","Burton","",41.470609,-81.1451,1418,"N",NA,"Y","Yes","Flowering","","","","provided","provided","JA"
"345",12268877,"MW","CM","specimen","Chelone glabra","Chelone","glabra","9/3/1927",1927,9,3,246,1927246,"flowering and fruit","unknown","Y","Y"," "," ","","same day/place, different phenology","Wisconsin","Polk","","Interstate Park, St. Croix Falls",NA,NA,NA,"N",NA,"Y","Yes","Both","","","","","","JA"
"346",12271788,"MW","CM","specimen","Chelone glabra","Chelone","glabra","9/30/1942",1942,9,30,273,1942273,"flowering","unknown","Y","N"," "," ","","","West Virginia","Monongalia","Greer","along Deckers Creek",39.572472,-79.848702,1000,"N",NA,"Y","Yes","Flowering","","","","locality","best estimate","JA"
"347",12271789,"MW","CM","specimen","Chelone glabra","Chelone","glabra","9/1/1942",1942,9,1,244,1942244,"flowering and fruit","unknown","Y","Y"," "," ","","","West Virginia","Monongalia","Gum Springs","",39.518418,-79.910343,3036,"N",NA,"Y","Yes","Both","","","","town","geolocate","JA"
"348",12271790,"MW","CM","specimen","Chelone glabra","Chelone","glabra","8/18/1937",1937,8,18,230,1937230,"flowering","unknown","Y","N"," "," ","","","West Virginia","Pocahontas","","Huntersville",38.188733,-80.016173,3036,"N",NA,"Y","Yes","Flowering","","","","provided","provided","JA"
"349",12289815,"MW","CM","specimen","Chelone glabra","Chelone","glabra","9/21/1882",1882,9,21,264,1882264,NA,"unknown","unknown","unknown"," "," ","","","Pennsylvania","Erie","","Sullivans, on Cascade Creek",42.112586,-80.118756,NA,"N",NA,"Y","Not Scorable","","",""," couldn’t find exact locality","locality","","JA"
"350",12315519,"MW","CM","specimen","Chelone glabra","Chelone","glabra","9/11/1972",1972,9,11,255,1972255,"flowering and fruit","unknown","Y","Y"," "," ","","","Michigan","Saint Clair","","ca 19 mi NW of Port Huron, just W of Fargo T8N, R15E, Sec. 28; ,",43.096556,-82.707847,1200,"N",NA,"Y","Yes","Both","","","","PLSS","best estimate","JA"
"351",12315520,"MW","CM","specimen","Chelone glabra","Chelone","glabra","9/13/1974",1974,9,13,256,1974256,"flowering and fruit","unknown","Y","Y"," "," ","","","Ohio","Erie","","Berlin Twp., approximately 5 mi E of Milan;;T5N, R21W; ,",41.297512,-82.509016,8504,"N",NA,"Y","Yes","Both","","","","provided","provided","JA"
"352",12318822,"MW","CM","specimen","Chelone glabra","Chelone","glabra","7/28/1978",1978,7,28,209,1978209,"flowering","unknown","Y","N"," "," ","","","Massachusetts","Hampden","Holyoke","along railroad & Connecticut River, just N of Rt. 141",42.212873,-72.606172,4300,"N",NA,"Y","Yes","Flowering","","","","locality","best estimate","JA"
"353",12322986,"MW","CM","specimen","Chelone glabra","Chelone","glabra","9/14/1981",1981,9,14,257,1981257,NA,"unknown","unknown","unknown"," "," ","","","Pennsylvania","Somerset","","Quemahoning Creek watershed, on US 30, ca 0.5 km NE of Ferrellton",40.151671,-79.031943,1200,"N",NA,"Y","Not Scorable","","","","","town+direction+distance","best estimate","JA"
"354",12322987,"MW","CM","specimen","Chelone glabra","Chelone","glabra","9/14/1981",1981,9,14,257,1981257,NA,"unknown","unknown","unknown"," "," ","","","Pennsylvania","Fayette","","Indian Creek Watershed, on PA 381-711, ca 1 km N of Melcroft",40.059821,-79.388719,900,"N",NA,"Y","Not Scorable","","","","","locality","best estimate","JA"
"355",12322992,"MW","CM","specimen","Chelone glabra","Chelone","glabra","9/14/1981",1981,9,14,257,1981257,NA,"unknown","unknown","unknown"," "," ","","","Pennsylvania","Bedford","","on US 30, near Shawnee State Park, ca 2 km E of Schellsburg",40.047749,-78.605236,NA,"N",NA,"Y","Not Scorable","","","","","locality","","JA"
"356",12323001,"MW","CM","specimen","Chelone glabra","Chelone","glabra","9/14/1981",1981,9,14,257,1981257,NA,"unknown","unknown","unknown"," "," ","","","Pennsylvania","Westmoreland","","Powdermill Nature Reserve, 6.5 mi SW of Rector, Friedline/Knupp 3;;40°07'45""N, 79°17'30""W; ,",40.12916667,-79.29166667,NA,"N",NA,"Y","Not Scorable","","","","","provided","","JA"
"357",12323045,"MW","CM","specimen","Chelone glabra","Chelone","glabra","9/27/1981",1981,9,27,270,1981270,"flowering and fruit","unknown","Y","Y"," "," ","","","Virginia","Rappahannock","","near Keyser Run, jct of Rt. 623 & 614",38.71817,-78.23789,NA,"N",NA,"Y","Yes","Both","","","","locality","","JA"
"358",12325278,"MW","CM","specimen","Chelone glabra","Chelone","glabra","9/25/1980",1980,9,25,269,1980269,"flowering","unknown","Y","N"," "," ","","same day/place, different phenology?","Tennessee","Blount","","beside Reed Creek Rd near Saddle Ridge Development E of Walland, S edge of Chilhowee Mt",35.744324,-83.724071,400,"N",NA,"Y","Yes","Flowering","","","","locality","best estimate","JA"
"359",12327391,"MW","CM","specimen","Chelone glabra","Chelone","glabra","8/30/1977",1977,8,30,242,1977242,NA,"unknown","unknown","unknown"," "," ","","","Pennsylvania","Somerset","","Lower Turkeyfoot Twp, Cranberry Glade Lake, ca 4.5 mi NNW of Humbert. 39°54'N, 79°22'W",39.907434,-79.371413,1100,"N",NA,"Y","Not Scorable","","","","","locality","best estimate","JA"
"360",12327398,"MW","CM","specimen","Chelone glabra","Chelone","glabra","8/6/1968",1968,8,6,219,1968219,"flowering","unknown","Y","N"," "," ","","","New Hampshire","Coos","","Success Pond Rd, Success",44.506427,-71.056172,8000,"N",NA,"Y","Yes","Flowering","","","","locality","best estimate","JA"
"361",12329386,"MW","CM","specimen","Chelone glabra","Chelone","glabra","8/28/1985",1985,8,28,240,1985240,NA,"unknown","unknown","unknown"," "," ","","","Pennsylvania","Butler","","Stone House, intersection Rt 528 and 173, Jennings Prairie, Jennings Environmental Education Center",41.01147,-80.0022,499,"N",NA,"Y","Not Scorable","","","","","provided","provided","JA"
"362",12330617,"MW","CM","specimen","Chelone glabra","Chelone","glabra","8/23/1986",1986,8,23,235,1986235,"flowering","unknown","Y","N"," "," ","","date: given as 23-24 Aug 1986","West Virginia","Preston","Terra Alta","Lake Terra Alta & vicinity",39.455578,-79.52477,700,"N",NA,"Y","Yes","Flowering","","","","locality","best estimate","JA"
"363",12331146,"MW","CM","specimen","Chelone glabra","Chelone","glabra","8/14/1987",1987,8,14,226,1987226,"flowering","unknown","Y","N"," "," ","","","Michigan","Menominee","","ca 4 mi W of Cedar River (village) enroute to Stephenson on Co. G-12. 45°20'N, 87°25'W",45.40967,-87.434012,5868,"N",NA,"Y","Yes","Flowering","","","has coordinates from observer, but description provides better location","town+direction+distance+locality","geolocate","JA"
"364",12331152,"MW","CM","specimen","Chelone glabra","Chelone","glabra","8/15/1987",1987,8,15,227,1987227,"flowering","unknown","Y","N"," "," ","","","Wisconsin","Oconto","","Breed Twp., ca 6 mi NW of Suring on WI 32 & county A on Wesco Flowage Rd. 45°00'N, 88°30'W",44.999155,-88.372046,NA,"N",NA,"Y","Yes","Flowering","","","lat lon in columns copied from messed up list ; ,","provided","","JA"
"365",12331340,"MW","CM","specimen","Chelone glabra","Chelone","glabra","9/6/1987",1987,9,6,249,1987249,NA,"unknown","unknown","unknown"," "," ","","","Pennsylvania","Blair","","Sinking Valley-Brush Mountain area, ca 10 air mi NE of Altoona, Fort Robinson off Rt 07053 near Culp;;40°35'N, 78°20'W; ,",40.58333,-78.33333,1205,"N",NA,"Y","Not Scorable","","","","","provided","provided","JA"
"366",12331388,"MW","CM","specimen","Chelone glabra","Chelone","glabra","8/19/1987",1987,8,19,231,1987231,"flowering","unknown","Y","N"," "," ","","","Wisconsin","Lincoln","","Rock Falls Twp., Grandfather Falls area of Wisconsin River along WI 107, 10 mi NNW of Merrill on 107. 45°17'N, 89°45'W",45.307155,-89.779297,NA,"N",NA,"Y","Yes","Flowering","","","lat lon in columns copied from messed up list ; ,","provided","","JA"
"367",12333208,"MW","CM","specimen","Chelone glabra","Chelone","glabra","7/25/1988",1988,7,25,207,1988207,"flowering and fruit","unknown","Y","Y"," "," ","","","Michigan","Gogebic","","S end of Lake Gogebic, Ice House Bay, ca 1.5 mi SE of MI 64 T46N, R42W, Sec. 10 NW; ,",46.405262,-89.548188,800,"N",NA,"Y","Yes","Both","","","","PLSS/locality","best estimate","JA"
"368",12333214,"MW","CM","specimen","Chelone glabra","Chelone","glabra","7/29/1988",1988,7,29,211,1988211,"flowering","unknown","Y","N"," "," ","","","Wisconsin","Lincoln","Birch","Birch township, E shore Larson Lake, ca 7 mi N of Merrill along US 51 T23N, R7E, Sec. 31; ,",45.299244,-89.65966,200,"N",NA,"Y","Yes","Flowering","","","Assuming T23N should be T33N","locality","best estimate","JA"
"369",12333363,"MW","CM","specimen","Chelone glabra","Chelone","glabra","8/28/1982",1982,8,28,240,1982240,NA,"unknown","unknown","unknown"," "," ","","","Pennsylvania","Blair","","Little Juniata River, ca 0.4 mi SW of Bellwood",40.585167,-78.343336,3255,"N",NA,"Y","Not Scorable","","","","","town+direction+distance+locality","geolocate","JA"
"370",12333364,"MW","CM","specimen","Chelone glabra","Chelone","glabra","8/26/1986",1986,8,26,238,1986238,NA,"unknown","unknown","unknown"," "," ","","","Pennsylvania","Blair","","along Boiling Spring Run, ca 0.8 mi SSW of Sproul",40.260699,-78.462094,1000,"N",NA,"Y","Not Scorable","","","","","town+direction+distance+locality","best estimate","JA"
"371",12333613,"MW","CM","specimen","Chelone glabra","Chelone","glabra","9/12/1984",1984,9,12,256,1984256,NA,"unknown","unknown","unknown"," "," ","","","Pennsylvania","Indiana","","0.5 mi W of junction of PA 119S and Indian Springs Road, VFW Country Club. 40°35'N, 79°10'W",40.591883,-79.167937,500,"N",NA,"Y","Not Scorable","","","","","locality","best estimate","JA"
"372",12334619,"MW","CM","specimen","Chelone glabra","Chelone","glabra","9/8/1990",1990,9,8,251,1990251,NA,"unknown","unknown","unknown"," "," ","","","Pennsylvania","Allegheny","","4 km N of Tarentum",40.63872,-79.75833,4765,"N",NA,"Y","Not Scorable","","","","","provided","provided","JA"
"373",12334753,"MW","CM","specimen","Chelone glabra","Chelone","glabra","8/24/1989",1989,8,24,236,1989236,"flowering","unknown","Y","N"," "," ","","same day/place, different phenology","Michigan","Presque Isle","","Forty Mile Point: Lake Huron shoreline, ca 1.3 mi NW of P.H. Hoeft State Park on MICH 23",NA,NA,NA,"N",NA,"Y","Yes","Flowering","","","","","","JA"
"374",12334758,"MW","CM","specimen","Chelone glabra","Chelone","glabra","8/24/1989",1989,8,24,236,1989236,"flowering and fruit","unknown","Y","Y"," "," ","","same day/place, different phenology","Michigan","Presque Isle","","Lake Huron-Hammond Bay: ca 1 mi WNW of Huron Beach on MI 23 enroute to Cheboygan",45.502225,-84.110538,500,"N",NA,"Y","Yes","Both","","","","town+direction+distance+locality","best estimate","JA"
"375",12334789,"MW","CM","specimen","Chelone glabra","Chelone","glabra","8/23/1989",1989,8,23,235,1989235,"flowering","unknown","Y","N"," "," ","","","Wisconsin","Marinette","","Silver Cliff Township: ca 9 mi SSE of Goodman & US hwy 8 on Co. hwy, along Pestigo River;;T35N, R17E, Sec. 10; ,",45.510757,-88.282737,5676,"N",NA,"Y","Yes","Flowering","","","","provided","provided","JA"
"376",12335229,"MW","CM","specimen","Chelone glabra","Chelone","glabra","8/8/1990",1990,8,8,220,1990220,"flowering","unknown","Y","N"," "," ","","","Wisconsin","Marathon","","Berlin Twp: ca 15 air mi NW of Wausau, 9 mi N on Co hwy K, & 3 mi W of Co K from Wausau;;T30N, R6E, Sec. 1 SW SW; ,",45.112527,-89.847188,15126,"N",NA,"Y","Yes","Flowering","","","","provided","provided","JA"
"377",12336031,"MW","CM","specimen","Chelone glabra","Chelone","glabra","8/14/1991",1991,8,14,226,1991226,NA,"unknown","unknown","unknown"," "," ","","","West Virginia","Preston","","ca 0.2 mi W of MD-WV line & ca 3.5 mi SSE of Cranesville on town road, near junction with Hoyes Run. 39°33'N, 79°30'W",39.514913,-79.484121,800,"N",NA,"Y","Not Scorable","","",""," provided coordinates don't match up with description","locality","best estimate","JA"
"378",12336041,"MW","CM","specimen","Chelone glabra","Chelone","glabra","8/8/1991",1991,8,8,220,1991220,NA,"unknown","unknown","unknown"," "," ","","","Wisconsin","Sawyer","","Chequamegon National Forest, E side of Moose Lake, ca 30 mi W of Park Falls, T41N, R5W, Sec. 20;",46.129566,-90.862983,NA,"N",NA,"Y","Not Scorable","","","","PLSS lat lon copied from messed up list-is wrong","provided","","JA"
"379",12336049,"MW","CM","specimen","Chelone glabra","Chelone","glabra","8/9/1991",1991,8,9,221,1991221,NA,"unknown","unknown","unknown"," "," ","","","Wisconsin","Ashland","","Chequamegon National Forest, Day Lake area, ca 1.5 mi N of Clam Lake on CO GG, SE side of Lake.  T43N, R4W, Sec. 29 NW; ,",46.176434,-90.895258,1200,"N",NA,"Y","Not Scorable","","","","","PLSS","best estimate","JA"
"380",12336057,"MW","CM","specimen","Chelone glabra","Chelone","glabra","8/8/1991",1991,8,8,220,1991220,NA,"unknown","unknown","unknown"," "," ","","","Wisconsin","Taylor","","Chequamegon National Forest, ca 15 mi NE of Medford on WI 13 & Co. D;;T33N, R1W, Sec. 24; ,",45.291965,-90.1224,11116,"N",NA,"Y","Not Scorable","","","","","provided","provided","JA"
"381",12336101,"MW","CM","specimen","Chelone glabra","Chelone","glabra","8/14/1991",1991,8,14,226,1991226,NA,"unknown","unknown","unknown"," "," ","","","Maryland","Garrett","","Garrett State Forest, Piney Mt., along Sang Run-Cranesville Rd from intersection with Piney Mt. Rd.  39°33'N, 79°27'W;",39.496232,-79.453512,NA,"N",NA,"Y","Not Scorable","","","","","locality","","JA"
"382",12337561,"MW","CM","specimen","Chelone glabra","Chelone","glabra","9/20/1992",1992,9,20,264,1992264,NA,"unknown","unknown","unknown"," "," ","","","Pennsylvania","Columbia","","3.5 km E of Coles Creek, edge of Grisco Swamp.  41°14'N, 76°19'W; ,",41.24264,-76.322119,NA,"N",NA,"Y","Not Scorable","","","","","locality","","JA"
"383",12338666,"MW","CM","specimen","Chelone glabra","Chelone","glabra","9/18/1992",1992,9,18,262,1992262,NA,"unknown","unknown","unknown"," "," ","","","Pennsylvania","Westmoreland","Donegal ","along Hauger Road from N end of Donegal Lake dam to Acme;;40°08'55""N, 79°23'07""W; ,",40.14861111,-79.38527778,NA,"N",NA,"Y","Not Scorable","","","","","provided","","JA"
"384",12338702,"MW","CM","specimen","Chelone glabra","Chelone","glabra","8/8/1986",1986,8,8,220,1986220,"flowering","unknown","Y","N"," "," ","","","Wisconsin","Bayfield","","5 mi N of Washburn along WI 13, along Chequamegon Bay, Lake Superior;;T49N, R4W, Sec. 5; ,",46.745657,-90.894908,9428,"N",NA,"Y","Yes","Flowering","","","","provided","provided","JA"
"385",12339456,"MW","CM","specimen","Chelone glabra","Chelone","glabra","9/18/1993",1993,9,18,261,1993261,NA,"unknown","unknown","unknown"," "," ","","","Pennsylvania","Forest","","ca 0.5 mi S of Trunkeyville along Allegheny River, Harmony Township",41.60294,-79.40318,1257,"N",NA,"Y","Not Scorable","","","","","provided","provided","JA"
"386",12340253,"MW","CM","specimen","Chelone glabra","Chelone","glabra","9/13/1993",1993,9,13,256,1993256,NA,"unknown","unknown","unknown"," "," ","","","Pennsylvania","Mercer","","0.5 mi E of Leesburg on PA 208, State Game Lands 284",41.134503,-80.210442,3479,"N",NA,"Y","Not Scorable","","","","","provided","provided","JA"
"387",12340477,"MW","CM","specimen","Chelone glabra","Chelone","glabra","9/2/1993",1993,9,2,245,1993245,"flowering","unknown","Y","N"," "," ","","","Ohio","Wood","Weston","0.5 mi SW of US 6 crossing,NE of Weston, Sec. 25, Weston Twp, moist thickets on E side of railroad",41.365338,-83.815479,NA,"N",NA,"Y","Yes","Flowering","","","PLSS","provided","","JA"
"388",12340553,"MW","CM","specimen","Chelone glabra","Chelone","glabra","9/11/1993",1993,9,11,254,1993254,NA,"unknown","unknown","unknown"," "," ","","","Pennsylvania","Somerset","","3 km NW of Somerset, Husband",40.04301,-79.10033,618,"N",NA,"Y","Not Scorable","","","","","provided","provided","JA"
"389",12341118,"MW","CM","specimen","Chelone glabra","Chelone","glabra","8/23/1994",1994,8,23,235,1994235,NA,"unknown","unknown","unknown"," "," ","","","Wisconsin","Shawano","","1.5 mi S of WI 29 to Voelz County Park on Wilson Lake;;44°49'08""N, 89°13'08""W; ,",44.81888889,-89.21888889,NA,"N",NA,"Y","Not Scorable","","","","","provided","","JA"
"390",12341168,"MW","CM","specimen","Chelone glabra","Chelone","glabra","8/24/1994",1994,8,24,236,1994236,NA,"unknown","unknown","unknown"," "," ","","","Wisconsin","Wood","","0.5 mi SW of Arpin on Co. E, Powers Bluff County Park;;44°31'39""N, 90°04'26""W; ,",44.5275,-90.07388889,NA,"N",NA,"Y","Not Scorable","","","","","provided","","JA"
"391",12341184,"MW","CM","specimen","Chelone glabra","Chelone","glabra","10/7/1994",1994,10,7,280,1994280,NA,"unknown","unknown","unknown"," "," ","","","Pennsylvania","Warren","","ca 4.5 mi NE of Bimber Corners, Allegheny National Forest.  41°42'N, 79°15'W",41.728641,-79.273905,6000,"N",NA,"Y","Not Scorable","","","","","provided by observer","best estimate","JA"
"392",12341236,"MW","CM","specimen","Chelone glabra","Chelone","glabra","10/15/1994",1994,10,15,288,1994288,NA,"unknown","unknown","unknown"," "," ","","","Pennsylvania","Indiana","","1.25 mi S of Nashville, State Game Lands 262;;40°46'N, 78°56'W; ,",40.778616,-78.926977,3909,"N",NA,"Y","Not Scorable","","","","","provided","provided","JA"
"393",12341241,"MW","CM","specimen","Chelone glabra","Chelone","glabra","10/15/1994",1994,10,15,288,1994288,NA,"unknown","unknown","unknown"," "," ","","","Pennsylvania","Jefferson","","1.25 mi SE of Green Valley, State Game Lands 31;;41°02'N, 79°02'W; ,",41.048643,-79.024159,3296,"N",NA,"Y","Not Scorable","","","","","provided","provided","JA"
"394",12341242,"MW","CM","specimen","Chelone glabra","Chelone","glabra","10/15/1994",1994,10,15,288,1994288,NA,"unknown","unknown","unknown"," "," ","","","Pennsylvania","Clarion","","ca 1 mi NW of Lamartine, Kahle Lake. 41°14'N, 79°78'W",41.236398,-79.657228,1900,"N",NA,"Y","Not Scorable","","","","came with verbatim coordinates, but they are not a valid number ","locality","best estimate","JA"
"395",12341245,"MW","CM","specimen","Chelone glabra","Chelone","glabra","10/24/1994",1994,10,24,297,1994297,NA,"unknown","unknown","unknown"," "," ","","","Pennsylvania","Mercer","","ca 3.25 mi S of West Middlesex, along Shenango River. 41°07'N, 80°27'W",41.114285,-80.44317,900,"N",NA,"Y","Not Scorable","","","","","locality","best estimate","JA"
"396",12341333,"MW","CM","specimen","Chelone glabra","Chelone","glabra","9/8/1994",1994,9,8,251,1994251,NA,"unknown","unknown","unknown"," "," ","","","Pennsylvania","Butler","","Moores Corners;;41°02'N, 80°06'W; ,",41.03333,-80.1,1205,"N",NA,"Y","Not Scorable","","","","","provided","provided","JA"
"397",12341340,"MW","CM","specimen","Chelone glabra","Chelone","glabra","7/27/1994",1994,7,27,208,1994208,NA,"unknown","unknown","unknown"," "," ","","same day/close together, NA phenology","Pennsylvania","Erie","","2.7 km NNW of Lowville, just W of French Creek, Lowville Fen;calcareous seepage wetland bissected by a powerline;42°02'39""N, 79°50'17""W; ,",42.04416667,-79.83805556,NA,"N",NA,"Y","Not Scorable","","","","","provided","","JA"
"398",12341361,"MW","CM","specimen","Chelone glabra","Chelone","glabra","9/23/1994",1994,9,23,266,1994266,NA,"unknown","unknown","unknown"," "," ","","same day/close together, NA phenology","Pennsylvania","Erie","","5 km NNE of Waterford, E side Le Boeuf Creek tributary, State Game Lands 109, Waterford Wetlands;41°59'05""N, 79°58'23""W; ,",41.98472222,-79.97305556,NA,"N",NA,"Y","Not Scorable","","","","","provided","","JA"
"399",12341362,"MW","CM","specimen","Chelone glabra","Chelone","glabra","9/23/1994",1994,9,23,266,1994266,NA,"unknown","unknown","unknown"," "," ","","same day/close together, NA phenology","Pennsylvania","Erie","","2.7 km NNW of Lowville, just W of French Creek, Lowville Fen;;42°02'39""N, 79°50'17""W; ,",42.04416667,-79.83805556,NA,"N",NA,"Y","Not Scorable","","","","","provided","","JA"
"400",12341363,"MW","CM","specimen","Chelone glabra","Chelone","glabra","7/27/1994",1994,7,27,208,1994208,NA,"unknown","unknown","unknown"," "," ","","same day/close together, NA phenology","Pennsylvania","Erie","","1.5 km N of Wattsburg on PA 89, Wattsburg Fen;;41°57'50""N, 79°45'46""W; ,",41.96388889,-79.76277778,NA,"N",NA,"Y","Not Scorable","","","","","provided","","JA"
"401",12341364,"MW","CM","specimen","Chelone glabra","Chelone","glabra","9/22/1994",1994,9,22,265,1994265,NA,"unknown","unknown","unknown"," "," ","","","Pennsylvania","Warren","","3 km NNW of Columbus, W of Brokenstraw Creek, State Game Lands 197, Brokenstraw Valley Fen;;41°58'03""N, 79°35'30""W; ,",41.9675,-79.59167,14,"N",NA,"Y","Not Scorable","","","","","provided","provided","JA"
"402",12341365,"MW","CM","specimen","Chelone glabra","Chelone","glabra","7/25/1994",1994,7,25,206,1994206,NA,"unknown","unknown","unknown"," "," ","","","Pennsylvania","Warren","","6 km N of Columbus, W edge of Tamarack Swamp, State Game Lands 197;;41°59'40""N, 79°33'45""W; ,",41.99444444,-79.5625,NA,"N",NA,"Y","Not Scorable","","","","","provided","","JA"
"403",12341366,"MW","CM","specimen","Chelone glabra","Chelone","glabra","9/7/1994",1994,9,7,250,1994250,NA,"unknown","unknown","unknown"," "," ","","","Pennsylvania","Crawford","","5 km ENE of Townville, E of Koochogey, Koochogey Wetlands Fen;;41°41'56""N, 79°48'08""W; ,",41.69888889,-79.80222222,NA,"N",NA,"Y","Not Scorable","","","","","provided","","JA"
"404",12341677,"MW","CM","specimen","Chelone glabra","Chelone","glabra","7/27/1995",1995,7,27,208,1995208,"flowering","unknown","Y","N"," "," ","","","New Hampshire","Coos","","0.3 mi W of Coleman State Park, along SW shore of Little Diamond Pond;;44°56'53""N, 71°19'46""W; ,",44.94805556,-71.32944444,NA,"N",NA,"Y","Yes","Flowering","","","","provided","","JA"
"405",12341960,"MW","CM","specimen","Chelone glabra","Chelone","glabra","8/27/1995",1995,8,27,239,1995239,"flowering","unknown","Y","N"," "," ","","","Pennsylvania","Tioga","","ca 3.8 mi S of Sabinsville on Gurnee Road. 41°48'N, 77°31'W",41.811876,-77.527715,2000,"N",NA,"Y","Yes","Flowering","","","","town+direction+distance+locality","best estimate","JA"
"406",12341963,"MW","CM","specimen","Chelone glabra","Chelone","glabra","8/26/1995",1995,8,26,238,1995238,"flowering","unknown","Y","N"," "," ","","","Pennsylvania","Potter","","ca 7 mi SSE of Coudersport;;41°40'N, 78°00'W; ,",41.680936,-77.968953,5783,"N",NA,"Y","Yes","Flowering","","","","provided","provided","JA"
"407",12342042,"MW","CM","specimen","Chelone glabra","Chelone","glabra","8/10/1995",1995,8,10,222,1995222,"flowering","unknown","Y","N"," "," ","","","Pennsylvania","Westmoreland","Donegal "," Forbes State Forest, Roaring Run Natural Area hiking trail;;40°03'12""N, 79°19'34""W; ,",40.05333,-79.32611,14,"N",NA,"Y","Yes","Flowering","","","","provided","provided","JA"
"408",12342057,"MW","CM","specimen","Chelone glabra","Chelone","glabra","8/20/1995",1995,8,20,232,1995232,"flowering","unknown","Y","N"," "," ","","","Maine","Waldo","","W side of Saint George Lake, 2 mi S of ME 3;;44°24'10""N, 69°21'45""W; ,",44.40277778,-69.3625,NA,"N",NA,"Y","Yes","Flowering","","","","provided","","JA"
"409",12342135,"MW","CM","specimen","Chelone glabra","Chelone","glabra","8/25/1995",1995,8,25,237,1995237,"flowering","unknown","Y","N"," "," ","","","Pennsylvania","Indiana","","1 mi from PA 259 & Blairsville on Reynolds Road (T870);;40°24'37""N, 79°08'15""W; ,",40.41028,-79.1375,14,"N",NA,"Y","Yes","Flowering","","","","provided","provided","JA"
"410",12342152,"MW","CM","specimen","Chelone glabra","Chelone","glabra","7/30/1995",1995,7,30,211,1995211,"flowering","unknown","Y","N"," "," ","","","New York","Saint Lawrence","","Adirondack Mountains, Horseshoe Lake area, Otterback Purchase tract, end of NY 421;;44°07'47""N, 74°38'40""W; ,",44.12972222,-74.64444444,NA,"N",NA,"Y","Yes","Flowering","","","","provided","","JA"
"411",12342624,"MW","CM","specimen","Chelone glabra","Chelone","glabra","9/6/1946",1946,9,6,249,1946249,"flowering","unknown","Y","N"," "," ","","","Quebec","","","Rivière Broadback, Rupert Bay, James B. 51°N, 79°W",51.463554,-79.018109,NA,"N",NA,"Y","Yes","Flowering","","","lat lon in columns copied from messed up list ; ,","provided","","JA"
"412",12344338,"MW","CM","specimen","Chelone glabra","Chelone","glabra","8/18/2005",2005,8,18,230,2005230,"flowering","unknown","Y","N"," "," ","","","Pennsylvania","Erie","","Lake LeBoeuf, wetlands west of lake. 41°56'N, 79°59'W;",41.933443,-79.992842,800,"N",NA,"Y","Yes","Flowering","","","","locality","best estimate","JA"
"413",12344433,"MW","CM","specimen","Chelone glabra","Chelone","glabra","9/1/2008",2008,9,1,245,2008245,"flowering and fruit","unknown","Y","Y"," "," ","","","Pennsylvania","Indiana","","Walnut Rd N of Cookport, 1 mi NNW of PA 240 intersection in Cookport, Green Twp;;40.7123544N, 78.9175037W NAD83; ,",40.7123544,-78.9175037,NA,"N",NA,"Y","Yes","Both","","","","provided","","JA"
"414",12344434,"MW","CM","specimen","Chelone glabra","Chelone","glabra","9/5/2008",2008,9,5,249,2008249,"flowering","unknown","Y","N"," "," ","","","Pennsylvania","Indiana","","along Little Mahoning Cr NE of Rochester Mills, just S of jct of Straight Run & Little Mahoning Cr;;40.8242807N, 78.9270051W NAD83; ,",40.8242807,-78.9270051,NA,"N",NA,"Y","Yes","Flowering","","","","provided","","JA"
"415",12344635,"MW","CM","specimen","Chelone glabra","Chelone","glabra","9/29/1995",1995,9,29,272,1995272,"fruit","N","N","Y"," "," ","","","Pennsylvania","Elk","Hallton","near confluence of Spring Creek & Clarion River.  41°24'N, 78°56'W;",41.4,-78.933335,600,"N",NA,"Y","Yes","Fruiting","","","","provided by observer","best estimate","JA"
"416",12344894,"MW","CM","specimen","Chelone glabra","Chelone","glabra","10/16/1995",1995,10,16,289,1995289,"fruit","N","N","Y"," "," ","","","Pennsylvania","Lawrence","","ca 1.7 mi S of Parkstown, Covert Crossing, along railroad grade;;40°59'N, 80°24'W; ,",40.98333,-80.4,1205,"N",NA,"Y","Yes","Fruiting","","","","provided","provided","JA"
"417",12345153,"MW","CM","specimen","Chelone glabra","Chelone","glabra","9/3/1995",1995,9,3,246,1995246,"flowering and fruit","unknown","Y","Y"," "," ","","","Pennsylvania","Potter","","ca 1 mi W of Andrews Settlement, Rose Lake. 41°54'N, 77°55'W",41.896848,-77.921209,700,"N",NA,"Y","Yes","Both","","","","town+direction+distance+locality","best estimate","JA"
"418",12345429,"MW","CM","specimen","Chelone glabra","Chelone","glabra","8/15/1996",1996,8,15,228,1996228,"flowering","unknown","Y","N"," "," ","","","Pennsylvania","Forest","","3.9 km NNE of Marienville at McCrays Pond. 41°30'N, 79°06'W",41.5,-79.1,500,"N",NA,"Y","Yes","Flowering","","","","provided by observer","best estimate","JA"
"419",12345900,"MW","CM","specimen","Chelone glabra","Chelone","glabra","8/27/1996",1996,8,27,240,1996240,"flowering","unknown","Y","N"," "," ","","","Pennsylvania","Warren","","ca 3.4 km NW of Columbus, Hansen Seeps;;41°58'07""N, 79°36'10""W; ,",41.96861111,-79.60277778,NA,"N",NA,"Y","Yes","Flowering","","","","provided","","JA"
"420",12346120,"MW","CM","specimen","Chelone glabra","Chelone","glabra","8/28/1996",1996,8,28,241,1996241,"flowering","unknown","Y","N"," "," ","","","Pennsylvania","Erie","","3 km N of Kerrs Corners, Twentymile Creek;;42°13'53""N, 79°45'48""W; ,",42.23138889,-79.76333333,NA,"N",NA,"Y","Yes","Flowering","","","","provided","","JA"
"421",12346190,"MW","CM","specimen","Chelone glabra","Chelone","glabra","8/16/1996",1996,8,16,229,1996229,"flowering","unknown","Y","N"," "," ","","","Vermont","Addison","","Green Mountain National Forest, 5 mi N of VT 73 & Goshen on Forest Road 32, Moosalamoo camping area;;43°55'12""N, 73°01'08""W; ,",43.92,-73.01888889,NA,"N",NA,"Y","Yes","Flowering","","","","provided","","JA"
"422",12346206,"MW","CM","specimen","Chelone glabra","Chelone","glabra","8/16/1996",1996,8,16,229,1996229,"flowering","unknown","Y","N"," "," ","","","Vermont","Windsor","","Green Mountain National Forest, 4 mi NW of VT 73 and Robinson on Forest Road 42 (Bingo Road);;43°52'43""N, 72°55'13""W; ,",43.87861111,-72.92027778,NA,"N",NA,"Y","Yes","Flowering","","","","provided","","JA"
"423",12346853,"MW","CM","specimen","Chelone glabra","Chelone","glabra","9/4/1997",1997,9,4,247,1997247,"flowering","unknown","Y","N"," "," ","","same day/close together, different phenology","Pennsylvania","Erie","","0.8 km NW of McLane;;41°56'23""N, 80°08'05""W; ,",41.93972222,-80.13472222,NA,"N",NA,"Y","Yes","Flowering","","","","provided","","JA"
"424",12346855,"MW","CM","specimen","Chelone glabra","Chelone","glabra","9/3/1997",1997,9,3,246,1997246,"flowering","unknown","Y","N"," "," ","","","Pennsylvania","Erie","","5.5 km N of Union City, State Game Lands 102, Boleratz Bog;;41°56'30""N, 79°48'38""W; ,",41.94166667,-79.81055556,NA,"N",NA,"Y","Yes","Flowering","","","","provided","","JA"
"425",12346861,"MW","CM","specimen","Chelone glabra","Chelone","glabra","9/5/1997",1997,9,5,248,1997248,"flowering","unknown","Y","N"," "," ","","","Pennsylvania","Warren","","4 km N of Columbus, State Game Lands 197, Brokenstraw Creek;;41°58'33""N, 79°55'12""W; ,",41.97583333,-79.92,NA,"N",NA,"Y","Yes","Flowering","","","","provided","","JA"
"426",12346863,"MW","CM","specimen","Chelone glabra","Chelone","glabra","9/15/1997",1997,9,15,258,1997258,"flowering","unknown","Y","N"," "," ","","","Pennsylvania","Erie","","4.5 km SE of Wattsburg, Hubbel Run;;41°57'30""N, 79°46'05""W; ,",41.95833333,-79.76805556,NA,"N",NA,"Y","Yes","Flowering","","","","provided","","JA"
"427",12347435,"MW","CM","specimen","Chelone glabra","Chelone","glabra","9/15/1998",1998,9,15,258,1998258,"flowering","unknown","Y","N"," "," ","","","Ohio","Mahoning","","1.1 km SW of Poland, along Yellow Creek, Poland Municipal Forest;;41°00'50""N, 80°37'03""W; ,",41.01388889,-80.6175,NA,"N",NA,"Y","Yes","Flowering","","","","provided","","JA"
"428",12347486,"MW","CM","specimen","Chelone glabra","Chelone","glabra","9/1/1998",1998,9,1,244,1998244,"flowering","unknown","Y","N"," "," ","","","New York","Chautauqua","","4.8 km SSE of Brocton, State University of New York at Fredonia preserve;;42°20'42""N, 79°25'45""W; ,",42.345,-79.42916667,NA,"N",NA,"Y","Yes","Flowering","","","","provided","","JA"
"429",12347541,"MW","CM","specimen","Chelone glabra","Chelone","glabra","8/29/1996",1996,8,29,242,1996242,"flowering","unknown","Y","N"," "," ","","","Pennsylvania","Bedford","","ca 6 km WSW of Everett, 1 km S of Lutzville cliffs, S side of Cove Creek. 40°00'N, 78°26'W",40,-78.43333333,NA,"N",NA,"Y","Yes","Flowering","","","","provided by observer","","JA"
"430",12347544,"MW","CM","specimen","Chelone glabra","Chelone","glabra","9/12/1998",1998,9,12,255,1998255,"flowering","unknown","Y","N"," "," ","","","Pennsylvania","Lawrence","","along Neshannock Creek, 3.5 km NW of Eastbrook,  State Game Lands 178;;41°03'17""N, 80°18'52""W; ,",41.05472,-80.31445,14,"N",NA,"Y","Yes","Flowering","","","","provided","provided","JA"
"431",12347607,"MW","CM","specimen","Chelone glabra","Chelone","glabra","9/8/1994",1994,9,8,251,1994251,"flowering","unknown","Y","N"," "," ","","","Pennsylvania","Crawford","","Shaffer Road, Vernon Twp.",41.613726,-80.01918,16000,"N",NA,"Y","Yes","Flowering","",""," road wasn't in township, so used closest point on road to the township ","locality","best estimate","JA"
"432",12347966,"MW","CM","specimen","Chelone glabra","Chelone","glabra","8/17/1996",1996,8,17,230,1996230,"flowering","unknown","Y","N"," "," ","","","Wisconsin","Waushara","","3.8 km ENE of Wild Rose, junction Co. K & Apache Road;;44°11'51""N, 89°12'33""W; ,",44.1975,-89.20916667,NA,"N",NA,"Y","Yes","Flowering","","","","provided","","JA"
"433",12348600,"MW","CM","specimen","Chelone glabra","Chelone","glabra","9/4/1997",1997,9,4,247,1997247,"vegetative","N","N","N","Y"," ","","same day/close together, different phenology","Pennsylvania","Erie","","1.5 km N of Edinboro, Edinboro Lake;forested & shrub dominated seepage on slopes above lake;41°53'25""N, 80°07'57""W; ,",41.89027778,-80.1325,NA,"N",NA,"Y","No","","","","","provided","","JA"
"434",12348857,"MW","CM","specimen","Chelone glabra","Chelone","glabra","8/28/1996",1996,8,28,241,1996241,"flowering","unknown","Y","N"," "," ","","","Pennsylvania","Warren","","6.1 km SE of Sample Corners, Carlisle Farm, Carlisle Farm Seeps;;41°40'42""N, 79°31'30""W; ,",41.67833333,-79.525,NA,"N",NA,"Y","Yes","Flowering","","","","provided","","JA"
"435",12348871,"MW","CM","specimen","Chelone glabra","Chelone","glabra","8/19/1996",1996,8,19,232,1996232,"flowering","unknown","Y","N"," "," ","","","Pennsylvania","Butler","","just S of Moores Corners. 41°02'N, 80°06'W;",41.033383,-80.100183,NA,"N",NA,"Y","Yes","Flowering","","","","provided by observer","","JA"
"436",12350027,"MW","CM","specimen","Chelone glabra","Chelone","glabra","8/9/2002",2002,8,9,221,2002221,"flowering","unknown","Y","N"," "," ","","","Michigan","Marquette","","ca 2.5 km NW of Arnold, along MI 426-638;;46°03'36""N, 87°30'45""W; ,",46.06,-87.5125,NA,"N",NA,"Y","Yes","Flowering","","","","provided","","JA"
"437",12350798,"MW","CM","specimen","Chelone glabra","Chelone","glabra","9/7/2001",2001,9,7,250,2001250,"flowering and fruit","unknown","Y","Y"," "," ","","","Pennsylvania","Erie","","Ca 1.7 km N of Edinboro Borough, Edinboro Fen;;41°53N, 80°08W; ,",41.88333,-80.13333,1205,"N",NA,"Y","Yes","Both","","","","provided","provided","JA"
"438",12352061,"MW","CM","specimen","Chelone glabra","Chelone","glabra","9/11/2005",2005,9,11,254,2005254,"flowering","unknown","Y","N"," "," ","","","Pennsylvania","Washington","","Aunt Clara Fork, 2.2 mi, 167° from junction of Beaver & Washington Co, & WV, Hanover Township;;40°26'45.41""N, 80°30'42.98""W; ,",40.44595,-80.5095,14,"N",NA,"Y","Yes","Flowering","","","","provided","provided","JA"
"439",12352191,"MW","CM","specimen","Chelone glabra","Chelone","glabra","9/4/2000",2000,9,4,248,2000248,"flowering","unknown","Y","N"," "," ","","","Pennsylvania","Erie","","Along French Creek, 0.8 miles SSE of Arbuckle",41.973956,-79.859141,3231,"N",NA,"Y","Yes","Flowering","","","","provided","provided","JA"
"440",12352292,"MW","CM","specimen","Chelone glabra","Chelone","glabra","10/3/2006",2006,10,3,276,2006276,"flowering","unknown","Y","N"," "," ","","","Pennsylvania","Fayette","","Indian Creek Valley trail SW of Indian Head, S (left) bank of Indian Creek, Springfield Township;;40°00'56""N, 79°24'39""W, NAD83; ,",40.01556,-79.41083,14,"N",NA,"Y","Yes","Flowering","","","","provided","provided","JA"
"441",12352345,"MW","CM","specimen","Chelone glabra","Chelone","glabra","8/27/2003",2003,8,27,239,2003239,"flowering","unknown","Y","N"," "," ","","","Pennsylvania","Erie","","ca 20 ftkm SE of Erie, wetlands on the SE side of Lake Pleasant. 42°00'N, 79°54'W; ",42.053052,-79.961392,500,"N",NA,"Y","Yes","Flowering","","","","provided by observer","best estimate","JA"
"442",12352394,"MW","CM","specimen","Chelone glabra","Chelone","glabra","9/3/2003",2003,9,3,246,2003246,"flowering","unknown","Y","N"," "," ","","","Pennsylvania","Erie","","ca 0.7 km WNW of the island in LeBoeuf Lake;;41°56'N, 80°00'W; ,",41.93333,-80,1205,"N",NA,"Y","Yes","Flowering","","","","provided","provided","JA"
"443",12352435,"MW","CM","specimen","Chelone glabra","Chelone","glabra","9/25/2007",2007,9,25,268,2007268,"flowering and fruit","unknown","Y","Y"," "," ","","","Pennsylvania","Indiana","","Loraine Rd 2 mi SE of Marion Center, 1 mi S of jct of Loraine & Deckers Pt Rd, East Mahoning Twp.;;40.7578928N, 79.0099872W NAD83; ,",40.7578928,-79.0099872,NA,"N",NA,"Y","Yes","Both","","","","provided","","JA"
"444",12352510,"MW","CM","specimen","Chelone glabra","Chelone","glabra","9/22/2007",2007,9,22,265,2007265,"flowering","unknown","Y","N"," "," ","","","Pennsylvania","Fayette","","Indian Creek, right bank, downstream of PA653/White Bridge, 3700 ft SW of bridge, wet depression along RR;;39.9849335N, 79.4385643W NAD83; ,",39.98493,-79.43856,14,"N",NA,"Y","Yes","Flowering","","","","provided","provided","JA"
"445",12352570,"MW","CM","specimen","Chelone glabra","Chelone","glabra","7/21/2005",2005,7,21,202,2005202,"vegetative","N","N","N","Y"," ","","","Pennsylvania","Crawford","","Erie National Wildlife Refuge just west of Sugar Lake. 41°34'N, 79°57'W; ",41.567052,-79.951198,600,"N",NA,"Y","No","","","","","provided by observer","best estimate","JA"
"446",12352587,"MW","CM","specimen","Chelone glabra","Chelone","glabra","8/25/2006",2006,8,25,237,2006237,"flowering","unknown","Y","N"," "," ","","","Pennsylvania","Erie","","Lake Pleasant;;42-01 N, 79-54 W; ,",42.004364,-79.897629,500,"N",NA,"Y","Yes","Flowering","","","","locality","best estimate","JA"
"447",12352617,"MW","CM","specimen","Chelone glabra","Chelone","glabra","8/24/2001",2001,8,24,236,2001236,"vegetative","N","N","N","Y"," ","","","Pennsylvania","Mercer","","Sandy Lake;;41°20'N, 80°06'W; ,",41.35,-80.1,1205,"N",NA,"Y","No","","","","","provided","provided","JA"
"448",12352903,"MW","CM","specimen","Chelone glabra","Chelone","glabra","9/25/2009",2009,9,25,268,2009268,"flowering and fruit","unknown","Y","Y"," "," ","","","Pennsylvania","Westmoreland","","Pleasant Valley Park, Lyons Run, E of Pleasant Valley Rd, Murrysville;;40.403201N, 79.682561W NAD83; ,",40.403201,-79.682561,NA,"N",NA,"Y","Yes","Both","","","","provided","","JA"
"449",12352916,"MW","CM","specimen","Chelone glabra","Chelone","glabra","8/14/2009",2009,8,14,226,2009226,"flowering","unknown","Y","N"," "," ","","","Pennsylvania","Westmoreland","","Ruble Rd off PA711, SW of Robb, S of road and cemetery, St Clair Twp;;40.383937N, 79.046416W NAD83; ,",40.383937,-79.046416,NA,"N",NA,"Y","Yes","Flowering","","","","provided","","JA"
"450",12352997,"MW","CM","specimen","Chelone glabra","Chelone","glabra","8/8/2006",2006,8,8,220,2006220,"vegetative","N","N","N","Y"," ","","","Pennsylvania","McKean","","Allegheny River, State Game Lands 301;;716858.8, 4640129.3, UTM 17 Datum 83; ,",41.88335731,-78.3863672,NA,"N",NA,"Y","No","","","","","provided","","JA"
"451",12353192,"MW","CM","specimen","Chelone glabra","Chelone","glabra","9/7/2009",2009,9,7,250,2009250,"flowering","unknown","Y","N"," "," ","","","Pennsylvania","Lawrence","","6.5 km WNW of Wampum, along Jenkins Run;;40°54'22""N, 80°24'44""W, WGS 84; ,",40.90611111,-80.41222222,NA,"N",NA,"Y","Yes","Flowering","","","","provided","","JA"
"452",12353305,"MW","CM","specimen","Chelone glabra","Chelone","glabra","5/25/2011",2011,5,25,145,2011145,"fruit","N","N","Y"," "," ","","","West Virginia","Brooke","","ca 6 km ESE of Wellsburgh, Brooke Hills Park. 40-15 N, 80-32 W",40.26909,-80.540423,1500,"N",NA,"Y","Yes","Fruiting","","","","locality","best estimate","JA"
"453",12353383,"MW","CM","specimen","Chelone glabra","Chelone","glabra","8/30/2007",2007,8,30,242,2007242,"flowering","unknown","Y","N"," "," ","","","Pennsylvania","Armstrong","","Ca 3.5 km S of Mahoning;;40-54 N, 79-28 W; ,",40.901067,-79.45921,4839,"N",NA,"Y","Yes","Flowering","","","","provided","provided","JA"
"454",12353433,"MW","CM","specimen","Chelone glabra","Chelone","glabra","6/12/2008",2008,6,12,164,2008164,"vegetative","N","N","N","Y"," ","","","Pennsylvania","Butler","","Muddy Creek branch of Lake Arthur, Moraine State Park, Upper 528 boat launch, ~3.05 mi W of Muddy Cr;;40°58'08.63""N, 80°01'46.74""W NAD83; ,",40.96906389,-80.02965,NA,"N",NA,"Y","No","","","","","provided","","JA"
"455",4601087,"MW","CMC","specimen","Chelone glabra","Chelone","glabra","9/20/1973",1973,9,20,263,1973263,"flowering and fruit","unknown","Y","Y"," "," ","","","Michigan","Clare","","Neithercut Woodlands.",43.866873,-84.929197,800,"Y","Y","Y","Yes","Both","","","","locality","best estimate","JA"
"456",4601088,"MW","CMC","specimen","Chelone glabra","Chelone","glabra","9/21/1975",1975,9,21,264,1975264,"flowering and fruit","unknown","Y","Y"," "," ","","","Michigan","Isabella","","Union township.TRS: T14N R4W sec 12",43.618872,-84.738022,1200,"Y","Y","Y","Yes","Both","","","","PLSS","best estimate","JA"
"457",4601089,"MW","CMC","specimen","Chelone glabra","Chelone","glabra","9/9/1977",1977,9,9,252,1977252,"flowering","unknown","Y","N"," "," ","","","Michigan","Washtenaw","Superior","Superior township.TRS: T25 R7E sec 7",42.263094,-83.637717,3036,"Y","Y","Y","Yes","Flowering","","","PLSS unclear-maybe T25 is T2S?","town","geolocate","JA"
"458",4601090,"MW","CMC","specimen","Chelone glabra","Chelone","glabra","8/24/1927",1927,8,24,236,1927236,"flowering","unknown","Y","N"," "," ","","","Michigan","","","swamp Campau",NA,NA,NA,"Y","Y","Y","Yes","Flowering","","","is campau lake? 42.840200, -85.448068","","","JA"
"459",4601091,"MW","CMC","specimen","Chelone glabra","Chelone","glabra","9/29/1975",1975,9,29,272,1975272,"flowering","unknown","Y","N"," "," ","","","Michigan","Isabella","","[no precise location]TRS: T14N R5W sec 22",43.590065,-84.897752,1200,"Y","Y","Y","Yes","Flowering","","","","PLSS","best estimate","JA"
"460",4601092,"MW","CMC","specimen","Chelone glabra","Chelone","glabra","7/26/1979",1979,7,26,207,1979207,"vegetative","N","N","N","Y"," ","","","Michigan","Ottawa","","Consumers Power Company Campbell Site, Field Unit CMP-7.TRS: T6N R15W sec 15",42.906957,-86.071251,1200,"Y","Y","Y","No","","","","","PLSS","best estimate","JA"
"461",4601093,"MW","CMC","specimen","Chelone glabra","Chelone","glabra","9/10/1979",1979,9,10,253,1979253,"flowering","unknown","Y","N"," "," ","","","Michigan","Isabella","","Deerfield township.TRS: T14N R5W sec 16",43.604672,-84.917966,1200,"Y","Y","Y","Yes","Flowering","","","","PLSS","best estimate","JA"
"462",4601094,"MW","CMC","specimen","Chelone glabra","Chelone","glabra","8/21/2001",2001,8,21,233,2001233,"flowering","unknown","Y","N"," "," ","","","Michigan","Isabella","","Lincoln township.TRS: T13N R4W sec 34",43.473421,-84.776989,1200,"Y","Y","Y","Yes","Flowering","","","","PLSS","best estimate","JA"
"463",4601095,"MW","CMC","specimen","Chelone glabra","Chelone","glabra","9/8/1981",1981,9,8,251,1981251,"flowering and fruit","unknown","Y","Y"," "," ","","","Michigan","Isabella","","Gillmore township.TRS: T16N R5W sec 9",43.791891,-84.918738,1200,"Y","Y","Y","Yes","Both","","","","PLSS","best estimate","JA"
"464",4601096,"MW","CMC","specimen","Chelone glabra","Chelone","glabra","8/30/2001",2001,8,30,242,2001242,"flowering","unknown","Y","N"," "," ","","","Michigan","Tuscola","Arbela","Arbela township.TRS: T10N R7E sec 12",43.287943,-83.592675,1200,"Y","Y","Y","Yes","Flowering","","","","PLSS","best estimate","JA"
"465",13401839,"MW","CMC","specimen","Chelone glabra","Chelone","glabra","6/14/2012",2012,6,14,166,2012166,"vegetative","N","N","N","Y"," ","","","Michigan","Livingston","","Spring Mill Creek Fen, to get to western part of fen, take bike trail from spring mill creek to the west, enter fen where trail turns norths/ 90 m north of road 42.49, -83.72",42.4913,-83.722,NA,"Y","Y","Y","No","","","","need to change latlon based on new locality info? Online coordinates are more specific than picture ones","provided","","JA"
"466",13402203,"MW","CMC","specimen","Chelone glabra","Chelone","glabra","8/30/2013",2013,8,30,242,2013242,"flowering","unknown","Y","N"," "," ","","","Michigan","Washtenaw","","Park Lyndon Fen. 42.38, -84.07",42.38487,-84.07134,NA,"Y","Y","Y","Yes","Flowering","","","need to change latlon based on new locality info? Online coordinates are more specific than picture ones","provided","","JA"
"467",14369722,"MW","CMC","specimen","Chelone glabra","Chelone","glabra","5/25/2015",2015,5,25,145,2015145,"vegetative","N","N","N","Y"," ","","","Michigan","Oakland","","Halstead Lake Fen. 42.79866, -83.5592",42.79866,-83.5592,NA,"Y","Y","Y","No","","","","","provided","","JA"
"468",14369728,"MW","CMC","specimen","Chelone glabra","Chelone","glabra","5/29/2015",2015,5,29,149,2015149,"vegetative","N","N","N","Y"," ","","","Michigan","Oakland","","Long Lake Fen. 42.75784, -83.55485",42.75784,-83.55485,NA,"Y","Y","Y","No","","","","","provided","","JA"
"469",17324447,"MW","CMN","specimen","Chelone glabra","Chelone","glabra","8/8/1981",1981,8,8,220,1981220,NA,"unknown","unknown","unknown"," "," ","","","Prince Edward Island","Kings","","Montague Just W of Wightmans Point 4 mi. E of Montague;;46° 10' N, 62° 33' W",46.166667,-62.55,NA,"N",NA,"Y","Not Scorable","","","","","provided","","JA"
"470",17329587,"MW","CMN","specimen","Chelone glabra","Chelone","glabra","8/18/1988",1988,8,18,231,1988231,NA,"unknown","unknown","unknown"," "," ","","","New Brunswick","Gloucester","","Brunswick Mines 4.5 km south of Brunswick Mines turnoff at clearcut area.;;47° 25' 35"" N, 65° 52' W",47.426389,-65.866667,NA,"N",NA,"Y","Not Scorable","","","","","provided","","JA"
"471",17329814,"MW","CMN","specimen","Chelone glabra","Chelone","glabra","8/21/1911",1911,8,21,233,1911233,NA,"unknown","unknown","unknown"," "," ","","date: given as aug 21-22","Newfoundland and Labrador","Lewisporte Distr.","Norris Arm","Valley of Exploits River, Norris Arm;;49° 5' N, 55° 15' W",49.083333,-55.25,NA,"N",NA,"Y","Not Scorable","","","","","provided","","JA"
"472",17336493,"MW","CMN","specimen","Chelone glabra","Chelone","glabra","8/9/1989",1989,8,9,221,1989221,NA,"unknown","unknown","unknown"," "," ","","","Ontario","Ottawa (metro)","","Ottawa Approx. 5 miles south of Albion Road Woodlands, east side of road.;;45° 18' N, 75° 37' W",45.3,-75.616667,NA,"N",NA,"Y","Not Scorable","","","","","provided","","JA"
"473",17342171,"MW","CMN","specimen","Chelone glabra","Chelone","glabra","7/17/1985",1985,7,17,198,1985198,NA,"unknown","unknown","unknown"," "," ","","","Maine","Washington","","St. Croix River Grand Falls dam site Baileyville Township Loc. # 22.;;45° 16' N, 67° 29' W",45.266667,-67.483333,NA,"N",NA,"Y","Not Scorable","","","","","provided","","JA"
"474",17345757,"MW","CMN","specimen","Chelone glabra","Chelone","glabra","8/21/1989",1989,8,21,233,1989233,NA,"unknown","unknown","unknown"," "," ","","","Ontario","Lanark","","Perth 11 km southwest of, along Tay River Bathurst Township.;;44° 50' N, 76° 21' W",44.833333,-76.35,NA,"N",NA,"Y","Not Scorable","","","","","provided","","JA"
"475",17346484,"MW","CMN","specimen","Chelone glabra","Chelone","glabra","7/14/1964",1964,7,14,196,1964196,NA,"unknown","unknown","unknown"," "," ","","","Ontario","Cochrane Distr. ","","Harricanaw River Mouth of river. Ontario Northland Railway goose hunting camp;;51° 0' N, 79° 45' W",51,-79.75,NA,"N",NA,"Y","Not Scorable","","","","","provided","","JA"
"476",17346663,"MW","CMN","specimen","Chelone glabra","Chelone","glabra","9/22/1988",1988,9,22,266,1988266,NA,"unknown","unknown","unknown"," "," ","","","Ontario","Stormont, Dundas and Glengarry United Co.","","Morrisburg Swamp 4 km NW of Matilda Township.;;44° 55' N, 75° 15' W",44.916667,-75.25,NA,"N",NA,"Y","Not Scorable","","","","","provided","","JA"
"477",17350872,"MW","CMN","specimen","Chelone glabra","Chelone","glabra","8/2/1968",1968,8,2,215,1968215,NA,"unknown","unknown","unknown"," "," ","","","Ontario","Cochrane Distr. ","","Moosonee Ca. 3 mi. S. of Moosonee ca. .25 mi. along creek;;51° 14' N, 80° 40' W",51.233333,-80.666667,NA,"N",NA,"Y","Not Scorable","","","","","provided","","JA"
"478",17350874,"MW","CMN","specimen","Chelone glabra","Chelone","glabra","9/12/1979",1979,9,12,255,1979255,NA,"unknown","unknown","unknown"," "," ","","","Ontario","Ottawa (metro)","","Ottawa Vincent Massey Park along Rideau River;;45° 23' N, 75° 42' W",45.383333,-75.7,NA,"N",NA,"Y","Not Scorable","","","","","provided","","JA"
"479",17357005,"MW","CMN","specimen","Chelone glabra","Chelone","glabra","7/29/1975",1975,7,29,210,1975210,NA,"unknown","unknown","unknown"," "," ","","","Nova Scotia","Digby","","Comeau Cove Clare Municipality;;44° 10' 20"" N, 66° 11' W",44.172222,-66.183333,NA,"N",NA,"Y","Not Scorable","","","","","provided","","JA"
"480",17360547,"MW","CMN","specimen","Chelone glabra","Chelone","glabra","8/7/1982",1982,8,7,219,1982219,NA,"unknown","unknown","unknown"," "," ","","","Ontario","Cochrane Distr. ","","Tidewater Provincial Park Moosonee west shore Charles Island north of winter road;;51° 15' N, 80° 38' W",51.25,-80.633333,NA,"N",NA,"Y","Not Scorable","","","","","provided","","JA"
"481",17365212,"MW","CMN","specimen","Chelone glabra","Chelone","glabra","9/7/1970",1970,9,7,250,1970250,NA,"unknown","unknown","unknown"," "," ","","","Ontario","Muskoka Distr. Mun.","","Georgian Bay Islands National Park. Tonch Point Beausoleil Island;;44° 52' N, 79° 51' W",44.866667,-79.85,NA,"N",NA,"Y","Not Scorable","","","","","provided","","JA"
"482",17366101,"MW","CMN","specimen","Chelone glabra","Chelone","glabra","8/6/1986",1986,8,6,218,1986218,NA,"unknown","unknown","unknown"," "," ","","","Ontario","Leeds and Grenville United Co.","","Cardinal 3 km NW of Edwardsburg Township.;;44° 48' N, 75° 25' W",44.8,-75.416667,NA,"N",NA,"Y","Not Scorable","","","","","provided","","JA"
"483",17367058,"MW","CMN","specimen","Chelone glabra","Chelone","glabra","8/25/1980",1980,8,25,238,1980238,NA,"unknown","unknown","unknown"," "," ","","","Ontario","Lanark","","Clayton Lake E. end Clayton Lake",45.180606,-76.325719,2000,"N",NA,"Y","Not Scorable","","","","","locality","best estimate","JA"
"484",17368467,"MW","CMN","specimen","Chelone glabra","Chelone","glabra","8/25/1980",1980,8,25,238,1980238,NA,"unknown","unknown","unknown"," "," ","","","Ontario","Durham Reg. Mun.","Oshawa","Oshawa Second Marsh Study Area in Oshawa",43.880141,-78.814655,2000,"N",NA,"Y","Not Scorable","","","","","locality","best estimate","JA"
"485",17376847,"MW","CMN","specimen","Chelone glabra","Chelone","glabra","7/29/1996",1996,7,29,211,1996211,"flowering","unknown","Y","N"," "," ","","","Newfoundland and Labrador","Terra Nova Distr.","","(Terra Nova National Park). Bonavista South Dist. Big Brook, E of TCH.;;48° 32' 0"" N, 53° 58' 0"" W (coordinates are on sheet as 22U BJ 280000 5380000)",48.533333,-53.966667,NA,"Y","Y","Y","Yes","Flowering","","","","provided","","JA"
"486",17377040,"MW","CMN","specimen","Chelone glabra","Chelone","glabra","10/5/1985",1985,10,5,278,1985278,NA,"unknown","unknown","unknown"," "," ","","","Ontario","Lanark","","Blakeney Riverside park of rapids UTM 18T VF 402000E 5013300N",45.268122,-76.248961,2000,"N",NA,"Y","Not Scorable","","",""," also has UTM coordinates","locality","best estimate","JA"
"487",17379569,"MW","CMN","specimen","Chelone glabra","Chelone","glabra","8/25/1986",1986,8,25,237,1986237,NA,"unknown","unknown","unknown"," "," ","","","Ontario","Lanark","","North Mud Lake Conc. 10, Lots 9-12, Montague Township.;;45° 2' N, 75° 59' W",45.033333,-75.983333,NA,"N",NA,"Y","Not Scorable","","","","","provided","","JA"
"488",17380775,"MW","CMN","specimen","Chelone glabra","Chelone","glabra","8/13/1981",1981,8,13,225,1981225,NA,"unknown","unknown","unknown"," "," ","","","Prince Edward Island","Kings","","Hermanville Valley of the Cross River E of MacInnis Pond 1 mi. SE of Hermanville;;46° 27' N, 62° 16' W",46.45,-62.266667,NA,"N",NA,"Y","Not Scorable","","","","","provided","","JA"
"489",17387030,"MW","CMN","specimen","Chelone glabra","Chelone","glabra","8/9/1984",1984,8,9,222,1984222,"flowering","unknown","Y","N"," "," ","","","New Brunswick","Charlotte","","Milltown 4 km SW of. Mohannas Stream where it crosses road to Upper Mills St. Stephen Township. Loc. No. 1;;45° 10' N, 67° 20' W",45.166667,-67.333333,NA,"Y","Y","Y","Yes","Flowering","","","","provided","","JA"
"490",17391523,"MW","CMN","specimen","Chelone glabra","Chelone","glabra","8/19/1984",1984,8,19,232,1984232,NA,"unknown","unknown","unknown"," "," ","","","Nova Scotia","Richmond","","Irish Cove Brook 2 km south of Irish Cove Richmond Municipality. Loc. No. 18.;;45° 48' N, 60° 40' W",45.8,-60.666667,NA,"N",NA,"Y","Not Scorable","","","","","provided","","JA"
"491",17403721,"MW","CMN","specimen","Chelone glabra","Chelone","glabra","8/21/1988",1988,8,21,234,1988234,NA,"unknown","unknown","unknown"," "," ","","","New Brunswick","Victoria","","North Tilley 2 km NW of St. John River on east bank, south side of mouth of Little River.;;46° 50' 48"" N, 67° 41' 30"" W",46.846667,-67.691667,NA,"N",NA,"Y","Not Scorable","","","","","provided","","JA"
"492",17410963,"MW","CMN","specimen","Chelone glabra","Chelone","glabra","9/22/1988",1988,9,22,266,1988266,NA,"unknown","unknown","unknown"," "," ","","","Ontario","Leeds and Grenville United Co.","","McIntosh Mills 2 km south of (Graham Lake) Front of Yonge Township. Near St. Lawrence Islands National Park;;44° 32' N, 75° 55' W",44.533333,-75.916667,NA,"N",NA,"Y","Not Scorable","","","","","provided","","JA"
"493",17428848,"MW","CMN","specimen","Chelone glabra","Chelone","glabra","8/31/1989",1989,8,31,243,1989243,NA,"unknown","unknown","unknown"," "," ","","","Ontario","Prescott and Russell United Co. ","","Casselman 6 km southwest of, near Castor River Cambridge Township.;;45° 17' N, 75° 10' W",45.283333,-75.166667,NA,"N",NA,"Y","Not Scorable","","","","","provided","","JA"
"494",17431243,"MW","CMN","specimen","Chelone glabra","Chelone","glabra","9/30/1981",1981,9,30,273,1981273,NA,"unknown","unknown","unknown"," "," ","","","Ontario","Ottawa (metro)","","Nepean N-S Trail 200 m S of powerlines Stoney Swamp;;45° 17' N, 75° 50' W",45.283333,-75.833333,NA,"N",NA,"Y","Not Scorable","","","","","provided","","JA"
"495",17443077,"MW","CMN","specimen","Chelone glabra","Chelone","glabra","7/31/1964",1964,7,31,213,1964213,NA,"unknown","unknown","unknown"," "," ","","","Ontario","Cochrane Distr. ","","Factory Island Southwest shore of Moose River opposite Factory Island;;51° 15' N, 80° 35' W",51.25,-80.583333,NA,"N",NA,"Y","Not Scorable","","","","","provided","","JA"
"496",17445074,"MW","CMN","specimen","Chelone glabra","Chelone","glabra","8/13/1984",1984,8,13,226,1984226,NA,"unknown","unknown","unknown"," "," ","","","New Brunswick","Charlotte","","Saint James Parish 14 km NW of Beaconsfield at St. Croix River. Loc. No. 8.;;45° 29' N, 67° 30' W",45.483333,-67.5,NA,"N",NA,"Y","Not Scorable","","","","","provided","","JA"
"497",17447176,"MW","CMN","specimen","Chelone glabra","Chelone","glabra","9/1/1982",1982,9,1,244,1982244,NA,"unknown","unknown","unknown"," "," ","","","Ontario","Stormont, Dundas and Glengarry United Co.","","Iroquois Beach Provincial Park Port Burwell. Sand plain cliff and beach plain",42.643342,-80.819009,1300,"N",NA,"Y","Not Scorable","","","","","locality","best estimate","JA"
"498",17456088,"MW","CMN","specimen","Chelone glabra","Chelone","glabra","9/21/1982",1982,9,21,264,1982264,NA,"unknown","unknown","unknown"," "," ","","","Ontario","Renfrew","","Centennial Lake south shoreline 4.5 miles west of Mountain Chute Hydro Dam Matawatchan Township.;;45° 10' 30"" N, 77° 0' 30"" W",45.175,-77.008333,NA,"N",NA,"Y","Not Scorable","","","","","provided","","JA"
"499",17456816,"MW","CMN","specimen","Chelone glabra","Chelone","glabra","9/24/1986",1986,9,24,267,1986267,NA,"unknown","unknown","unknown"," "," ","","","Ontario","Lanark","","Pakenham 5 km west of. South side of Pakenham Mountains Pakenham Township.;;45° 18' N, 76° 20' W",45.3,-76.333333,NA,"N",NA,"Y","Not Scorable","","","","","provided","","JA"
"500",17463491,"MW","CMN","specimen","Chelone glabra","Chelone","glabra","8/23/1980",1980,8,23,236,1980236,NA,"unknown","unknown","unknown"," "," ","","date: given as 23-24 Aug","Ontario","Ottawa (metro)","","South Gloucester Gloucester Township east of Highway 31, east side of Hawthorne Road. Dawson's Woods.;;45° 18' N, 75° 33' W",45.3,-75.55,NA,"N",NA,"Y","Not Scorable","","","","","provided","","JA"
"501",13954149,"MW","COLO","specimen","Chelone glabra","Chelone","glabra","8/7/1968",1968,8,7,220,1968220,"flowering","unknown","Y","N"," "," ","","","Quebec","Wolfe","wolfestown","riviere blanche, saint-julien, bord humide de la riviere",46.060971,-72.102693,NA,"Y","Y","Y","Yes","Flowering","","","","provided","","JA"
"502",13954160,"MW","COLO","specimen","Chelone glabra","Chelone","glabra","8/2/1965",1965,8,2,214,1965214,"flowering","unknown","Y","N"," "," ","","","Quebec","Wolfe","garthby","breeches lake, a l'ouest de disraeli, en bordure d'une aulnaie sur la berge de la decharge du lac",NA,NA,NA,"Y","Y","Y","Yes","Flowering","","","","","","JA"
"503",13954161,"MW","COLO","specimen","Chelone glabra","Chelone","glabra","8/7/1894",1894,8,7,219,1894219,"flowering and fruit","unknown","Y","Y"," "," ","","","Minnesota","Ramsey","Saint Paul","",44.94441,-93.093274,3036,"Y","Y","Y","Yes","Both","","","","town","geolocate","JA"
"504",13954162,"MW","COLO","specimen","Chelone glabra","Chelone","glabra","8/19/1956",1956,8,19,232,1956232,"flowering and fruit","unknown","Y","Y"," "," ","","same day/place, same phenology?","North Carolina","graham","","near stratton meadows, 9 miles south of tapoco",NA,NA,NA,"Y","Y","Y","Yes","Both","","","","","","JA"
"505",13954163,"MW","COLO","specimen","Chelone glabra","Chelone","glabra","9/17/1936",1936,9,17,261,1936261,"flowering","unknown","Y","N"," "," ","","","Maine","Waldo","","roadside ditch, west slope near north end of megunticook mt",44.23812,-69.067917,2000,"Y","Y","Y","Yes","Flowering","","","","locality","best estimate","JA"
"506",13954164,"MW","COLO","specimen","Chelone glabra","Chelone","glabra","9/9/1935",1935,9,9,252,1935252,"flowering","unknown","Y","N"," "," ","","","New York","Bronx","","van cortlandt park swamp",40.896788,-73.886472,1700,"Y","Y","Y","Yes","Flowering","","","","locality","best estimate","JA"
"507",13954165,"MW","COLO","specimen","Chelone glabra","Chelone","glabra","8/3/1967",1967,8,3,215,1967215,"flowering","unknown","Y","N"," "," ","","same day/place, same phenology","Quebec","Wolfe","garthby","lac aylmer. Baie moose ouest, fosse de la voie ferree longeant le lac",45.814896,-71.37409,NA,"Y","Y","Y","Yes","Flowering","","","","provided","","JA"
"508",13954166,"MW","COLO","specimen","Chelone glabra","Chelone","glabra","8/1/1966",1966,8,1,213,1966213,"flowering","unknown","Y","N"," "," ","","","Quebec","Wolfe","garthby","lac sans nom, R. I N. baissiere humide",NA,NA,NA,"Y","Y","Y","Yes","Flowering","","","","","","JA"
"509",13954167,"MW","COLO","specimen","Chelone glabra","Chelone","glabra","8/18/1968",1968,8,18,231,1968231,"flowering","unknown","Y","N"," "," ","","","Minnesota","Aitkin","","mcgregor",NA,NA,NA,"Y","Y","Y","Yes","Flowering","","","","","","JA"
"510",13954168,"MW","COLO","specimen","Chelone glabra","Chelone","glabra","9/26/1972",1972,9,26,270,1972270,"flowering","unknown","Y","N"," "," ","","same day/place, same phenology?","Kentucky","Calloway","","intersection of ky. 94 and murray state university biological station road",NA,NA,NA,"Y","Y","Y","Yes","Flowering","","","","","","JA"
"511",13954169,"MW","COLO","specimen","Chelone glabra","Chelone","glabra","8/3/1967",1967,8,3,215,1967215,"flowering","unknown","Y","N"," "," ","","same day/place, same phenology","Quebec","Wolfe","garthby","lac aylmer. Baie moose ouest, fosse de la voie ferree longeant le lac",NA,NA,NA,"Y","Y","Y","Yes","Flowering","","","","","","JA"
"512",13954170,"MW","COLO","specimen","Chelone glabra","Chelone","glabra","9/5/1966",1966,9,5,248,1966248,"flowering","unknown","Y","N"," "," ","","","Ontario","Frontenac","Kingston","bells swamp-picture has map",44.287438,-76.500512,6000,"Y","Y","Y","Yes","Flowering","","","","locality","best estimate","JA"
"513",13954181,"MW","COLO","specimen","Chelone glabra","Chelone","glabra","9/30/1970",1970,9,30,273,1970273,"fruit","N","N","Y"," "," ","","","Vermont","Chittenden","Shelburne","shelburne pond",44.386912,-73.160637,1400,"Y","Y","Y","Yes","Fruiting","","","","locality","best estimate","JA"
"514",12783,"NE","CONN","specimen","Chelone glabra","Chelone","glabra","8/15/2010",2010,8,15,227,2010227,"flowering","unknown","Y","N"," "," ","","same day/place, same phenology","Maine","Somerset","","Bigelow Mountain 45°6.967' N, 70°19.489' W",45.11611,-70.32481,NA,"Y","Y","Y","Yes","Flowering","","","","provided","","JA"
"515",12784,"NE","CONN","specimen","Chelone glabra","Chelone","glabra","8/15/2010",2010,8,15,227,2010227,"flowering","unknown","Y","N"," "," ","","same day/place, same phenology","Maine","Somerset","","Bigelow Mountain, north of fire wardens trail. 45?6.967'N 70?19.489'W",45.11611,-70.32481,1,"Y","Y","Y","Yes","Flowering","","","","provided","provided","JA"
"516",23948,"NE","CONN","specimen","Chelone glabra","Chelone","glabra","9/12/2003",2003,9,12,255,2003255,"flowering","unknown","Y","N"," "," ","","","Connecticut","Tolland","Bolton","Upper Bolton Lake 41°48' 30"""" N, 72°25' 48"""" W",41.821696,-72.420967,400,"Y","Y","Y","Yes","Flowering","","","","locality","best estimate","JA"
"517",25373,"NE","CONN","specimen","Chelone glabra","Chelone","glabra","9/8/2008",2008,9,8,252,2008252,"flowering","unknown","Y","N"," "," ","","","Connecticut","Tolland","Mansfield","Mansfield Hollow, Fenton River 41°46' 47"""" N, 72°12' 6.5"""" W",41.77972,-72.2018,NA,"Y","Y","Y","Yes","Flowering","","","","provided","","JA"
"518",26718,"NE","CONN","specimen","Chelone glabra","Chelone","glabra","8/31/1998",1998,8,31,243,1998243,"flowering and ???","maybe","Y","maybe"," "," ","recheck phenology: very unsure","","Connecticut","Hartford","Windsor","Northwest Park 41°54' 18"""" N, 72°42' 07"""" W",41.905,-72.70194,NA,"Y","Y","Y","Yes","Flowering","","","","provided","","JA"
"519",27211,"NE","CONN","specimen","Chelone glabra","Chelone","glabra","8/18/2008",2008,8,18,231,2008231,"flowering","unknown","Y","N"," "," ","","","Connecticut","Litchfield","Canaan","41.96166°57' 21"""" N, 73°20' 48.22"""" W",41.96166,-73.34672,NA,"Y","Y","Y","Yes","Flowering","","","","provided","","JA"
"520",62984,"NE","CONN","specimen","Chelone glabra","Chelone","glabra","9/23/1973",1973,9,23,266,1973266,"flowering and fruit","unknown","Y","Y"," "," ","","","Connecticut","Tolland","Coventry","41°47' 04"""" N, 72°20' 22"""" W",41.78444,-72.33944,NA,"N",NA,"Y","Yes","Both","","","","provided","","JA"
"521",62985,"NE","CONN","specimen","Chelone glabra","Chelone","glabra","9/15/1973",1973,9,15,258,1973258,"flowering and fruit","unknown","Y","Y"," "," ","","same day/place, different phenology?","Connecticut","Tolland","Mansfield","Storrs, Pink Ravine 41°48' 11"""" N, 72°16' 52"""" W",41.80305,-72.28111,NA,"N",NA,"Y","Yes","Both","","","","locality","","JA"
"522",62986,"NE","CONN","specimen","Chelone glabra","Chelone","glabra","9/16/1973",1973,9,16,259,1973259,"flowering","unknown","Y","N"," "," ","","","Connecticut","Tolland","Willington","Willington 41°53' 07"""" N, 72°15' 41"""" W",41.88527,-72.26138,NA,"N",NA,"Y","Yes","Flowering","","","","provided","","JA"
"523",65427,"NE","CONN","specimen","Chelone glabra","Chelone","glabra","8/29/2003",2003,8,29,241,2003241,"flowering","unknown","Y","N"," "," ","","","Connecticut","Hartford","Windsor","Rainbow Reservoir, Rainbow, Windsor 41°54' 54"""" N, 72°41' 36"""" W",41.915,-72.69333,NA,"Y","Y","Y","Yes","Flowering","","","","provided","","JA"
"524",65444,"NE","CONN","specimen","Chelone glabra","Chelone","glabra","9/12/2003",2003,9,12,255,2003255,"flowering","unknown","Y","N"," "," ","","","Connecticut","Hartford","Manchester","Salters Pond 41°47' 43"""" N, 72°30' 14"""" W",41.79527,-72.50388,NA,"Y","Y","Y","Yes","Flowering","","","","locality","","JA"
"525",348033,"NE","CONN","specimen","Chelone glabra","Chelone","glabra","9/19/1997",1997,9,19,262,1997262,"flowering and fruit?","unknown","Y","Y"," "," ","recheck phenology: unsure","","Connecticut","Litchfield","Cornwall","41°50' 37"""" N, 73°19' 45"""" W",41.84361,-73.32916,NA,"Y","Y","Y","Yes","Both","","","","provided","","JA"
"526",351198,"NE","CONN","specimen","Chelone glabra","Chelone","glabra","9/22/1983",1983,9,22,265,1983265,"fruit","N","N","Y"," "," ","","","Connecticut","Fairfield","Trumbull","41°14' 34"""" N, 73°12' 02"""" W",41.24277,-73.20055,NA,"Y","Y","Y","Yes","Fruiting","","","","provided","","JA"
"527",351299,"NE","CONN","specimen","Chelone glabra","Chelone","glabra","9/26/1981",1981,9,26,263,1981263,"fruit","N","N","Y"," "," ","","","Connecticut","Tolland","Coventry","41°47' 04"""" N, 72°20' 22"""" W",41.78444,-72.33944,NA,"Y","Y","Y","Yes","Fruiting","","","","provided","","JA"
"528",355573,"NE","CONN","specimen","Chelone glabra","Chelone","glabra","8/29/1981",1981,8,29,241,1981241,"flowering and fruit","unknown","Y","Y"," "," ","","","New Hampshire","Merrimack","","43°18' 00 N, 71°40' 58"""" W",43.3,-71.68277,NA,"Y","Y","Y","Yes","Both","","","","provided","","JA"
"529",358560,"NE","CONN","specimen","Chelone glabra","Chelone","glabra","9/24/1993",1993,9,24,267,1993267,"flowering","unknown","Y","N"," "," ","","","Connecticut","Hartford","Bloomfield","41°49' 35"""" N, 72°43' 48"""" W",41.82638,-72.73,NA,"Y","Y","Y","Yes","Flowering","","","","provided","","JA"
"530",360629,"NE","CONN","specimen","Chelone glabra","Chelone","glabra","9/20/1981",1981,9,20,269,1981269,"flowering","unknown","Y","N"," "," ","","","Connecticut","Tolland","Coventry","41°47' 04"""" N, 72°20' 22"""" W",41.78444,-72.33944,NA,"Y","Y","Y","Yes","Flowering","","","","provided","","JA"
"531",858612,"NE","CONN","specimen","Chelone glabra","Chelone","glabra","9/14/1981",1981,9,14,257,1981257,"flowering","unknown","Y","N"," "," ","","","New Jersey","Morris","Mount Olive","Mount Olive;;40°51' 30"""" N, 74°47' 00 W",40.85833,-74.78333,NA,"Y","Y","Y","Yes","Flowering","","","","provided","","JA"
"532",858856,"NE","CONN","specimen","Chelone glabra","Chelone","glabra","9/4/1981",1981,9,4,247,1981247,"flowering","unknown","Y","N"," "," ","","","Connecticut","Middlesex","Cromwell","Cromwell;;41°35' 42"""" N, 72°38' 43"""" W",41.595,-72.64527,NA,"Y","Y","Y","Yes","Flowering","","","","provided","","JA"
"533",869189,"NE","CONN","specimen","Chelone glabra","Chelone","glabra","9/8/1957",1957,9,8,251,1957251,"flowering and fruit","unknown","Y","Y"," "," ","","","Connecticut","Litchfield","Litchfield","White Memorial Conservation Preserve, Litchfield;;41°44' 02"""" N, 73°12' 15"""" W",41.73388,-73.20416,NA,"Y","Y","Y","Yes","Both","","","","provided","","JA"
"534",869190,"NE","CONN","specimen","Chelone glabra","Chelone","glabra","8/24/1978",1978,8,24,236,1978236,NA,"maybe","maybe","maybe"," "," ","recheck phenology: description says flowering/fruiting, I don’t see fruit in pic","","Connecticut","New London","Mystic","Mystic;;41°21' 15"""" N, 71°57' 59"""" W",41.35416,-71.96638,NA,"Y","Y","Y","Yes","Flowering","","","","provided","","JA"
"535",869191,"NE","CONN","specimen","Chelone glabra","Chelone","glabra","8/28/1974",1974,8,28,240,1974240,"flowering and ?","maybe","Y","maybe"," "," ","recheck phenology: unsure","","Connecticut","Windham","Chaplin","Chaplin;;41°47' 41"""" N, 72°07' 38"""" W",41.79472,-72.12722,NA,"Y","Y","Y","Yes","Flowering","","","","provided","","JA"
"536",869192,"NE","CONN","specimen","Chelone glabra","Chelone","glabra","9/13/1979",1979,9,13,256,1979256,"flowering and fruit??","unknown","Y","Y"," "," ","recheck phenology: very unsure","","Connecticut","Tolland","Mansfield","Storrs, University of Connecticut;;41°48' 33"""" N, 72°15' 13"""" W",41.80916,-72.25361,NA,"Y","Y","Y","Yes","Both","","","","provided","","JA"
"537",869194,"NE","CONN","specimen","Chelone glabra","Chelone","glabra","9/16/1939",1939,9,16,259,1939259,"flowering","unknown","Y","N"," "," ","","","Connecticut","Tolland","Mansfield","Storrs;;41°48' 30"""" N, 72°14' 58"""" W",41.80833,-72.24944,NA,"Y","Y","Y","Yes","Flowering","","","","provided","","JA"
"538",869195,"NE","CONN","specimen","Chelone glabra","Chelone","glabra","8/31/1940",1940,8,31,244,1940244,"flowering","unknown","Y","N"," "," ","","same day/place, some have different phenology","Connecticut","Hartford","Suffield","Beech Swamp;41°58' 54"""" N, 072°39' 04"""" W (says verbatim, but not on sheet)",41.98166,-72.65111,20000,"Y","Y","Y","Yes","Flowering","","","","provided","provided","JA"
"539",869196,"NE","CONN","specimen","Chelone glabra","Chelone","glabra","8/25/1991",1991,8,25,237,1991237,"flowering","unknown","Y","N"," "," ","","","Connecticut","Windham","Ashford","Ashford;;41°52' 23"""" N, 072°07' 19"""" W",41.87305,-72.12194,NA,"Y","Y","Y","Yes","Flowering","","","","provided","","JA"
"540",869197,"NE","CONN","specimen","Chelone glabra","Chelone","glabra","9/19/1990",1990,9,19,262,1990262,"flowering","unknown","Y","N"," "," ","","","Connecticut","New London","Old Lyme","Lieutenant River, Old Lyme;;41°18' 32"""" N, 72°20' 41"""" W",41.30888,-72.34472,NA,"Y","Y","Y","Yes","Flowering","","","","provided","","JA"
"541",869198,"NE","CONN","specimen","Chelone glabra","Chelone","glabra","10/6/1990",1990,10,6,279,1990279,"flowering","unknown","Y","N"," "," ","","","Connecticut","Middlesex","Haddam","George Dudley Seymour State Park;;41°30' 32"""" N, 72°32' 37"""" W",41.50888,-72.54361,NA,"Y","Y","Y","Yes","Flowering","","","","provided","","JA"
"542",869199,"NE","CONN","specimen","Chelone glabra","Chelone","glabra","9/8/1990",1990,9,8,251,1990251,"flowering","unknown","Y","N"," "," ","","","Connecticut","Tolland","Vernon","Valley Falls Recreation Area;;41°49' 05"""" N, 72°26' 37"""" W",41.81805,-72.44361,NA,"Y","Y","Y","Yes","Flowering","","","","provided","","JA"
"543",869200,"NE","CONN","specimen","Chelone glabra","Chelone","glabra","9/20/1990",1990,9,20,263,1990263,"flowering","unknown","Y","N"," "," ","","","Connecticut","Hartford","East Hartford","East Hartford;;41°46' 56"""" N, 72°36' 43"""" W",41.78222,-72.61194,NA,"Y","Y","Y","Yes","Flowering","","","","provided","","JA"
"544",869201,"NE","CONN","specimen","Chelone glabra","Chelone","glabra","10/22/1988",1988,10,22,296,1988296,"flowering and fruit","unknown","Y","Y"," "," ","","","Connecticut","Hartford","Wethersfield","Wethersfield;;41°42' 04"""" N, 72°40' 12"""" W",41.70111,-72.67,NA,"Y","Y","Y","Yes","Both","","","","provided","","JA"
"545",869202,"NE","CONN","specimen","Chelone glabra","Chelone","glabra","11/4/1997",1997,11,4,308,1997308,"fruit","N","N","Y"," "," ","","","Connecticut","Tolland","Bolton","Gay City State Park, Bolton;;41°43' 34"""" N, 72°26' 26"""" W",41.72611,-72.44055,NA,"Y","Y","Y","Yes","Fruiting","","","","provided","","JA"
"546",869203,"NE","CONN","specimen","Chelone glabra","Chelone","glabra","9/16/1968",1968,9,16,260,1968260,"flowering and ?","maybe","Y","maybe"," "," ","recheck phenology: unsure","same day/place, same phenology?","Connecticut","Litchfield","Woodbury","Parker Farm, Old Flanders Road;;41°34' 58"""" N, 73°12' 15"""" W",41.58277,-73.20416,NA,"Y","Y","Y","Yes","Flowering","","","","provided","","JA"
"547",869204,"NE","CONN","specimen","Chelone glabra","Chelone","glabra","8/15/1929",1929,8,15,227,1929227,"flowering","unknown","Y","N"," "," ","","","Connecticut","New London","Groton","Trails Corner, Groton;;41°20' 29"""" N, 72°03' 27"""" W",41.34138,-72.0575,NA,"Y","Y","Y","Yes","Flowering","","","","provided","","JA"
"548",869205,"NE","CONN","specimen","Chelone glabra","Chelone","glabra","9/13/1913",1913,9,13,256,1913256,"flowering and fruit?","unknown","Y","Y"," "," ","recheck phenology: unsure","","Connecticut","Hartford","Burlington","Farmington River, Burlington;;41°47' 16"""" N, 72°55' 30"""" W",41.78777,-72.925,NA,"Y","Y","Y","Yes","Both","","","","provided","","JA"
"549",869206,"NE","CONN","specimen","Chelone glabra","Chelone","glabra","9/15/1946",1946,9,15,258,1946258,"flowering","unknown","Y","N"," "," ","","","Connecticut","Tolland","Tolland","Tolland;;41°52' 17"""" N, 72°22' 07"""" W",41.87138,-72.36861,NA,"Y","Y","Y","Yes","Flowering","","","","provided","","JA"
"550",869207,"NE","CONN","specimen","Chelone glabra","Chelone","glabra","8/31/1940",1940,8,31,244,1940244,"flowering","unknown","Y","N"," "," ","","same day/place, some have different phenology","Connecticut","Hartford","Suffield","Beech Swamp;41°58' 54"""" N, 072°39' 04"""" W (says verbatim, but not on sheet)",41.98166,-72.65111,20000,"Y","Y","Y","Yes","Flowering","","","","provided","provided","JA"
"551",869208,"NE","CONN","specimen","Chelone glabra","Chelone","glabra","8/11/1903",1903,8,11,223,1903223,"flowering","unknown","Y","N"," "," ","","","Connecticut","Tolland","Mansfield","Mansfield;;41°45' 47"""" N, 72°14' 01"""" W",41.76305,-72.23361,NA,"Y","Y","Y","Yes","Flowering","","","","provided","","JA"
"552",869209,"NE","CONN","specimen","Chelone glabra","Chelone","glabra","9/3/1922",1922,9,3,246,1922246,"flowering","unknown","Y","N"," "," ","","","Connecticut","Tolland","Mansfield","Gurleyville, Fenton River;;41°48' 53"""" N, 72°13' 31"""" W",41.81472,-72.22527,NA,"Y","Y","Y","Yes","Flowering","","","","provided","","JA"
"553",869210,"NE","CONN","specimen","Chelone glabra","Chelone","glabra","8/21/1940",1940,8,21,234,1940234,"flowering","unknown","Y","N"," "," ","","","Connecticut","New London","Colchester","Babcock Pond;;41°32' 22"""" N, 72°23' 49"""" W",41.53944,-72.39694,NA,"Y","Y","Y","Yes","Flowering","","","","provided","","JA"
"554",869211,"NE","CONN","specimen","Chelone glabra","Chelone","glabra","9/20/1933",1933,9,20,263,1933263,"flowering","unknown","Y","N"," "," ","","","Connecticut","New London","Groton","Groton;;41°21' 00 N, 72°04' 42"""" W",41.35,-72.07833,NA,"Y","Y","Y","Yes","Flowering","","","","provided","","JA"
"555",869213,"NE","CONN","specimen","Chelone glabra","Chelone","glabra","10/3/1975",1975,10,3,276,1975276,"flowering and fruit?","unknown","Y","Y"," "," ","recheck phenology: unsure","","Connecticut","Tolland","Mansfield","Storrs, North Eagleville Road;;41°48' 30"""" N, 72°15' 00 W",41.80833,-72.25,NA,"Y","Y","Y","Yes","Both","","","","provided","","JA"
"556",869214,"NE","CONN","specimen","Chelone glabra","Chelone","glabra","9/10/1904",1904,9,10,254,1904254,"flowering","unknown","Y","N"," "," ","","","Connecticut","Hartford","South Windsor","South Windsor;;41°49' 25"""" N, 72°37' 16"""" W",41.82361,-72.62111,NA,"Y","Y","Y","Yes","Flowering","","","","provided","","JA"
"557",869215,"NE","CONN","specimen","Chelone glabra","Chelone","glabra","9/16/1966",1966,9,16,259,1966259,"vegetative","N","N","N","Y"," ","","","Connecticut","Tolland","Tolland","Charter Marsh Wildlife Management Area;;41°53' 39"""" N, 72°20' 37"""" W",41.89416,-72.34361,NA,"Y","Y","Y","No","","","","","provided","","JA"
"558",869216,"NE","CONN","specimen","Chelone glabra","Chelone","glabra","9/22/1907",1907,9,22,265,1907265,"fruit (description says flowers too, but not in pic)","N","Y","Y"," "," ","","","Connecticut","Hartford","East Hartford","East Hartford;;41°46' 56"""" N, 72°36' 43"""" W",41.78222,-72.61194,NA,"Y","Y","Y","Yes","Fruiting","","","","provided","","JA"
"559",869217,"NE","CONN","specimen","Chelone glabra","Chelone","glabra","9/30/1905",1905,9,30,273,1905273,"flowering and fruit","unknown","Y","Y"," "," ","","","Connecticut","Litchfield","Woodbury","Pomperaug River, Woodbury;;41°32' 25"""" N, 73°12' 50"""" W",41.54027,-73.21388,NA,"Y","Y","Y","Yes","Both","","","","provided","","JA"
"560",869218,"NE","CONN","specimen","Chelone glabra","Chelone","glabra","9/16/1937",1937,9,16,259,1937259,"flowering","unknown","Y","N"," "," ","","same day/place, same phenology","Connecticut","Hartford","Granby","Granby;;41°57' 14"""" N, 72°47' 19"""" W",41.95388,-72.78861,NA,"Y","Y","Y","Yes","Flowering","","","","provided","","JA"
"561",869220,"NE","CONN","specimen","Chelone glabra","Chelone","glabra","7/29/1903",1903,7,29,210,1903210,"flowering","unknown","Y","N"," "," ","","","Connecticut","Litchfield","Salisbury","Hammertown, Hammertown Pond, Salisbury;;42°02' 41"""" N, 73°25' 08"""" W",42.04472,-73.41888,NA,"Y","Y","Y","Yes","Flowering","","","","provided","","JA"
"562",869221,"NE","CONN","specimen","Chelone glabra","Chelone","glabra","9/16/1968",1968,9,16,260,1968260,"flowering","unknown","Y","N"," "," ","","same day/place, same phenology?","Connecticut","Litchfield","Woodbury","Parker Farm, Old Flanders Road;41°34' 58"""" N, 73°12' 15"""" W (says verbatim, but not on sheet)",41.58277,-73.20416,5000,"Y","Y","Y","Yes","Flowering","","","","provided","provided","JA"
"563",869223,"NE","CONN","specimen","Chelone glabra","Chelone","glabra","9/15/1973",1973,9,15,258,1973258,"flowering","unknown","Y","N"," "," ","","same day/place, different phenology?","Connecticut","Tolland","Mansfield","Mansfield Hollow State Park;;41°46' 07"""" N, 72°10' 26"""" W",41.76861,-72.17388,5000,"Y","Y","Y","Yes","Flowering","","","","provided","provided","JA"
"564",869224,"NE","CONN","specimen","Chelone glabra","Chelone","glabra","9/9/1873",1873,9,9,252,1873252,"flowering and ?","maybe","Y","maybe"," "," ","recheck phenology: unsure","","Connecticut","New Haven","Cheshire","Cheshire;;41°29' 21"""" N, 072°54' 17"""" W",41.48916,-72.90472,NA,"Y","Y","Y","Yes","Flowering","","","","provided","","JA"
"565",869225,"NE","CONN","specimen","Chelone glabra","Chelone","glabra","9/14/1974",1974,9,14,257,1974257,"flowering","unknown","Y","N"," "," ","","","Connecticut","Tolland","Willington","Fenton River, Willington;;41°53' 19"""" N, 72°13' 56"""" W",41.88861,-72.23222,NA,"Y","Y","Y","Yes","Flowering","","","","provided","","JA"
"566",869226,"NE","CONN","specimen","Chelone glabra","Chelone","glabra","9/8/1975",1975,9,8,251,1975251,"flowering","unknown","Y","N"," "," ","","","Connecticut","Tolland","Storrs Mansfield","Gurleyville Road;;41°48' 52.57"""" N, 72°13' 19.21"""" W",41.8146,-72.222,NA,"Y","Y","Y","Yes","Flowering","","","","provided","","JA"
"567",869227,"NE","CONN","specimen","Chelone glabra","Chelone","glabra","9/13/1988",1988,9,13,257,1988257,"flowering","unknown","Y","N"," "," ","","","Connecticut","New London","Salem","Salem;;41°29' 25"""" N, 72°16' 31"""" W",41.49027,-72.27527,NA,"Y","Y","Y","Yes","Flowering","","","","provided","","JA"
"568",869228,"NE","CONN","specimen","Chelone glabra","Chelone","glabra","9/21/1973",1973,9,21,264,1973264,"flowering","unknown","Y","N"," "," ","","","Connecticut","Hartford","Bristol","Bristol;;41°40' 18"""" N, 72°56' 57"""" W",41.67166,-72.94916,NA,"Y","Y","Y","Yes","Flowering","","","","provided","","JA"
"569",869229,"NE","CONN","specimen","Chelone glabra","Chelone","glabra","9/7/1892",1892,9,7,251,1892251,"flowering","unknown","Y","N"," "," ","","","Connecticut","Fairfield","Bridgeport","Bridgeport;;41°10' 01"""" N, 73°12' 17"""" W",41.16694,-73.20472,NA,"Y","Y","Y","Yes","Flowering","","","","provided","","JA"
"570",869230,"NE","CONN","specimen","Chelone glabra","Chelone","glabra","9/16/1937",1937,9,16,259,1937259,"flowering","unknown","Y","N"," "," ","","same day/place, same phenology","Connecticut","Hartford","Granby","Granby;41°57' 14"""" N, 72°47' 19"""" W (says verbatim, but not on sheet)",41.95388,-72.78861,5000,"Y","Y","Y","Yes","Flowering","","","","provided","provided","JA"
"571",869231,"NE","CONN","specimen","Chelone glabra","Chelone","glabra","8/21/1938",1938,8,21,233,1938233,"flowering and fruit","unknown","Y","Y"," "," ","","","Connecticut","Hartford","West Granby","West Granby;;41°57' 22"""" N, 72°50' 33"""" W",41.95611,-72.8425,NA,"Y","Y","Y","Yes","Both","","","","provided","","JA"
"572",869232,"NE","CONN","specimen","Chelone glabra","Chelone","glabra","10/9/2009",2009,10,9,282,2009282,"flowering","unknown","Y","N"," "," ","","","Massachusetts","Suffolk","Boston","Peters Hill, Arnold Arboretum, Jamaica Plain;;42°17' 36"""" N, 71°07' 40"""" W",42.29333,-71.12777,NA,"Y","Y","Y","Yes","Flowering","","","","provided","","JA"
"573",869233,"NE","CONN","specimen","Chelone glabra","Chelone","glabra","9/11/1988",1988,9,11,255,1988255,"flowering and ???","maybe","Y","maybe"," "," ","recheck phenology: very unsure","","Maine","Knox","Appleton","Appleton;;44°17' 21"""" N, 69°15' 03"""" W",44.28916,-69.25083,NA,"Y","Y","Y","Yes","Flowering","","","","provided","","JA"
"574",869234,"NE","CONN","specimen","Chelone glabra","Chelone","glabra","9/19/2001",2001,9,19,262,2001262,"flowering","unknown","Y","N"," "," ","description says veg","","New Hampshire","Strafford","Barrington","Barrington;;43°14' 52"""" N, 71°04' 06"""" W",43.24777,-71.06833,NA,"Y","Y","Y","Yes","Flowering","","","","provided","","JA"
"575",869235,"NE","CONN","specimen","Chelone glabra","Chelone","glabra","8/16/1902",1902,8,16,228,1902228,"flowering","unknown","Y","N"," "," ","","","Connecticut","Fairfield","Noroton","Noroton;;41°03' 52"""" N, 73°29' 19"""" W",41.06444,-73.48861,NA,"Y","Y","Y","Yes","Flowering","","","","provided","","JA"
"576",869236,"NE","CONN","specimen","Chelone glabra","Chelone","glabra","8/21/1879",1879,8,21,233,1879233,"flowering and ???","maybe","Y","maybe"," "," ","recheck phenology: very unsure","","Vermont","Chittenden","Burlington",";;44°28' 33"""" N, 73°12' 44"""" W",44.475882,-73.212072,6885,"Y","Y","Y","Yes","Flowering","","","","town","geolocate","JA"
"577",869237,"NE","CONN","specimen","Chelone glabra","Chelone","glabra","10/14/1991",1991,10,14,287,1991287,"flowering","unknown","Y","N"," "," ","","","New Jersey","Morris","Morris","Patriots Path;;40°48' 52"""" N, 074°29' 48"""" W",40.81444,-74.49666,NA,"Y","Y","Y","Yes","Flowering","","","","provided","","JA"
"578",869238,"NE","CONN","specimen","Chelone glabra","Chelone","glabra","8/30/1891",1891,8,30,242,1891242,"flowering","unknown","Y","N"," "," ","","","New York","Saratoga","Stillwater","Stillwater;;42°56' 18"""" N, 73°39' 11"""" W",42.93833,-73.65305,NA,"Y","Y","Y","Yes","Flowering","","","","provided","","JA"
"579",869239,"NE","CONN","specimen","Chelone glabra","Chelone","glabra","8/31/1974",1974,8,31,243,1974243,"flowering","unknown","Y","N"," "," ","","","New Hampshire","Sullivan","Claremont","Claremont;;43°22' 36"""" N, 72°20' 48"""" W",43.37666,-72.34666,NA,"Y","Y","Y","Yes","Flowering","","","","provided","","JA"
"580",869240,"NE","CONN","specimen","Chelone glabra","Chelone","glabra","9/8/1974",1974,9,8,251,1974251,"flowering","unknown","Y","N"," "," ","","same day/place, some have different phenology","Massachusetts","Hampshire","Northampton","off bridge rd, northampton;42°19' 30"""" N, 72°38' 28"""" W (says verbatim, but not on sheet)",42.325,-72.64111,5000,"Y","Y","Y","Yes","Flowering","","","","provided","provided","JA"
"581",869241,"NE","CONN","specimen","Chelone glabra","Chelone","glabra","8/9/1969",1969,8,9,221,1969221,"flowering and fruit??","unknown","Y","Y"," "," ","recheck phenology: very unsure","","Vermont","Orange","Williamstown","Williamstown;;44°07' 19"""" N, 72°32' 29"""" W",44.12194,-72.54138,NA,"Y","Y","Y","Yes","Both","","","","provided","","JA"
"582",869243,"NE","CONN","specimen","Chelone glabra","Chelone","glabra","8/8/1943",1943,8,8,220,1943220,"flowering","unknown","Y","N"," "," ","","","Quebec","Argenteuil","Saint-Adolphe d'Howard","Saint-Adolphe d'Howard;;45°58' 00 N, 74°19' 52"""" W",45.96666,-74.33111,NA,"Y","Y","Y","Yes","Flowering","","","","provided","","JA"
"583",869247,"NE","CONN","specimen","Chelone glabra","Chelone","glabra","8/17/1936",1936,8,17,230,1936230,"flowering","unknown","Y","N"," "," ","","","Maine","Knox","Camden","Mount Megunticook, Camden;;44°14' 28"""" N, 69°04' 01"""" W",44.24111,-69.06694,NA,"Y","Y","Y","Yes","Flowering","","","","provided","","JA"
"584",869248,"NE","CONN","specimen","Chelone glabra","Chelone","glabra","8/3/1939",1939,8,3,215,1939215,"flowering","unknown","Y","N"," "," ","","","Vermont","Rutland","Hubbardton","Lake Bomoseen;;43°41' 19"""" N, 73°11' 34"""" W",43.68861,-73.19277,NA,"Y","Y","Y","Yes","Flowering","","","","provided","","JA"
"585",876289,"NE","CONN","specimen","Chelone glabra","Chelone","glabra","11/16/1893",1893,11,16,320,1893320,"fruit","N","N","Y"," "," ","","","Connecticut","Fairfield","Bridgeport","Bridgeport;;41°10' 01"""" N, 73°12' 17"""" W",41.16694,-73.20472,NA,"N",NA,"Y","Yes","Fruiting","","","","provided","","JA"
"586",10269723,"MW","CONV","specimen","Chelone glabra","Chelone","glabra","9/4/1936",1936,9,4,248,1936248,"flowering","unknown","Y","N"," "," ","","","North Carolina","Swain","","deep creek, bryson place",35.52098,-83.420704,800,"Y","Y","Y","Yes","Flowering","","","","locality","best estimate","JA"
"587",10269724,"MW","CONV","specimen","Chelone glabra","Chelone","glabra","10/10/1968",1968,10,10,284,1968284,"flowering","unknown","Y","N"," "," ","","same day/place, same phenology?","North Carolina","Martin","","pocosin-like depressions along us 64, 3 miles east of jamesville",NA,NA,NA,"Y","Y","Y","Yes","Flowering","","","","","","JA"
"588",10269726,"MW","CONV","specimen","Chelone glabra","Chelone","glabra","7/31/1937",1937,7,31,212,1937212,"buds???","Y","N","maybe"," "," ","recheck phenology: very unsure. leaf covering buds(?) in picture","","North Carolina","Swain","","black camp gap",35.535376,-83.175671,700,"Y","Y","Y","Yes","Flowering","Early","","","locality","best estimate","JA"
"589",10269727,"MW","CONV","specimen","Chelone glabra","Chelone","glabra","10/2/1936",1936,10,2,276,1936276,"vegetative???","maybe","maybe","maybe","Y"," ","recheck phenology: very unsure","plant may be missing pieces in picture","Tennessee","Blount","","cooper road, cades cove. Great smoky mountains national park",35.599902,-83.842636,1200,"Y","Y","Y","No","","","","","locality","best estimate","JA"
"590",10269728,"MW","CONV","specimen","Chelone glabra","Chelone","glabra","8/22/1938",1938,8,22,234,1938234,"buds","Y","N","N"," "," ","","","Tennessee","Sevier","","near indian gap, just below the gap, Great smoky mountains national park",35.611225,-83.438533,500,"Y","Y","Y","Yes","Flowering","Early","","","locality","best estimate","JA"
"591",3291773,"MW","DBG","specimen","Chelone glabra","Chelone","glabra","8/1/1965",1965,8,1,213,1965213,"flowering","unknown","Y","N"," "," ","","","Michigan","Baraga","","L'Anse",46.769148,-88.40578,14844,"Y","Y","Y","Yes","Flowering","","","","provided","provided","JA"
"592",3291775,"MW","DBG","specimen","Chelone glabra","Chelone","glabra","8/18/1933",1933,8,18,230,1933230,"flowering","unknown","Y","N"," "," ","","","Maine","Hancock","","3.5 mi E of Franklin",44.593845,-68.22973,7705,"Y","Y","Y","Yes","Flowering","","","","provided","provided","JA"
"593",3291776,"MW","DBG","specimen","Chelone glabra","Chelone","glabra","9/13/1964",1964,9,13,257,1964257,"flowering","unknown","Y","N"," "," ","","","Indiana","Lake","Hammond","Rt 20 and 912",41.603653,-87.432601,600,"Y","Y","Y","Yes","Flowering","","","","locality","best estimate","JA"
"594",3291777,"MW","DBG","specimen","Chelone glabra","Chelone","glabra","9/12/1888",1888,9,12,256,1888256,"flowering","unknown","Y","N"," "," ","","","Massachusetts","Norfolk","Wellesley","",42.296486,-71.292557,5068,"Y","Y","Y","Yes","Flowering","","","","town","geolocate","JA"
"595",10358935,"MW","DSC","specimen","Chelone glabra","Chelone","glabra","10/15/2000",2000,10,15,289,2000289,"flowering","unknown","Y","N"," "," ","","same day/place, some have different phenology","Mississippi","Calhoun","","MISSISSIPPI. Calhoun Co.: ca. 4 miles northeast of Derma; T13S, R1W, Sec. 36, NW 1/4.",33.896697,-89.2351,4462,"Y","Y","Y","Yes","Flowering","","","PLSS","town+direction+distance","geolocate","JA"
"596",10358937,"MW","DSC","specimen","Chelone glabra","Chelone","glabra","10/15/2000",2000,10,15,289,2000289,"flowering","unknown","Y","N"," "," ","","same day/place, some have different phenology","Mississippi","Calhoun","","MISSISSIPPI. Calhoun Co.: ca. 4 miles northeast of Derma; T13S, R1W, Sec. 36, NW 1/4.",33.896697,-89.2351,4462,"Y","Y","Y","Yes","Flowering","","","PLSS","town+direction+distance","geolocate","JA"
"597",10358938,"MW","DSC","specimen","Chelone glabra","Chelone","glabra","10/15/2000",2000,10,15,289,2000289,"flowering and fruit","unknown","Y","Y"," "," ","","same day/place, some have different phenology","Mississippi","Calhoun","","MISSISSIPPI. Calhoun Co.: ca. 4 miles northeast of Derma; T13S, R1W, Sec. 36, NW 1/4.",33.896697,-89.2351,4462,"Y","Y","Y","Yes","Both","","","PLSS","town+direction+distance","geolocate","JA"
"598",1020015,"NE","ECON","specimen","Chelone glabra","Chelone","glabra","9/25/1917",1917,9,25,268,1917268,"flowering","unknown","Y","N"," "," ","","","Massachusetts","Suffolk","Jamaica Plain","Jamaica Plain",42.309737,-71.115143,NA,"Y","Y","Y","Yes","Flowering","","","lat lon should be ok","provided","","JA"
"599",4906446,"MW","EIU","specimen","Chelone glabra","Chelone","glabra","8/16/2000",2000,8,16,229,2000229,"buds","Y","N","N"," "," ","","","Illinois","Cook","","CBG, Glencoe: McDonald Woods. West side of main woodland pond;;45°23'00""N 88°08'00""W",42.147089,-87.786061,1200,"N",NA,"Y","Yes","Flowering","Early","","","locality","best estimate","JA"
"600",5431844,"MW","EKY","specimen","Chelone glabra","Chelone","glabra","9/19/1997",1997,9,19,262,1997262,"flowering","unknown","Y","N"," "," ","","","Kentucky","Adair","","11 mi S on Hwy 76 Spout Springs Rd.",37.104156,-85.280649,30025,"Y","Y","Y","Yes","Flowering","","","locality description ambiguous, used county","county","geolocate","JA"
"601",5431846,"MW","EKY","specimen","Chelone glabra","Chelone","glabra","9/2/1978",1978,9,2,245,1978245,"buds?","Y","N","maybe"," "," ","recheck phenology: unsure","","Kentucky","Anderson","","Kentucky River Cliffs. Lover's Leap off Lane's Mill road near Ninevah.",38.092309,-84.864375,500,"Y","Y","Y","Yes","Flowering","Early","","","locality","best estimate","JA"
"602",5431847,"MW","EKY","specimen","Chelone glabra","Chelone","glabra","9/15/1965",1965,9,15,258,1965258,"flowering and fruit","unknown","Y","Y"," "," ","","","Kentucky","Bell","","Pine Mountain State Park.",36.751111,-83.709167,3000,"Y","Y","Y","Yes","Both","","","","locality","best estimate","JA"
"603",5431848,"MW","EKY","specimen","Chelone glabra","Chelone","glabra","9/20/1978",1978,9,20,263,1978263,"flowering and fruit?","unknown","Y","Y"," "," ","recheck phenology: unsure","","Kentucky","Bell","","36?41'20"", -83?49'20"" Alluvial meadow- union of Major Branch and Clear Creek. Elev about 1300'. Off KY 190.",36.68889,-83.82222,NA,"Y","Y","Y","Yes","Both","","","","provided by observer","","JA"
"604",5431849,"MW","EKY","specimen","Chelone glabra","Chelone","glabra","9/11/1965",1965,9,11,254,1965254,"flowering and fruit???","unknown","Y","Y"," "," ","recheck phenology: very unsure","","Kentucky","Carter","","KY 174- low roadside- 0.9 mi W of Jct. this road and US 60 near Olive Hill. Base of N slope at edge of deciduous woods.",38.284231,-83.196548,800,"Y","Y","Y","Yes","Both","","","","locality","best estimate","JA"
"605",5431850,"MW","EKY","specimen","Chelone glabra","Chelone","glabra","9/4/1980",1980,9,4,248,1980248,"flowering","unknown","Y","N"," "," ","","","Kentucky","Daviess","","Bottomland woods along S side of the South Fork of Panther Creek on the E side of Poplar Log Bridge road. Just W of the Davidson & Ohio Co. lines. Elev. 400'.",37.632039,-86.963,1000,"Y","?","Y","Yes","Flowering","","","","locality","best estimate","JA"
"606",5431851,"MW","EKY","specimen","Chelone glabra","Chelone","glabra","9/30/1980",1980,9,30,274,1980274,"flowering and fruit???","unknown","Y","Y"," "," ","recheck phenology: very unsure","","Kentucky","Estill","","Marshy area- between Route 1571 and railroad tracks- across from entrance to lock No. 12- at east end of Ravenna.",37.680514,-83.945724,400,"Y","?","Y","Yes","Both","","","","locality","best estimate","JA"
"607",5431852,"MW","EKY","specimen","Chelone glabra","Chelone","glabra","9/25/1987",1987,9,25,268,1987268,"flowering and fruit","unknown","Y","Y"," "," ","","","Kentucky","Estill","","Ky 52- 6.9 mi E of Madison-Estill Co. line. Floodplain of Kentucky River located near alfalfa field.",37.698242,-83.975816,2000,"Y","?","Y","Yes","Both","","","","locality","best estimate","JA"
"608",5431853,"MW","EKY","specimen","Chelone glabra","Chelone","glabra","9/25/1981",1981,9,25,268,1981268,"flowering","unknown","Y","N"," "," ","","","Kentucky","Franklin","","Trumbo Bottom- wet meadow.",38.179396,-84.849449,1000,"Y","?","Y","Yes","Flowering","","","","locality","best estimate","JA"
"609",5431854,"MW","EKY","specimen","Chelone glabra","Chelone","glabra","8/18/1980",1980,8,18,231,1980231,"flowering","unknown","Y","N"," "," ","","","Kentucky","Franklin","","Marsh and swamp areas. S side of the ""Backbone""- just east of Peaks Mill Rd and W of Elkhorn Creek- about 3 miles NE of Frankfort.",38.231655,-84.834146,1700,"Y","?","Y","Yes","Flowering","","","","locality","best estimate","JA"
"610",5431855,"MW","EKY","specimen","Chelone glabra","Chelone","glabra","9/14/1978",1978,9,14,257,1978257,"flowering","unknown","Y","N"," "," ","","","Kentucky","Franklin","","Bryan Farm; riverbank",38.239148,-84.877068,21112,"Y","?","Y","Yes","Flowering","","","couldn't find locality, used county","county","geolocate","JA"
"611",5431857,"MW","EKY","specimen","Chelone glabra","Chelone","glabra","8/7/1980",1980,8,7,220,1980220,"vegetative","N","N","N","Y"," ","","","Kentucky","Hardin","","Alder thickets in low ground along Pup Run- just N of KY 222.",37.588722,-85.839643,400,"Y","?","Y","No","","","","","locality","best estimate","JA"
"612",5431858,"MW","EKY","specimen","Chelone glabra","Chelone","glabra","9/21/1993",1993,9,21,264,1993264,"flowering","unknown","Y","N"," "," ","","","Kentucky","Harlan","","Blanton Forest in and around Kentennia Bog.",36.860362,-83.383159,5000,"Y","?","Y","Yes","Flowering","","","couldn't find exact locality","locality","best estimate","JA"
"613",5431859,"MW","EKY","specimen","Chelone glabra","Chelone","glabra","8/19/1998",1998,8,19,231,1998231,"buds??","Y","N","maybe"," "," ","recheck phenology: very unsure","","Kentucky","Harlan","","Black Mountain- along Razor Fork- in areas targeted for strip mining- S facing slope- 3500-3800 ft",36.887702,-82.893934,3700,"Y","?","Y","Yes","Flowering","Early","","","locality","best estimate","JA"
"614",5431860,"MW","EKY","specimen","Chelone glabra","Chelone","glabra","9/5/1998",1998,9,5,248,1998248,"flowering","unknown","Y","N"," "," ","","","Kentucky","Harlan","","Black Mountain- along Razor Fork- in areas targeted for strip-mining- N facing slope-",36.89475,-82.896438,3700,"Y","?","Y","Yes","Flowering","","","","locality","best estimate","JA"
"615",5431861,"MW","EKY","specimen","Chelone glabra","Chelone","glabra","10/1/1992",1992,10,1,275,1992275,"flowering","unknown","Y","N"," "," ","","","Kentucky","Laurel","","37?4'21"", 83?58'28"" Charlie Cheek Swamp. Turn left off Hwy 830 onto Sargent Rd. Go 0.5 mi- site is on N side of road in a flat wet meadow with sandy soil.",37.0725,-83.97444,NA,"Y","?","Y","Yes","Flowering","","","","provided by observer","","JA"
"616",5431862,"MW","EKY","specimen","Chelone glabra","Chelone","glabra","10/1/1991",1991,10,1,274,1991274,"flowering and fruit","unknown","Y","Y"," "," ","","","Kentucky","Laurel","","Wet meadow along Laurel River- gravel road off Co. 830.",37.059744,-83.998702,3000,"Y","?","Y","Yes","Both","","","","locality","best estimate","JA"
"617",5431863,"MW","EKY","specimen","Chelone glabra","Chelone","glabra","9/22/2004",2004,9,22,266,2004266,"flowering","unknown","Y","N"," "," ","","","Kentucky","Powell","","Wooded NE facing slopes and ridgetops; 74 ac addition to Natural Bridge State Resort Park along Red River and Hwy 11; Bryant Henson Tract- above Red River Inn; ca 1.0 mi SE of Slade exit- Mountain Parkway.",37.788451,-83.690826,1200,"Y","?","Y","Yes","Flowering","","","","locality","best estimate","JA"
"618",5431864,"MW","EKY","specimen","Chelone glabra","Chelone","glabra","9/22/1980",1980,9,22,266,1980266,"fruit?","unknown","N","Y"," "," ","recheck phenology: unsure","","Kentucky","McLean","","Bottomland woods S of the Greene River.",37.518508,-87.240908,11000,"Y","?","Y","Yes","Fruiting","","","","locality","best estimate","JA"
"619",5431865,"MW","EKY","specimen","Chelone glabra","Chelone","glabra","9/30/1980",1980,9,30,274,1980274,"flowering","unknown","Y","N"," "," ","","","Kentucky","Powell","","Marshy area just S of the Red River and N of route 11 & 15 between Rosslyn and Bowen- about 4.5 mi E of Stanton.",37.833145,-83.792066,2000,"Y","?","Y","Yes","Flowering","","","","locality","best estimate","JA"
"620",5431866,"MW","EKY","specimen","Chelone glabra","Chelone","glabra","11/7/1999",1999,11,7,311,1999311,"fruit","N","N","Y"," "," ","","","Kentucky","Powell","","Natural Bridge State Resort Park. Fuller Tract. Low woods around pond.",37.777224,-83.686022,3000,"Y","?","Y","Yes","Fruiting","","","couldn't find exact locality","locality","best estimate","JA"
"621",5431868,"MW","EKY","specimen","Chelone glabra","Chelone","glabra","9/22/1997",1997,9,22,265,1997265,"flowering","unknown","Y","N"," "," ","","","Kentucky","Rockcastle","","Roadside out from tunnel along RR near Apeyard.",37.365178,-84.315941,26166,"Y","?","Y","Yes","Flowering","","","couldn't find locality, used county","county","geolocate","JA"
"622",5431869,"MW","EKY","specimen","Chelone glabra","Chelone","glabra","9/3/1977",1977,9,3,246,1977246,"flowering","unknown","Y","N"," "," ","","","Kentucky","Rockcastle","","Rigsby's Swamp- 0.5 mi NW off county route 1505 at Union Chapel about 2.5 air miles NE of Brodhead.",37.424274,-84.383343,1000,"Y","?","Y","Yes","Flowering","","","","locality","best estimate","JA"
"623",5431870,"MW","EKY","specimen","Chelone glabra","Chelone","glabra","9/26/1968",1968,9,26,270,1968270,"flowering","unknown","Y","N"," "," ","","","Kentucky","Trigg","","Hematite Lake.",36.895547,-88.044618,800,"Y","Y","Y","Yes","Flowering","","","","locality","best estimate","JA"
"624",5431871,"MW","EKY","specimen","Chelone glabra","Chelone","glabra","9/22/1954",1954,9,22,265,1954265,"flowering","unknown","Y","N"," "," ","","","Kentucky","Woodford","","Swamp of Guyn's Mill.",37.918283,-84.716886,12000,"Y","?","Y","Yes","Flowering","","","couldn't find exact locality","locality","best estimate","JA"
"625",5431872,"MW","EKY","specimen","Chelone glabra","Chelone","glabra","8/17/1975",1975,8,17,229,1975229,"flowering","unknown","Y","N"," "," ","","","Michigan","Cheboygan","","HW 68- at Pigeon River- 16.5 mi E jct 68 and 31 at Alanson roadside.",45.374566,-84.515026,3000,"Y","?","Y","Yes","Flowering","","","","locality","best estimate","JA"
"626",5431873,"MW","EKY","specimen","Chelone glabra","Chelone","glabra","8/4/1998",1998,8,4,216,1998216,"flowering and ???","maybe","Y","maybe"," "," ","recheck phenology: very unsure","","Michigan","Schoolcraft","","Seney National Wildlife Refuge- Tamarack-Alnus Bog- Wildlife Driving Loop mile Post 3.5- about 2.5 mi N of Germfask- MI.",46.274685,-85.951886,3000,"Y","?","Y","Yes","Flowering","","","","locality","best estimate","JA"
"627",5431874,"MW","EKY","specimen","Chelone glabra","Chelone","glabra","9/21/1986",1986,9,21,264,1986264,"flowering","unknown","Y","N"," "," ","","","Tennessee","Cheatham","","Wet ground- spring/creek jct. S of Kingston Springs and just N and parallel with I40.",36.086778,-87.092127,7000,"Y","?","Y","Yes","Flowering","","","location description unclear","locality","best estimate","JA"
"628",5431875,"MW","EKY","specimen","Chelone glabra","Chelone","glabra","7/25/1961",1961,7,25,206,1961206,"flowering","unknown","Y","N"," "," ","","","Virginia","Giles","","Roadside ditch- near Biological Station. Mountain Lake Region.",37.375123,-80.522758,2000,"Y","?","Y","Yes","Flowering","","","","locality","best estimate","JA"
"629",5431877,"MW","EKY","specimen","Chelone glabra","Chelone","glabra","9/9/1980",1980,9,9,253,1980253,"vegetative","N","N","N","Y"," ","","","Kentucky","Grayson","","Bottomland along Rough River along the big slough of 54 & 1623.",37.54217,-86.597806,10000,"Y","?","Y","No","","","","couldn't find exact locality","locality","best estimate","JA"
"630",5431879,"MW","EKY","specimen","Chelone glabra","Chelone","glabra","9/24/1980",1980,9,24,268,1980268,"flowering?","unknown","Y","maybe"," "," ","recheck phenology: unsure","","Kentucky","McLean","","Nall Woods. Bottomland woods near the Green River. 3.5 air km SE of jcts Sr's 81 and 138.",37.505559,-87.229247,1000,"Y","?","Y","Yes","Flowering","","","","locality","best estimate","JA"
"631",5431880,"MW","EKY","specimen","Chelone glabra","Chelone","glabra","7/12/1979",1979,7,12,193,1979193,"flowering","unknown","Y","N"," "," ","","","Kentucky","Powell","","N of the Red River at its junction with Middle Fork along Mountain Parkway.",37.84309,-83.762914,500,"Y","?","Y","Yes","Flowering","","","","locality","best estimate","JA"
"632",5486869,"MW","EKY","specimen","Chelone glabra","Chelone","glabra","9/19/2013",2013,9,19,262,2013262,"flowering","unknown","Y","N"," "," ","","","Kentucky","Powell","","Red River Gorge Martins Fork; Hwy 77- 3 mi from junction Hwy 11",37.817188,-83.666295,300,"Y","?","Y","Yes","Flowering","","","","locality","best estimate","JA"
"633",13205417,"MW","EKY","specimen","Chelone glabra","Chelone","glabra","9/16/1988",1988,9,16,260,1988260,"flowering","unknown","Y","N"," "," ","","","Kentucky","Powell","","Red River Gorge, Low ground along creek branch below Ky. highway 77, ca. 0.35 mile east of east end of Nada Tunnel.",37.816399,-83.673362,300,"Y","?","Y","Yes","Flowering","","","","locality","best estimate","JA"
"634",7458536,"MW","EMC","specimen","Chelone glabra","Chelone","glabra","9/9/1979",1979,9,9,252,1979252,"flowering","unknown","Y","N"," "," ","","","Michigan","Washtenaw","Ypsilanti","Ypsilanti, Burlingame Farms East. T2S R6E sec. 12",42.324562,-83.672498,1200,"Y","?","Y","Yes","Flowering","","","","PLSS","best estimate","JA"
"635",7458537,"MW","EMC","specimen","Chelone glabra","Chelone","glabra","8/23/1971",1971,8,23,235,1971235,"flowering","unknown","Y","N"," "," ","","","Michigan","Wayne","Plymouth","Plymouth, Near creek behind 14100 Beck Rd. (Allen's), between N. Territorial Rd. & C & O R.R. T1S R8E sec. 21 SW 1/4",42.382913,-83.506509,500,"Y","?","Y","Yes","Flowering","","","","locality","best estimate","JA"
"636",7458538,"MW","EMC","specimen","Chelone glabra","Chelone","glabra","8/8/1971",1971,8,8,220,1971220,"flowering","unknown","Y","N"," "," ","","","Michigan","Washtenaw","Ypsilanti","Ypsilanti, Behind Highland Cemetery  T3S R7E sec. 4 N 1/2",42.256784,-83.612803,600,"Y","?","Y","Yes","Flowering","","","","PLSS/locality","best estimate","JA"
"637",7458539,"MW","EMC","specimen","Chelone glabra","Chelone","glabra","8/22/1986",1986,8,22,234,1986234,"flowering and fruit","unknown","Y","Y"," "," ","","","Michigan","Lapeer","Mayfield","Mayfield, Access road to Sawdel Lake, .5 miles south of junction with Norway Lk. Rd.",43.138825,-83.342443,NA,"Y","?","Y","Yes","Both","","","couldn't find exact locality","locality","","JA"
"638",7458540,"MW","EMC","specimen","Chelone glabra","Chelone","glabra","8/27/1980",1980,8,27,240,1980240,"flowering","unknown","Y","N"," "," ","","","Michigan","Lapeer","Mayfield","Mayfield, Kresge Environmental Education Center, S. side of Vernor Rd. between Reed & Roods Lake Rds.T8N R10E sec. 15",43.108227,-83.274286,700,"Y","?","Y","Yes","Flowering","","","","PLSS/locality","best estimate","JA"
"639",7458541,"MW","EMC","specimen","Chelone glabra","Chelone","glabra","8/18/1976",1976,8,18,231,1976231,"flowering and fruit","unknown","Y","Y"," "," ","","same day/place, same phenology","Michigan","Ontonagon","","Road to farm, about 3/8 mi. SE of Mass, greenland twp;T50N R38W sec. 5 NE 1/4",NA,NA,NA,"Y","Y","Y","Yes","Both","","","","","","JA"
"640",7458542,"MW","EMC","specimen","Chelone glabra","Chelone","glabra","8/18/1976",1976,8,18,231,1976231,"flowering and fruit","unknown","Y","Y"," "," ","","same day/place, same phenology","Michigan","Ontonagon","Greenland","Greenland, Road to farm, about 3/8 mi. SE of Mass T50N R38W sec. 5 NE 1/4",46.762405,-89.078844,600,"Y","?","Y","Yes","Both","","","","PLSS","best estimate","JA"
"641",7458543,"MW","EMC","specimen","Chelone glabra","Chelone","glabra","9/21/1977",1977,9,21,264,1977264,"flowering","unknown","Y","N"," "," ","","","Michigan","Jackson","","Trist Creek, S.W. corner of Trist and Seymour Rds. T1S R2E sec. 34",42.336856,-84.17626,300,"Y","?","Y","Yes","Flowering","","","","PLSS/locality","best estimate","JA"
"642",8505980,"MW","EMC","specimen","Chelone glabra","Chelone","glabra","8/26/1976",1976,8,26,239,1976239,"flowering and fruit??","unknown","Y","Y"," "," ","recheck phenology: very unsure","","Michigan","Lapeer","Mayfield","S. side of Vernor Rd. between Reed and Roods Lake Rds.;;TRS: T8N R10E sec 15",43.110204,-83.272225,969,"Y","?","Y","Yes","Both","","","","locality","geolocate","JA"
"643",4440102,"MW","F","specimen","Chelone glabra","Chelone","glabra","9/14/1897",1897,9,14,257,1897257,"flowering","unknown","Y","N"," "," ","","","Indiana","Lake","Clarke [Gary]","",41.59337,-87.346427,11196,"Y","Y","Y","Yes","Flowering","","","lat lon copied from messed up list ","town","geolocate","JA"
"644",4440103,"MW","F","specimen","Chelone glabra","Chelone","glabra","9/7/1899",1899,9,7,250,1899250,"flowering","unknown","Y","N"," "," ","","","Indiana","Lake","","deep woods near hammond ind",41.583369,-87.500041,10572,"Y","Y","Y","Yes","Flowering","","","lat lon copied from messed up list, got more detailed location from picture","town","geolocate","JA"
"645",4440104,"MW","F","specimen","Chelone glabra","Chelone","glabra","9/3/1911",1911,9,3,246,1911246,"flowering","unknown","Y","N"," "," ","","","Indiana","Porter","Dune Acres","Mineral Springs",41.649482,-87.085867,3000,"Y","Y","Y","Yes","Flowering","","","lat lon copied from messed up list ","locality","best estimate","JA"
"646",4440105,"MW","F","specimen","Chelone glabra","Chelone","glabra","9/5/1902",1902,9,5,248,1902248,"flowering","unknown","Y","N"," "," ","","","Indiana","","","near lake, indiana. Plants of the lake chicago basin",NA,NA,NA,"Y","Y","Y","Yes","Flowering","","","not sure which place called lake","","","JA"
"647",4440106,"MW","F","specimen","Chelone glabra","Chelone","glabra","9/5/1903",1903,9,5,248,1903248,"flowering","unknown","Y","N"," "," ","","","Indiana","Porter","","bottom land of calumet river",41.622451,-87.076866,13000,"Y","Y","Y","Yes","Flowering","","","got more detailed location from picture","locality","best estimate","JA"
"648",4440107,"MW","F","specimen","Chelone glabra","Chelone","glabra","9/22/1951",1951,9,22,265,1951265,"flowering","unknown","Y","N"," "," ","","","Indiana","LaPorte","","Smith Station. Along trail creek west of hansen road about one mile north of us 20 west of springville",41.703116,-86.763516,2000,"Y","Y","Y","Yes","Flowering","","","couldn't find exact locality","locality","best estimate","JA"
"649",4440108,"MW","F","specimen","Chelone glabra","Chelone","glabra","9/15/1936",1936,9,15,259,1936259,"flowering and ?","maybe","Y","maybe"," "," ","recheck phenology: unsure","","Indiana","LaPorte","","Smith Station. Swamp 1 mile NE of springville",41.695565,-86.722972,4807,"Y","Y","Y","Yes","Flowering","","","got more detailed location from picture","town+direction+distance","geolocate","JA"
"650",4440109,"MW","F","specimen","Chelone glabra","Chelone","glabra","9/15/1964",1964,9,15,259,1964259,"flowering","unknown","Y","N"," "," ","","","Wisconsin","Kenosha","","w of carol beach",42.584742,-87.821185,NA,"Y","Y","Y","Yes","Flowering","","","got more detailed location from picture,  lat lon copied from messed up list ","provided","","JA"
"651",4440110,"MW","F","specimen","Chelone glabra","Chelone","glabra","8/17/1941",1941,8,17,229,1941229,"flowering","unknown","Y","N"," "," ","","","Illinois","Cook","","Palos Park. Below pond north of willow springs picnic grove",41.721538,-87.864396,8000,"Y","Y","Y","Yes","Flowering","","","","locality","best estimate","JA"
"652",4440111,"MW","F","specimen","Chelone glabra","Chelone","glabra","9/12/1882",1882,9,12,255,1882255,"flowering","unknown","Y","N"," "," ","","","Illinois","","","north branch",NA,NA,NA,"Y","Y","Y","Yes","Flowering","","","not specific enough","","","JA"
"653",4440112,"MW","F","specimen","Chelone glabra","Chelone","glabra","9/6/1930",1930,9,6,249,1930249,"flowering","unknown","Y","N"," "," ","","","Illinois","Lake","","Beach",42.418633,-87.819794,NA,"Y","Y","Y","Yes","Flowering","","","","provided","","JA"
"654",4440113,"MW","F","specimen","Chelone glabra","Chelone","glabra","9/26/1909",1909,9,26,269,1909269,"flowering and fruit","unknown","Y","Y"," "," ","","","Illinois","DuPage","","Hinsdale",41.800864,-87.937005,4462,"Y","Y","Y","Yes","Both","","","","town","geolocate","JA"
"655",4440115,"MW","F","specimen","Chelone glabra","Chelone","glabra","9/16/1914",1914,9,16,259,1914259,"flowering","unknown","Y","N"," "," ","","","Illinois","Lake","","Waukegan",42.363633,-87.844794,9481,"Y","Y","Y","Yes","Flowering","","","","town","geolocate","JA"
"656",4440116,"MW","F","specimen","Chelone glabra","Chelone","glabra","8/30/1944",1944,8,30,243,1944243,"flowering and fruit???","unknown","Y","Y"," "," ","recheck phenology: very unsure","","Illinois","McHenry","","Fox River Grove",42.200858,-88.214526,NA,"Y","Y","Y","Yes","Both","","","","provided","","JA"
"657",4440117,"MW","F","specimen","Chelone glabra","Chelone","glabra","9/4/1909",1909,9,4,247,1909247,"flowering","unknown","Y","N"," "," ","","same day/place, different phenology?","Illinois","Lake","","Camp Logan",42.464188,-87.817017,NA,"Y","Y","Y","Yes","Flowering","","","","locality","","JA"
"658",4440118,"MW","F","specimen","Chelone glabra","Chelone","glabra","9/4/1909",1909,9,4,247,1909247,"fruit???","unknown","N","Y"," "," ","recheck phenology: very unsure","same day/place, different phenology?","Illinois","Lake","","Camp Logan",NA,NA,NA,"Y","Y","Y","Yes","Fruiting","","","","","","JA"
"659",4440119,"MW","F","specimen","Chelone glabra","Chelone","glabra","9/1/1917",1917,9,1,244,1917244,"flowering","unknown","Y","N"," "," ","","","Illinois","Cook","","west lowland, lord's park .vicinity of elgin",42.041908,-88.262494,600,"Y","Y","Y","Yes","Flowering","","","","locality","best estimate","JA"
"660",4440120,"MW","F","specimen","Chelone glabra","Chelone","glabra","9/15/1892",1892,9,15,259,1892259,"flowering","unknown","Y","N"," "," ","","","Illinois","Cook","Chicago","Chicago. Wolf lake",41.665793,-87.527503,2000,"Y","Y","Y","Yes","Flowering","","","","locality","best estimate","JA"
"661",4440121,"MW","F","specimen","Chelone glabra","Chelone","glabra","9/8/1928",1928,9,8,252,1928252,"flowering","unknown","Y","N"," "," ","","","Illinois","Cook","Chicago","Chicago. Sauganash",41.990032,-87.742282,3036,"Y","Y","Y","Yes","Flowering","","","","town","geolocate","JA"
"662",4440122,"MW","F","specimen","Chelone glabra","Chelone","glabra","8/31/1878",1878,8,31,243,1878243,"flowering","unknown","Y","N"," "," ","","","Illinois","Cook","Chicago","rose hill, Chicago",41.850033,-87.650052,31817,"Y","Y","Y","Yes","Flowering","",""," couldn't find locality, used town","town","geolocate","JA"
"663",4440123,"MW","F","specimen","Chelone glabra","Chelone","glabra","9/11/1948",1948,9,11,255,1948255,"flowering","unknown","Y","N"," "," ","","","Illinois","Lake","","margin of tamarack swamp, just south of wauconda and east of highway 12",42.2539,-88.1302,2000,"Y","Y","Y","Yes","Flowering","","","","locality","best estimate","JA"
"664",4440124,"MW","F","specimen","Chelone glabra","Chelone","glabra","8/28/1949",1949,8,28,240,1949240,"flowering","unknown","Y","N"," "," ","","","Illinois","Lake","","meadow bordering north end of tamarack swamp on south side of wauconda, east of highway 12",42.2539,-88.1302,2000,"Y","Y","Y","Yes","Flowering","","","","locality","best estimate","JA"
"665",4440125,"MW","F","specimen","Chelone glabra","Chelone","glabra","8/21/1979",1979,8,21,233,1979233,"flowering","unknown","Y","N"," "," ","","","Illinois","DuPage","","blackwell forest preserve at du page river and mack road",41.843173,-88.19781,1400,"Y","Y","Y","Yes","Flowering","","","","locality","best estimate","JA"
"666",4440126,"MW","F","specimen","Chelone glabra","Chelone","glabra","9/13/1913",1913,9,13,256,1913256,"flowering","unknown","Y","N"," "," ","","","Illinois","Kankakee","","river bank near cook's cottage. 3 mi above kkk",41.137705,-87.861798,41645,"Y","Y","Y","Yes","Flowering","","","couldn't find locality, KKK is probably abbreviation for Kankakee river, used county","county","geolocate","JA"
"667",4440129,"MW","F","specimen","Chelone glabra","Chelone","glabra","8/25/1905",1905,8,25,237,1905237,"flowering","unknown","Y","N"," "," ","","","Illinois","Cook","Niles","",42.0167,-87.8,NA,"Y","Y","Y","Yes","Flowering","","","","provided","","JA"
"668",4440130,"MW","F","specimen","Chelone glabra","Chelone","glabra","9/10/1918",1918,9,10,253,1918253,"flowering","unknown","Y","N"," "," ","","","Illinois","Cook","Glenwood","",41.542535,-87.602266,3637,"Y","Y","Y","Yes","Flowering","","","","town","geolocate","JA"
"669",4440131,"MW","F","specimen","Chelone glabra","Chelone","glabra","9/18/1915",1915,9,18,261,1915261,"flowering","unknown","Y","N"," "," ","","","Illinois","McHenry","","Cary",42.2,-88.2333,NA,"Y","Y","Y","Yes","Flowering","","","","provided","","JA"
"670",4464528,"MW","F","specimen","Chelone glabra","Chelone","glabra","9/4/1927",1927,9,4,247,1927247,"flowering","unknown","Y","N"," "," ","","same day/place, different phenology","Indiana","Spencer","","springhead in woods, 2 mi NE of grandview",37.954165,-86.955108,3794,"Y","Y","Y","Yes","Flowering","","","","town+direction+distance","geolocate","JA"
"671",8153526,"MW","F","specimen","Chelone glabra","Chelone","glabra","8/21/1919",1919,8,21,233,1919233,"flowering","unknown","Y","N"," "," ","","","New York","Ulster","Shandaken","ngt? Fields",42.12009,-74.395427,3036,"Y","Y","Y","Yes","Flowering","","","","town","geolocate","JA"
"672",15328973,"MW","FLAS","specimen","Chelone glabra","Chelone","glabra","9/19/1927",1927,9,19,262,1927262,"flowering","unknown","Y","N"," "," ","","same day/place, some have different phenology","North Carolina","Yancey","","near cane river, 3 miles west of burnsville",35.915475,-82.352754,5936,"Y","Y","Y","Yes","Flowering","","","","town+direction+distance+locality","geolocate","JA"
"673",15328974,"MW","FLAS","specimen","Chelone glabra","Chelone","glabra","9/19/1927",1927,9,19,262,1927262,"flowering","unknown","Y","N"," "," ","","same day/place, some have different phenology","North Carolina","yancey","","near cane river, 3 miles west of burnsville",NA,NA,NA,"Y","Y","Y","Yes","Flowering","","","","","","JA"
"674",15328982,"MW","FLAS","specimen","Chelone glabra","Chelone","glabra","11/18/1928",1928,11,18,323,1928323,"vegetative","N","N","N","Y"," ","","","Virginia","Fauquier","","mountain brook in woods 5 mi nw of Hitch",38.89204,-78.139971,5000,"Y","Y","Y","No","","","","","locality","best estimate","JA"
"675",15328983,"MW","FLAS","specimen","Chelone glabra","Chelone","glabra","9/15/1927",1927,9,15,258,1927258,"flowering","unknown","Y","N"," "," ","","","Georgia","Rabun","","along stream in woods near blalock",34.893149,-83.513496,5000,"Y","Y","Y","Yes","Flowering","","","","town","geolocate","JA"
"676",15328985,"MW","FLAS","specimen","Chelone glabra","Chelone","glabra","8/26/1927",1927,8,26,238,1927238,"flowering","unknown","Y","N"," "," ","","same day/close together, same phenology","West Virginia","Randolph","","along blister run, E of cheat bridge",38.610587,-79.865141,1200,"Y","Y","Y","Yes","Flowering","","","","locality","best estimate","JA"
"677",15328986,"MW","FLAS","specimen","Chelone glabra","Chelone","glabra","9/15/1927",1927,9,15,258,1927258,"flowering","unknown","Y","N"," "," ","","","Georgia","Towns","","5 mi  W of Hiawassee",34.949227,-83.845885,8207,"Y","Y","Y","Yes","Flowering","","","hard to tell if label says 5 mi W or 5 mi N, used W because 5 mi N is in different state","town+direction+distance","geolocate","JA"
"678",15330423,"MW","FLAS","specimen","Chelone glabra","Chelone","glabra","9/15/1927",1927,9,15,258,1927258,"flowering and ?","maybe","Y","maybe"," "," ","recheck phenology: unsure","","Virginia","Lynchburg (City)","Lynchburg","",37.413754,-79.142246,3036,"Y","Y","Y","Yes","Flowering","","","","town","geolocate","JA"
"679",15334636,"MW","FLAS","specimen","Chelone glabra","Chelone","glabra","8/16/1964",1964,8,16,229,1964229,"flowering","unknown","Y","N"," "," ","","same day/place, some have different phenology","West Virginia","Preston","","cranesville bog, near cranesville",39.553143,-79.494767,NA,"Y","Y","Y","Yes","Flowering","","","","provided","","JA"
"680",15337623,"MW","FLAS","specimen","Chelone glabra","Chelone","glabra","9/13/1978",1978,9,13,256,1978256,"flowering","unknown","Y","N"," "," ","","same day/place, same phenology?","Georgia","Union","","Hogpen gap, just N of summit of gap",34.728729,-83.838665,1000,"Y","Y","Y","Yes","Flowering","","","","locality","best estimate","JA"
"681",15337940,"MW","FLAS","specimen","Chelone glabra","Chelone","glabra","9/9/1975",1975,9,9,252,1975252,"flowering and fruit?","unknown","Y","Y"," "," ","recheck phenology: unsure","same day/place, different phenology?","Virginia","Gloucester","","along beaverdam swamp stream at rt 606 crossing, gauging station on abandoned portion of old road. F-6",37.471151,-76.564158,3000,"Y","Y","Y","Yes","Both","","","","locality","best estimate","JA"
"682",15339738,"MW","FLAS","specimen","Chelone glabra","Chelone","glabra","9/19/1987",1987,9,19,262,1987262,"flowering ","unknown","Y","N"," "," ","","","Virginia","Rappahannock","","along the Rappahannock River at Zeke's Country, accessible from rt. 643, W of Amissville",38.705423,-77.983531,900,"Y","Y","Y","Yes","Flowering","","","","locality","best estimate","JA"
"683",16074101,"MW","FLAS","specimen","Chelone glabra","Chelone","glabra","9/10/2012",2012,9,10,254,2012254,"flowering","unknown","Y","N"," "," ","","","New York","Erie","Newstead","Counterfeiters Lodge Nature Conservancy Preserve; east of Scotland Rd, below Onondaga Escarpment. Seepage area in abandoned field.",43.014607,-78.482171,5000,"N",NA,"Y","Yes","Flowering","",""," couldn’t find counterfeiters lodge, found location from other description info","locality","best estimate","JA"
"684",14216801,"MW","FMUH","specimen","Chelone glabra","Chelone","glabra","9/29/1982",1982,9,29,272,1982272,"fruit?","unknown","N","Y"," "," ","recheck phenology: unsure","same day/place, different phenology","South Carolina","Florence","","between ingram lumber yard and evergreen",34.080598,-79.660072,2200,"Y","Y","Y","Yes","Fruiting","","","","locality","best estimate","JA"
"685",14216802,"MW","FMUH","specimen","Chelone glabra","Chelone","glabra","9/29/1982",1982,9,29,272,1982272,"flowering ","unknown","Y","N"," "," ","","same day/place, different phenology","South Carolina","Florence","","willow creek. bridge rd 327. E. Evergreen, Flo Co",34.079029,-79.642822,200,"Y","Y","Y","Yes","Flowering","","","","locality","best estimate","JA"
"686",14216803,"MW","FMUH","specimen","Chelone glabra","Chelone","glabra","10/4/1984",1984,10,4,278,1984278,"flowering ","unknown","Y","N"," "," ","","","South Carolina","Florence","Darlington","williamson park",34.311855,-79.866445,600,"Y","Y","Y","Yes","Flowering","","","","locality","best estimate","JA"
"687",14286546,"MW","FMUH","specimen","Chelone glabra","Chelone","glabra","9/30/1982",1982,9,30,273,1982273,"flowering and fruit","unknown","Y","Y"," "," ","","","South Carolina","Florence","","E. of Evergreen, branch willow creek, rd 327 E of lumber mill",34.091224,-79.63187,1300,"Y","Y","Y","Yes","Both","","","","locality","best estimate","JA"
"688",14286665,"MW","FMUH","specimen","Chelone glabra","Chelone","glabra","9/20/1973",1973,9,20,263,1973263,"flowering","unknown","Y","N"," "," ","","same day/place, same phenology","South Carolina","Florence","","howe spring road (near RR)",34.134392,-79.758949,300,"Y","Y","Y","Yes","Flowering","","","","locality","best estimate","JA"
"689",14286666,"MW","FMUH","specimen","Chelone glabra","Chelone","glabra","9/20/1973",1973,9,20,263,1973263,"flowering","unknown","Y","N"," "," ","","same day/place, same phenology","South Carolina","Florence","","howe spring road (near RR)",NA,NA,NA,"Y","Y","Y","Yes","Flowering","","","","","","JA"
"690",14630471,"MW","FMUH","specimen","Chelone glabra","Chelone","glabra","11/6/1989",1989,11,6,310,1989310,"fruit","N","N","Y"," "," ","","","South Carolina","Darlington","","McCall tract between byrd's island and the great pee dee river. great pee dee river hertiage preserve. NE of mechanicsville. West of gate",34.377257,-79.687642,600,"Y","Y","Y","Yes","Fruiting","","","","locality","best estimate","JA"
"691",14632079,"MW","FMUH","specimen","Chelone glabra","Chelone","glabra","7/31/2004",2004,7,31,213,2004213,"flowering ","unknown","Y","N"," "," ","","","Maine","Franklin","Carrabassett Valley","RR trail. 44?05'33""N, 70?15'13""W",45.091638,-70.272187,2500,"Y","Y","Y","Yes","Flowering","","","","locality","best estimate","JA"
"692",14634276,"MW","FMUH","specimen","Chelone glabra","Chelone","glabra","10/14/1993",1993,10,14,287,1993287,"flowering and fruit???","unknown","Y","Y"," "," ","recheck phenology: very unsure","","South Carolina","Darlington","","McCall tract between byrd's island and the great pee dee river. great pee dee river hertiage preserve. NE of mechanicsville. West of gate",34.377257,-79.687642,600,"Y","Y","Y","Yes","Both","","","","locality","best estimate","JA"
"693",16480633,"MW","FSU","specimen","Chelone glabra","Chelone","glabra","8/31/1965",1965,8,31,243,1965243,"flowering ","unknown","Y","N"," "," ","","","New Brunswick","Saint John","","along stream near beach at New River Beach",45.13738,-66.530835,800,"Y","Y","Y","Yes","Flowering","","","","locality","best estimate","JA"
"694",16480634,"MW","FSU","specimen","Chelone glabra","Chelone","glabra","9/22/1969",1969,9,22,265,1969265,"flowering and fruit","unknown","Y","Y"," "," ","","couldn't find record online when I went back to check it. same day/place, same phenology","Tennessee","Lewis","","Tenn 99, 3 mi (looks like superimposed s and n?). w. Hampshire",35.596195,-87.293062,8000,"Y","Y","Y","Yes","Both","","","description doesn't make sense, used coordinates for hampshire town","town?","best estimate","JA"
"695",16480672,"MW","FSU","specimen","Chelone glabra","Chelone","glabra","8/29/1951",1951,8,29,241,1951241,"flowering","unknown","Y","N"," "," ","","","North Carolina","Jackson-Haywood","","summit of Richland Balsam mt",35.416676,-83.004711,3000,"Y","Y","Y","Yes","Flowering","","","","locality","best estimate","JA"
"696",16480676,"MW","FSU","specimen","Chelone glabra","Chelone","glabra","9/28/1958",1958,9,28,271,1958271,"flowering and fruit","unknown","Y","Y"," "," ","","same day/place, different phenology","North Carolina","Ashe","","foot of mount jefferson, 1 mile sw of west jefferson",36.39923,-81.471984,4000,"Y","Y","Y","Yes","Both","","","","locality","best estimate","JA"
"697",16480677,"MW","FSU","specimen","Chelone glabra","Chelone","glabra","9/20/1959",1959,9,20,263,1959263,"flowering and fruit","unknown","Y","Y"," "," ","","","West Virginia","Upshur","French Creek","wet ground by run, near french creek",38.884283,-80.29707,2000,"Y","Y","Y","Yes","Both","","","","locality","best estimate","JA"
"698",16480679,"MW","FSU","specimen","Chelone glabra","Chelone","glabra","8/16/1964",1964,8,16,229,1964229,"flowering","unknown","Y","N"," "," ","","same day/place, some have different phenology","West Virginia","Preston","","cranesville bog, near cranesville",NA,NA,NA,"Y","Y","Y","Yes","Flowering","","","","","","JA"
"699",16480680,"MW","FSU","specimen","Chelone glabra","Chelone","glabra","9/17/1970",1970,9,17,260,1970260,"flowering and fruit?","unknown","Y","Y"," "," ","recheck phenology: unsure","same day/place, some have different phenology","Tennessee","Polk","McFarland","along Hiwassee river at Mcfarlands below cherokee national forest rd 23 east of Reliance about 9 miles",35.172299,-84.394925,3036,"Y","Y","Y","Yes","Both","","","","town","geolocate","JA"
"700",16480683,"MW","FSU","specimen","Chelone glabra","Chelone","glabra","8/26/1930",1930,8,26,238,1930238,"flowering","unknown","Y","N"," "," ","","","Utah","","Halifax","swamp near an old abandoned road-green river to Halifax",NA,NA,NA,"Y","Y","N","Yes","Flowering","","","not in BCB range","","","JA"
"701",16480685,"MW","FSU","specimen","Chelone glabra","Chelone","glabra","8/31/1960",1960,8,31,244,1960244,"flowering","unknown","Y","N"," "," ","","","Michigan","Oceana","","in low wet soil along Stony Creek at Camp Miniwanca on the east side of Lake Michigan",43.55828,-86.501092,500,"Y","Y","Y","Yes","Flowering","","","","locality","best estimate","JA"
"702",16480687,"MW","FSU","specimen","Chelone glabra","Chelone","glabra","9/23/1950",1950,9,23,266,1950266,"fruit","N","N","Y"," "," ","","","New York","Yates","","abandoned road in Potter swamp",42.723361,-77.166922,5000,"Y","Y","Y","Yes","Fruiting","","","","locality","best estimate","JA"
"703",16480692,"MW","FSU","specimen","Chelone glabra","Chelone","glabra","9/16/1958",1958,9,16,259,1958259,"flowering","unknown","Y","N"," "," ","","","Indiana","Huntington","","along wabash river, south of huntington",40.854235,-85.503909,4000,"Y","Y","Y","Yes","Flowering","","","","locality","best estimate","JA"
"704",16480694,"MW","FSU","specimen","Chelone glabra","Chelone","glabra","9/5/1961",1961,9,5,248,1961248,"flowering","unknown","Y","N"," "," ","","","Virginia","Giles","","Vicinity of Interior, marshy area",37.413735,-80.587843,3036,"Y","Y","Y","Yes","Flowering","","","","town","geolocate","JA"
"705",16480695,"MW","FSU","specimen","Chelone glabra","Chelone","glabra","9/20/1936",1936,9,20,264,1936264,"flowering and fruit","unknown","Y","Y"," "," ","","same day/place, different phenology","West Virginia","Cabell","","rickett's place",38.401988,-82.408717,NA,"Y","Y","Y","Yes","Both","","","","locality","","JA"
"706",16480696,"MW","FSU","specimen","Chelone glabra","Chelone","glabra","9/22/1957",1957,9,22,265,1957265,"flowering and fruit","unknown","Y","Y"," "," ","","same day/place, different phenology","Tennessee","Fentress","","Glade Branch, about 2 m. E. of clarkrange on a county road off Tenn. Rte 28",36.18371,-84.979489,6033,"Y","Y","Y","Yes","Both","","","","town+direction+distance+locality","geolocate","JA"
"707",16480699,"MW","FSU","specimen","Chelone glabra","Chelone","glabra","9/6/1952",1952,9,6,250,1952250,"flowering","unknown","Y","N"," "," ","","","Pennsylvania","Centre","","stream bank along roadise, 3 mi NE of Coburn",40.893858,-77.423787,5342,"Y","Y","Y","Yes","Flowering","","","","town+direction+distance","geolocate","JA"
"708",9417771,"MW","FUGR","specimen","Chelone glabra","Chelone","glabra","8/16/1964",1964,8,16,229,1964229,"flowering","unknown","Y","N"," "," ","","same day/place, some have different phenology","West Virginia","Preston","","cranesville bog, near cranesville",NA,NA,NA,"Y","Y","Y","Yes","Flowering","","","","","","JA"
"709",9417781,"MW","FUGR","specimen","Chelone glabra","Chelone","glabra","9/28/1971",1971,9,28,271,1971271,"flowering","unknown","Y","N"," "," ","","same day/place, some have different phenology","Virginia","Charles City","","ditch between woods and NE-most two fish ponds, harrison lake national fish hatchery about 8 miles w of charles city via VA rt 5",37.336239,-77.186569,500,"Y","Y","Y","Yes","Flowering","","","","locality","best estimate","JA"
"710",9417946,"MW","FUGR","specimen","Chelone glabra","Chelone","glabra","9/20/1968",1968,9,20,264,1968264,"flowering","unknown","Y","N"," "," ","","same day/place, some have different phenology","North Carolina","Watauga","","along CO. Rt. 1102, on Rich Mt., 3.4 mi west of howard's knob",36.23758,-81.7077,NA,"Y","Y","Y","Yes","Flowering","","","","provided","","JA"
"711",9417956,"MW","FUGR","specimen","Chelone glabra","Chelone","glabra","10/2/1970",1970,10,2,275,1970275,"flowering","unknown","Y","N"," "," ","","","South Carolina","Pickens","","by small stream on old highway 11 about 3/4 mile west of highway 178",34.984945,-82.766882,700,"Y","Y","Y","Yes","Flowering","","","","locality","best estimate","JA"
"712",9417969,"MW","FUGR","specimen","Chelone glabra","Chelone","glabra","9/21/1962",1962,9,21,264,1962264,"flowering","unknown","Y","N"," "," ","","same day/place, same phenology","North Carolina","Transylvania","","seeps at revis ridge",NA,NA,NA,"Y","Y","Y","Yes","Flowering","","","","","","JA"
"713",9417977,"MW","FUGR","specimen","Chelone glabra","Chelone","glabra","8/23/1928",1928,8,23,236,1928236,"flowering and fruit","unknown","Y","Y"," "," ","","","North Carolina","Transylvania","","YWCA camp, burgiss glen",35.135711,-82.630465,500,"Y","Y","Y","Yes","Both","","","","locality","best estimate","JA"
"714",9417985,"MW","FUGR","specimen","Chelone glabra","Chelone","glabra","7/29/1976",1976,7,29,211,1976211,"flowering","unknown","Y","N"," "," ","","","North Carolina","Haywood","","edge of woods, 3 miles north on 215 from blue ridge parkway",35.333243,-82.908468,900,"Y","Y","Y","Yes","Flowering","","","","locality","best estimate","JA"
"715",9460858,"MW","GA","specimen","Chelone glabra","Chelone","glabra","9/19/1946",1946,9,19,262,1946262,"flowering and fruit","unknown","Y","Y"," "," ","","","Georgia","Murray","","along small creek just se of lake conasauga",34.858253,-84.650557,300,"Y","Y","Y","Yes","Both","","","","locality","best estimate","JA"
"716",9460995,"MW","GA","specimen","Chelone glabra","Chelone","glabra","9/22/1963",1963,9,22,265,1963265,"flowering and fruit?","unknown","Y","Y"," "," ","recheck phenology: unsure","","Georgia","Union","",".3 miles e to se of wolfpen gap, n of slaughter mountain",34.761993,-83.947225,800,"Y","Y","Y","Yes","Both","","","","locality","best estimate","JA"
"717",9461829,"MW","GA","specimen","Chelone glabra","Chelone","glabra","9/30/1962",1962,9,30,273,1962273,"flowering and ?","maybe","Y","maybe"," "," ","recheck phenology: unsure","","Georgia","Banks","","along broad river, n tip of county",34.458951,-83.479954,9000,"Y","Y","Y","Yes","Flowering","","","","locality","best estimate","JA"
"718",9463502,"MW","GA","specimen","Chelone glabra","Chelone","glabra","9/25/1955",1955,9,25,268,1955268,"flowering","unknown","Y","N"," "," ","","","Georgia","Hall","","above waterfall 3.7 miles W22?s of flowery branch",34.223051,-83.971066,5000,"Y","Y","Y","Yes","Flowering","","","double check direction notation system","town+direction+distance","best estimate","JA"
"719",9464761,"MW","GA","specimen","Chelone glabra","Chelone","glabra","9/30/2001",2001,9,30,273,2001273,"flowering","unknown","Y","N"," "," ","","","Georgia","Dawson","","dawson forest wildlife management area, from eagle ridge road 1.1 miles w of fausett lake on state hwy 136",34.526309,-84.299462,11000,"Y","Y","Y","Yes","Flowering","","","","locality","best estimate","JA"
"720",9465338,"MW","GA","specimen","Chelone glabra","Chelone","glabra","9/24/1977",1977,9,24,267,1977267,"flowering","unknown","Y","N"," "," ","","","Georgia","Murray","","8 mi e of chatsworth. Fort mountain state park, cohutta mountain",34.740658,-84.660809,10000,"Y","Y","Y","Yes","Flowering","","","","locality","best estimate","JA"
"721",9467298,"MW","GA","specimen","Chelone glabra","Chelone","glabra","10/1/1981",1981,10,1,274,1981274,"flowering and fruit","unknown","Y","Y"," "," ","","same day/place, different phenology","Georgia","Gilmer","","rich mountain Wildlife Management Area. near Stanley Gap. Cold mountain",NA,NA,NA,"Y","Y","Y","Yes","Both","","","","","","JA"
"722",9468764,"MW","GA","specimen","Chelone glabra","Chelone","glabra","10/11/1971",1971,10,11,284,1971284,"flowering","unknown","Y","N"," "," ","","same day/place, different phenology?","Georgia","Greene","","se of oconee river along hwy 15 between watkinsville and greensboro",33.722204,-83.294677,1500,"Y","Y","Y","Yes","Flowering","","","","locality","best estimate","JA"
"723",9469569,"MW","GA","specimen","Chelone glabra","Chelone","glabra","10/28/1951",1951,10,28,301,1951301,"flowering","unknown","Y","N"," "," ","","","Georgia","Walton","","along creek bank 1.5 miles e of Between",33.817609,-83.781205,2797,"Y","Y","Y","Yes","Flowering","","","","town+direction+distance","geolocate","JA"
"724",9471385,"MW","GA","specimen","Chelone glabra","Chelone","glabra","9/4/1946",1946,9,4,247,1946247,"flowering","unknown","Y","N"," "," ","","same day/place, same phenology","Georgia","Rabun","","at edge of ga-nc state line n1?e of tower on rabun bald",34.994627,-83.295211,3300,"Y","Y","Y","Yes","Flowering","","","double check direction notation system","locality","best estimate","JA"
"725",9472487,"MW","GA","specimen","Chelone glabra","Chelone","glabra","11/8/1983",1983,11,8,312,1983312,"fruit","N","N","Y"," "," ","","","Georgia","Walton","","between loganville and walnut grove. About .75 mi n of junction of center hill church road and kent rock road. ""rock of ages"" huge flatrock on both sides of  rocky branch",NA,NA,NA,"Y","Y","Y","Yes","Fruiting","","","","","","JA"
"726",9474057,"MW","GA","specimen","Chelone glabra","Chelone","glabra","9/28/1941",1941,9,28,271,1941271,"fruit?","unknown","N","Y"," "," ","recheck phenology: unsure","same day/close together, different phenology?","Georgia","Dawson","","amicola falls, above new dam (lake incomplete)",NA,NA,NA,"Y","Y","Y","Yes","Fruiting","","","","","","JA"
"727",9476215,"MW","GA","specimen","Chelone glabra","Chelone","glabra","9/20/1992",1992,9,20,264,1992264,"flowering","unknown","Y","N"," "," ","","","Georgia","Greene","","lake oconee and highway 12 on apalachee river",33.599227,-83.303943,4700,"Y","Y","Y","Yes","Flowering","","","","locality","best estimate","JA"
"728",9477059,"MW","GA","specimen","Chelone glabra","Chelone","glabra","9/29/1951",1951,9,29,272,1951272,"flowering","unknown","Y","N"," "," ","","","Georgia","Catoosa ","","at edge of yates spring, 6.2 miles south 25? west of ringgold",34.832271,-85.152953,5000,"Y","Y","Y","Yes","Flowering","","","double check direction notation system","locality","best estimate","JA"
"729",9478360,"MW","GA","specimen","Chelone glabra","Chelone","glabra","10/2/1955",1955,10,2,275,1955275,"flowering and fruit???","unknown","Y","Y"," "," ","recheck phenology: very unsure","","Georgia","Dawson","","ravine w of chestatee river about .7 mi s of lumpkin co line",34.367893,-83.994767,5000,"Y","Y","Y","Yes","Both","","","","locality","best estimate","JA"
"730",9479494,"MW","GA","specimen","Chelone glabra","Chelone","glabra","10/17/1990",1990,10,17,290,1990290,"flowering and fruit","unknown","Y","Y"," "," ","","","Georgia","Oconee","","along banks of big robinson creek, s of whippoorwill road",33.84035,-83.473462,500,"Y","Y","Y","Yes","Both","","","","locality","best estimate","JA"
"731",9481920,"MW","GA","specimen","Chelone glabra","Chelone","glabra","10/17/1947",1947,10,17,290,1947290,"flowering","unknown","Y","N"," "," ","","same day/place, same phenology","Georgia","Early","","along ravine near chattahoochee river, gilberts landing",NA,NA,NA,"Y","Y","Y","Yes","Flowering","","","","","","JA"
"732",9482311,"MW","GA","specimen","Chelone glabra","Chelone","glabra","10/4/1988",1988,10,4,278,1988278,"flowering","unknown","Y","N"," "," ","","same day/place, same phenology","Georgia","Cherokee ","","davis pond, .45 miles n 5? e of sharp top on ga 108, north of waleska",34.36918,-84.479957,3069,"Y","Y","Y","Yes","Flowering","","","double check direction notation system. couldn't find exact locality","town+direction+distance+locality","geolocate","JA"
"733",9482916,"MW","GA","specimen","Chelone glabra","Chelone","glabra","10/12/1924",1924,10,12,286,1924286,"flowering","unknown","Y","N"," "," ","","","Georgia","Clarke","Winterville","",33.967059,-83.27821,1984,"Y","Y","Y","Yes","Flowering","","","","town","geolocate","JA"
"734",9483828,"MW","GA","specimen","Chelone glabra","Chelone","glabra","9/23/1970",1970,9,23,266,1970266,"flowering","unknown","Y","N"," "," ","","","Georgia","Walker","","shoreline of hogjowl creek, mclemmore cove",34.671404,-85.416702,6000,"Y","Y","Y","Yes","Flowering","","","","locality","best estimate","JA"
"735",9484740,"MW","GA","specimen","Chelone glabra","Chelone","glabra","9/17/1950",1950,9,17,260,1950260,"flowering and fruit","unknown","Y","Y"," "," ","","","Georgia","Rabun","","edge of messer cr. About 4.5 miles northwesterly from dillard",34.99211,-83.449647,3630,"Y","Y","Y","Yes","Both","","","","town+direction+distance+locality","geolocate","JA"
"736",9486682,"MW","GA","specimen","Chelone glabra","Chelone","glabra","9/23/2001",2001,9,23,266,2001266,"flowering","unknown","Y","N"," "," ","","","Georgia","Murray","","songbird trail at downstream side of beaverdam, .3 mi nw of lake conasauga, 34.86394 n, 84.65585 w",34.86394,-84.65585,NA,"Y","Y","Y","Yes","Flowering","","","","provided by observer","","JA"
"737",9487802,"MW","GA","specimen","Chelone glabra","Chelone","glabra","10/11/2001",2001,10,11,284,2001284,"buds?","Y","N","maybe"," "," ","recheck phenology: unsure","","Georgia","Dawson","","dawson forest wma, atlanta tract. Unamed trib, origin off of reactor road, .6 miles south of the etowah ",34.359356,-84.166823,4000,"Y","Y","Y","Yes","Flowering","Early","","","locality","best estimate","JA"
"738",9491650,"MW","GA","specimen","Chelone glabra","Chelone","glabra","10/20/2012",2012,10,20,294,2012294,"vegetative","N","N","N","Y"," ","","","Georgia","Catoosa ","","in the sharp bend of fox spring road 335 m west of service road. N 34.928191, w85.067696 (tennessee army national guard training facility)",34.928191,-85.067696,NA,"Y","Y","Y","No","","","","","provided by observer","","JA"
"739",9492371,"MW","GA","specimen","Chelone glabra","Chelone","glabra","9/13/1949",1949,9,13,256,1949256,"flowering","unknown","Y","N"," "," ","","","Georgia","Rabun","","cleared area of glades in northeast part of rabun county",34.938606,-83.26269,16000,"Y","Y","Y","Yes","Flowering","","","","locality","best estimate","JA"
"740",9493534,"MW","GA","specimen","Chelone glabra","Chelone","glabra","10/28/1979",1979,10,28,301,1979301,"flowering ","unknown","Y","N"," "," ","","","Georgia","Bibb","Macon","Wooded edge of rose hill cemetary",32.847984,-83.633017,500,"Y","Y","Y","Yes","Flowering","","","","locality","best estimate","JA"
"741",9493609,"MW","GA","specimen","Chelone glabra","Chelone","glabra","9/29/1928",1928,9,29,273,1928273,"flowering","unknown","Y","N"," "," ","","","Georgia","Cobb","Marietta","mrs clay's pasture, e clay street",33.94345,-84.544307,200,"Y","Y","Y","Yes","Flowering","","","couldn't find exact locality","locality","best estimate","JA"
"742",9494386,"MW","GA","specimen","Chelone glabra","Chelone","glabra","8/30/1970",1970,8,30,242,1970242,"vegetative","N","N","N","Y"," ","","same day/place, different phenology?","Georgia","Morgan","Rutledge","edge of lake, hard labor creek state park",33.654837,-83.594589,2300,"Y","Y","Y","No","","","","","locality","best estimate","JA"
"743",9496065,"MW","GA","specimen","Chelone glabra","Chelone","glabra","10/29/1979",1979,10,29,302,1979302,"fruit","N","N","Y"," "," ","","","Georgia","DeKalb","","about 1.7 mi ne of summit of arabia mountain, a domed granite outcrop. Present at margin of forest lake",33.679992,-84.094317,300,"Y","Y","Y","Yes","Fruiting","","","","locality","best estimate","JA"
"744",9498375,"MW","GA","specimen","Chelone glabra","Chelone","glabra","9/10/1979",1979,9,10,253,1979253,"flowering and ?","maybe","Y","maybe"," "," ","recheck phenology: unsure","same day/place, same phenology?","Georgia","Hart","","bank of stream flowing into savannah river. Site 79 (34?20'56"", 82?48'43"") ca 1 mile south of lake hartwell dam, at lower end of park area. In backwaters of proposed russell dam",NA,NA,NA,"Y","Y","Y","Yes","Flowering","","","","","","JA"
"745",9501175,"MW","GA","specimen","Chelone glabra","Chelone","glabra","9/10/1985",1985,9,10,253,1985253,"flowering","unknown","Y","N"," "," ","","","Georgia","Bartow","","se of ga hwy 140. e of towe chapel and nw of dewey church. Edge of small stream through woods",34.356331,-84.799584,4000,"Y","Y","Y","Yes","Flowering","","","","locality","best estimate","JA"
"746",9504002,"MW","GA","specimen","Chelone glabra","Chelone","glabra","10/3/1995",1995,10,3,276,1995276,"flowering","unknown","Y","N"," "," ","","","Georgia","DeKalb","","stone mountain park, alone margins of howell lake on south side of robert e lee boulevard; stone mt 7.5' topo quad",33.799221,-84.154607,130,"Y","Y","Y","Yes","Flowering","","","","provided","provided","JA"
"747",9504153,"MW","GA","specimen","Chelone glabra","Chelone","glabra","10/12/2001",2001,10,12,285,2001285,"flowering and fruit","unknown","Y","Y"," "," ","","same day/close together, same phenology?","Georgia","Lumpkin","","camp wasega off of forest service road 28-1. just uphill from camp entrance, at emergence of piped stream from under road crossing, at sharp hair-pin turn in road",34.610575,-84.095911,1000,"Y","Y","Y","Yes","Both","","","","locality","best estimate","JA"
"748",9505680,"MW","GA","specimen","Chelone glabra","Chelone","glabra","10/4/1936",1936,10,4,278,1936278,"flowering and fruit","unknown","Y","Y"," "," ","","","Georgia","Dawson","","margin of small stream, 12 mi nw of dawsonville",34.544216,-84.268311,9874,"Y","Y","Y","Yes","Both","","","","town+direction+distance","geolocate","JA"
"749",9511883,"MW","GA","specimen","Chelone glabra","Chelone","glabra","9/30/1966",1966,9,30,273,1966273,"flowering","unknown","Y","N"," "," ","","","Georgia","Oglethorpe ","","along millstone creek. Echols mill granite outcrop, 9.3 mi n 45?e of lexington, piedmont province",33.9678922,-83.0051444,1000,"Y","Y","Y","Yes","Flowering","","","double check direction notation system","locality","best estimate","JA"
"750",9512143,"MW","GA","specimen","Chelone glabra","Chelone","glabra","9/13/1978",1978,9,13,256,1978256,"flowering and ?","maybe","Y","maybe"," "," ","recheck phenology: unsure","same day/place, same phenology?","Georgia","Union","","hogpen gap, just n of summit of gap",NA,NA,NA,"Y","Y","Y","Yes","Flowering","","","","","","JA"
"751",9513163,"MW","GA","specimen","Chelone glabra","Chelone","glabra","10/11/1958",1958,10,11,284,1958284,"flowering and ?","maybe","Y","maybe"," "," ","recheck phenology: unsure","same day/place, same phenology?","Georgia","Jasper","","3 mi from monticello",33.304848,-83.683229,5000,"Y","Y","Y","Yes","Flowering","","","","town","geolocate","JA"
"752",9516994,"MW","GA","specimen","Chelone glabra","Chelone","glabra","10/12/2001",2001,10,12,285,2001285,"flowering???","unknown","Y","maybe"," "," ","recheck phenology: very unsure","same day/close together, same phenology?","Georgia","Lumpkin","","chattahoochee national forest. Etowah river headwaters, north of army ranger camp merrill along forest service rd 142",NA,NA,NA,"Y","Y","Y","Yes","Flowering","","","","","","JA"
"753",9517417,"MW","GA","specimen","Chelone glabra","Chelone","glabra","8/21/2007",2007,8,21,233,2007233,"buds","Y","N","N"," "," ","","","Georgia","Cobb","","ca 7 mi e of marietta, chattahoochee river national recreation area, cochran shoals, interstate parkway, gunby creek, ne of intersection of I-285 and powers ferry road, n side of boardwalk. 33.9093, 84.4491 33.9093, 84.4491",33.9093,-84.4491,NA,"Y","Y","Y","Yes","Flowering","Early","","","provided by observer","","JA"
"754",9520203,"MW","GA","specimen","Chelone glabra","Chelone","glabra","10/1/1997",1997,10,1,274,1997274,"flowering","unknown","Y","N"," "," ","","","Georgia","Floyd","","blacks bluff preserve, north side of blacks bluff road off of s broad street",34.209475,-85.219434,6000,"Y","Y","Y","Yes","Flowering","","","couldn't find exact locality","locality","best estimate","JA"
"755",9521504,"MW","GA","specimen","Chelone glabra","Chelone","glabra","9/4/1946",1946,9,4,247,1946247,"flowering","unknown","Y","N"," "," ","","same day/place, same phenology","Georgia","Rabun","","edge of GA-NC state line N 1?E of tower on rabun bald",NA,NA,NA,"Y","Y","Y","Yes","Flowering","","","","","","JA"
"756",9522315,"MW","GA","specimen","Chelone glabra","Chelone","glabra","9/12/1923",1923,9,12,255,1923255,"flowering and fruit","unknown","Y","Y"," "," ","","","Georgia","Rabun","Mountain City","silver creek",34.924232,-83.375116,300,"Y","Y","Y","Yes","Both","","","","locality","best estimate","JA"
"757",9525282,"MW","GA","specimen","Chelone glabra","Chelone","glabra","9/28/1941",1941,9,28,271,1941271,"flowering","unknown","Y","N"," "," ","","same day/close together, different phenology?","Georgia","Dawson","","along amicolola creek",34.467813,-84.226524,12000,"Y","Y","Y","Yes","Flowering","","","","locality","best estimate","JA"
"758",9526132,"MW","GA","specimen","Chelone glabra","Chelone","glabra","10/1/1938",1938,10,1,274,1938274,"flowering","unknown","Y","N"," "," ","","","Georgia","Union","","rich cove, neel gap",34.734793,-83.917981,1000,"Y","Y","Y","Yes","Flowering","","","couldn't find exact locality","locality","best estimate","JA"
"759",9529747,"MW","GA","specimen","Chelone glabra","Chelone","glabra","9/18/1988",1988,9,18,262,1988262,"flowering","unknown","Y","N"," "," ","","","Georgia","Butts ","","se of jackson off ga hwy 42, indian springs state park, along lake edge",33.248107,-83.93362,800,"Y","Y","Y","Yes","Flowering","","","","locality","best estimate","JA"
"760",9531704,"MW","GA","specimen","Chelone glabra","Chelone","glabra","10/4/1988",1988,10,4,278,1988278,"flowering","unknown","Y","N"," "," ","","same day/place, same phenology","Georgia","Cherokee ","","davis pond, .45 miles n 5? e of sharp top on ga 108, north of waleska",NA,NA,NA,"Y","Y","Y","Yes","Flowering","","","","","","JA"
"761",9538196,"MW","GA","specimen","Chelone glabra","Chelone","glabra","10/7/1923",1923,10,7,280,1923280,"flowering","unknown","Y","N"," "," ","","","Georgia","Clarke","Oconee Heights","",33.989836,-83.425715,3036,"Y","Y","Y","Yes","Flowering","","","","town","geolocate","JA"
"762",9540002,"MW","GA","specimen","Chelone glabra","Chelone","glabra","9/29/1940",1940,9,29,273,1940273,"flowering and ???","maybe","Y","maybe"," "," ","recheck phenology: very unsure","","Georgia","Pike","","6 miles from griffen ga",33.171387,-84.286538,6000,"Y","Y","Y","Yes","Flowering","","","","locality","best estimate","JA"
"763",9541295,"MW","GA","specimen","Chelone glabra","Chelone","glabra","10/3/1990",1990,10,3,276,1990276,"flowering and fruit?","unknown","Y","Y"," "," ","recheck phenology: unsure","","Georgia","Catoosa ","","3.2 mi s of fort oglethorpe. Chickamauga national battlefield park. S from e margin of viniard field",34.902544,-85.2569,2000,"Y","Y","Y","Yes","Both","","","couldn't find exact locality","locality","best estimate","JA"
"764",9541853,"MW","GA","specimen","Chelone glabra","Chelone","glabra","10/6/1990",1990,10,6,279,1990279,"flowering","unknown","Y","N"," "," ","","","Georgia","Rabun","","war woman road, along stream",34.897387,-83.281885,10000,"Y","Y","Y","Yes","Flowering","","","","locality","best estimate","JA"
"765",9542971,"MW","GA","specimen","Chelone glabra","Chelone","glabra","10/5/1941",1941,10,5,278,1941278,"flowering","unknown","Y","N"," "," ","","","Georgia","Rabun","",".5 miles east of oakey mountain at head of long branch",34.886365,-83.486568,2000,"Y","Y","Y","Yes","Flowering","","","couldn't find exact locality","locality","best estimate","JA"
"766",9548084,"MW","GA","specimen","Chelone glabra","Chelone","glabra","10/9/2007",2007,10,9,282,2007282,"flowering","unknown","Y","N"," "," ","","","Georgia","Fulton","Roswell","chattahoochee river nra: island ford park (park headquarters), se corner of roberts drive and island ford parkway, border of pond sw side of island ford parkway, just n of visitors center",33.994175,-84.332806,500,"Y","Y","Y","Yes","Flowering","","","","locality","best estimate","JA"
"767",9549185,"MW","GA","specimen","Chelone glabra","Chelone","glabra","10/30/1938",1938,10,30,303,1938303,"fruit","N","N","Y"," "," ","","","Georgia","Clarke","","along river at tallassee shoals",33.991532,-83.502204,500,"Y","Y","Y","Yes","Fruiting","","","","locality","best estimate","JA"
"768",10419286,"MW","GA","specimen","Chelone glabra","Chelone","glabra","10/6/2014",2014,10,6,279,2014279,"flowering","unknown","Y","N"," "," ","","","Georgia","Oconee","","between 1241 and 1301 ivywood drive approx 33.904268 n -83.395556 e",33.904268,-83.395556,NA,"Y","Y","Y","Yes","Flowering","","","","provided by observer","","JA"
"769",17294583,"MW","GA","specimen","Chelone glabra","Chelone","glabra","9/24/1958",1958,9,24,267,1958267,"flowering?","unknown","Y","maybe"," "," ","recheck phenology: unsure","same day/place, different phenology?","North Carolina","Avery","","4.2 miles south southeast of banner elk near linville gap on NC 184",36.12055,-81.841042,800,"Y","Y","Y","Yes","Flowering","","","","locality","best estimate","JA"
"770",17294604,"MW","GA","specimen","Chelone glabra","Chelone","glabra","9/22/1976",1976,9,22,266,1976266,"flowering","unknown","Y","N"," "," ","","same day/place, same phenology","Tennessee","Robertson","","cedar hill swamp, nw of springfield by US 41 just s of cedar hill",NA,NA,NA,"Y","Y","Y","Yes","Flowering","","","","","","JA"
"771",17294841,"MW","GA","specimen","Chelone glabra","Chelone","glabra","9/23/1962",1962,9,23,266,1962266,"flowering","unknown","Y","N"," "," ","","same day/place, same phenology","Tennessee","Blount","","near alleghnay baptist church southwest of kagley",NA,NA,NA,"Y","Y","Y","Yes","Flowering","","","","","","JA"
"772",17294928,"MW","GA","specimen","Chelone glabra","Chelone","glabra","9/17/1969",1969,9,17,260,1969260,"flowering","unknown","Y","N"," "," ","","same day/place, same phenology?","Tennessee","Giles","","in hills by Tenn 11, 3 mi NE Minor hill",NA,NA,NA,"Y","Y","Y","Yes","Flowering","","","","","","JA"
"773",17295158,"MW","GA","specimen","Chelone glabra","Chelone","glabra","9/10/1980",1980,9,10,254,1980254,"flowering and ?","maybe","Y","maybe"," "," ","recheck phenology: unsure","","Tennessee","Polk","","margin and islands of hiwasse river just below hwy 68 bridge N of farner",35.167915,-84.317227,200,"Y","Y","Y","Yes","Flowering","","","","locality","best estimate","JA"
"774",17295177,"MW","GA","specimen","Chelone glabra","Chelone","glabra","9/21/1962",1962,9,21,264,1962264,"flowering","unknown","Y","N"," "," ","","same day/place, same phenology","North Carolina","Transylvania","","seeps at revis ridge",35.202128,-82.798293,30212,"Y","Y","Y","Yes","Flowering","",""," couldn't find locality, used county ","county","geolocate","JA"
"775",17295283,"MW","GA","specimen","Chelone glabra","Chelone","glabra","10/7/1980",1980,10,7,281,1980281,"flowering","unknown","Y","N"," "," ","","","South Carolina","Anderson","","on bank of savannah river at base of west-facing slope, 34?12'20"", 82?37'52"", just north of sc 184/ga 368 bridge over savannah river. Below contour for proposed russell lake",34.20556,-82.63111,NA,"Y","Y","Y","Yes","Flowering","","","","provided by observer","","JA"
"776",17295455,"MW","GA","specimen","Chelone glabra","Chelone","glabra","9/1/1929",1929,9,1,244,1929244,"flowering and fruit???","unknown","Y","Y"," "," ","recheck phenology: very unsure","","Alabama","Jackson","","lake guntersville, near scottsboro, margin of spring, above small impoundment, residential area above lake",34.639092,-85.982441,20000,"Y","Y","Y","Yes","Both","","","couldn't find exact locality (dam built over original lake)","locality","best estimate","JA"
"777",17295493,"MW","GA","specimen","Chelone glabra","Chelone","glabra","10/2/1943",1943,10,2,275,1943275,"flowering and ???","maybe","Y","maybe"," "," ","recheck phenology: very unsure","","South Carolina","Charleston","","caw caw swamp 17 mi due w of charleston",32.795213,-80.198638,800,"Y","Y","Y","Yes","Flowering","","","","locality","best estimate","JA"
"778",17295509,"MW","GA","specimen","Chelone glabra","Chelone","glabra","10/7/1969",1969,10,7,280,1969280,"fruit?","unknown","N","Y"," "," ","recheck phenology: unsure","same day/place, different phenology?","Alabama","Jackson","","summit of sand mountain off Ala 117, 5.2 mi n flat rock, streambank",34.6475,-85.94222,1138,"Y","Y","Y","Yes","Fruiting","","","","provided","provided","JA"
"779",17295745,"MW","GA","specimen","Chelone glabra","Chelone","glabra","9/19/2004",2004,9,19,263,2004263,"flowering","unknown","Y","N"," "," ","","","Tennessee","Greene","","cherokee national forest, edge of cutshall bog",36.038456,-82.75581,18000,"Y","Y","Y","Yes","Flowering","","","couldn't find exact locality","locality","best estimate","JA"
"780",17295781,"MW","GA","specimen","Chelone glabra","Chelone","glabra","9/17/1979",1979,9,17,260,1979260,"flowering and ???","maybe","Y","maybe"," "," ","recheck phenology: very unsure","","South Carolina","Abbeville","","east side of the rocky river, 34?13'20"",82?37'15"", ca. .5 mile north of the SC contour (full pool for proposed russell lake)",34.222222,-82.620833,100,"Y","Y","Y","Yes","Flowering","","","double check lat lon ","provided by observer","best estimate","JA"
"781",17295819,"MW","GA","specimen","Chelone glabra","Chelone","glabra","9/22/1969",1969,9,22,265,1969265,"flowering and fruit","unknown","Y","Y"," "," ","","same day/place, same phenology","Tennessee","Lewis","","by Tenn 99, 3 mi (n or s?) w. hampshire",NA,NA,NA,"Y","Y","Y","Yes","Both","","","","","","JA"
"782",16966217,"MW","GAS","specimen","Chelone glabra","Chelone","glabra","8/6/1962",1962,8,6,218,1962218,NA,"unknown","unknown","unknown"," "," ","","","North Carolina","Macon","","",35.150474,-83.422185,36547,"N",NA,"Y","Not Scorable","","","","","county","geolocate","JA"
"783",16974232,"MW","GAS","specimen","Chelone glabra","Chelone","glabra","9/21/1962",1962,9,21,264,1962264,NA,"unknown","unknown","unknown"," "," ","","","North Carolina","Chatham ","","Approximately 4 miles north of Merry Oaks, N.C.",35.699837,-79.007514,7959,"N",NA,"Y","Not Scorable","","","","","town+direction+distance","geolocate","JA"
"784",16975102,"MW","GAS","specimen","Chelone glabra","Chelone","glabra","9/22/1962",1962,9,22,265,1962265,NA,"unknown","unknown","unknown"," "," ","","","North Carolina","Chatham ","","",35.702572,-79.255276,42528,"N",NA,"Y","Not Scorable","","","","","county","geolocate","JA"
"785",8022559,"MW","GEO","specimen","Chelone glabra","Chelone","glabra","9/28/1946",1946,9,28,271,1946271,"flowering","unknown","Y","N"," "," ","","","Georgia","DeKalb","","falls at outlet of Lake Phoebe",33.886616,-84.333801,500,"Y","?","Y","Yes","Flowering","","","","locality","best estimate","JA"
"786",9219637,"MW","GEO","specimen","Chelone glabra","Chelone","glabra","10/17/1947",1947,10,17,290,1947290,"flowering","unknown","Y","N"," "," ","","same day/place, same phenology","Georgia","Early","","Gilbert's Landing",31.4743385,-85.0668731,NA,"Y","?","Y","Yes","Flowering","","","","provided","","JA"
"787",56308,"?","GH","","Chelone glabra","Chelone","glabra","8/15/1910",1910,8,15,227,1910227,"flowering","unknown","Y","N"," "," ","","can't find in NE database","Newfoundland and Labrador","","","Swampy thicket, carboniferous sandstone, Stephenville",48.546625,-58.584478,NA,"?","?","Y","Yes","Flowering","","","lat lon should be ok","provided","","ND"
"788",1019853,"NE","GH","specimen","Chelone glabra","Chelone","glabra","8/14/1893",1893,8,14,226,1893226,"flowering","unknown","Y","N"," "," ","","","Maine","Aroostook","","St. Francis",47.170142,-68.890311,NA,"Y","?","Y","Yes","Flowering","","","","provided","","JA"
"789",1019860,"NE","GH","specimen","Chelone glabra","Chelone","glabra","8/8/1895",1895,8,8,220,1895220,"flowering","unknown","Y","N"," "," ","","same day/place, same phenology?","Maine","Piscataquis","Dover-Foxcroft","",45.18083,-69.20469,11598,"Y","Y","Y","Yes","Flowering","","","""Coordinates are for the centroid of the town polygon. The uncertainty is the largest possible distance between the centroid and the polygon edge.""","provided (town level)","provided","JA"
"790",1019861,"NE","GH","specimen","Chelone glabra","Chelone","glabra","8/8/1895",1895,8,8,220,1895220,"flowering","unknown","Y","N"," "," ","","same day/place, same phenology?","Maine","Piscataquis","Dover-Foxcroft","",45.183388,-69.226989,5192,"Y","?","Y","Yes","Flowering","","","","town","geolocate","JA"
"791",1019868,"NE","GH","specimen","Chelone glabra","Chelone","glabra","8/2/1903",1903,8,2,214,1903214,"flowering","unknown","Y","N"," "," ","","","Maine","Franklin","Rangeley","",44.966444,-70.642846,3036,"Y","?","Y","Yes","Flowering","","","","town","geolocate","JA"
"792",1019877,"NE","GH","specimen","Chelone glabra","Chelone","glabra","8/9/1989",1989,8,9,221,1989221,"flowering","unknown","Y","N"," "," ","","","Maine","Washington","South Lubec","Quoddy Head neck, carrying place heath bog. W of state park and quoddy head neck; lubeck",44.824247,-66.992757,3036,"Y","Y","Y","Yes","Flowering","","","","town","geolocate","JA"
"793",1019895,"NE","GH","specimen","Chelone glabra","Chelone","glabra","8/26/1939",1939,8,26,238,1939238,"flowering","unknown","Y","N"," "," ","","","Maine","Knox","South Thomaston","",44.04049,-69.14068,5792,"Y","?","Y","Yes","Flowering","","","","provided","provided","JA"
"794",1019908,"NE","GH","specimen","Chelone glabra","Chelone","glabra","8/23/1901",1901,8,23,235,1901235,"flowering","unknown","Y","N"," "," ","","same day/place, same phenology","Maine","Cumberland","Cumberland","",43.79025,-70.24727,9067,"Y","?","Y","Yes","Flowering","","","","town","geolocate","JA"
"795",1019912,"NE","GH","specimen","Chelone glabra","Chelone","glabra","9/8/1894",1894,9,8,251,1894251,"flowering","unknown","Y","N"," "," ","","","Maine","York","Kennebunkport","",43.39745,-70.44772,6569,"Y","?","Y","Yes","Flowering","","","","provided","provided","JA"
"796",1019920,"NE","GH","specimen","Chelone glabra","Chelone","glabra","7/29/1906",1906,7,29,210,1906210,"flowering","unknown","Y","N"," "," ","","","New Hampshire","Coos","Northumberland","",44.5759,-71.5176,8811,"Y","?","Y","Yes","Flowering","","","","provided","provided","JA"
"797",1019923,"NE","GH","specimen","Chelone glabra","Chelone","glabra","7/31/1896",1896,7,31,213,1896213,"flowering","unknown","Y","N"," "," ","","","New Hampshire","Coos","Randolph","",44.375339,-71.279798,3036,"Y","?","Y","Yes","Flowering","","","","town","geolocate","JA"
"798",1019924,"NE","GH","specimen","Chelone glabra","Chelone","glabra","8/26/1902",1902,8,26,238,1902238,"flowering","unknown","Y","N"," "," ","","","New Hampshire","Coos","Randolph","",44.375339,-71.279798,3036,"Y","?","Y","Yes","Flowering","","","","town","geolocate","JA"
"799",1019928,"NE","GH","specimen","Chelone glabra","Chelone","glabra","8/26/1897",1897,8,26,238,1897238,"flowering","unknown","Y","N"," "," ","","same day/place, different phenology?","New Hampshire","Coos","Whitefield","",44.37336,-71.59184,8881,"Y","?","Y","Yes","Flowering","","","","provided","provided","JA"
"800",1019931,"NE","GH","specimen","Chelone glabra","Chelone","glabra","8/25/1875",1875,8,25,237,1875237,"flowering","unknown","Y","N"," "," ","","","New Hampshire","Carroll","North Conway","",44.053681,-71.128404,NA,"Y","?","Y","Yes","Flowering","","","","provided","","JA"
"801",1019933,"NE","GH","specimen","Chelone glabra","Chelone","glabra","7/28/1907",1907,7,28,209,1907209,"flowering","unknown","Y","N"," "," ","","","New Hampshire","Grafton","Benton","",44.04078,-71.87642,8526,"Y","?","Y","Yes","Flowering","","","","provided","provided","JA"
"802",1019936,"NE","GH","specimen","Chelone glabra","Chelone","glabra","8/28/1939",1939,8,28,240,1939240,"buds","Y","N","N"," "," ","","","New Hampshire","Grafton","Lincoln","along stream ,opposite the flume, north of North Woodstock",44.102811,-71.652724,2000,"Y","?","Y","Yes","Flowering","Early","","","locality","best estimate","JA"
"803",1019942,"NE","GH","specimen","Chelone glabra","Chelone","glabra","8/21/1903",1903,8,21,233,1903233,"flowering","unknown","Y","N"," "," ","","","New Hampshire","Merrimack","East Andover","",43.45938,-71.747684,NA,"Y","?","Y","Yes","Flowering","","","","provided","","JA"
"804",1019968,"NE","GH","specimen","Chelone glabra","Chelone","glabra","8/10/1959",1959,8,10,222,1959222,"flowering","unknown","Y","N"," "," ","","","Vermont","Caledonia","Groton","",44.21034,-72.195373,3036,"Y","?","Y","Yes","Flowering","","","","town","geolocate","JA"
"805",1019972,"NE","GH","specimen","Chelone glabra","Chelone","glabra","8/3/1906",1906,8,3,215,1906215,"flowering","unknown","Y","N"," "," ","","","Vermont","Chittenden","Hinesburg","",44.32436,-73.0902,7318,"Y","?","Y","Yes","Flowering","","","","provided","provided","JA"
"806",1019973,"NE","GH","specimen","Chelone glabra","Chelone","glabra","8/22/1935",1935,8,22,234,1935234,"flowering","unknown","Y","N"," "," ","","","Vermont","Washington","Duxbury","",44.30571,-72.82417,7853,"Y","?","Y","Yes","Flowering","","","","provided","provided","JA"
"807",1019974,"NE","GH","specimen","Chelone glabra","Chelone","glabra","9/10/1935",1935,9,10,253,1935253,"flowering","unknown","Y","N"," "," ","","same day/place, same phenology","Vermont","Washington","Fayston","",44.21309,-72.87509,8424,"Y","?","Y","Yes","Flowering","","","","provided","provided","JA"
"808",1019975,"NE","GH","specimen","Chelone glabra","Chelone","glabra","9/10/1935",1935,9,10,253,1935253,"flowering","unknown","Y","N"," "," ","","same day/place, same phenology","Vermont","Washington","Fayston","",44.21309,-72.87509,8424,"Y","Y","Y","Yes","Flowering","","","""Coordinates are for the centroid of the town polygon. The uncertainty is the largest possible distance between the centroid and the polygon edge.""","provided (town level)","provided","JA"
"809",1019987,"NE","GH","specimen","Chelone glabra","Chelone","glabra","8/6/1900",1900,8,6,218,1900218,"flowering and fruit","unknown","Y","Y"," "," ","","has same picture as 1019988, should probably delete this one","Vermont","Bennington","Sunderland","",43.07089,-73.06898,7703,"Y","?","Y","Yes","Both","","","","provided","provided","JA"
"810",1019988,"NE","GH","specimen","Chelone glabra","Chelone","glabra","10/5/1896",1896,10,5,279,1896279,"flowering and fruit?","unknown","Y","Y"," "," ","recheck phenology: unsure","same day/place, different phenology","Vermont","Rutland","Rutland","",43.624,-72.97802,6494,"Y","?","Y","Yes","Both","","","","provided","provided","JA"
"811",1019999,"NE","GH","specimen","Chelone glabra","Chelone","glabra","9/21/1908",1908,9,21,265,1908265,"flowering","unknown","Y","N"," "," ","","","Massachusetts","Middlesex","Belmont","",42.39593,-71.178666,3578,"Y","?","Y","Yes","Flowering","","","","town","geolocate","JA"
"812",1020000,"NE","GH","specimen","Chelone glabra","Chelone","glabra","8/30/1896",1896,8,30,243,1896243,"buds?","Y","N","maybe"," "," ","recheck phenology: unsure","","Massachusetts","Middlesex","Concord","",42.46197,-71.36386,6146,"Y","?","Y","Yes","Flowering","Early","","","provided","provided","JA"
"813",1020016,"NE","GH","specimen","Chelone glabra","Chelone","glabra","9/26/1886",1886,9,26,269,1886269,"fruit","N","N","Y"," "," ","","","Massachusetts","Suffolk","Jamaica Plain","Jamaica Plain",42.309736,-71.115143,NA,"Y","?","Y","Yes","Fruiting","","","","provided","","JA"
"814",1020021,"NE","GH","specimen","Chelone glabra","Chelone","glabra","8/29/1853",1853,8,29,241,1853241,"flowering","unknown","Y","N"," "," ","","","Massachusetts","Norfolk","Milton","",42.249544,-71.066161,5895,"Y","?","Y","Yes","Flowering","","","","town","geolocate","JA"
"815",1020027,"NE","GH","specimen","Chelone glabra","Chelone","glabra","9/26/1897",1897,9,26,269,1897269,"flowering","unknown","Y","N"," "," ","","same day/place, different phenology","Massachusetts","Norfolk","Walpole","",42.14643,-71.25546,6759,"Y","?","Y","Yes","Flowering","","","","provided","provided","JA"
"816",1020033,"NE","GH","specimen","Chelone glabra","Chelone","glabra","9/7/1903",1903,9,7,250,1903250,"flowering and ?","maybe","Y","maybe"," "," ","recheck phenology: unsure","","Massachusetts","Plymouth","Scituate","",42.19293,-70.75656,9742,"Y","?","Y","Yes","Flowering","","","","provided","provided","JA"
"817",1020039,"NE","GH","specimen","Chelone glabra","Chelone","glabra","8/26/1928",1928,8,26,239,1928239,"flowering","unknown","Y","N"," "," ","","same day/place, some have different phenology","Massachusetts","Barnstable","Barnstable","Barnstable Town. ""woods back of salt marsh, west barnstable""",41.70011,-70.299466,3036,"Y","?","Y","Yes","Flowering","","","","town","geolocate","JA"
"818",1020044,"NE","GH","specimen","Chelone glabra","Chelone","glabra","8/22/1916",1916,8,22,235,1916235,"flowering","unknown","Y","N"," "," ","","","Massachusetts","Dukes","West Tisbury","",41.40013,-70.65456,6911,"Y","?","Y","Yes","Flowering","","","","provided","provided","JA"
"819",1020058,"NE","GH","specimen","Chelone glabra","Chelone","glabra","8/11/1908",1908,8,11,224,1908224,"flowering","unknown","Y","N"," "," ","","","Massachusetts","Franklin","Deerfield","",42.52202,-72.60972,7304,"Y","?","Y","Yes","Flowering","","","","provided","provided","JA"
"820",1020068,"NE","GH","specimen","Chelone glabra","Chelone","glabra","8/22/1912",1912,8,22,235,1912235,"flowering","unknown","Y","N"," "," ","","","Massachusetts","Hampshire","West Chesterfield","banks of westfield river West Chesterfield",42.403367,-72.876938,NA,"Y","?","Y","Yes","Flowering","","","","provided","","JA"
"821",1020069,"NE","GH","specimen","Chelone glabra","Chelone","glabra","8/16/1912",1912,8,16,229,1912229,"flowering","unknown","Y","N"," "," ","","","Massachusetts","Hampshire","Worthington","",42.39536,-72.94243,8415,"Y","?","Y","Yes","Flowering","","","","provided","provided","JA"
"822",1020073,"NE","GH","specimen","Chelone glabra","Chelone","glabra","8/28/1925",1925,8,28,240,1925240,"flowering","unknown","Y","N"," "," ","","same day/place, same phenology","Massachusetts","Hampden","Ludlow","higher brook",42.1921,-72.45805,6281,"Y","Y","Y","Yes","Flowering","","","""Coordinates are for the centroid of the town polygon. The uncertainty is the largest possible distance between the centroid and the polygon edge.""","provided (town level)","provided","JA"
"823",1020084,"NE","GH","specimen","Chelone glabra","Chelone","glabra","9/6/1903",1903,9,6,249,1903249,"flowering and fruit","unknown","Y","Y"," "," ","","","Rhode Island","Providence","","Rumford",41.846216,-71.355716,NA,"Y","?","Y","Yes","Both","","","","provided","","JA"
"824",1020088,"NE","GH","specimen","Chelone glabra","Chelone","glabra","8/30/1899",1899,8,30,242,1899242,"flowering","unknown","Y","N"," "," ","","","Connecticut","New London","Franklin","",41.61532,-72.14324,5995,"Y","?","Y","Yes","Flowering","","","","provided","provided","JA"
"825",1020091,"NE","GH","specimen","Chelone glabra","Chelone","glabra","8/26/1938",1938,8,26,238,1938238,"buds?","Y","N","maybe"," "," ","recheck phenology: unsure","","Connecticut","Tolland","Hebron","",41.65937,-72.39032,9535,"Y","?","Y","Yes","Flowering","Early","","","provided","provided","JA"
"826",1020093,"NE","GH","specimen","Chelone glabra","Chelone","glabra","9/2/1898",1898,9,2,245,1898245,"flowering","unknown","Y","N"," "," ","","","Connecticut","Hartford","Southington","",41.60489,-72.88003,7659,"Y","?","Y","Yes","Flowering","","","","town","geolocate","JA"
"827",7408041,"MW","GMUF","specimen","Chelone glabra","Chelone","glabra","9/1/1976",1976,9,1,245,1976245,"flowering","unknown","Y","N"," "," ","","","Virginia","Fairfax","","Near jct. of Round Lick Run and Cub Run.",38.87031,-77.47351,3000,"Y","?","Y","Yes","Flowering","",""," couldn't find exact locality","locality","best estimate","JA"
"828",7408042,"MW","GMUF","specimen","Chelone glabra","Chelone","glabra","9/16/1993",1993,9,16,259,1993259,"flowering","unknown","Y","N"," "," ","","","Virginia","Nottoway","","Fort Pickett Military Reservation. Along branch of Birchin Creek, at large granite flatrocks 0.4 mi. SW of the south end of Birchin Lake at Lake Rd., 4.8 miles SW of Darville.",37.030642,-77.911222,200,"Y","?","Y","Yes","Flowering","","","","locality","best estimate","JA"
"829",7408043,"MW","GMUF","specimen","Chelone glabra","Chelone","glabra","9/27/1993",1993,9,27,270,1993270,"flowering","unknown","Y","N"," "," ","","","Virginia","Caroline","","Fort A.P. Hill Military Reservation. On west side of the south headwaters branch of Peumansend Creek, 0.8 mi. NE of Broaddus and 3.6 miles NE of Bowling Green.",38.098291,-77.260847,7000,"Y","?","Y","Yes","Flowering","","","","locality","best estimate","JA"
"830",7408045,"MW","GMUF","specimen","Chelone glabra","Chelone","glabra","9/11/1988",1988,9,11,255,1988255,"flowering","unknown","Y","N"," "," ","","","Virginia","Fauquier","","Occasional on shaded alluvial banks of Horner Run, in open floodplain forest; at northern base of the Rappahannock Mountains, just S. of Rt. 703 terminus, 3.0 miles S. of Marshall; elev. 480'.",38.823295,-77.851397,3000,"Y","?","Y","Yes","Flowering","","","","locality","best estimate","JA"
"831",7408046,"MW","GMUF","specimen","Chelone glabra","Chelone","glabra","9/30/1969",1969,9,30,273,1969273,"flowering and fruit","unknown","Y","Y"," "," ","","","Virginia","Isle of Wight","","3 miles N of Carrsville",36.755323,-76.82607,6954,"Y","?","Y","Yes","Both","","","","town+direction+distance","geolocate","JA"
"832",7408047,"MW","GMUF","specimen","Chelone glabra","Chelone","glabra","10/10/1983",1983,10,10,283,1983283,"flowering and fruit","unknown","Y","Y"," "," ","","","Virginia","Louisa","Mineral","Jct. of rtes. 618 and 667 in Mineral",38.010758,-77.897254,300,"Y","?","Y","Yes","Both","","","","locality","best estimate","JA"
"833",7408048,"MW","GMUF","specimen","Chelone glabra","Chelone","glabra","10/10/1981",1981,10,10,283,1981283,"flowering and fruit","unknown","Y","Y"," "," ","","","Virginia","Arlington","","Along Gulf Branch, 0.5 mi. SW of Potomac River, 0.5 mi. south of Chain Bridge.",38.919776,-77.119045,500,"Y","?","Y","Yes","Both","","","","locality","best estimate","JA"
"834",7408049,"MW","GMUF","specimen","Chelone glabra","Chelone","glabra","9/22/1973",1973,9,22,265,1973265,"flowering and fruit","unknown","Y","Y"," "," ","","","Virginia","Fairfax","","Old field and marsh at Shreve Rd. and Rt. 29-211.",38.87605,-77.218975,300,"Y","?","Y","Yes","Both","","","","locality","best estimate","JA"
"835",7408050,"MW","GMUF","specimen","Chelone glabra","Chelone","glabra","9/30/1973",1973,9,30,273,1973273,"flowering and fruit","unknown","Y","Y"," "," ","","","Virginia","Lancaster","","Creek crossing of Rt. 354 near junction with Rt. 3.",37.829395,-76.57606,600,"Y","?","Y","Yes","Both","","","","locality","best estimate","JA"
"836",7408051,"MW","GMUF","specimen","Chelone glabra","Chelone","glabra","9/22/1974",1974,9,22,265,1974265,"flowering","unknown","Y","N"," "," ","","","Virginia","Essex","","Along the Occupacia River. Off of rte 661 east of jct with rte 637",38.06818,-76.945161,5000,"Y","?","Y","Yes","Flowering","","","","locality","best estimate","JA"
"837",7408052,"MW","GMUF","specimen","Chelone glabra","Chelone","glabra","9/24/1997",1997,9,24,267,1997267,"flowering","unknown","Y","N"," "," ","","","Virginia","Charlotte","","Ca. 0.2 km ESE of the junction of the Hyco River and Rt. 92.",36.822659,-78.610857,6000,"Y","?","Y","Yes","Flowering","",""," couldn't find exact locality, used route/county","locality","best estimate","JA"
"838",7408054,"MW","GMUF","specimen","Chelone glabra","Chelone","glabra","9/20/1981",1981,9,20,263,1981263,"flowering","unknown","Y","N"," "," ","","","Virginia","Shenandoah","Mount Jackson","along the North Fork of the Shenandoah River at rte. 698 in Mount Jackson.",38.746001,-78.638871,1500,"Y","?","Y","Yes","Flowering","","","","locality","best estimate","JA"
"839",7408055,"MW","GMUF","specimen","Chelone glabra","Chelone","glabra","9/6/1969",1969,9,6,249,1969249,"fruit","N","N","Y"," "," ","","same day/place, same phenology","Virginia","Fairfax","","Roadside, jct of Va 7 & Va 743, Colvin Run Mill;Colvin Run Mill; Roadside",NA,NA,NA,"Y","Y","Y","Yes","Fruiting","","","","","","JA"
"840",7408056,"MW","GMUF","specimen","Chelone glabra","Chelone","glabra","9/6/1969",1969,9,6,249,1969249,"fruit","N","N","Y"," "," ","","same day/place, same phenology","Virginia","Fairfax","","jct of Va 7 & Va 743, Colvin Run Mill",38.967323,-77.291458,200,"Y","?","Y","Yes","Fruiting","","","","locality","best estimate","JA"
"841",7408057,"MW","GMUF","specimen","Chelone glabra","Chelone","glabra","10/5/1985",1985,10,5,278,1985278,"flowering","unknown","Y","N"," "," ","","","Virginia","Stafford","","At Potomac Creek and rte. 608, nw. of Falmouth.",38.356672,-77.395345,300,"Y","?","Y","Yes","Flowering","","","","locality","best estimate","JA"
"842",7408058,"MW","GMUF","specimen","Chelone glabra","Chelone","glabra","9/25/1977",1977,9,25,268,1977268,"flowering","unknown","Y","N"," "," ","","","Virginia","Rappahannock","","1/4 mi. W. of U.S. 522 on Co. rte. 630.",38.793109,-78.109268,200,"Y","?","Y","Yes","Flowering","","","","locality","best estimate","JA"
"843",7408059,"MW","GMUF","specimen","Chelone glabra","Chelone","glabra","9/20/1979",1979,9,20,263,1979263,"flowering","unknown","Y","N"," "," ","","","Virginia","Fairfax","","Campus, George Mason University",38.831576,-77.313649,1400,"Y","?","Y","Yes","Flowering","","","","locality","best estimate","JA"
"844",7408060,"MW","GMUF","specimen","Chelone glabra","Chelone","glabra","9/22/1977",1977,9,22,265,1977265,"flowering","unknown","Y","N"," "," ","","","Virginia","Stafford","","Junction of rte. 655 and tributary of Rappahannock River.",38.353641,-77.584652,300,"Y","?","Y","Yes","Flowering","","","","locality","best estimate","JA"
"845",7408061,"MW","GMUF","specimen","Chelone glabra","Chelone","glabra","9/20/1997",1997,9,20,263,1997263,"flowering","unknown","Y","N"," "," ","","","Virginia","Spotsylvania","","Dave Meadow's farm at the end of Buckland Rd.",38.250737,-77.763994,500,"Y","?","Y","Yes","Flowering","","","","locality","best estimate","JA"
"846",7408062,"MW","GMUF","specimen","Chelone glabra","Chelone","glabra","9/24/1972",1972,9,24,268,1972268,"flowering and ?","maybe","Y","maybe"," "," ","recheck phenology: unsure","","Virginia","Frederick","","Pembrook Springs.",39.1078835,-78.4247292,2000,"Y","?","Y","Yes","Flowering","","","","locality","best estimate","JA"
"847",1151459,"NE","GRCH","specimen","Chelone glabra","Chelone","glabra","8/3/2007",2007,8,3,215,2007215,"reproductive ","maybe","maybe","maybe"," ","Y","","","New York","Madison","","Growing along Taylor Lake on Colgate University's campus.",42.8192,-75.53937,NA,"N",NA,"Y","Yes","","","","","provided","","JA"
"848",1151510,"NE","GRCH","specimen","Chelone glabra","Chelone","glabra","10/29/2007",2007,10,29,302,2007302,"reproductive ","maybe","maybe","maybe"," ","Y","","","New York","Madison","","Hamilton, Woodman Pond.",42.85185,-75.57167,NA,"N",NA,"Y","Yes","","","","","provided","","JA"
"849",15360285,"MW","GSW","specimen","Chelone glabra","Chelone","glabra","9/16/1974",1974,9,16,259,1974259,"flowering","unknown","Y","N"," "," ","","","Tennessee","Dickson","","montgomery bell state park by us 70, w. of white bluff",36.105539,-87.272917,1800,"Y","Y","Y","Yes","Flowering","","","","locality","best estimate","JA"
"850",15360286,"MW","GSW","specimen","Chelone glabra","Chelone","glabra","10/15/1992",1992,10,15,289,1992289,"flowering","unknown","Y","N"," "," ","","date: assuming '92' is 1992 ","Georgia","Sumter","Americus","8 miles south of americus on east side of hwy 377 on edge of beaver pond of philema creek cut over area",31.958192,-84.200612,1000,"Y","Y","Y","Yes","Flowering","","","","town+direction+distance+locality","best estimate","JA"
"851",15360287,"MW","GSW","specimen","Chelone glabra","Chelone","glabra","9/15/1988",1988,9,15,259,1988259,"flowering","unknown","Y","N"," "," ","","","Wisconsin","Fond Du Lac","","hobb's woods nature area, section 9, T14N, R17E",43.692475,-88.465691,600,"Y","Y","Y","Yes","Flowering","","","PLSS","PLSS/locality","best estimate","JA"
"852",15360288,"MW","GSW","specimen","Chelone glabra","Chelone","glabra","8/26/1981",1981,8,26,238,1981238,"flowering","unknown","Y","N"," "," ","","","New York","Erie","Alden","in swamp on flood plain of ellicott creek, ca 300 ft E and 100 ft N of 1714 meadow drive",42.905507,-78.506478,100,"Y","Y","Y","Yes","Flowering","","","","locality","best estimate","JA"
"853",5530534,"MW","GVSC","specimen","Chelone glabra","Chelone","glabra","9/7/1965",1965,9,7,250,1965250,"flowering and fruit","unknown","Y","Y"," "," ","","","Michigan","Ottawa","","Grand Valley State College campus, marsh in ravine near west bank of grand river",NA,NA,NA,"Y","?","Y","Yes","Both","","","","","","JA"
"854",5530535,"MW","GVSC","specimen","Chelone glabra","Chelone","glabra","9/8/2006",2006,9,8,251,2006251,"flowering","unknown","Y","N"," "," ","","","Michigan","Kent","Alpine","Alpine Twp, sec. 1 T8N R12W",43.109089,-85.680164,1200,"Y","?","Y","Yes","Flowering","","","","PLSS","best estimate","JA"
"855",1440664,"NE","HF","specimen","Chelone glabra","Chelone","glabra","9/28/1933",1933,9,28,271,1933271,"buds??","Y","N","maybe"," "," ","recheck phenology: very unsure","","Massachusetts","Worcester","Petersham","bank of stream in ""stab lily?"" tract",42.45969,-72.22107,15025,"Y","Y","Y","Yes","Flowering","Early","","","provided","provided","JA"
"856",1441158,"NE","HF","specimen","Chelone glabra","Chelone","glabra","8/28/1978",1978,8,28,240,1978240,"flowering","unknown","Y","N"," "," ","","","Massachusetts","Worcester","Phillipston/Petersham","harvard forest, prospect hil tract, by stream",42.5405,-72.184599,1500,"Y","Y","Y","Yes","Flowering","","","","locality","best estimate","JA"
"857",1441476,"NE","HF","specimen","Chelone glabra","Chelone","glabra","7/18/1934",1934,7,18,199,1934199,"vegetative","N","N","N","Y"," ","","","New Hampshire","Cheshire","Winchester","swamp in Pisgah tract",42.7874,-72.40055,9623,"Y","Y","Y","No","","","","","provided","provided","JA"
"858",5620496,"MW","HLSD","specimen","Chelone glabra","Chelone","glabra","9/25/1995",1995,9,25,268,1995268,"flowering","unknown","Y","N"," "," ","","","Michigan","Hillsdale","","lost nations",41.84656,-84.493025,5000,"Y","Y","Y","Yes","Flowering","","","assuming lost nations is state game area","locality","best estimate","JA"
"859",5620497,"MW","HLSD","specimen","Chelone glabra","Chelone","glabra","9/24/1995",1995,9,24,267,1995267,"flowering","unknown","Y","N"," "," ","","","Michigan","Hillsdale","","sour gum swamp, baw beese lake",41.900491,-84.610377,1000,"Y","Y","Y","Yes","Flowering","","","","locality","best estimate","JA"
"860",4311273,"MW","HPC","specimen","Chelone glabra","Chelone","glabra","9/5/1969",1969,9,5,248,1969248,NA,"unknown","unknown","unknown"," "," ","","","North Carolina","Watauga","","",36.231106,-81.696425,25642,"N",NA,"Y","Not Scorable","","","","","county","geolocate","JA"
"861",15385992,"MW","HTTU","specimen","Chelone glabra","Chelone","glabra","9/25/1967",1967,9,25,268,1967268,"flowering and fruit","unknown","Y","Y"," "," ","","same day/place, some have different phenology","Tennessee","Warren","","below great falls dam, .25 miles above power plant",35.804751,-85.630287,400,"Y","Y","Y","Yes","Both","","","","locality","best estimate","JA"
"862",15385993,"MW","HTTU","specimen","Chelone glabra","Chelone","glabra","9/25/1967",1967,9,25,268,1967268,"flowering","unknown","Y","N"," "," ","","same day/place, some have different phenology","Tennessee","Warren","","below great falls dam, .25 miles above power plant",35.804751,-85.630287,400,"Y","Y","Y","Yes","Flowering","","","","locality","best estimate","JA"
"863",15385994,"MW","HTTU","specimen","Chelone glabra","Chelone","glabra","9/24/1999",1999,9,24,267,1999267,"flowering","unknown","Y","N"," "," ","","","Tennessee","Scott","","big south fork national river and recreation area, streambank at edge of greasy creek where the trail crosses it",36.434127,-84.592236,600,"Y","Y","Y","Yes","Flowering","","","","locality","best estimate","JA"
"864",15385995,"MW","HTTU","specimen","Chelone glabra","Chelone","glabra","10/8/1999",1999,10,8,281,1999281,"flowering and ?","maybe","Y","maybe"," "," ","recheck phenology: unsure","","Tennessee","Scott","","big south fork national river and recreation area, edge of stream above beavers falls, ca 5 m NW of john muir trail",36.536904,-84.678853,18000,"Y","Y","Y","Yes","Flowering","","","couldn't find exact locality","locality","best estimate","JA"
"865",15385996,"MW","HTTU","specimen","Chelone glabra","Chelone","glabra","9/21/2004",2004,9,21,265,2004265,"flowering","unknown","Y","N"," "," ","","","Tennessee","Putnam","cookeville","old city lake",36.130636,-85.444275,1800,"Y","Y","Y","Yes","Flowering","","","","locality","best estimate","JA"
"866",15385998,"MW","HTTU","specimen","Chelone glabra","Chelone","glabra","9/17/2006",2006,9,17,260,2006260,"flowering","unknown","Y","N"," "," ","","","Tennessee","Putnam","cookeville","near the lake, cane creek park",36.163178,-85.541891,600,"Y","Y","Y","Yes","Flowering","","","","locality","best estimate","JA"
"867",15385999,"MW","HTTU","specimen","Chelone glabra","Chelone","glabra","9/9/2004",2004,9,9,253,2004253,"flowering","unknown","Y","N"," "," ","","","Tennessee","Putnam","cookeville","old city lake",36.130636,-85.444275,1800,"Y","Y","Y","Yes","Flowering","","","","locality","best estimate","JA"
"868",15386002,"MW","HTTU","specimen","Chelone glabra","Chelone","glabra","9/20/1968",1968,9,20,264,1968264,"fruit","N","N","Y"," "," ","","same day/place, some have different phenology","North Carolina","Watauga","","along CO. Rt. 1102, on Rich Mt., 3.4 mi west of howard's knob",36.23758,-81.7077,NA,"Y","Y","Y","Yes","Fruiting","","","","provided","","JA"
"869",15734396,"MW","HTTU","specimen","Chelone glabra","Chelone","glabra","9/25/1967",1967,9,25,268,1967268,"flowering","unknown","Y","N"," "," ","","same day/place, some have different phenology","Tennessee","Warren","","below great falls dam, .25 miles above power plant",NA,NA,NA,"Y","Y","Y","Yes","Flowering","","","","","","JA"
"870",15734399,"MW","HTTU","specimen","Chelone glabra","Chelone","glabra","9/28/2004",2004,9,28,272,2004272,"flowering and ???","maybe","Y","maybe"," "," ","recheck phenology: very unsure","","Tennessee","Putnam","cookeville","next to water at the end of the trail at old city lake",36.130636,-85.444275,1800,"Y","Y","Y","Yes","Flowering","","","","locality","best estimate","JA"
"871",15734401,"MW","HTTU","specimen","Chelone glabra","Chelone","glabra","9/22/1998",1998,9,22,265,1998265,"flowering","unknown","Y","N"," "," ","","","Tennessee","Knox","west knoxville","turkey creek conservation easement. Easement is on right side of I-40 driving east. Get off at the lovell road exit, then proceed to turn right (south). Easement runs parallel to lovell road on the right, driving toward kingston pike. Collected next to first access road",35.903523,-84.126584,4000,"Y","Y","Y","Yes","Flowering","","","","locality","best estimate","JA"
"872",15753897,"MW","HTTU","specimen","Chelone glabra","Chelone","glabra","10/14/1971",1971,10,14,287,1971287,"flowering and fruit","unknown","Y","Y"," "," ","","","Alabama","Lee","","2.4 miles north west of auburn bypass, first left off bypass north of Ala.14, growing in water",32.639463,-85.529805,8000,"Y","Y","Y","Yes","Both","","","couldn't find exact locality","locality","best estimate","JA"
"873",16196264,"MW","HTTU","specimen","Chelone glabra","Chelone","glabra","10/8/1996",1996,10,8,282,1996282,"fruit","N","N","Y"," "," ","","","Tennessee","Putnam","cookeville","wetland, west of bridge and roadside at the edge of old city lake. 36.132, -85.445",36.132,-85.445,NA,"Y","Y","Y","Yes","Fruiting","","","","provided by observer","","JA"
"874",16196993,"MW","HTTU","specimen","Chelone glabra","Chelone","glabra","9/25/2001",2001,9,25,268,2001268,"flowering","unknown","Y","N"," "," ","","same day/place, same phenology","Tennessee","Putnam","cookeville","old city lake",36.130636,-85.444275,1800,"Y","Y","Y","Yes","Flowering","","","","locality","best estimate","JA"
"875",16196998,"MW","HTTU","specimen","Chelone glabra","Chelone","glabra","9/25/2001",2001,9,25,268,2001268,"flowering","unknown","Y","N"," "," ","","same day/place, same phenology","Tennessee","Putnam","cookeville","old city lake",NA,NA,NA,"Y","Y","Y","Yes","Flowering","","","","","","JA"
"876",16198082,"MW","HTTU","specimen","Chelone glabra","Chelone","glabra","9/5/2000",2000,9,5,249,2000249,"flowering","unknown","Y","N"," "," ","","same day/place, same phenology","Tennessee","Putnam","cookeville","10th street",NA,NA,NA,"Y","Y","Y","Yes","Flowering","","","","","","JA"
"877",16483792,"MW","HTTU","specimen","Chelone glabra","Chelone","glabra","9/5/2000",2000,9,5,249,2000249,"flowering","unknown","Y","N"," "," ","","same day/place, same phenology","Tennessee","Putnam","cookeville","10th street",36.175627,-85.486565,2400,"Y","Y","Y","Yes","Flowering","","","","locality","best estimate","JA"
"878",10274099,"MW","HXC","specimen","Chelone glabra","Chelone","glabra","8/19/1981",1981,8,19,231,1981231,"flowering","unknown","Y","N"," "," ","","","Wisconsin","Shawano","","",NA,NA,NA,"Y","Y","Y","Yes","Flowering","","","","","","JA"
"879",6985279,"MW","ILLS","specimen","Chelone glabra","Chelone","glabra","9/6/1978",1978,9,6,249,1978249,NA,"unknown","unknown","unknown"," "," ","","","Illinois","Bureau","","Miller-Anderson Woods Nature Preserve. T. 14N, R. 10E, Sect. 6",41.241695,-89.410364,1300,"N",NA,"Y","Not Scorable","","","","PLSS","locality","best estimate","JA"
"880",6985280,"MW","ILLS","specimen","Chelone glabra","Chelone","glabra","8/30/1960",1960,8,30,243,1960243,NA,"unknown","unknown","unknown"," "," ","","","Illinois","Cass","","Moist woods north of Arenzville.",39.876992,-90.373457,1227,"N",NA,"Y","Not Scorable","","","","","town","geolocate","JA"
"881",6985281,"MW","ILLS","specimen","Chelone glabra","Chelone","glabra","10/20/1974",1974,10,20,293,1974293,NA,"unknown","unknown","unknown"," "," ","","","Illinois","Cass","","Marshland north of Arenzville.",39.876992,-90.373457,1227,"N",NA,"Y","Not Scorable","","","","","town","geolocate","JA"
"882",6985282,"MW","ILLS","specimen","Chelone glabra","Chelone","glabra","8/31/1971",1971,8,31,243,1971243,NA,"unknown","unknown","unknown"," "," ","","","Illinois","Cass","","Marshland north of Arenzville.",39.876992,-90.373457,1227,"N",NA,"Y","Not Scorable","","","","","town","geolocate","JA"
"883",6985283,"MW","ILLS","specimen","Chelone glabra","Chelone","glabra","9/16/1959",1959,9,16,259,1959259,NA,"unknown","unknown","unknown"," "," ","","","Illinois","Christian","","Marshland northeast of Clarksdale.",39.511368,-89.339959,NA,"N",NA,"Y","Not Scorable","","","","","town+direction+distance","","JA"
"884",6985284,"MW","ILLS","specimen","Chelone glabra","Chelone","glabra","9/16/1943",1943,9,16,259,1943259,NA,"unknown","unknown","unknown"," "," ","","","Illinois","Cook","Orland.","",41.600832,-87.835328,NA,"N",NA,"Y","Not Scorable","","","","","provided","","JA"
"885",6985285,"MW","ILLS","specimen","Chelone glabra","Chelone","glabra","5/14/1973",1973,5,14,134,1973134,NA,"unknown","unknown","unknown"," "," ","","","Illinois","DeKalb","","Township 38; Somonauk Creek crosses area; ""Wait's pasture""; fide Miss Clara Greeley.  W1/2 Sect. 11",41.929474,-88.750365,NA,"N",NA,"Y","Not Scorable","","","","check record PLSS lat lon copied from messed up list, got more detailed location from picture","provided","","JA"
"886",6985286,"MW","ILLS","specimen","Chelone glabra","Chelone","glabra","10/3/1975",1975,10,3,276,1975276,NA,"unknown","unknown","unknown"," "," ","","","Illinois","Fayette","","Peppermill Creek, 6 miles east of Ramsey. T. 8N, R. 2E, Sect. 20",39.143212,-89.033493,NA,"N",NA,"Y","Not Scorable","","","","PLSS","locality","","JA"
"887",6985287,"MW","ILLS","specimen","Chelone glabra","Chelone","glabra","10/1/1975",1975,10,1,274,1975274,NA,"unknown","unknown","unknown"," "," ","","","Illinois","Hancock","","Calumet Springs, south of Warsaw. T. 4N, R. 9W, Sect. 21",40.3281,-91.440153,90,"N",NA,"Y","Not Scorable","","","","PLSS","town","geolocate","JA"
"888",6985288,"MW","ILLS","specimen","Chelone glabra","Chelone","glabra","9/8/1943",1943,9,8,251,1943251,NA,"unknown","unknown","unknown"," "," ","","same day/close together, NA phenology","Illinois","Henry","","Stumpy swamp 0.5 miles east of Goodrich cabin, south side of Penny Slough.",41.353133,-90.131417,40947,"N",NA,"Y","Not Scorable","","",""," couldn't find locality, used county","county","geolocate","JA"
"889",6985290,"MW","ILLS","specimen","Chelone glabra","Chelone","glabra","9/8/1943",1943,9,8,251,1943251,NA,"unknown","unknown","unknown"," "," ","","same day/close together, NA phenology","Illinois","Henry","","Swamp region, Geneseo.",41.44809,-90.154285,4021,"N",NA,"Y","Not Scorable","","","","","town","geolocate","JA"
"890",6985291,"MW","ILLS","specimen","Chelone glabra","Chelone","glabra","9/10/1943",1943,9,10,253,1943253,NA,"unknown","unknown","unknown"," "," ","","","Illinois","Henry","","Along roadside 9 miles northwest of Geneseo.",41.54024,-90.277312,8720,"N",NA,"Y","Not Scorable","","","","","town+direction+distance","geolocate","JA"
"891",6985292,"MW","ILLS","specimen","Chelone glabra","Chelone","glabra","8/29/1952",1952,8,29,242,1952242,NA,"unknown","unknown","unknown"," "," ","","","Illinois","Jo Daviess","","Apple River Canyon State Park.",42.446849,-90.052894,800,"N",NA,"Y","Not Scorable","","","","","locality","best estimate","JA"
"892",6985293,"MW","ILLS","specimen","Chelone glabra","Chelone","glabra","8/25/1948",1948,8,25,238,1948238,NA,"unknown","unknown","unknown"," "," ","","","Illinois","Kane","","3 miles south of Elburn.",41.848782,-88.472301,7335,"N",NA,"Y","Not Scorable","","","","","town+direction+distance","geolocate","JA"
"893",6985294,"MW","ILLS","specimen","Chelone glabra","Chelone","glabra","9/3/1991",1991,9,3,246,1991246,"flowering","unknown","Y","N"," "," ","","","Illinois","Kane","","Burr Woods Marsh. T. 40N, R. 8E, Sect. 19",41.91418,-88.367099,6954,"N",NA,"Y","Yes","Flowering","","","PLSS,  found thing online that said marsh is 3 miles w of st charles","locality","geolocate","JA"
"894",6985295,"MW","ILLS","specimen","Chelone glabra","Chelone","glabra","9/12/1990",1990,9,12,255,1990255,NA,"unknown","unknown","unknown"," "," ","","","Illinois","Kendall","","0.9 miles east of junction of Illinois Route 71 and US Route 34, north side of Route 34 just east of Waubansee Creek. T. 37N, R. 8E, E1/2 SW1/4 SE1/4 Sect. 9",41.695446,-88.32491,200,"N",NA,"Y","Not Scorable","","","","PLSS","locality","best estimate","JA"
"895",6985296,"MW","ILLS","specimen","Chelone glabra","Chelone","glabra","10/20/1960",1960,10,20,294,1960294,NA,"unknown","unknown","unknown"," "," ","","","Illinois","LaSalle","","Bottomland woods, along Fox River, between Sheridan and Serena.",41.506653,-88.702754,3000,"N",NA,"Y","Not Scorable","","","","","locality","best estimate","JA"
"896",6985297,"MW","ILLS","specimen","Chelone glabra","Chelone","glabra","9/20/1977",1977,9,20,263,1977263,NA,"unknown","unknown","unknown"," "," ","","","Illinois","LaSalle","","Matthiessen State Park.",41.285455,-89.024644,4000,"N",NA,"Y","Not Scorable","","","","","locality","best estimate","JA"
"897",6985298,"MW","ILLS","specimen","Chelone glabra","Chelone","glabra","9/22/1961",1961,9,22,265,1961265,NA,"unknown","unknown","unknown"," "," ","","","Illinois","Lake","","In Wauconda Bog, south of Wauconda.",42.2539,-88.1302,1000,"N",NA,"Y","Not Scorable","","","","","locality","best estimate","JA"
"898",6985299,"MW","ILLS","specimen","Chelone glabra","Chelone","glabra","8/25/1951",1951,8,25,237,1951237,NA,"unknown","unknown","unknown"," "," ","","","Illinois","Lake","","In a ditch, northwest of Wadsworth.",42.428632,-87.923965,6665,"N",NA,"Y","Not Scorable","","","","","town","geolocate","JA"
"899",6985300,"MW","ILLS","specimen","Chelone glabra","Chelone","glabra","10/30/1975",1975,10,30,303,1975303,NA,"unknown","unknown","unknown"," "," ","","","Illinois","Lake","Lake Forest","Lake Forest Garden Club Ravine, Lake Forest. T. 43N, R. 12E, Sect.3",42.258634,-87.840625,5410,"N",NA,"Y","Not Scorable","","","","PLSS couldn't find locality, used town","town","geolocate","JA"
"900",6985301,"MW","ILLS","specimen","Chelone glabra","Chelone","glabra","8/24/1965",1965,8,24,236,1965236,NA,"unknown","unknown","unknown"," "," ","","","Illinois","Lawrence","","Marshland at Billett.",38.664444,-87.652222,3036,"N",NA,"Y","Not Scorable","","","","","town","geolocate","JA"
"901",6985302,"MW","ILLS","specimen","Chelone glabra","Chelone","glabra","10/8/1953",1953,10,8,281,1953281,NA,"unknown","unknown","unknown"," "," ","","","Illinois","McHenry","","In Bay View Farm Bog southeast of Johnsburg.",42.380021,-88.242032,5168,"N",NA,"Y","Not Scorable","","","","couldn't find locality","town","geolocate","JA"
"902",6985303,"MW","ILLS","specimen","Chelone glabra","Chelone","glabra","9/22/1977",1977,9,22,265,1977265,NA,"unknown","unknown","unknown"," "," ","","same day/close together, NA phenology","Illinois","McHenry","","Pistakee Bog Nature Preserve.;T. 45N, R. 9E, Sect. 20",NA,NA,NA,"N",NA,"Y","Not Scorable","","","","","","","JA"
"903",6985304,"MW","ILLS","specimen","Chelone glabra","Chelone","glabra","9/8/1977",1977,9,8,251,1977251,NA,"unknown","unknown","unknown"," "," ","","","Illinois","McHenry","","Chalet Golf Course, Cary. T. 44N, R. 9E, Sect. 31",42.247329,-88.231922,900,"N",NA,"Y","Not Scorable","","","","PLSS","locality","best estimate","JA"
"904",6985305,"MW","ILLS","specimen","Chelone glabra","Chelone","glabra","9/15/1977",1977,9,15,258,1977258,NA,"unknown","unknown","unknown"," "," ","","","Illinois","McHenry","","Spring Grove sedge meadow, just north of US 12, east of Spring Grove. T. 46N, R. 9E, Sect. 30",42.434468,-88.217689,4000,"N",NA,"Y","Not Scorable","","","","PLSS","locality","best estimate","JA"
"905",6985306,"MW","ILLS","specimen","Chelone glabra","Chelone","glabra","9/16/1977",1977,9,16,259,1977259,NA,"unknown","unknown","unknown"," "," ","","","Illinois","McHenry","","Boone Creek Fen, Valley Hill Road, north of Mason Hill road. T. 44N, R. 7E, Sect 7",42.338489,-88.364272,1800,"N",NA,"Y","Not Scorable","","","","PLSS","locality","best estimate","JA"
"906",6985307,"MW","ILLS","specimen","Chelone glabra","Chelone","glabra","9/22/1977",1977,9,22,265,1977265,NA,"unknown","unknown","unknown"," "," ","","same day/close together, NA phenology","Illinois","McHenry","","Southeast corner of Lac Louette. T. 45N, R. 9E, Sect. 19",42.362355,-88.222124,400,"N",NA,"Y","Not Scorable","","","","PLSS","locality","best estimate","JA"
"907",6985308,"MW","ILLS","specimen","Chelone glabra","Chelone","glabra","5/31/1989",1989,5,31,151,1989151,NA,"unknown","unknown","unknown"," "," ","","","Illinois","Ogle","","Just north of Oregon off the west side of Illinois Route 2. T. 24N, R. 10E, NW1/4 NE1/4 SW1/4 NE1/4 Sect. 33",42.041212,-89.344602,1600,"N",NA,"Y","Not Scorable","","","","PLSS","locality","best estimate","JA"
"908",6985309,"MW","ILLS","specimen","Chelone glabra","Chelone","glabra","9/20/1967",1967,9,20,263,1967263,NA,"unknown","unknown","unknown"," "," ","","","Illinois","Pope","","Marshy woods, Massac Tower, southwest of Bay City.",37.248944,-88.496709,3036,"N",NA,"Y","Not Scorable","","","","couldn't find locality","town","geolocate","JA"
"909",6985310,"MW","ILLS","specimen","Chelone glabra","Chelone","glabra","9/18/1957",1957,9,18,261,1957261,NA,"unknown","unknown","unknown"," "," ","","","Illinois","Tazewell","","North of East Peoria.",40.666149,-89.580098,7887,"N",NA,"Y","Not Scorable","","","","","town","geolocate","JA"
"910",6985311,"MW","ILLS","specimen","Chelone glabra","Chelone","glabra","9/29/1949",1949,9,29,272,1949272,NA,"unknown","unknown","unknown"," "," ","","","Illinois","Tazewell","","In a marsh 3 miles north of East Peoria.",40.709626,-89.580098,11431,"N",NA,"Y","Not Scorable","","","","","town+direction+distance","geolocate","JA"
"911",6985313,"MW","ILLS","specimen","Chelone glabra","Chelone","glabra","9/24/1958",1958,9,24,267,1958267,NA,"unknown","unknown","unknown"," "," ","","","Illinois","Woodford","","Swampland near Spring Bay.",40.824481,-89.522315,2000,"N",NA,"Y","Not Scorable","","","","","town","best estimate","JA"
"912",6985314,"MW","ILLS","specimen","Chelone glabra","Chelone","glabra","9/29/1949",1949,9,29,272,1949272,NA,"unknown","unknown","unknown"," "," ","","","Illinois","Woodford","","Marshland 3 miles north of Spring Bay.",40.86169,-89.486591,NA,"N",NA,"Y","Not Scorable","","","","","town+direction+distance","","JA"
"913",6985316,"MW","ILLS","specimen","Chelone glabra","Chelone","glabra","8/9/1980",1980,8,9,222,1980222,NA,"unknown","unknown","unknown"," "," ","","","Maine","Oxford","","Woods by Cupsuptic Lake.",44.991749,-70.831873,5000,"N",NA,"Y","Not Scorable","","","","","locality","best estimate","JA"
"914",6985317,"MW","ILLS","specimen","Chelone glabra","Chelone","glabra","10/13/1965",1965,10,13,286,1965286,NA,"unknown","unknown","unknown"," "," ","","","Michigan","Washtenaw","","Geddes Bridge, Huron River.",42.276718,-83.701754,10000,"N",NA,"Y","Not Scorable","","","","","locality","best estimate","JA"
"915",6985318,"MW","ILLS","specimen","Chelone glabra","Chelone","glabra","8/3/1980",1980,8,3,216,1980216,NA,"unknown","unknown","unknown"," "," ","","","Vermont","","","Red River Pond Recreation Area, Green Mountain National Forest.",43.049672,-73.02965,46000,"N",NA,"Y","Not Scorable","","",""," couldn't find exact locality","locality","best estimate","JA"
"916",6997428,"MW","ILLS","specimen","Chelone glabra","Chelone","glabra","10/2/1991",1991,10,2,275,1991275,NA,"unknown","unknown","unknown"," "," ","","","Illinois","Vermilion","","""Kinney Ford Seep"", 1.3 miles northeast of Collison, north of road on Illinois Department of Conservation property. Collison 7.5 minute quad.T. 21N, R. 13W, SW1/4 SE1/4 Sect. 26",40.24717,-87.796648,2000,"N",NA,"Y","Not Scorable","","","","PLSS","locality","best estimate","JA"
"917",6998063,"MW","ILLS","specimen","Chelone glabra","Chelone","glabra","8/25/1996",1996,8,25,238,1996238,NA,"unknown","unknown","unknown"," "," ","","","Wisconsin","Vilas","","Rice Creek at junction with Route K. 1.8 miles north of Newcomb Lane. UTM Zone 16, 287724mE, 5113272mN.",NA,NA,NA,"N",NA,"Y","Not Scorable","","","","","","","JA"
"918",6998106,"MW","ILLS","specimen","Chelone glabra","Chelone","glabra","9/19/1995",1995,9,19,262,1995262,"flowering","unknown","Y","N"," "," ","","","Illinois","Winnebago","Roscoe","west side of Pleasant Valley Road; Belvidere Northwest 7.5 minute quadrangle.  T. 46N, R. 2E, NE1/4 NE1/4 SE1/4 Sect. 15",42.467858,-88.987846,1200,"N",NA,"Y","Yes","Flowering","","","PLSS","locality","best estimate","JA"
"919",7028623,"MW","ILLS","specimen","Chelone glabra","Chelone","glabra","9/28/1992",1992,9,28,272,1992272,"flowering","unknown","Y","N"," "," ","","","Illinois","Vermilion","","Horseshoe Bottom Nature Preserve. Collison 7.5 minute quadrangle. East side of the Middle Fork of the Vermilion River. T. 21N, R. 12W, SW1/4 Sect. 31",40.229745,-87.753017,900,"N",NA,"Y","Yes","Flowering","","","PLSS","locality","best estimate","JA"
"920",7045315,"MW","ILLS","specimen","Chelone glabra","Chelone","glabra","9/26/2002",2002,9,26,269,2002269,NA,"unknown","unknown","unknown"," "," ","","","Illinois","Lee","","The Green River State Wildlife Area is in the Green River Lowland Section of the Grand Prairie Natural Division of Illinois. TheWildlife Area is about 14 mile directly south of Dixon, Illinois. Harmon 7.5 minute quadrangle. Elevation about 690 feet. T. 19N, R. 8E, N1/2 SW1/4 Sect. 13",41.6396,-89.506289,2600,"N",NA,"Y","Not Scorable","","","","PLSS","locality","best estimate","JA"
"921",7051216,"MW","ILLS","specimen","Chelone glabra","Chelone","glabra","9/9/1997",1997,9,9,252,1997252,"flowering","unknown","Y","N"," "," ","","","Illinois","LaSalle","","Brookfield Spring (spring fed sedge meadow north side of road), in floodplain of the Illinois River south side of the Illinois River. Across Illinois River from Marseilles and then east about 2 miles. Grand Prairie Section of the Grand Prairie Natural Division of Illinois. Elevation about 505 feet. Marseilles 7.5 minute quadrangle. UTM 16, 360310mE, 4573595mN. T. 33N, R. 5E, South Center SW1/4 SE1/4 NE1/4 Sect. 29",41.307209,-88.671559,400,"N",NA,"Y","Yes","Flowering","","","PLSS","locality","best estimate","JA"
"922",7053799,"MW","ILLS","specimen","Chelone glabra","Chelone","glabra","8/2/1961",1961,8,2,214,1961214,NA,"unknown","unknown","unknown"," "," ","","","Michigan","Presque Isle","","Just south of Hackett Lake School.",45.282444,-84.166156,200,"N",NA,"Y","Not Scorable","","","","","locality","best estimate","JA"
"923",7056699,"MW","ILLS","specimen","Chelone glabra","Chelone","glabra","9/3/2003",2003,9,3,246,2003246,NA,"unknown","unknown","unknown"," "," ","","","Illinois","Knox","","Galesburg section of the Western Forest Prairie Division. Jim Ellis property about a mile and a half west of Douglas, IL. Site west of CR1800E and north of RR tracks.  T.9N., R.3E., SE 1/4 Sec. 1",40.787743,-90.111087,1000,"N",NA,"Y","Not Scorable","","","","PLSS","locality","best estimate","JA"
"924",7057498,"MW","ILLS","specimen","Chelone glabra","Chelone","glabra","9/23/2000",2000,9,23,267,2000267,"flowering","unknown","Y","N"," "," ","","","Illinois","Marshall","Lacon","Along Route 26 in the Marshall County Conservation Area. Lacon Township. T. 29N, R. 3W, Sect. 14",41.000707,-89.4251,6000,"N",NA,"Y","Yes","Flowering","","","PLSS","locality","best estimate","JA"
"925",7058219,"MW","ILLS","specimen","Chelone glabra","Chelone","glabra","8/3/1990",1990,8,3,215,1990215,"flowering","unknown","Y","N"," "," ","","","Illinois","Mason","","About 2 mile northeast of Bath, Illinois. Matanzas Prairie Nature Preserve. Illinois River Section of the Illinois and Mississippi River Sand Area Natural Division. Kilbourne Quadrangle.;;T. 20N, R. 9W, NE1/4 Sect. 4; 40.2154, -90.1129",40.2154,-90.1129,NA,"N",NA,"Y","Yes","Flowering","","","","provided","","JA"
"926",7058330,"MW","ILLS","specimen","Chelone glabra","Chelone","glabra","9/21/1990",1990,9,21,264,1990264,"flowering","unknown","Y","N"," "," ","","","Illinois","Mason","","About 2 mile northeast of Bath, Illinois. Matanzas Prairie Nature Preserve. Illinois River Section of the Illinois and Mississippi River Sand Area Natural Division. Kilbourne Quadrangle.;;T. 20N, R. 9W, NE1/4 Sect. 4; 40.2154, -90.1129",40.2154,-90.1129,NA,"N",NA,"Y","Yes","Flowering","","","","provided","","JA"
"927",7065106,"MW","ILLS","specimen","Chelone glabra","Chelone","glabra","9/2/2006",2006,9,2,245,2006245,"flowering","unknown","Y","N"," "," ","","","Illinois","Will","","Wilmington, Braidwood Dunes and Savanna Nature Preserve. 0.8 mile southeast of Braidwood and west of the Bohemian Cemetery. Kankakee Sand Area Section of the Grand Prairie Natural Division. (NAD83/WGS84).;;41.25113, -88.19926",41.25113,-88.19926,NA,"N",NA,"Y","Yes","Flowering","","","","provided","","JA"
"928",7065133,"MW","ILLS","specimen","Chelone glabra","Chelone","glabra","9/5/2006",2006,9,5,248,2006248,"flowering","unknown","Y","N"," "," ","","","Illinois","Cass","","Arenzville East, About 13 mile north of Arenzville, in the floodplain of Prairie Creek. Located in the Carlinville Section of the Western Forest-Prairie Natural Division. (NAD83/WGS84).;;39.90841, -90.37033",39.90841,-90.37033,NA,"N",NA,"Y","Yes","Flowering","","","","provided","","JA"
"929",7065414,"MW","ILLS","specimen","Chelone glabra","Chelone","glabra","9/21/2004",2004,9,21,265,2004265,"flowering","unknown","Y","N"," "," ","","","Illinois","Mason","","Havana Quadrangle, elevation about 450 feet. The Illinois River Section of the Illinois & Mississippi Rivers Bottomlands Natural Division. Growing in a series of seep areas along White Oak Creek. (WGS84/NAD83);;40.2568, 90.08953",40.2568,-90.08953,NA,"N",NA,"Y","Yes","Flowering","","","","provided","","JA"
"930",7066118,"MW","ILLS","specimen","Chelone glabra","Chelone","glabra","9/6/2006",2006,9,6,249,2006249,"flowering","unknown","Y","N"," "," ","","","Illinois","Woodford","","Spring Bay Fen Nature Preserve, about 2 mile south of Spring Bay and 0.75 mile west of Illinois Route 26. East side of the Illinois River. In the Illinois River Section of the Upper Mississippi River and Illinois River Bottomlands Natural Division.;;40.78618, -89.5349",40.78618,-89.5349,NA,"N",NA,"Y","Yes","Flowering","","","","provided","","JA"
"931",7067842,"MW","ILLS","specimen","Chelone glabra","Chelone","glabra","8/27/2004",2004,8,27,240,2004240,"flowering","unknown","Y","N"," "," ","","","Illinois","Ogle","","Oregon. West side of Illinois Route 2, starting 4 meters (13 feet) west of pavement and approximately 128 meters (420 feet) north of Cultra Road. Elevation approximately 210-216 meters.;;T. 24N, R. 10E, SE1/4 NW1/4 [NE1/4 SW1/4] NE1/4 Sect. 33; 42.0396, 89.3413",42.0396,-89.3413,NA,"N",NA,"Y","Yes","Flowering","","","","provided","","JA"
"932",7068106,"MW","ILLS","specimen","Chelone glabra","Chelone","glabra","7/18/2006",2006,7,18,199,2006199,NA,"unknown","unknown","unknown"," "," ","","","Illinois","Cook","Glencoe","Highland Park, Green Bay Trail Bike Path Survey Corridor - Turnbull Woods (Chicago Botanic Garden);;42.14915, -87.78508",42.149896,-87.77045,700,"N",NA,"Y","Not Scorable","","","","","locality","best estimate","JA"
"933",7069940,"MW","ILLS","specimen","Chelone glabra","Chelone","glabra","9/26/2007",2007,9,26,269,2007269,NA,"unknown","unknown","unknown"," "," ","","","Illinois","Woodford","","Spring Bay Fen Nature Preserve. NAD83/WGS84;;40.78634, -89.53503",40.78634,-89.53503,NA,"N",NA,"Y","Not Scorable","","","","","provided","","JA"
"934",7072123,"MW","ILLS","specimen","Chelone glabra","Chelone","glabra","9/2/2005",2005,9,2,245,2005245,NA,"unknown","unknown","unknown"," "," ","","","Illinois","Kendall","","Margin of Big Rock Creek, north side, at powerline clearing crossing, south of Rock Creek Road, west of Hennig Road, Plano. Coordinate Datum: WGS84/NAD83;;41.687056, -88.5125",41.687056,-88.5125,NA,"N",NA,"Y","Not Scorable","","","","","provided","","JA"
"935",7077713,"MW","ILLS","specimen","Chelone glabra","Chelone","glabra","8/28/2008",2008,8,28,241,2008241,"flowering","unknown","Y","N"," "," ","","","Illinois","Will","","Wilmington Shrub Prairie Nature Preserve. 3 miles east of Braidwood (junction of Route 53 & 113) along Route 113, 1.5 mile north on Zilm Road, and then 0.5 mile west. In the Kankakee Sand Area Section of the Grand Prairie Natural Division. Coordinate datum: WGS84/NAD83;;T. 32N, R. 9E, NW1/4 NE1/4 NW1/4 Sect. 11; 41.27505, -88.16465",41.27505,-88.16465,NA,"N",NA,"Y","Yes","Flowering","","","","provided","","JA"
"936",7077849,"MW","ILLS","specimen","Chelone glabra","Chelone","glabra","11/7/2009",2009,11,7,311,2009311,NA,"unknown","unknown","unknown"," "," ","","","Illinois","Piatt","","Weldon East, Robert Allerton Park, near North entrance. Found on south margin of small pond, a short way into trail originating at south end of Foo Garden. Coordinate datum: WGS84/NAD83.;;40.0069, -88.6408",40.0069,-88.6408,NA,"N",NA,"Y","Not Scorable","","","","","provided","","JA"
"937",7079615,"MW","ILLS","specimen","Chelone glabra","Chelone","glabra","9/18/2009",2009,9,18,261,2009261,NA,"unknown","unknown","unknown"," "," ","","","Illinois","Woodford","","El Paso, ParkLands Foundationäó»s Chinquapin Bluffs Preserve; located approximately 5 miles north of Carlock, Illinois. Map Datum: WGS84/NAD83.;;40.66116, -89.11022",40.66116,-89.11022,NA,"N",NA,"Y","Not Scorable","","","","","provided","","JA"
"938",7083743,"MW","ILLS","specimen","Chelone glabra","Chelone","glabra","8/11/2009",2009,8,11,223,2009223,NA,"unknown","unknown","unknown"," "," ","","","Illinois","Lake","","Fox Lake, Turner Lake Sedge Meadow, Chain-o-lakes State Park. CTAP Number: 300017W. In the Morainal Section of the Northeastern Morainal Natural Division of Illinois. Coordinate datum: WGS84/NAD83.;;T. 46N, R. 9E, NE1/4 NW1/4 Sect. 28; 42.44317, 88.19156",42.44317,-88.19156,NA,"N",NA,"Y","Not Scorable","","","","","provided","","JA"
"939",7084990,"MW","ILLS","specimen","Chelone glabra","Chelone","glabra","9/20/2011",2011,9,20,263,2011263,"flowering","unknown","Y","N"," "," ","","","Illinois","LaSalle","","La Salle, Along Clark Run, east of the Oak Hill Cemetery, north Utica, Illinois. Grand Prairie Section of the Grand Prairie Natural Division;;T. 33N, R. 2E, NW1/4 SW1/4 NW1/4 Sect. 9; 41.34922, -89.00938",41.34922,-89.00938,200,"N",NA,"Y","Yes","Flowering","","","","locality","best estimate","JA"
"940",7085023,"MW","ILLS","specimen","Chelone glabra","Chelone","glabra","9/22/2011",2011,9,22,265,2011265,"flowering","unknown","Y","N"," "," ","","","Illinois","Tazewell","","Illinois River Section of the Upper Mississippi River and Illinois River Bottomlands Natural Division. Duck Island, South end of Spring Lake at base of forested dune and spring feeding into Spring Lake, east side of Lake. About 1.1 mile north of 800 North and the Mason - Tazewell county line.;;T. 23N, R. 7W, NE1/4 Sect. 16; 40.44803, -89.89064",40.44803,-89.89064,NA,"N",NA,"Y","Yes","Flowering","","","","provided","","JA"
"941",7085429,"MW","ILLS","specimen","Chelone glabra","Chelone","glabra","10/3/2005",2005,10,3,276,2005276,"flowering","unknown","Y","N"," "," ","","","Illinois","McLean","","McLean, Funks Grove Illinois Natural Areas Inventory (INAI) site. Ewing Grove Tract Buffer Area. WGS 84 map datum; +/- 19.1 ft.;;40.34695, -89.14217",40.355993,-89.13,3000,"N",NA,"Y","Yes","Flowering","","","check location again-couldn't find exact locality","locality","best estimate","JA"
"942",7088918,"MW","ILLS","specimen","Chelone glabra","Chelone","glabra","4/19/2011",2011,4,19,109,2011109,NA,"unknown","unknown","unknown"," "," ","","","Illinois","Fayette","","Vandalia, Approximately 0.2 mile southeast of intersection of Interstate-70 and Route 51, on northeast edge of Vandalia, IL. WGS84/NAD83.;;T. 6N, R. 1E, NW1/4 SE1/4 Sect. 9; 38.97344, -89.092",38.97344,-89.092,NA,"N",NA,"Y","Not Scorable","","","","","provided","","JA"
"943",7094285,"MW","ILLS","specimen","Chelone glabra","Chelone","glabra","8/22/2000",2000,8,22,235,2000235,"flowering","unknown","Y","N"," "," ","","","Illinois","Lee","","Harmon, Green River State Conservation Area. Green River Lowland Section of the Grand Prairie Natural Division. Coordinate Datum: WGS84/NAD83. Large Marsh.;;T. 19N, R. 8E, SW1/4 NW1/4 Sect. 13; 41.63805, -89.5337",41.63805,-89.5337,NA,"N",NA,"Y","Yes","Flowering","","","","provided","","JA"
"944",7095515,"MW","ILLS","specimen","Chelone glabra","Chelone","glabra","8/24/1992",1992,8,24,237,1992237,"flowering","unknown","Y","N"," "," ","","","Illinois","Vermilion","","Collison, Middle Fork State Fish & Wildlife Area. Seep. Along the Middle Fork of the Vermilion River. Vermilion River Section of the Wabash Border Natural Division. Coordinate Datum: WGS84/NAD83.;;T. 20N, R. 12W, NW1/4 Sect. 5; 40.22592, -87.75386",40.22592,-87.75386,NA,"N",NA,"Y","Yes","Flowering","","","","provided","","JA"
"945",7096118,"MW","ILLS","specimen","Chelone glabra","Chelone","glabra","9/23/2001",2001,9,23,266,2001266,NA,"unknown","unknown","unknown"," "," ","","","Virginia","Stafford","","Roadside, near Loblolly and Raven Streets on rte. 621, se. of Brooke.;;38.377483, -77.355916",38.377483,-77.355916,NA,"N",NA,"Y","Not Scorable","","","","","provided","","JA"
"946",15603468,"MW","IND","specimen","Chelone glabra","Chelone","glabra","9/18/1927",1927,9,18,261,1927261,NA,"maybe","maybe","maybe"," "," ","recheck phenology: description says flowering, picture has fruit","","Indiana","Elkhart","","James B. Eaton woods about 3 miles southwest of Middlebury",41.644583,-85.747253,6086,"Y","?","Y","Yes","Fruiting","","","couldn't find locality","town+direction+distance","geolocate","JA"
"947",15603472,"MW","IND","specimen","Chelone glabra","Chelone","glabra","8/27/1920",1920,8,27,240,1920240,"flowering and ?","maybe","Y","maybe"," "," ","recheck phenology: unsure","","Indiana","Elkhart","","5 miles northeast of Elkhart",41.733202,-85.908074,10446,"Y","?","Y","Yes","Flowering","","","","town+direction+distance","geolocate","JA"
"948",15603476,"MW","IND","specimen","Chelone glabra","Chelone","glabra","8/30/1920",1920,8,30,243,1920243,"flowering and fruit","unknown","Y","Y"," "," ","","","Indiana","DeKalb","","0.5 mile south of St. Joe",41.308083,-84.901353,3479,"Y","?","Y","Yes","Both","","","","town+direction+distance","geolocate","JA"
"949",15603480,"MW","IND","specimen","Chelone glabra","Chelone","glabra","9/21/1932",1932,9,21,265,1932265,"flowering and fruit","unknown","Y","Y"," "," ","","","Indiana","Daviess","","ne. corner of Sec. 6 about 1 1/2 mi. southeast of Newberry",38.909669,-86.999688,1636,"Y","?","Y","Yes","Both","","","PLSS","town+direction+distance","geolocate","JA"
"950",15603486,"MW","IND","specimen","Chelone glabra","Chelone","glabra","8/31/1986",1986,8,31,243,1986243,"buds??","Y","N","maybe"," "," ","recheck phenology: very unsure","","Indiana","Crawford","","Yellow Birch Ravine, ca. 1 mi SE of Taswell on road to Mifflin; T2S R1W S19 SE 1/4",38.326113,-86.545564,1700,"Y","?","Y","Yes","Flowering","Early","","PLSS","locality","best estimate","JA"
"951",15603489,"MW","IND","specimen","Chelone glabra","Chelone","glabra","10/7/1923",1923,10,7,280,1923280,"fruit","N","N","Y"," "," ","","","Indiana","Dubois","","Patoka bottoms about 2 miles northwest of Huntingburg",38.319443,-86.981123,5230,"Y","?","Y","Yes","Fruiting","","","","town+direction+distance","geolocate","JA"
"952",15603498,"MW","IND","specimen","Chelone glabra","Chelone","glabra","10/3/1926",1926,10,3,276,1926276,"flowering","unknown","Y","N"," "," ","","","Indiana","Decatur","","3 miles east of Letts",39.235038,-85.508828,6954,"Y","?","Y","Yes","Flowering","","","","town+direction+distance","geolocate","JA"
"953",15603507,"MW","IND","specimen","Chelone glabra","Chelone","glabra","10/17/1917",1917,10,17,290,1917290,"flowering and fruit?","unknown","Y","Y"," "," ","recheck phenology: unsure","","Indiana","Clark","","James Snider farm about 2 miles north of Jeffersonville",38.306567,-85.737185,9065,"Y","?","Y","Yes","Both","","","couldn't find locality","town+direction+distance","geolocate","JA"
"954",15603516,"MW","IND","specimen","Chelone glabra","Chelone","glabra","10/14/1931",1931,10,14,287,1931287,"flowering","unknown","Y","N"," "," ","","","Indiana","Clark","","Fourteen-mile Creek just below where it is crossed by the New Washington and Charlestown Pike",38.463571,-85.617242,2000,"Y","?","Y","Yes","Flowering","","","","locality","best estimate","JA"
"955",15603524,"MW","IND","specimen","Chelone glabra","Chelone","glabra","9/15/1927",1927,9,15,258,1927258,"flowering","unknown","Y","N"," "," ","","","Indiana","Cass","","Henry Ferguson farm about 2 miles west of New Waverly",40.764201,-86.230763,6033,"Y","?","Y","Yes","Flowering","","","couldn't find locality","town+direction+distance","geolocate","JA"
"956",15603528,"MW","IND","specimen","Chelone glabra","Chelone","glabra","9/3/1914",1914,9,3,246,1914246,"flowering and ???","maybe","Y","maybe"," "," ","recheck phenology: very unsure","","Indiana","Carroll","","North of the point where the Delphi-Frankfort Road crosses Wildcat Creek",40.464788,-86.63667,6000,"Y","?","Y","Yes","Flowering","","","","locality","best estimate","JA"
"957",15603533,"MW","IND","specimen","Chelone glabra","Chelone","glabra","9/10/1930",1930,9,10,253,1930253,"flowering","unknown","Y","N"," "," ","","same day/place, same phenology","Indiana","Carroll","","north side of the Wabash River in Sec. 9 about 3 mi. south of Lake Cicott",40.72333,-86.534351,4968,"Y","?","Y","Yes","Flowering","","","PLSS","town+direction+distance","geolocate","JA"
"958",15603540,"MW","IND","specimen","Chelone glabra","Chelone","glabra","9/10/1930",1930,9,10,253,1930253,"flowering","unknown","Y","N"," "," ","","same day/place, same phenology","Indiana","Carroll","","Sec. 9 abou 3 miles south of Lake Cicott",NA,NA,NA,"Y","Y","Y","Yes","Flowering","","","","","","JA"
"959",15603544,"MW","IND","specimen","Chelone glabra","Chelone","glabra","9/18/1922",1922,9,18,261,1922261,"flowering and fruit","unknown","Y","Y"," "," ","","","Indiana","Brown","","Jackson Creek about 1 mile northeast of Belmont",39.16912,-86.341559,4807,"Y","?","Y","Yes","Both","","","","town+direction+distance+locality","geolocate","JA"
"960",15603552,"MW","IND","specimen","Chelone glabra","Chelone","glabra","9/10/1918",1918,9,10,253,1918253,"flowering","unknown","Y","N"," "," ","","","Indiana","Allen","","On the east side of Lake Everett, about 11 miles northwest of Ft. Wayne",41.155193,-85.310598,400,"Y","?","Y","Yes","Flowering","","","","locality","best estimate","JA"
"961",15603557,"MW","IND","specimen","Chelone glabra","Chelone","glabra","8/31/1920",1920,8,31,244,1920244,"flowering","unknown","Y","N"," "," ","","","Indiana","Adams","","5 miles south of the Allen County line and 1 mile west of the Ohio line",40.84858,-84.822831,800,"Y","?","Y","Yes","Flowering","","","","locality","best estimate","JA"
"962",15603636,"MW","IND","specimen","Chelone glabra","Chelone","glabra","9/21/1945",1945,9,21,264,1945264,"flowering and ?","maybe","Y","maybe"," "," ","recheck phenology: unsure","","Indiana","Huntington","","Salamonie River about a mile northeast of Monument City",40.776128,-85.582923,1600,"Y","?","Y","Yes","Flowering","","","","town+direction+distance+locality","best estimate","JA"
"963",15603641,"MW","IND","specimen","Chelone glabra","Chelone","glabra","10/5/1935",1935,10,5,278,1935278,"flowering and fruit","unknown","Y","Y"," "," ","","","Indiana","Howard","","West of Kokomo",40.486427,-86.133603,6378,"Y","?","Y","Yes","Both","","","","town","geolocate","JA"
"964",15603643,"MW","IND","specimen","Chelone glabra","Chelone","glabra","9/12/1927",1927,9,12,255,1927255,"flowering","unknown","Y","N"," "," ","","","Indiana","Henry","","about 2 1/2 miles northeast of Springport",40.073163,-85.360668,1816,"Y","?","Y","Yes","Flowering","","","","town+direction+distance","geolocate","JA"
"965",15603647,"MW","IND","specimen","Chelone glabra","Chelone","glabra","9/4/1914",1914,9,4,247,1914247,"flowering and fruit","unknown","Y","Y"," "," ","","","Indiana","Grant","","5 miles northeast of Fairmount",40.466538,-85.583231,5224,"Y","?","Y","Yes","Both","","","","town+direction+distance","geolocate","JA"
"966",15607743,"MW","IND","specimen","Chelone glabra","Chelone","glabra","9/3/1909",1909,9,3,246,1909246,"flowering and ???","maybe","Y","maybe"," "," ","recheck phenology: very unsure","","Indiana","Grant","","about 3 miles northeast Fairmount",40.446055,-85.610152,4384,"Y","?","Y","Yes","Flowering","","","","town+direction+distance","geolocate","JA"
"967",15607745,"MW","IND","specimen","Chelone glabra","Chelone","glabra","9/21/1928",1928,9,21,265,1928265,"flowering","unknown","Y","N"," "," ","","","Indiana","Fulton","","on the N side of Bruce Lake, 2.5 mi NW of Bruce Lake Station",41.082255,-86.460546,1500,"Y","?","Y","Yes","Flowering","","","s","locality","best estimate","JA"
"968",15607748,"MW","IND","specimen","Chelone glabra","Chelone","glabra","10/3/1916",1916,10,3,277,1916277,"flowering and fruit?","unknown","Y","Y"," "," ","recheck phenology: unsure","","Indiana","Fountain","","Near the Shawnee Bridge over the Wabash River.",40.254819,-87.299628,600,"Y","?","Y","Yes","Both","","","","locality","best estimate","JA"
"969",15607751,"MW","IND","specimen","Chelone glabra","Chelone","glabra","8/1/1953",1953,8,1,213,1953213,"vegetative","N","N","N","Y"," ","","","Indiana","Fountain","","1 mile south of Covington",40.127211,-87.394736,4069,"Y","?","Y","No","","","","","town+direction+distance","geolocate","JA"
"970",15607754,"MW","IND","specimen","Chelone glabra","Chelone","glabra","9/19/1953",1953,9,19,262,1953262,"flowering and ???","maybe","Y","maybe"," "," ","recheck phenology: very unsure","same day/place, same phenology?","Indiana","Fountain","","1 mile south of Covington",40.127211,-87.394736,4069,"Y","?","Y","Yes","Flowering","","","","town+direction+distance","geolocate","JA"
"971",15607756,"MW","IND","specimen","Chelone glabra","Chelone","glabra","9/19/1953",1953,9,19,262,1953262,"flowering","unknown","Y","N"," "," ","","same day/place, same phenology?","Indiana","Fountain","","one mile south of Covington",NA,NA,NA,"Y","Y","Y","Yes","Flowering","","","","","","JA"
"972",15607765,"MW","IND","specimen","Chelone glabra","Chelone","glabra","9/15/1921",1921,9,15,258,1921258,"flowering and fruit","unknown","Y","Y"," "," ","","","Indiana","LaPorte","","6 miles northeast of La Porte",41.672044,-86.640301,6526,"Y","?","Y","Yes","Both","","","","town+direction+distance","geolocate","JA"
"973",15607768,"MW","IND","specimen","Chelone glabra","Chelone","glabra","9/17/1930",1930,9,17,260,1930260,"flowering","unknown","Y","N"," "," ","","","Indiana","Lake","","2 miles north of Hobart",41.561239,-87.255035,10883,"Y","?","Y","Yes","Flowering","","","","town+direction+distance","geolocate","JA"
"974",15607773,"MW","IND","specimen","Chelone glabra","Chelone","glabra","8/30/1914",1914,8,30,242,1914242,"flowering and ?","maybe","Y","maybe"," "," ","recheck phenology: unsure","","Indiana","Lagrange","","Pigeon River in the Sarah Long woods about 2 miles east of Ontario",41.697398,-85.347664,6033,"Y","?","Y","Yes","Flowering","","","couldn't find exact locality","town+direction+distance+locality","geolocate","JA"
"975",15607778,"MW","IND","specimen","Chelone glabra","Chelone","glabra","9/2/1930",1930,9,2,245,1930245,"flowering","unknown","Y","N"," "," ","","same day/close together, same phenology","Indiana","Lagrange","Scott","Kline's, Scott, Ind.",41.740981,-85.555898,2000,"Y","?","Y","Yes","Flowering","","","couldn't find locality, used town","town","best estimate","JA"
"976",15607780,"MW","IND","specimen","Chelone glabra","Chelone","glabra","8/24/1930",1930,8,24,236,1930236,"flowering","unknown","Y","N"," "," ","","","Indiana","Lagrange","Scott","",41.740981,-85.555898,2000,"Y","?","Y","Yes","Flowering","","","","town","best estimate","JA"
"977",15607784,"MW","IND","specimen","Chelone glabra","Chelone","glabra","8/31/1943",1943,8,31,243,1943243,"fruit","N","N","Y"," "," ","","","Indiana","Kosciusko","","North of Webster Lake",41.334132,-85.681423,1400,"Y","?","Y","Yes","Fruiting","","","","locality","best estimate","JA"
"978",15607787,"MW","IND","specimen","Chelone glabra","Chelone","glabra","9/15/1916",1916,9,15,259,1916259,"flowering","unknown","Y","N"," "," ","","","Indiana","Kosciusko","","south side of Tippecanoe Lake",41.326608,-85.763122,2200,"Y","?","Y","Yes","Flowering","","","","locality","best estimate","JA"
"979",15607792,"MW","IND","specimen","Chelone glabra","Chelone","glabra","9/22/1922",1922,9,22,265,1922265,"flowering and fruit","unknown","Y","Y"," "," ","","","Indiana","Jennings","","1 mile south of San Jacinto",38.941948,-85.497186,5241,"Y","?","Y","Yes","Both","","","","town+direction+distance","geolocate","JA"
"980",15607794,"MW","IND","specimen","Chelone glabra","Chelone","glabra","10/4/1947",1947,10,4,277,1947277,"flowering","unknown","Y","N"," "," ","","","Indiana","Jennings","","Illinois Drift Plain, west side of Rd. 3, 4 miles south of Rd. 7",38.802893,-85.52374,13000,"Y","?","Y","Yes","Flowering","","","","locality","best estimate","JA"
"981",15607798,"MW","IND","specimen","Chelone glabra","Chelone","glabra","9/16/1933",1933,9,16,259,1933259,"flowering and fruit??","unknown","Y","Y"," "," ","recheck phenology: very unsure","","Indiana","Jefferson","","Big Creek about 2.5 miles northeast of Ft. Donaldson",41.386766,-86.410047,3826,"Y","?","Y","Yes","Both","","","couldn't find locality","town+direction+distance","geolocate","JA"
"982",15607815,"MW","IND","specimen","Chelone glabra","Chelone","glabra","10/2/1926",1926,10,2,275,1926275,"flowering","unknown","Y","N"," "," ","","","Indiana","Jefferson","","sec. 19, 2 miles east of Foltz",38.785823,-85.438573,28137,"Y","?","Y","Yes","Flowering","","","PLSS","county","geolocate","JA"
"983",15607825,"MW","IND","specimen","Chelone glabra","Chelone","glabra","9/11/1924",1924,9,11,255,1924255,"flowering","unknown","Y","N"," "," ","","","Indiana","Jasper","","along roads",41.022998,-87.116121,37595,"Y","?","Y","Yes","Flowering","","","","county","geolocate","JA"
"984",15607829,"MW","IND","specimen","Chelone glabra","Chelone","glabra","9/27/1919",1919,9,27,270,1919270,"flowering","unknown","Y","N"," "," ","","","Indiana","Jackson","","about 0.5 mile southwest of Vallonia",38.841873,-86.10434,3272,"Y","?","Y","Yes","Flowering","","","","town+direction+distance","geolocate","JA"
"985",15611938,"MW","IND","specimen","Chelone glabra","Chelone","glabra","9/22/1925",1925,9,22,265,1925265,"flowering and ?","maybe","Y","maybe"," "," ","recheck phenology: unsure","","Indiana","Sullivan","","about 2 miles northeast of Merom",39.076929,-87.541123,3051,"Y","?","Y","Yes","Flowering","","","","town+direction+distance","geolocate","JA"
"986",15611940,"MW","IND","specimen","Chelone glabra","Chelone","glabra","9/24/1931",1931,9,24,267,1931267,"flowering and fruit","unknown","Y","Y"," "," ","","","Indiana","Starke","","S side of Koontz Lake",41.41197,-86.47376,1300,"Y","?","Y","Yes","Both","","","","locality","best estimate","JA"
"987",15611945,"MW","IND","specimen","Chelone glabra","Chelone","glabra","9/29/1929",1929,9,29,272,1929272,"flowering and fruit???","unknown","Y","Y"," "," ","recheck phenology: very unsure","","Indiana","Spencer","","3 miles north of Lamar",38.112717,-86.905549,6954,"Y","?","Y","Yes","Both","","","","town+direction+distance","geolocate","JA"
"988",15612006,"MW","IND","specimen","Chelone glabra","Chelone","glabra","9/29/1925",1925,9,29,272,1925272,"flowering and fruit","unknown","Y","Y"," "," ","","","Indiana","Spencer","","near Big Sandy Creek about 1.5 mi N of Grandview",37.954986,-86.969502,3112,"Y","?","Y","Yes","Both","","","","town+direction+distance+locality","geolocate","JA"
"989",15612010,"MW","IND","specimen","Chelone glabra","Chelone","glabra","9/4/1979",1979,9,4,247,1979247,"flowering","unknown","Y","N"," "," ","","same day/place, same phenology","Indiana","Shelby","","along SR44 between Rays Crossing and the Rush-Shelby county line between roadside and abandoned railroad right-of-way",39.562105,-85.650351,2000,"Y","?","Y","Yes","Flowering","","","","locality","best estimate","JA"
"990",15612015,"MW","IND","specimen","Chelone glabra","Chelone","glabra","9/4/1979",1979,9,4,247,1979247,"flowering","unknown","Y","N"," "," ","","same day/place, same phenology","Indiana","Shelby","","Along SR44 between Rays Crossing and the Rush-Shelby county line;ditch between roadside and railroad right of way",NA,NA,NA,"Y","Y","Y","Yes","Flowering","","","","","","JA"
"991",15612018,"MW","IND","specimen","Chelone glabra","Chelone","glabra","9/14/1929",1929,9,14,257,1929257,"flowering","unknown","Y","N"," "," ","","","Indiana","Saint Joseph","","Kane's woods about 3 1/2 mi. southeast of North Liberty",41.498341,-86.379327,3016,"Y","?","Y","Yes","Flowering","","","couldn't find locality","town+direction+distance","geolocate","JA"
"992",15612022,"MW","IND","specimen","Chelone glabra","Chelone","glabra","9/2/1944",1944,9,2,246,1944246,"flowering","unknown","Y","N"," "," ","","same day/close together, same phenology","Indiana","Randolph","","farm of Park Anderson in the center of Sec.36, 7 miles south of Union City",40.100537,-84.809129,10483,"Y","?","Y","Yes","Flowering","","","PLSS,  couldn't find exact locality","town+direction+distance","geolocate","JA"
"993",15612025,"MW","IND","specimen","Chelone glabra","Chelone","glabra","9/14/1923",1923,9,14,257,1923257,"flowering","unknown","Y","N"," "," ","","","Indiana","Porter","","just south of the dunes and 2 miles east of Tremont",41.648643,-87.004861,6033,"Y","?","Y","Yes","Flowering","","","","town+direction+distance","geolocate","JA"
"994",15612026,"MW","IND","specimen","Chelone glabra","Chelone","glabra","11/14/1930",1930,11,14,318,1930318,"flowering","unknown","Y","N"," "," ","","","Indiana","Porter","","in the Dunes State Park near the Tremont Inn",41.668492,-87.020173,10000,"Y","?","Y","Yes","Flowering","","","couldn't find exact locality","locality","best estimate","JA"
"995",15612028,"MW","IND","specimen","Chelone glabra","Chelone","glabra","9/3/1954",1954,9,3,246,1954246,"flowering","unknown","Y","N"," "," ","","","Indiana","Parke","","two mile southwest of Grange Corner",39.919119,-87.213544,3000,"Y","?","Y","Yes","Flowering","","","","locality","best estimate","JA"
"996",15612029,"MW","IND","specimen","Chelone glabra","Chelone","glabra","9/22/1917",1917,9,22,265,1917265,"flowering","unknown","Y","N"," "," ","","","Indiana","Owen","","about 5 mi SE of Spencer",39.235443,-86.69629,5228,"Y","?","Y","Yes","Flowering","","","","town+direction+distance","geolocate","JA"
"997",15612031,"MW","IND","specimen","Chelone glabra","Chelone","glabra","8/25/1914",1914,8,25,237,1914237,"flowering","unknown","Y","N"," "," ","","","Indiana","Noble","","west side of Deep Lake about 1 mile south of Wolf Lake",41.331293,-85.48199,3000,"Y","?","Y","Yes","Flowering","","","wolf lake isn’t south of deep lake","locality","best estimate","JA"
"998",15612033,"MW","IND","specimen","Chelone glabra","Chelone","glabra","9/7/1929",1929,9,7,250,1929250,"flowering and ???","maybe","Y","maybe"," "," ","recheck phenology: very unsure","","Indiana","Montgomery","","Sugar Creek about 1 mi. west of Darlington",40.110977,-86.791262,3179,"Y","?","Y","Yes","Flowering","","","","town+direction+distance+locality","geolocate","JA"
"999",15612034,"MW","IND","specimen","Chelone glabra","Chelone","glabra","9/13/1930",1930,9,13,256,1930256,"flowering","unknown","Y","N"," "," ","","same day/place, same phenology","Indiana","Morgan","Waverly","",39.556992,-86.271379,3036,"Y","?","Y","Yes","Flowering","","","","town","geolocate","JA"
"1000",15612036,"MW","IND","specimen","Chelone glabra","Chelone","glabra","9/8/1931",1931,9,8,251,1931251,"flowering","unknown","Y","N"," "," ","","","Indiana","Monroe","","Salt Creek Township, Station C.",39.119686,-86.39853,7300,"Y","Y","Y","Yes","Flowering","","","couldn't find locality, used town","town","best estimate","JA"
"1001",15612037,"MW","IND","specimen","Chelone glabra","Chelone","glabra","9/1/1930",1930,9,1,244,1930244,"flowering","unknown","Y","N"," "," ","","","Indiana","Monroe","Bloomington","Salt Creek, Bloomington",39.064792,-86.440495,14000,"Y","?","Y","Yes","Flowering","","","","locality","best estimate","JA"
"1002",15612039,"MW","IND","specimen","Chelone glabra","Chelone","glabra","9/14/1930",1930,9,14,257,1930257,"flowering","unknown","Y","N"," "," ","","","Indiana","Monroe","Bloomington","Salt Creek, Bloomington, Ind.",39.064792,-86.440495,14000,"Y","?","Y","Yes","Flowering","","","","locality","best estimate","JA"
"1003",15612040,"MW","IND","specimen","Chelone glabra","Chelone","glabra","9/11/1928",1928,9,11,255,1928255,"flowering","unknown","Y","N"," "," ","","","Indiana","Miami","","about 1/2 mile south of Reserve",40.653313,-86.142993,42000,"Y","?","Y","Yes","Flowering","","","assuming reserve is air force reserve, but used uncertainty for county","locality","best estimate","JA"
"1004",15612042,"MW","IND","specimen","Chelone glabra","Chelone","glabra","9/14/1921",1921,9,14,257,1921257,"flowering","unknown","Y","N"," "," ","","","Indiana","Marshall","","SW side of Lake Maxinkuckee",41.190606,-86.409771,1700,"Y","?","Y","Yes","Flowering","","","","locality","best estimate","JA"
"1005",15612047,"MW","IND","specimen","Chelone glabra","Chelone","glabra","9/11/1916",1916,9,11,255,1916255,"flowering","unknown","Y","N"," "," ","","","Indiana","Whitley","","south side of Blue River Lake",41.237378,-85.360598,37000,"Y","?","Y","Yes","Flowering","","","not sure if right lake, so used uncertainty for county","locality","best estimate","JA"
"1006",15612049,"MW","IND","specimen","Chelone glabra","Chelone","glabra","9/12/1905",1905,9,12,255,1905255,"flowering and ?","maybe","Y","maybe"," "," ","recheck phenology: unsure","","Indiana","Wells","","Winter's woods .25 mi. south of Bluffton",40.735035,-85.171637,5004,"Y","?","Y","Yes","Flowering","","","couldn't find locality","town+direction+distance","geolocate","JA"
"1007",15612054,"MW","IND","specimen","Chelone glabra","Chelone","glabra","7/25/1897",1897,7,25,206,1897206,"flowering","unknown","Y","N"," "," ","","","Indiana","Wells","","1/2 mile south of Bluffton",40.731412,-85.171637,5289,"Y","?","Y","Yes","Flowering","","","","town+direction+distance","geolocate","JA"
"1008",15612058,"MW","IND","specimen","Chelone glabra","Chelone","glabra","9/2/1910",1910,9,2,245,1910245,"flowering","unknown","Y","N"," "," ","","same day/place, same phenology","Indiana","Wayne","","0.75 miles south of Williamsburg",39.940009,-84.996352,3510,"Y","?","Y","Yes","Flowering","","","","town+direction+distance","geolocate","JA"
"1009",15612573,"MW","IND","specimen","Chelone glabra","Chelone","glabra","9/2/1910",1910,9,2,245,1910245,"flowering","unknown","Y","N"," "," ","","same day/place, same phenology","Indiana","Wayne","","about 3/4 mile south of Williamsburg",NA,NA,NA,"Y","Y","Y","Yes","Flowering","","","","","","JA"
"1010",15612577,"MW","IND","specimen","Chelone glabra","Chelone","glabra","9/15/1920",1920,9,15,259,1920259,"flowering","unknown","Y","N"," "," ","","","Indiana","Warren","","Pine Creek about 1.5 miles south of Rainsville",40.397758,-87.328435,4260,"Y","?","Y","Yes","Flowering","","","","town+direction+distance","geolocate","JA"
"1011",15612580,"MW","IND","specimen","Chelone glabra","Chelone","glabra","9/16/1926",1926,9,16,259,1926259,"flowering","unknown","Y","N"," "," ","","","Indiana","Wabash","","3 1/2 mi. south of Disko",40.951546,-85.944436,6272,"Y","?","Y","Yes","Flowering","","","","town+direction+distance","geolocate","JA"
"1012",15612586,"MW","IND","specimen","Chelone glabra","Chelone","glabra","9/23/1982",1982,9,23,266,1982266,"flowering","unknown","Y","N"," "," ","","","Indiana","Wabash","","2 miles No. of No. Man - T30N, R7E, S20, NE1/4",41.029583,-85.768597,6124,"Y","?","Y","Yes","Flowering","","","PLSS","town+direction+distance","geolocate","JA"
"1013",15612588,"MW","IND","specimen","Chelone glabra","Chelone","glabra","9/13/1993",1993,9,13,256,1993256,"flowering","unknown","Y","N"," "," ","","","Indiana","Wabash","","Swank Creek floodplain; T30N R7E Sec. 28, NW 1/4",41.030527,-85.760046,2000,"Y","?","Y","Yes","Flowering","","","PLSS","locality","best estimate","JA"
"1014",15612596,"MW","IND","specimen","Chelone glabra","Chelone","glabra","9/18/1915",1915,9,18,261,1915261,"flowering and fruit","unknown","Y","Y"," "," ","","","Indiana","Union","","1 mi. north and 1 mi. east of Philomath",39.738429,-84.996947,5241,"Y","?","Y","Yes","Both","","","","town+direction+distance","geolocate","JA"
"1015",15612604,"MW","IND","specimen","Chelone glabra","Chelone","glabra","9/3/1902",1902,9,3,246,1902246,"flowering","unknown","Y","N"," "," ","","","Indiana","Tippecanoe","","south of Iron Bridge over Wildcat Creek",40.437074,-86.803869,15000,"Y","?","Y","Yes","Flowering","","","couldn't find exact locality","locality","best estimate","JA"
"1016",15612609,"MW","IND","specimen","Chelone glabra","Chelone","glabra","9/11/1930",1930,9,11,254,1930254,"flowering and ???","maybe","Y","maybe"," "," ","recheck phenology: very unsure","same day/close together, different phenology?","Indiana","Tippecanoe","","about 2 mi S of Battle Ground",40.479383,-86.841676,5714,"Y","?","Y","Yes","Flowering","","","","town+direction+distance","geolocate","JA"
"1017",15612616,"MW","IND","specimen","Chelone glabra","Chelone","glabra","9/20/1953",1953,9,20,263,1953263,"flowering","unknown","Y","N"," "," ","","same day/place, same phenology","Indiana","Tippecanoe","","three miles west of West Point",NA,NA,NA,"Y","Y","Y","Yes","Flowering","","","","","","JA"
"1018",15612621,"MW","IND","specimen","Chelone glabra","Chelone","glabra","9/20/1953",1953,9,20,263,1953263,"flowering","unknown","Y","N"," "," ","","same day/place, same phenology","Indiana","Tippecanoe","","3 miles west of West Point",40.345524,-87.099898,2000,"Y","?","Y","Yes","Flowering","","","","town+direction+distance","best estimate","JA"
"1019",15613192,"MW","IND","specimen","Chelone glabra","Chelone","glabra","9/18/1926",1926,9,18,261,1926261,"flowering","unknown","Y","N"," "," ","","","Quebec","","","cartierville, bois humides su bord de la riviere",NA,NA,NA,"Y","Y","Y","Yes","Flowering","","","","","","JA"
"1020",15613198,"MW","IND","specimen","Chelone glabra","Chelone","glabra","8/28/1933",1933,8,28,240,1933240,"flowering","unknown","Y","N"," "," ","","same day/place, same phenology","Tennessee","Claiborne","","powell river bank near virginia state line",36.597198,-83.321529,5000,"Y","Y","Y","Yes","Flowering","","","","locality","best estimate","JA"
"1021",15613200,"MW","IND","specimen","Chelone glabra","Chelone","glabra","9/12/1928",1928,9,12,256,1928256,"flowering","unknown","Y","N"," "," ","","","Pennsylvania","Butler","","along Connoquenessing creek, at Ribold, on BcD R.R.",40.798183,-79.99253,200,"Y","Y","Y","Yes","Flowering","","","","provided","provided","JA"
"1022",15613202,"MW","IND","specimen","Chelone glabra","Chelone","glabra","9/18/1926",1926,9,18,261,1926261,"flowering","unknown","Y","N"," "," ","","same day/place, some have different phenology","Pennsylvania","Delaware","Darling","along chester creek s.w. of station",NA,NA,NA,"Y","Y","Y","Yes","Flowering","","","","","","JA"
"1023",15613203,"MW","IND","specimen","Chelone glabra","Chelone","glabra","9/23/1957",1957,9,23,266,1957266,"flowering","unknown","Y","N"," "," ","","","North Carolina","Transylvania","","us highway 276 near looking glass falls",35.296341,-82.769516,300,"Y","Y","Y","Yes","Flowering","","","","locality","best estimate","JA"
"1024",15613204,"MW","IND","specimen","Chelone glabra","Chelone","glabra","8/26/1929",1929,8,26,238,1929238,"flowering and ?","maybe","Y","maybe"," "," ","recheck phenology: unsure","","Michigan","","","bass lake",NA,NA,NA,"Y","Y","Y","Yes","Flowering","","","not specific enough","","","JA"
"1025",15613206,"MW","IND","specimen","Chelone glabra","Chelone","glabra","8/26/1926",1926,8,26,238,1926238,"flowering","unknown","Y","N"," "," ","","","Michigan","","","bass lake",NA,NA,NA,"Y","Y","Y","Yes","Flowering","","","not specific enough","","","JA"
"1026",15613208,"MW","IND","specimen","Chelone glabra","Chelone","glabra","10/10/1941",1941,10,10,283,1941283,"flowering and ?","maybe","Y","maybe"," "," ","recheck phenology: unsure","","Kentucky","Whitley","","base of wooded slope along the cumberland river near the falls",36.838097,-84.343683,800,"Y","Y","Y","Yes","Flowering","","","","locality","best estimate","JA"
"1027",15613211,"MW","IND","specimen","Chelone glabra","Chelone","glabra","9/27/1940",1940,9,27,271,1940271,"flowering","unknown","Y","N"," "," ","","same day/place, different phenology?","Kentucky","Letcher","Whitesburg","",37.118432,-82.826826,3410,"Y","Y","Y","Yes","Flowering","","","","town","geolocate","JA"
"1028",14455062,"MW","KE","specimen","Chelone glabra","Chelone","glabra","8/22/1960",1960,8,22,235,1960235,"flowering","unknown","Y","N"," "," ","","","Ohio","Stark","Plain","Swamp, Plain Twp. Sec. 27 along Nimishillen Creek.",40.839472,-81.407373,3300,"N",NA,"Y","Yes","Flowering","","","PLSS","locality","best estimate","JA"
"1029",14455113,"MW","KE","specimen","Chelone glabra","Chelone","glabra","9/12/1960",1960,9,12,256,1960256,"flowering","unknown","Y","N"," "," ","","","Ohio","Stark","Jackson","Bog, Jackson Twp., E 1/2 Sec. 20.",40.866551,-81.4938,7700,"N",NA,"Y","Yes","Flowering","","","PLSS","town","best estimate","JA"
"1030",14456964,"MW","KE","specimen","Chelone glabra","Chelone","glabra","8/28/1982",1982,8,28,240,1982240,"flowering","unknown","Y","N"," "," ","","","Ohio","Hocking","Laurel","Wet marshy depressions on bottoms; Crane Hollow, 10 mi SW of Logan, E 1/2 S33, T12N R18W, Laurel Twp.",39.466803,-82.572899,1000,"N",NA,"Y","Yes","Flowering","","","","PLSS","best estimate","JA"
"1031",14456990,"MW","KE","specimen","Chelone glabra","Chelone","glabra","9/8/1979",1979,9,8,251,1979251,"flowering","unknown","Y","N"," "," ","","","Ohio","Stark","Lawrence","Frequent; calcareous seepage area on S side of sandy hill, E of Ohio-Erie Canal, S of Butterbridge Rd., S 1/2 Sec. 23, Lawrence Twp.",40.859065,-81.556209,2000,"N",NA,"Y","Yes","Flowering","","","PLSS","locality","best estimate","JA"
"1032",14460220,"MW","KE","specimen","Chelone glabra","Chelone","glabra","9/10/1979",1979,9,10,253,1979253,"flowering","unknown","Y","N"," "," ","","","Ohio","Clark","Springfield","ODNR Flora of Ohio; frequent; fen along small stream; E, Redmond Rd., 0.15 mi S, US. Rt. 40, Sect. 5, Springfield Twp.",39.923053,-83.704113,1600,"N",NA,"Y","Yes","Flowering","","","PLSS","locality","best estimate","JA"
"1033",14460855,"MW","KE","specimen","Chelone glabra","Chelone","glabra","9/20/1976",1976,9,20,264,1976264,"flowering","unknown","Y","N"," "," ","","","Ohio","Jackson","Liberty","Swampy woods along stream; ""White's Gulf""; Co. Rt. 25, 1 1/2 mi SE, Co. Rt. 58, Sect. 17, Liberty Twp.",39.072188,-82.727262,6000,"N",NA,"Y","Yes","Flowering","","","PLSS,  couldn't find exact locality","locality","best estimate","JA"
"1034",14461546,"MW","KE","specimen","Chelone glabra","Chelone","glabra","9/19/1977",1977,9,19,262,1977262,"flowering","unknown","Y","N"," "," ","","","Ohio","Trumbull","","Frequent on gorge bottom, Mill Creek Gorge, 2 mi N of Mesopotamia, NW 1/4 Mesopotamia Twp.",41.48835,-80.954338,6033,"N",NA,"Y","Yes","Flowering","","","PLSS","town+direction+distance+locality","geolocate","JA"
"1035",14462929,"MW","KE","specimen","Chelone glabra","Chelone","glabra","8/26/1967",1967,8,26,238,1967238,"flowering","unknown","Y","N"," "," ","","","Ohio","Geauga","","Growing at NE edge of Geauga Lake",41.350578,-81.370735,300,"N",NA,"Y","Yes","Flowering","","","","locality","best estimate","JA"
"1036",14463340,"MW","KE","specimen","Chelone glabra","Chelone","glabra","8/23/1978",1978,8,23,235,1978235,"flowering","unknown","Y","N"," "," ","","","Ohio","Portage","Nelson","Common; moist roadside ditch on N side of Newell's Ledges, SW corner of the intersection of Twp. Rd. 295 and Co. Rd. 297, NW 1/4 Sec. 46, Nelson Twp.",41.333432,-81.036242,1000,"N",NA,"Y","Yes","Flowering","","","PLSS,  couldn't find exact locality","locality","best estimate","JA"
"1037",14463642,"MW","KE","specimen","Chelone glabra","Chelone","glabra","8/19/1965",1965,8,19,231,1965231,"flowering","unknown","Y","N"," "," ","","","Ohio","Medina","Sharon","Marsh, St. Rt. 162, 1 mi E Sharon Center, Sharon Twp.",41.093766,-81.71879,700,"N",NA,"Y","Yes","Flowering","","","","locality","best estimate","JA"
"1038",14463828,"MW","KE","specimen","Chelone glabra","Chelone","glabra","8/31/1972",1972,8,31,244,1972244,"flowering","unknown","Y","N"," "," ","","","Ohio","Ashtabula","Windsor","among rubble under campfire circle; 4-H Camp Whitewood, Wiswell Rd., 0.5 mi S US Rt. 322, Windsor twp",41.528351,-80.966482,500,"N",NA,"Y","Yes","Flowering","","","","locality","best estimate","JA"
"1039",14465620,"MW","KE","specimen","Chelone glabra","Chelone","glabra","8/12/1969",1969,8,12,224,1969224,"flowering","unknown","Y","N"," "," ","","","Quebec","Nicolet","","Moist, weedy ground at edge of concrete bridge base, SW side of intersection of Rt. 3 and River Godefroy, ca. 3 mi W of Laval (St. Angele de Laval), Comte de Nicolet, Quebec.",NA,NA,NA,"N",NA,"Y","Yes","Flowering","","","","","","JA"
"1040",14466628,"MW","KE","specimen","Chelone glabra","Chelone","glabra","8/25/2002",2002,8,25,237,2002237,"flowering","unknown","Y","N"," "," ","","","Ohio","Portage","","Jennings Woods off of McCormick Rd. NE of Ravenna; near front of property. Infrequent. Semi-disturbed floodplain.",41.177479,-81.1727,4000,"N",NA,"Y","Yes","Flowering","","","","locality","best estimate","JA"
"1041",14466653,"MW","KE","specimen","Chelone glabra","Chelone","glabra","8/31/1977",1977,8,31,243,1977243,"flowering","unknown","Y","N"," "," ","","","Ohio","Wayne","Milton","Infrequent; marshy area between Twp. Rd. 427 and RR tracks, NE 1/4 Sec. 8, Milton Twp.",40.967767,-81.841164,900,"N",NA,"Y","Yes","Flowering","","","PLSS","locality","best estimate","JA"
"1042",14466959,"MW","KE","specimen","Chelone glabra","Chelone","glabra","8/9/1967",1967,8,9,221,1967221,"flowering","unknown","Y","N"," "," ","","","West Virginia","Greenbrier","","Rich, moist roadside ditch at entrance to Summit Lake along dirt road leading from Rt. 39, about 12 mi W of Mill Point",38.247532,-80.437123,2000,"N",NA,"Y","Yes","Flowering","","","","locality","best estimate","JA"
"1043",14467132,"MW","KE","specimen","Chelone glabra","Chelone","glabra","9/6/1978",1978,9,6,249,1978249,"flowering","unknown","Y","N"," "," ","","","Ohio","Miami","Bethel","ODNR Flora of Ohio; frequent; fen on N & W sides of Silver Lake; W, Scarff Rd., S 1/2 Sect. 6, Bethel Twp.",39.957135,-84.055476,600,"N",NA,"Y","Yes","Flowering","","","PLSS","locality","best estimate","JA"
"1044",14467225,"MW","KE","specimen","Chelone glabra","Chelone","glabra","9/3/1991",1991,9,3,246,1991246,"flowering and fruit","unknown","Y","Y"," "," ","","","Ohio","Columbiana","Knox","Frequent, roadside, low wet area, W side of Twelfth St, Twp Rd 708; 0.1 mi N of Mountz Rd, Twp Rd 808; SE 1/4 Sect 34, Knox Twp.",40.815737,-81.015989,2000,"N",NA,"Y","Yes","Both","","","PLSS","locality","best estimate","JA"
"1045",14467854,"MW","KE","specimen","Chelone glabra","Chelone","glabra","9/21/1967",1967,9,21,264,1967264,"flowering","unknown","Y","N"," "," ","","","Ohio","Carroll","Brown","Along stream in rich woods; St Rt 171, 0.25 mi SE, Stark County line, NW 1/4 of Sect 26, Brown Twp.",40.719624,-81.212575,11000,"N",NA,"Y","Yes","Flowering","","","PLSS,  couldn't find exact locality","locality","best estimate","JA"
"1046",14467899,"MW","KE","specimen","Chelone glabra","Chelone","glabra","9/18/1956",1956,9,18,262,1956262,"flowering","unknown","Y","N"," "," ","","","Iowa","Clinton","Hampshire","Rich, seeping marsh surrounded by woods, SE 1/4 Sec. 2, Hampshire Twp.",NA,NA,NA,"N",NA,"Y","Yes","Flowering","","","PLSS","","","JA"
"1047",14469538,"MW","KE","specimen","Chelone glabra","Chelone","glabra","8/10/1966",1966,8,10,222,1966222,"flowering","unknown","Y","N"," "," ","","","Maine","Hancock","Seal Harbor","Open, marshy slope in city park at Seal Harbor on Mount Desert Island.",44.303136,-68.240292,3036,"N",NA,"Y","Yes","Flowering","",""," couldn't find locality, used town","town","geolocate","JA"
"1048",14470098,"MW","KE","specimen","Chelone glabra","Chelone","glabra","9/15/1965",1965,9,15,258,1965258,"flowering and fruit","unknown","Y","Y"," "," ","","","North Carolina","Avery","","Moist, weedy roadside along Rt. 194, 2 mi SE of Elk Park. ",36.140596,-81.948877,3036,"N",NA,"Y","Yes","Both","","","","town+direction+distance+locality","geolocate","JA"
"1049",14470329,"MW","KE","specimen","Chelone glabra","Chelone","glabra","9/15/1960",1960,9,15,259,1960259,"flowering","unknown","Y","N"," "," ","","","Ohio","Columbiana","Yellow Creek","Rocky ground along creek running through rich, wooded ravine, SW 1/4 Sec. 24, Yellow Creek Twp.",40.574509,-80.667575,3036,"N",NA,"Y","Yes","Flowering","","","PLSS","town","geolocate","JA"
"1050",14470341,"MW","KE","specimen","Chelone glabra","Chelone","glabra","8/18/1933",1933,8,18,230,1933230,"flowering","unknown","Y","N"," "," ","","","Ohio","Geauga","","",41.499542,-81.178655,31345,"N",NA,"Y","Yes","Flowering","","","","county","geolocate","JA"
"1051",14470416,"MW","KE","specimen","Chelone glabra","Chelone","glabra","9/23/1973",1973,9,23,266,1973266,"flowering","unknown","Y","N"," "," ","","","Ohio","Knox","Middlebury","Open, wet, roadside ditch along Markley Run, 1/2 mi E of Palmyra, NE 1/4 Sec. 6, Middlebury Twp.",40.536888,-82.534204,3479,"N",NA,"Y","Yes","Flowering","","","PLSS","town+direction+distance+locality","geolocate","JA"
"1052",14471122,"MW","KE","specimen","Chelone glabra","Chelone","glabra","9/4/1964",1964,9,4,248,1964248,"flowering","unknown","Y","N"," "," ","","","Ohio","Columbiana","Butler","In shaded ground near bog meadow at ""Watercress Marsh,"" 6 mi SW of Salem, along Rt. 9, Secs. 33 & 34, Butler Twp.",40.820176,-80.919427,700,"N",NA,"Y","Yes","Flowering","","","PLSS","locality","best estimate","JA"
"1053",14472588,"MW","KE","specimen","Chelone glabra","Chelone","glabra","8/27/1966",1966,8,27,239,1966239,"flowering","unknown","Y","N"," "," ","","","Virginia","Madison","","Common in swampy area of the Big Meadows, E of the Skyline Drive, Shenandoah National Park.",38.525131,-78.41988,2000,"N",NA,"Y","Yes","Flowering","","","","locality","best estimate","JA"
"1054",14473243,"MW","KE","specimen","Chelone glabra","Chelone","glabra","9/25/1980",1980,9,25,269,1980269,"flowering","unknown","Y","N"," "," ","","","Ohio","Ashland","Hanover","Scarce; moist hemlock wooded ravine sides and floodplains on S side of Clear Fork by Lyons Falls Trail, Mohican State Park, SE 1/4 Sec. 7, Hanover twp",40.616017,-82.320049,500,"N",NA,"Y","Yes","Flowering","","","PLSS","locality","best estimate","JA"
"1055",14474106,"MW","KE","specimen","Chelone glabra","Chelone","glabra","10/18/1976",1976,10,18,292,1976292,"fruit","N","N","Y"," "," ","","","Ohio","Shelby","Orange","seepage area above Great Miami River; Co. Rt. 25A bridge, S limits of Sidney, Sect. 1, Orange Twp.",40.265653,-84.157259,200,"N",NA,"Y","Yes","Fruiting","","","PLSS","locality","best estimate","JA"
"1056",14475616,"MW","KE","specimen","Chelone glabra","Chelone","glabra","8/30/1970",1970,8,30,242,1970242,"flowering","unknown","Y","N"," "," ","","same day/close together, same phenology","Ohio","Holmes","Washington","Open marsh, Twp. Rt. 273, 1/4 mi SW of jct. with Co. Rt. 22, SE 1/4 Sec. 4, Washington Twp.",40.622481,-82.172289,3000,"N",NA,"Y","Yes","Flowering","","","PLSS,  couldn't find exact locality","locality","best estimate","JA"
"1057",14476301,"MW","KE","specimen","Chelone glabra","Chelone","glabra","9/15/1965",1965,9,15,258,1965258,"flowering","unknown","Y","N"," "," ","","","Ohio","Jefferson","Island Creek","Low, shaded ground in N-facing side gorge of Island Creek behind Tenney Farm, Co. Rt. 56, 1 mi W, Costonia, Sect. 34, Island Creek Twp.",40.430152,-80.637502,3000,"N",NA,"Y","Yes","Flowering","","","PLSS,  couldn't find exact locality","locality","best estimate","JA"
"1058",14476428,"MW","KE","specimen","Chelone glabra","Chelone","glabra","8/29/1973",1973,8,29,241,1973241,"flowering","unknown","Y","N"," "," ","","","Ohio","Portage","Streetsboro","Cattail fen; Frame Farm Preserve, 2000 ft E Seasons Rd, 2500 ft N Ravenna Rd, Streetsboro Twp.",41.239223,-81.34594,6786,"N",NA,"Y","Yes","Flowering","",""," couldn't find locality, used town","town","geolocate","JA"
"1059",14476684,"MW","KE","specimen","Chelone glabra","Chelone","glabra","7/30/1967",1967,7,30,211,1967211,"vegetative","N","N","N","Y"," ","","","Maine","Hancock","Seal Harbor","Open, marshy slope in city park at Seal Harbor on Mount Desert Island.",44.303136,-68.240292,3036,"N",NA,"Y","No","","",""," couldn't find locality, used town","town","geolocate","JA"
"1060",14477628,"MW","KE","specimen","Chelone glabra","Chelone","glabra","10/8/1981",1981,10,8,281,1981281,"flowering","unknown","Y","N"," "," ","","","Ohio","Lawrence","","Pine Creek",38.525317,-82.359064,1400,"N",NA,"Y","Yes","Flowering","","","","locality","best estimate","JA"
"1061",14478376,"MW","KE","specimen","Chelone glabra","Chelone","glabra","9/16/1986",1986,9,16,259,1986259,"flowering","unknown","Y","N"," "," ","","","Ohio","Lake","North Perry","Rare; wet area in rich woods, S Lockwood Rd., N of east-west power lines; between Antioch Rd. and Perry Power Plant, 1 mi N US Rt. 20, North Perry.",41.807728,-81.12768,600,"N",NA,"Y","Yes","Flowering","","","","locality","best estimate","JA"
"1062",14478708,"MW","KE","specimen","Chelone glabra","Chelone","glabra","9/20/1960",1960,9,20,264,1960264,"flowering and fruit","unknown","Y","Y"," "," ","","","Ohio","Portage","Streetsboro","Weedy Sphagnum bog, 2 mi W of Streetsboro, near Rt. 303, Streetsboro Twp.",41.239216,-81.384482,9611,"N",NA,"Y","Yes","Both","","","","town+direction+distance+locality","geolocate","JA"
"1063",14479770,"MW","KE","specimen","Chelone glabra","Chelone","glabra","9/5/1974",1974,9,5,248,1974248,"flowering","unknown","Y","N"," "," ","","","Ohio","Knox","Hilliar","Frequent in small marsh; Twp. Rt. 108, 1/2 mi W of jct. with St. Rt. 314, NE 1/4 Sec. 2, Hilliar Twp.",40.338544,-82.700492,800,"N",NA,"Y","Yes","Flowering","","","PLSS","locality","best estimate","JA"
"1064",14481594,"MW","KE","specimen","Chelone glabra","Chelone","glabra","9/24/1966",1966,9,24,267,1966267,"flowering","unknown","Y","N"," "," ","","","North Carolina","Yancey","","Rocky, seeping ground in woods on S bank of South Toe River, E side of Rt. 80, 5 mi S of Celo.",35.782305,-82.202159,1500,"N",NA,"Y","Yes","Flowering","","","","town+direction+distance+locality","best estimate","JA"
"1065",14482222,"MW","KE","specimen","Chelone glabra","Chelone","glabra","8/15/1969",1969,8,15,227,1969227,"flowering","unknown","Y","N"," "," ","","","New Hampshire","Grafton","North Woodstock","Wooded bank of small stream feeding into Pemigewasset River near point where river is crossed by Rt. 3A",NA,NA,NA,"N",NA,"Y","Yes","Flowering","","","","","","JA"
"1066",14483487,"MW","KE","specimen","Chelone glabra","Chelone","glabra","9/10/1979",1979,9,10,253,1979253,"flowering","unknown","Y","N"," "," ","","","Ohio","Logan","Liberty","ODNR Flora of Ohio; Frequent; wet ditch; Liberty Fen; E, Twp. Rt. 192, 0.15 mi N, Twp. Rt. 193, Sect. 33, Liberty Twp.",40.253951,-83.773033,400,"N",NA,"Y","Yes","Flowering","","","PLSS","locality","best estimate","JA"
"1067",14483710,"MW","KE","specimen","Chelone glabra","Chelone","glabra","8/28/1979",1979,8,28,240,1979240,"flowering","unknown","Y","N"," "," ","","","Ohio","Cuyahoga","Brecksville ","Common; roadside depression, N of Park Dr., Brecksville Res., Cuyahoga National Valley Recreation Area, SW 1/4 of Brecksville Twp.",41.30901,-81.60891,1300,"N",NA,"Y","Yes","Flowering","","","PLSS","locality","best estimate","JA"
"1068",14484361,"MW","KE","specimen","Chelone glabra","Chelone","glabra","8/11/1965",1965,8,11,223,1965223,"vegetative","N","N","N","Y"," ","","","Ohio","Hocking","Good Hope","Shaded ground at edge of Clear Creek, 10 mi NW of Logan, NE 1/4 Sec. 20, Good Hope Twp.",39.589374,-82.58175,3200,"N",NA,"Y","No","","","","PLSS","locality","best estimate","JA"
"1069",14485159,"MW","KE","specimen","Chelone glabra","Chelone","glabra","9/12/1968",1968,9,12,256,1968256,"flowering","unknown","Y","N"," "," ","","","Ohio","Erie","","low wet woods by Pen-Central RR, 1 mi W of Ceylon.",41.371714,-82.51309,5241,"N",NA,"Y","Yes","Flowering","","","","town+direction+distance+locality","geolocate","JA"
"1070",14485873,"MW","KE","specimen","Chelone glabra","Chelone","glabra","9/17/1964",1964,9,17,261,1964261,"flowering","unknown","Y","N"," "," ","","","Ohio","Hocking","Good Hope","Shaded ground along stream flowing into Clear Creek, NE 1/4 Sect 20, Good Hope Twp.",39.59155,-82.56602,4000,"N",NA,"Y","Yes","Flowering","","","","locality","best estimate","JA"
"1071",14486907,"MW","KE","specimen","Chelone glabra","Chelone","glabra","9/22/1988",1988,9,22,266,1988266,"flowering","unknown","Y","N"," "," ","","","Ohio","Ashtabula","Kingsville","Rare; wet area in rich woods; 0.5 mi S Rt. 84; N Ashtabula River ford; W Hadlock Rd.,; Kingsville twp",41.870996,-80.71348,600,"N",NA,"Y","Yes","Flowering","","","","locality","best estimate","JA"
"1072",14488208,"MW","KE","specimen","Chelone glabra","Chelone","glabra","10/4/1977",1977,10,4,277,1977277,"fruit","N","N","Y"," "," ","","","Ohio","Henry","Damascus","frequent; wooded floodplain of Maumee River; Mary Jane Thurston State Park marina, St. Rt. 65, 1/2 mi NW, Wood Co. line, Sect. 12, Damascus Twp.",41.411843,-83.88664,200,"N",NA,"Y","Yes","Fruiting","","","PLSS","locality","best estimate","JA"
"1073",14489734,"MW","KE","specimen","Chelone glabra","Chelone","glabra","8/13/1968",1968,8,13,226,1968226,"flowering","unknown","Y","N"," "," ","","","Ohio","Portage","Brimfield","Scarce under trees on muddy bank on S side of Mogadore Reservoir W of Congress Lake Rd., Brimfield Twp.",41.054163,-81.340753,3500,"N",NA,"Y","Yes","Flowering","","","","locality","best estimate","JA"
"1074",14490209,"MW","KE","specimen","Chelone glabra","Chelone","glabra","9/26/1959",1959,9,26,269,1959269,"flowering","unknown","Y","N"," "," ","","same day/place, different phenology","Ohio","Geauga","","GEAUGA, OH, US;Low wet field; S of Rt. 87, 1 mi. W of Newbury, Newbury Twp.",NA,NA,NA,"N",NA,"Y","Yes","Flowering","","","","","","JA"
"1075",14490402,"MW","KE","specimen","Chelone glabra","Chelone","glabra","8/17/1958",1958,8,17,229,1958229,"flowering","unknown","Y","N"," "," ","","","Virginia","Giles","","Open ground near small stream near Biological Station on Salt Pond Mountain.",37.375123,-80.522758,2000,"N",NA,"Y","Yes","Flowering","","","","locality","best estimate","JA"
"1076",14490586,"MW","KE","specimen","Chelone glabra","Chelone","glabra","9/5/1964",1964,9,5,249,1964249,"flowering","unknown","Y","N"," "," ","","","Ohio","Jefferson","Island Creek","Moist ground on wooded stream bank, 4 mi NW of Steubenville, W 1/2 Sec. 32, Island Creek Twp",40.41077,-80.687768,8800,"N",NA,"Y","Yes","Flowering","","","PLSS","town+direction+distance","best estimate","JA"
"1077",14490843,"MW","KE","specimen","Chelone glabra","Chelone","glabra","9/4/1926",1926,9,4,247,1926247,"flowering","unknown","Y","N"," "," ","","","New York","Erie","","NY, US williamsville",42.963947,-78.737809,1850,"N",NA,"Y","Yes","Flowering","","","","town","geolocate","JA"
"1078",14490921,"MW","KE","specimen","Chelone glabra","Chelone","glabra","9/26/1959",1959,9,26,269,1959269,"fruit","N","N","Y"," "," ","","same day/place, different phenology","Ohio","Geauga","Newbury","Low wet field; S of Rt. 87, 1 mi. W of Newbury, Newbury Twp.",41.460275,-81.308603,5000,"N",NA,"Y","Yes","Fruiting","","","","provided","provided","JA"
"1079",14491434,"MW","KE","specimen","Chelone glabra","Chelone","glabra","8/6/1968",1968,8,6,219,1968219,"flowering","unknown","Y","N"," "," ","","","Maine","Washington","North Perry","ditch of Lake Rd. in pine forest, 1 mi from US Rt. 1",45.025511,-67.1255,600,"N",NA,"Y","Yes","Flowering","","","","locality","best estimate","JA"
"1080",14492089,"MW","KE","specimen","Chelone glabra","Chelone","glabra","9/14/1968",1968,9,14,258,1968258,"flowering","unknown","Y","N"," "," ","","","North Carolina","Jackson","","Wet area on rocky, wooded slope near Bearpen Gap (on Blue Ridge Parkway), elev. ca. 5500 ft",35.321429,-82.96481,1600,"N",NA,"Y","Yes","Flowering","","","","locality","best estimate","JA"
"1081",14492547,"MW","KE","specimen","Chelone glabra","Chelone","glabra","8/12/1969",1969,8,12,224,1969224,"vegetative","N","N","N","Y"," ","","","Quebec","Huntington","","Wet, wooded ground at edge of Lake St. Francis, along Rt. 3, just S of Point Doyon, 2 mi SW of Port Lewis, Huntingdon Co., Quebec.",45.161577,-74.326661,3000,"N",NA,"Y","No","","","","couldn't find exact locality","locality","best estimate","JA"
"1082",14492673,"MW","KE","specimen","Chelone glabra","Chelone","glabra","8/15/1967",1967,8,15,227,1967227,"vegetative","N","N","N","Y"," ","","","Ohio","Portage","Hiram","Wet, weedy, wooded valley abutting Asbury Rd., 9 mi NNE of Ravenna, Hiram Twp.",41.28087,-81.164169,2000,"N",NA,"Y","No","","","","","locality","best estimate","JA"
"1083",14493156,"MW","KE","specimen","Chelone glabra","Chelone","glabra","9/10/1975",1975,9,10,253,1975253,"flowering","unknown","Y","N"," "," ","","","Ohio","Summit","Stow","wet field by old sand pit; between old RR bed & Call Rd., 1/4 mi W, Young Rd., Stow, Stow Twp.",41.190211,-81.407076,200,"N",NA,"Y","Yes","Flowering","","","","locality","best estimate","JA"
"1084",14495049,"MW","KE","specimen","Chelone glabra","Chelone","glabra","9/10/1967",1967,9,10,253,1967253,"flowering","unknown","Y","N"," "," ","","","Ohio","Lorain","Black River","wet woods behind lake beach, Oak Point, Black River Twp.",41.433936,-82.249049,9000,"N",NA,"Y","Yes","Flowering","",""," town doesn't exist anymore","locality","best estimate","JA"
"1085",14495510,"MW","KE","specimen","Chelone glabra","Chelone","glabra","9/5/1964",1964,9,5,249,1964249,"flowering","unknown","Y","N"," "," ","","","Ohio","Harrison","","HARRISON, OH, US;Shaded marshy ground in meander scar along stream on Cusick Farm, E ½ sec. 3, German Twp. Apex of plant.",NA,NA,NA,"N",NA,"Y","Yes","Flowering","","","","","","JA"
"1086",14495540,"MW","KE","specimen","Chelone glabra","Chelone","glabra","9/21/1966",1966,9,21,264,1966264,"flowering","unknown","Y","N"," "," ","","","Ohio","Ross","Liberty","Springy ground along stream in woods along road NE of Schooley Station, NW 1/4 Sec. 18, Liberty Twp.",39.284072,-82.857008,7000,"N",NA,"Y","Yes","Flowering","","","PLSS","locality","best estimate","JA"
"1087",14497038,"MW","KE","specimen","Chelone glabra","Chelone","glabra","9/9/1980",1980,9,9,253,1980253,"flowering","unknown","Y","N"," "," ","","","Ohio","Williams","Jefferson","Frequent; small fen; S side, Co Rt I, just E, Beaver Creek bridge & E, jct of Co Rt 54, Sects 21 & 28, Jefferson Twp.",41.543244,-84.525597,900,"N",NA,"Y","Yes","Flowering","","","PLSS,  couldn't find exact locality","locality","best estimate","JA"
"1088",14497716,"MW","KE","specimen","Chelone glabra","Chelone","glabra","8/21/1966",1966,8,21,233,1966233,"vegetative","N","N","N","Y"," ","","","North Carolina","Yancey","","Rocky, seeping ground in woods on S bank of South Toe River, E side of Rt. 80, 5 mi S of Celo.",35.782305,-82.202159,1500,"N",NA,"Y","No","","","","","town+direction+distance+locality","best estimate","JA"
"1089",14498163,"MW","KE","specimen","Chelone glabra","Chelone","glabra","9/20/1979",1979,9,20,263,1979263,"flowering","unknown","Y","N"," "," ","","","Ohio","Summit","Cuyahoga Falls","Frequent; marshy field on W side of lodge, Galt Park, S side of Northmoreland Rd., 0.6 mi S of St. Rt. 91, city of Cuyahoga Falls.",41.130632,-81.456631,300,"N",NA,"Y","Yes","Flowering","","","","locality","best estimate","JA"
"1090",14498214,"MW","KE","specimen","Chelone glabra","Chelone","glabra","9/13/1968",1968,9,13,257,1968257,"flowering","unknown","Y","N"," "," ","","","North Carolina","Macon","Highlands","Open, wet hollow N of road where small stream abuts, 0.5 mi W of Rt. 28, 2.1 mi S of Rts. 28 & 64 intersection in Highlands.",35.021973,-83.195952,600,"N",NA,"Y","Yes","Flowering","","","","locality","best estimate","JA"
"1091",14498298,"MW","KE","specimen","Chelone glabra","Chelone","glabra","7/17/1967",1967,7,17,198,1967198,"vegetative","N","N","N","Y"," ","","","Iowa","Jones","Hale","Marshy roadside ditch, 10 mi SE of Anamosa, SW 1/4 Sec. 6, Hale Twp.",NA,NA,NA,"N",NA,"Y","No","","","","PLSS","","","JA"
"1092",14498774,"MW","KE","specimen","Chelone glabra","Chelone","glabra","8/14/1969",1969,8,14,226,1969226,"flowering","unknown","Y","N"," "," ","","","Vermont","Essex","","Wet, boggy ground along roadside, 1 mi E of Norton (just W of Norton Drive-in Movie)",44.9958,-71.806748,3500,"N",NA,"Y","Yes","Flowering","","","","locality","best estimate","JA"
"1093",14499172,"MW","KE","specimen","Chelone glabra","Chelone","glabra","9/23/1977",1977,9,23,266,1977266,"flowering","unknown","Y","N"," "," ","","","Ohio","Cuyahoga","Sagamore Hills ","Common; roadside ditch, 1/2 mi N of Snowville Rd. on Riverview Rd., Cuyahoga Valley National Recreation Area, SW 1/4 of Sagamore Hills Twp.",41.293192,-81.57832,1700,"N",NA,"Y","Yes","Flowering","","","PLSS","locality","best estimate","JA"
"1094",14500207,"MW","KE","specimen","Chelone glabra","Chelone","glabra","9/4/1964",1964,9,4,248,1964248,"flowering","unknown","Y","N"," "," ","","","Ohio","Jefferson","","Open, rocky ground along stream at base of wooded slope in Jefferson Lake State Park, 2 mi NW of Richmond, Salem Twp. Apex of plant.",40.460534,-80.811342,2000,"N",NA,"Y","Yes","Flowering","","","","locality","best estimate","JA"
"1095",14500377,"MW","KE","specimen","Chelone glabra","Chelone","glabra","8/27/1964",1964,8,27,240,1964240,"flowering","unknown","Y","N"," "," ","","","Ohio","Portage","Franklin","Marshy ground in meander scar of Cuyahoga River, 1 mi N of Kent, Franklin Twp.",41.168158,-81.357886,6341,"N",NA,"Y","Yes","Flowering","","","","town+direction+distance","geolocate","JA"
"1096",14500791,"MW","KE","specimen","Chelone glabra","Chelone","glabra","9/18/1966",1966,9,18,261,1966261,"flowering","unknown","Y","N"," "," ","","","Ohio","Huron","","at edge of small stream, 2 mi E of Norwalk",41.242547,-82.57719,7359,"N",NA,"Y","Yes","Flowering","","","","town+direction+distance","geolocate","JA"
"1097",14502761,"MW","KE","specimen","Chelone glabra","Chelone","glabra","8/22/2009",2009,8,22,234,2009234,"flowering","unknown","Y","N"," "," ","","","Ohio","Geauga","Chester","Geauga Park District, Sunnybrook Preserve, Chester Twp. N 41?31' 58"", W 81? 18' 26"".",41.53277778,-81.30722222,NA,"N",NA,"Y","Yes","Flowering","","","","provided by observer","","JA"
"1098",14504182,"MW","KE","specimen","Chelone glabra","Chelone","glabra","9/7/1964",1964,9,7,251,1964251,"flowering","unknown","Y","N"," "," ","","","Ohio","Columbiana","Butler","In swampy forest at edge of Watercress Marsh, along Rt. 9, 6 mi SW of Salem, Butler Twp.",40.820176,-80.919427,700,"N",NA,"Y","Yes","Flowering","","","","locality","best estimate","JA"
"1099",14504715,"MW","KE","specimen","Chelone glabra","Chelone","glabra","9/7/1965",1965,9,7,250,1965250,"flowering","unknown","Y","N"," "," ","","","Michigan","Washtenaw","Ann Arbor","Open marsh-meadow along Huron River, SE from jct. of Fuller & Gedes Sts. in Ann Arbor.",42.276699,-83.697769,300,"N",NA,"Y","Yes","Flowering","","","","locality","best estimate","JA"
"1100",14506167,"MW","KE","specimen","Chelone glabra","Chelone","glabra","9/17/1964",1964,9,17,261,1964261,"flowering","unknown","Y","N"," "," ","","","Ohio","Lawrence","Washington","Shaded creek bank near marshy area along Rt. 93, 5 mi N of Olive Furnace, SE 1/4 Sec. 34, Washington Twp. ",38.82773,-82.595631,2000,"N",NA,"Y","Yes","Flowering","","","PLSS","locality+direction+distance","best estimate","JA"
"1101",14506863,"MW","KE","specimen","Chelone glabra","Chelone","glabra","9/17/1983",1983,9,17,260,1983260,"flowering","unknown","Y","N"," "," ","","","Ohio","Hocking","Laurel","Marsh along stream at head of hollow; Crane Hollow, 10 mi SW of Logan, SW 1/4 SW 1/4 S21, T12N R18W, Laurel Twp. ",39.49158,-82.582598,500,"N",NA,"Y","Yes","Flowering","","","","PLSS","best estimate","JA"
"1102",14507299,"MW","KE","specimen","Chelone glabra","Chelone","glabra","8/19/1960",1960,8,19,232,1960232,"flowering","unknown","Y","N"," "," ","","","Ohio","Holmes","Washington","Muddy, marshy ground at margin of Odells Lake, Washington Twp.",40.659661,-82.113882,1000,"N",NA,"Y","Yes","Flowering","","","","locality","best estimate","JA"
"1103",14508941,"MW","KE","specimen","Chelone glabra","Chelone","glabra","8/22/1966",1966,8,22,234,1966234,"vegetative","N","N","N","Y"," ","","","North Carolina","Madison","","Wet, shaded ground in small stream along Rt. 19 at Ivy Gap, 1/2 mi S of Yancey Co. line.",35.900428,-82.472674,500,"N",NA,"Y","No","","","","","locality","best estimate","JA"
"1104",14509770,"MW","KE","specimen","Chelone glabra","Chelone","glabra","9/14/1987",1987,9,14,257,1987257,"flowering","unknown","Y","N"," "," ","","","Ohio","Fayette","Marion","ODNR Flora of Ohio; frequent; fen remnant; 1/4 mi E of White Rd. & 0.8 mi SSE of US Rt. 22 at Johnson, Marion Twp.",39.537553,-83.315724,1300,"N",NA,"Y","Yes","Flowering","","","","locality","best estimate","JA"
"1105",14510762,"MW","KE","specimen","Chelone glabra","Chelone","glabra","8/14/1969",1969,8,14,226,1969226,"flowering","unknown","Y","N"," "," ","","same day/close together, same phenology","New Hampshire","Coos","","Moist roadside ditch, 1 mi SE of Lancaster.",44.478705,-71.554896,3922,"N",NA,"Y","Yes","Flowering","","","","town+direction+distance","geolocate","JA"
"1106",14511305,"MW","KE","specimen","Chelone glabra","Chelone","glabra","8/30/1970",1970,8,30,242,1970242,"flowering","unknown","Y","N"," "," ","","same day/close together, same phenology","Ohio","Holmes","Knox","Infrequent in moist, shady ravine below Co. Rt. 23, 1 mi E of jct. with Twp. Rt. 254, NW 1/4 sec. 20, Knox Twp.",40.591623,-82.19545,6000,"N",NA,"Y","Yes","Flowering","","","PLSS,  couldn't find exact locality","locality","best estimate","JA"
"1107",14511469,"MW","KE","specimen","Chelone glabra","Chelone","glabra","8/10/1965",1965,8,10,222,1965222,"vegetative","N","N","N","Y"," ","","","Ohio","Columbiana","Yellow Creek","Rocky ground at edge of stream by wooded slope, 3 mi NW of Wellsville, N 1/2 Sec. 23, Yellow Creek Twp.",40.574509,-80.667575,3036,"N",NA,"Y","No","","","","PLSS","town","geolocate","JA"
"1108",14511624,"MW","KE","specimen","Chelone glabra","Chelone","glabra","9/10/1965",1965,9,10,253,1965253,"flowering","unknown","Y","N"," "," ","","","Ohio","Columbiana","Butler","Open area near bog meadow at ""Watercress Marsh,"" along Rt. 9, 6 mi SW of Salem, Secs. 33 & 34, Butler Twp.",40.820176,-80.919427,700,"N",NA,"Y","Yes","Flowering","","","PLSS","locality","best estimate","JA"
"1109",14511911,"MW","KE","specimen","Chelone glabra","Chelone","glabra","8/16/1931",1931,8,16,228,1931228,"flowering","unknown","Y","N"," "," ","","","Ohio","Trumbull","Cortland","in Walnut Ravine, Cortland",41.330334,-80.725358,4325,"N",NA,"Y","Yes","Flowering","",""," couldn't find locality, used town","town","geolocate","JA"
"1110",14511963,"MW","KE","specimen","Chelone glabra","Chelone","glabra","8/14/1969",1969,8,14,226,1969226,"flowering","unknown","Y","N"," "," ","","same day/close together, same phenology","New Hampshire","Coos","","Open, wet, weedy ground beside small stream along Rt. 3, 7.5 mi N of Stratford.",44.764579,-71.605413,3500,"N",NA,"Y","Yes","Flowering","","","","town+direction+distance+locality","best estimate","JA"
"1111",14512273,"MW","KE","specimen","Chelone glabra","Chelone","glabra","9/10/1964",1964,9,10,254,1964254,"flowering and fruit","unknown","Y","Y"," "," ","","","Ohio","Portage","Hiram","Roadside marsh along Schustrich Rd., immediately W of Asbury Rd., 9 mi NNE of Ravenna, Hiram Twp.",41.28087,-81.164169,300,"N",NA,"Y","Yes","Both","","","","locality","best estimate","JA"
"1112",14512698,"MW","KE","specimen","Chelone glabra","Chelone","glabra","8/27/1965",1965,8,27,239,1965239,"flowering","unknown","Y","N"," "," ","","","Ohio","Huron","","at weedy river edge near West Clarksfield",41.188701,-82.424375,1300,"N",NA,"Y","Yes","Flowering","","","","locality","best estimate","JA"
"1113",14512842,"MW","KE","specimen","Chelone glabra","Chelone","glabra","9/14/1983",1983,9,14,257,1983257,"flowering","unknown","Y","N"," "," ","","same day/place, different phenology","Ohio","Mahoning","","MAHONING, OH, US;ODNR Flora of Ohio; common in damp field on powerline corridor, S side of Alliance-Sebring Rd., 0.5 mi E of Oyster Rd., NW ¼ of SW ¼ Sect. 29, Smith Twp.",NA,NA,NA,"N",NA,"Y","Yes","Flowering","","","","","","JA"
"1114",14513228,"MW","KE","specimen","Chelone glabra","Chelone","glabra","8/15/1964",1964,8,15,228,1964228,"vegetative","N","N","N","Y"," ","","","Ohio","Stark","Jackson","In partial shade in marl bog, 3 mi N of Massilon, E 1/2 Sec. 20, Jackson Twp.",40.8402,-81.521509,10947,"N",NA,"Y","No","","","","PLSS","town+direction+distance","geolocate","JA"
"1115",14514888,"MW","KE","specimen","Chelone glabra","Chelone","glabra","8/29/1973",1973,8,29,241,1973241,"flowering","unknown","Y","N"," "," ","","","Ohio","Washington","Barlow","common; swamp below spring; Lawton Farm, S, US Rt. 50A, 1/4 mi. SE, Barlow, Sect. 15, Barlow Twp.",39.39264,-81.652742,700,"N",NA,"Y","Yes","Flowering","","","PLSS","locality","best estimate","JA"
"1116",14516224,"MW","KE","specimen","Chelone glabra","Chelone","glabra","10/9/1966",1966,10,9,282,1966282,"flowering","unknown","Y","N"," "," ","","","Ohio","Hocking","","Bank of lake at Wakeena",39.497024,-82.479254,32991,"N",NA,"Y","Yes","Flowering","",""," couldn't find locality, used county ","county","geolocate","JA"
"1117",14517081,"MW","KE","specimen","Chelone glabra","Chelone","glabra","8/25/1964",1964,8,25,238,1964238,"flowering","unknown","Y","N"," "," ","","","Ohio","Portage","Franklin","Marshy ground in meander scar of Cuyahoga River, 1 mi N of Kent, Franklin Twp.",41.168158,-81.357886,6341,"N",NA,"Y","Yes","Flowering","","","","town+direction+distance","geolocate","JA"
"1118",14519218,"MW","KE","specimen","Chelone glabra","Chelone","glabra","8/26/1998",1998,8,26,238,1998238,"flowering","unknown","Y","N"," "," ","","","Ohio","Portage","Charlestown","Rare; growing in wet meadow; about 1.5 to 1.6 miles west of Rt. 80, north side of North Patrol Rd.; Charlestown Twp.; N 41 11 46.3; W 81 10 25.3",41.19611111,-81.17361111,NA,"N",NA,"Y","Yes","Flowering","","","","provided by observer","","JA"
"1119",14520746,"MW","KE","specimen","Chelone glabra","Chelone","glabra","9/17/1964",1964,9,17,261,1964261,"flowering","unknown","Y","N"," "," ","","","Ohio","Scioto","Madison","Shady bank of stream at White Gravel Mine, White Gravel Rd., Madison Twp",38.923868,-82.821104,700,"N",NA,"Y","Yes","Flowering","","","","locality","best estimate","JA"
"1120",1057467,"NE","KESC","specimen","Chelone glabra","Chelone","glabra","8/21/1972",1972,8,21,234,1972234,"flowering","unknown","Y","N"," "," ","","","New Hampshire","Cheshire","Sullivan","power lines west of village",43.013135,-72.220918,3036,"Y","Y","Y","Yes","Flowering","","","","town","geolocate","JA"
"1121",1057470,"NE","KESC","specimen","Chelone glabra","Chelone","glabra","8/1/1969",1969,8,1,213,1969213,"flowering","unknown","Y","N"," "," ","","","New Hampshire","Cheshire","Westmoreland","glebe brook",42.940317,-72.399874,2000,"Y","Y","Y","Yes","Flowering","","","","locality","best estimate","JA"
"1122",1057472,"NE","KESC","specimen","Chelone glabra","Chelone","glabra","8/17/1972",1972,8,17,230,1972230,"flowering","unknown","Y","N"," "," ","","date: Bottom half of date is cut off-could be 1973?","New Hampshire","Merrimack","Danbury","hill between forbes mt and the pinacle",43.52563,-71.861748,3036,"Y","Y","Y","Yes","Flowering","",""," couldn’t find locality, used town","town","geolocate","JA"
"1123",1057473,"NE","KESC","specimen","Chelone glabra","Chelone","glabra","9/10/1972",1972,9,10,254,1972254,"fruit","N","N","Y"," "," ","","","New Hampshire","Merrimack","Hopkinton","",43.191469,-71.675353,3036,"Y","Y","Y","Yes","Fruiting","","","","town","geolocate","JA"
"1124",1057477,"NE","KESC","specimen","Chelone glabra","Chelone","glabra","9/14/1972",1972,9,14,258,1972258,"flowering","unknown","Y","N"," "," ","","","Massachusetts","Middlesex","Ayer","rte 2-A ?? Jct. With rte",42.568813,-71.59275,1700,"Y","Y","Y","Yes","Flowering","","","","locality","best estimate","JA"
"1125",1057478,"NE","KESC","specimen","Chelone glabra","Chelone","glabra","8/19/1972",1972,8,19,232,1972232,"flowering","unknown","Y","N"," "," ","","same day/place, same phenology","Rhode Island","Newport","","near quicksand pond",NA,NA,NA,"Y","Y","Y","Yes","Flowering","","","","","","JA"
"1126",1460899,"NE","KIRI","specimen","Chelone glabra","Chelone","glabra","9/6/1880",1880,9,6,250,1880250,"flowering","unknown","Y","N"," "," ","","","Pennsylvania","Montgomery","Green Lane","",40.336767,-75.469067,NA,"Y","Y","Y","Yes","Flowering","","","","provided","","JA"
"1127",1460900,"NE","KIRI","specimen","Chelone glabra","Chelone","glabra","8/18/1971",1971,8,18,230,1971230,"flowering","unknown","Y","N"," "," ","","","Vermont","Essex","","Victory Bog",44.547916,-71.827698,NA,"Y","Y","Y","Yes","Flowering","","","","provided","","JA"
"1128",1460902,"NE","KIRI","specimen","Chelone glabra","Chelone","glabra","8/15/1891",1891,8,15,227,1891227,"flowering","unknown","Y","N"," "," ","","","Rhode Island","Washington","South Kingstown","Kingston rd",41.515716,-71.580306,NA,"Y","Y","Y","Yes","Flowering","","","","locality","","JA"
"1129",1460904,"NE","KIRI","specimen","Chelone glabra","Chelone","glabra","8/17/1937",1937,8,17,229,1937229,"flowering","unknown","Y","N"," "," ","","","New York","Tompkins","Ithaca","Shore of Beebe Lake",42.45101,-76.47619,NA,"Y","Y","Y","Yes","Flowering","","","","provided","","JA"
"1130",10421037,"MW","KNK","specimen","Chelone glabra","Chelone","glabra","9/19/1997",1997,9,19,262,1997262,"flowering","unknown","Y","N"," "," ","","","Kentucky","Morgan","","vicinity of bethany chuch off highway 460, ca. 4 miles se of west liberty",37.899061,-83.193149,200,"Y","Y","Y","Yes","Flowering","","","","locality","best estimate","JA"
"1131",10421040,"MW","KNK","specimen","Chelone glabra","Chelone","glabra","9/17/1995",1995,9,17,260,1995260,"flowering","unknown","Y","N"," "," ","","","Kentucky","Kenton","","along e side of ishmael road, ca. 0.22 m s of its junction with kenton station road",38.864572,-84.457822,200,"Y","Y","Y","Yes","Flowering","","","","locality","best estimate","JA"
"1132",10421041,"MW","KNK","specimen","Chelone glabra","Chelone","glabra","9/4/1978",1978,9,4,247,1978247,"flowering","unknown","Y","N"," "," ","","","Kentucky","Greenup","","Acorus-Leersia marsh along stream ca. 2.5 miles s of South Shore along road to Lynn",38.677009,-82.932905,2800,"Y","Y","Y","Yes","Flowering","","","","locality","best estimate","JA"
"1133",5737199,"MW","LSU","specimen","Chelone glabra","Chelone","glabra","8/15/1973",1973,8,15,227,1973227,"flowering and ???","maybe","Y","maybe"," "," ","recheck phenology: very unsure","","Newfoundland and Labrador","","","Long Harbour, Placentia Bay, 0.5 mile east of community. Wet roadside.; Long Harbour",47.103007,-54.185932,NA,"Y","?","Y","Yes","Flowering","","","","provided","","JA"
"1134",5737200,"MW","LSU","specimen","Chelone glabra","Chelone","glabra","9/14/1983",1983,9,14,257,1983257,"flowering and fruit","unknown","Y","Y"," "," ","","same day/place, different phenology","Ohio","Mahoning","Smith","On powerline corridor, S side of Alliance-Sebring Rd., 0.5 miles E of Oyster Road. Smith Twp. Alliance Quadrangle. Sec29 NW1/4 SW1/4",40.921898,-81.06902,3000,"Y","?","Y","Yes","Both","","","PLSS,  couldn't find exact locality","locality","best estimate","JA"
"1135",5737201,"MW","LSU","specimen","Chelone glabra","Chelone","glabra","9/8/1974",1974,9,8,251,1974251,"flowering and fruit","unknown","Y","Y"," "," ","","same day/place, some have different phenology","Massachusetts","Hampshire","","Swampy woodland border, off Bridge Road, Northampton.; Northampton",NA,NA,NA,"Y","Y","Y","Yes","Both","","","","","","JA"
"1136",5737202,"MW","LSU","specimen","Chelone glabra","Chelone","glabra","10/1/1976",1976,10,1,275,1976275,"flowering","unknown","Y","N"," "," ","","","New Jersey","Union","","At edge of lake, Watchung Reservation",40.688973,-74.375854,4000,"Y","?","Y","Yes","Flowering","","","","locality","best estimate","JA"
"1137",5737205,"MW","LSU","specimen","Chelone glabra","Chelone","glabra","9/20/1968",1968,9,20,264,1968264,"flowering","unknown","Y","N"," "," ","","same day/place, some have different phenology","North Carolina","Watauga","","Roadbanks and deciduous woods along Co. Rt. 1102, on Rich Mt., 3.4 miles west of Howard's Knob.; Howard's Knob",NA,NA,NA,"Y","Y","Y","Yes","Flowering","","","","","","JA"
"1138",5737206,"MW","LSU","specimen","Chelone glabra","Chelone","glabra","9/20/1968",1968,9,20,264,1968264,"flowering","unknown","Y","N"," "," ","","same day/place, some have different phenology","North Carolina","Watauga","","Roadbanks and deciduous woods along Co. Rt. 1102, on Rich Mt., 3.4 miles west of Howard's Knob.; Howard's Knob",NA,NA,NA,"Y","Y","Y","Yes","Flowering","","","","","","JA"
"1139",5737208,"MW","LSU","specimen","Chelone glabra","Chelone","glabra","9/19/1927",1927,9,19,262,1927262,"fruit","N","N","Y"," "," ","","same day/place, some have different phenology","North Carolina","Yancey","","near cane river, 3 miles west of burnsville",35.915475,-82.352754,5936,"Y","?","Y","Yes","Fruiting","","","","town+direction+distance+locality","geolocate","JA"
"1140",1207913,"NE","MAINE","specimen","Chelone glabra","Chelone","glabra","8/13/1941",1941,8,13,225,1941225,NA,"unknown","unknown","unknown"," "," ","","","Maine","Aroostook","Wade","",46.79093,-68.23831,6975,"N",NA,"Y","Not Scorable","","","","","provided","provided","JA"
"1141",1207914,"NE","MAINE","specimen","Chelone glabra","Chelone","glabra","8/15/1940",1940,8,15,228,1940228,NA,"unknown","unknown","unknown"," "," ","","","Maine","Aroostook","Presque Isle","",46.68672,-67.98735,11305,"N",NA,"Y","Not Scorable","","","","","provided","provided","JA"
"1142",1207915,"NE","MAINE","specimen","Chelone glabra","Chelone","glabra","9/5/1956",1956,9,5,249,1956249,NA,"unknown","unknown","unknown"," "," ","","","Maine","Knox","Rockland","N. side of Thomaston road, s. edge of city.",44.12772,-69.13744,5330,"N",NA,"Y","Not Scorable","","","","","provided","provided","JA"
"1143",1207916,"NE","MAINE","specimen","Chelone glabra","Chelone","glabra","9/1/1978",1978,9,1,244,1978244,NA,"unknown","unknown","unknown"," "," ","","","Maine","Penobscot","Dixmont","Lower sw. slope Of Mt. Harris (Dixmont Mt).",44.69566,-69.13334,7007,"N",NA,"Y","Not Scorable","","","","","provided","provided","JA"
"1144",1207918,"NE","MAINE","specimen","Chelone glabra","Chelone","glabra","9/1/1953",1953,9,1,244,1953244,NA,"unknown","unknown","unknown"," "," ","","","Maine","Waldo","Winterport","Penobscot River Cove at s. base of Oak Pt.",44.65838,-68.91517,8228,"N",NA,"Y","Not Scorable","","","","","provided","provided","JA"
"1145",1207919,"NE","MAINE","specimen","Chelone glabra","Chelone","glabra","8/25/1950",1950,8,25,237,1950237,NA,"unknown","unknown","unknown"," "," ","","","Maine","Waldo","Palermo","Sheepscot River, just s. w. of Sheepscot Pond, S. Palermo",44.39603,-69.42711,9168,"N",NA,"Y","Not Scorable","","","","","provided","provided","JA"
"1146",1207920,"NE","MAINE","specimen","Chelone glabra","Chelone","glabra","7/28/1954",1954,7,28,209,1954209,NA,"unknown","unknown","unknown"," "," ","","","Maine","Knox","Rockland","NW. edge of Rockland",44.12772,-69.13744,5330,"N",NA,"Y","Not Scorable","","","","","provided","provided","JA"
"1147",1207921,"NE","MAINE","specimen","Chelone glabra","Chelone","glabra","8/12/1967",1967,8,12,224,1967224,"flowering","unknown","Y","N"," "," ","","","Maine","Piscataquis","","Outlet stream at w. end of Haymock Lake, 965 ft. T8 R11; ",46.31108,-69.211343,600,"N",NA,"Y","Yes","Flowering","","","PLSS","locality","best estimate","JA"
"1148",1207922,"NE","MAINE","specimen","Chelone glabra","Chelone","glabra","8/20/1953",1953,8,20,232,1953232,NA,"unknown","unknown","unknown"," "," ","","","Maine","Waldo","Lincolnville","Burgess's Brook, above Pitcher Pond, near Rt.137",44.338665,-69.030109,2000,"N",NA,"Y","Not Scorable","","",""," couldn't find exact locality","locality","best estimate","JA"
"1149",1207923,"NE","MAINE","specimen","Chelone glabra","Chelone","glabra","8/9/1967",1967,8,9,221,1967221,"flowering","unknown","Y","N"," "," ","","","Maine","Piscataquis","","Rum Brook, near Mink Pond, over 1 mi. n. of Lower Togue Pond, 650 ft. T2 R9",45.839802,-68.88062,800,"N",NA,"Y","Yes","Flowering","","","","provided","provided","JA"
"1150",1207925,"NE","MAINE","specimen","Chelone glabra","Chelone","glabra","8/2/1935",1935,8,2,214,1935214,NA,"unknown","unknown","unknown"," "," ","","","Maine","Aroostook","","Madawaska Lake. T16 R4",47.026056,-68.217462,3000,"N",NA,"Y","Not Scorable","","","","","town","best estimate","JA"
"1151",1207926,"NE","MAINE","specimen","Chelone glabra","Chelone","glabra","8/22/1960",1960,8,22,235,1960235,NA,"unknown","unknown","unknown"," "," ","","","Maine","Knox","Rockport","Near Lilly Pond",44.17711,-69.11515,7362,"N",NA,"Y","Not Scorable","","","","","provided","provided","JA"
"1152",1207927,"NE","MAINE","specimen","Chelone glabra","Chelone","glabra","8/23/1941",1941,8,23,235,1941235,NA,"unknown","unknown","unknown"," "," ","","","Maine","Waldo","Lincolnville Center","",44.297855,-69.107538,3036,"N",NA,"Y","Not Scorable","","","","","town","geolocate","JA"
"1153",1207930,"NE","MAINE","specimen","Chelone glabra","Chelone","glabra","8/14/1958",1958,8,14,226,1958226,NA,"unknown","unknown","unknown"," "," ","","","Maine","Sagadahoc","","Merrymeeting Bay",43.993166,-69.838999,NA,"N",NA,"Y","Not Scorable","","","","","provided","","JA"
"1154",1207932,"NE","MAINE","specimen","Chelone glabra","Chelone","glabra","8/11/1957",1957,8,11,223,1957223,NA,"unknown","unknown","unknown"," "," ","","","Maine","Waldo","Belfast","Wet meadow, 11/2 mi. se. of Mason Pond; e. Belfast.",44.42782,-69.03303,8261,"N",NA,"Y","Not Scorable","","","","","provided","provided","JA"
"1155",1207933,"NE","MAINE","specimen","Chelone glabra","Chelone","glabra","8/24/1972",1972,8,24,237,1972237,"flowering","unknown","Y","N"," "," ","","","Maine","Aroostook","Woodland","Woodland bog, s. of Woodland Center.",46.88407,-68.11951,6858,"N",NA,"Y","Yes","Flowering","","","","provided","provided","JA"
"1156",1207934,"NE","MAINE","specimen","Chelone glabra","Chelone","glabra","8/2/1933",1933,8,2,214,1933214,NA,"unknown","unknown","unknown"," "," ","","","Maine","Penobscot","Orono","Marsh Island",44.897044,-68.660485,2000,"N",NA,"Y","Not Scorable","","","","","locality","best estimate","JA"
"1157",1207935,"NE","MAINE","specimen","Chelone glabra","Chelone","glabra","8/5/1954",1954,8,5,217,1954217,NA,"unknown","unknown","unknown"," "," ","","","Maine","York","Alfred","",43.4858,-70.73079,11297,"N",NA,"Y","Not Scorable","","","","","provided","provided","JA"
"1158",1207936,"NE","MAINE","specimen","Chelone glabra","Chelone","glabra","9/5/1947",1947,9,5,248,1947248,NA,"unknown","unknown","unknown"," "," ","","","Maine","Penobscot","Old Town","Marsh Island, Stillwater River.",44.9499,-68.7226,8731,"N",NA,"Y","Not Scorable","","","","","provided","provided","JA"
"1159",1207938,"NE","MAINE","specimen","Chelone glabra","Chelone","glabra","8/28/1954",1954,8,28,240,1954240,NA,"unknown","unknown","unknown"," "," ","","","Maine","Penobscot","","Sebasticook Lake",44.861139,-69.247483,NA,"N",NA,"Y","Not Scorable","","","","","provided","","JA"
"1160",1207939,"NE","MAINE","specimen","Chelone glabra","Chelone","glabra","8/27/1897",1897,8,27,239,1897239,NA,"unknown","unknown","unknown"," "," ","","","Maine","Somerset","Skowhegan","",44.75535,-69.66573,9316,"N",NA,"Y","Not Scorable","","","","","provided","provided","JA"
"1161",1207941,"NE","MAINE","specimen","Chelone glabra","Chelone","glabra","8/3/1912",1912,8,3,216,1912216,NA,"unknown","unknown","unknown"," "," ","","","Maine","Oxford","Hiram","",43.86381,-70.82579,10543,"N",NA,"Y","Not Scorable","","","","","provided","provided","JA"
"1162",1207943,"NE","MAINE","specimen","Chelone glabra","Chelone","glabra","8/16/1974",1974,8,16,228,1974228,NA,"unknown","unknown","unknown"," "," ","","","Maine","Oxford","Bowman","",44.879329,-70.863645,NA,"N",NA,"Y","Not Scorable","","",""," couldn't find town, used territory","county","","JA"
"1163",1207944,"NE","MAINE","specimen","Chelone glabra","Chelone","glabra","8/1/1974",1974,8,1,213,1974213,NA,"unknown","unknown","unknown"," "," ","","","Maine","Oxford","Upper Cupsuptic","",45.126686,-70.876067,NA,"N",NA,"Y","Not Scorable","","","","","provided","","JA"
"1164",1207945,"NE","MAINE","specimen","Chelone glabra","Chelone","glabra","7/24/1933",1933,7,24,205,1933205,NA,"unknown","unknown","unknown"," "," ","","","Maine","Penobscot","Newport","",44.86026,-69.23292,6991,"N",NA,"Y","Not Scorable","","","","","provided","provided","JA"
"1165",1207946,"NE","MAINE","specimen","Chelone glabra","Chelone","glabra","8/12/1933",1933,8,12,224,1933224,NA,"unknown","unknown","unknown"," "," ","","","Maine","Aroostook","Hodgdon","",46.04798,-67.84463,7316,"N",NA,"Y","Not Scorable","","","","","provided","provided","JA"
"1166",1207947,"NE","MAINE","specimen","Chelone glabra","Chelone","glabra","7/20/1934",1934,7,20,201,1934201,NA,"unknown","unknown","unknown"," "," ","","","Maine","Aroostook","Hodgdon","",46.04798,-67.84463,7316,"N",NA,"Y","Not Scorable","","","","","provided","provided","JA"
"1167",1207948,"NE","MAINE","specimen","Chelone glabra","Chelone","glabra","8/1/1898",1898,8,1,213,1898213,NA,"unknown","unknown","unknown"," "," ","","","Maine","Androscoggin","Ea. Auburn","",44.14285,-70.226999,NA,"N",NA,"Y","Not Scorable","","","","","provided","","JA"
"1168",1207949,"NE","MAINE","specimen","Chelone glabra","Chelone","glabra","7/21/1935",1935,7,21,202,1935202,NA,"unknown","unknown","unknown"," "," ","","","Maine","Aroostook","Fort Fairfield","",46.77769,-67.85529,11685,"N",NA,"Y","Not Scorable","","","","","provided","provided","JA"
"1169",1207950,"NE","MAINE","specimen","Chelone glabra","Chelone","glabra","9/8/1947",1947,9,8,251,1947251,NA,"unknown","unknown","unknown"," "," ","","","Maine","Somerset","Flagstaff","Flagstaff Pltn.",45.59134,-69.999921,NA,"N",NA,"Y","Not Scorable","","","","","provided","","JA"
"1170",1207953,"NE","MAINE","specimen","Chelone glabra","Chelone","glabra","3/21/1905",1905,3,21,80,1905080,NA,"unknown","unknown","unknown"," "," ","","","Maine","Androscoggin","Livermore","",44.40789,-70.21502,7926,"N",NA,"Y","Not Scorable","","","","","provided","provided","JA"
"1171",1207954,"NE","MAINE","specimen","Chelone glabra","Chelone","glabra","8/1/1891",1891,8,1,213,1891213,NA,"unknown","unknown","unknown"," "," ","","","Maine","Penobscot","Orono","",44.883125,-68.671977,4982,"N",NA,"Y","Not Scorable","","","","","town","geolocate","JA"
"1172",1207955,"NE","MAINE","specimen","Chelone glabra","Chelone","glabra","8/10/1954",1954,8,10,222,1954222,NA,"unknown","unknown","unknown"," "," ","","","Maine","Washington","","Debbois Hatchery",44.728792,-67.965794,NA,"N",NA,"Y","Not Scorable","","","","","provided","","JA"
"1173",1207956,"NE","MAINE","specimen","Chelone glabra","Chelone","glabra","9/9/1983",1983,9,9,252,1983252,NA,"unknown","unknown","unknown"," "," ","","","Maine","Sagadahoc","","4 D stream",43.817127,-69.782553,NA,"N",NA,"Y","Not Scorable","","","","","provided","","JA"
"1174",1207957,"NE","MAINE","specimen","Chelone glabra","Chelone","glabra","7/21/1938",1938,7,21,202,1938202,NA,"unknown","unknown","unknown"," "," ","","","Maine","Aroostook","Grand Isle","St. John River",47.24973,-68.12942,9700,"N",NA,"Y","Not Scorable","","","","","provided","provided","JA"
"1175",1207958,"NE","MAINE","specimen","Chelone glabra","Chelone","glabra","7/28/1913",1913,7,28,209,1913209,NA,"unknown","unknown","unknown"," "," ","","","Maine","Oxford","Bethel","",44.404232,-70.790625,3036,"N",NA,"Y","Not Scorable","","","","","town","geolocate","JA"
"1176",1207959,"NE","MAINE","specimen","Chelone glabra","Chelone","glabra","8/9/1974",1974,8,9,221,1974221,NA,"unknown","unknown","unknown"," "," ","","","Maine","Oxford","Albany","Rt. 5",44.332566,-70.845625,NA,"N",NA,"Y","Not Scorable","","","","","provided","","JA"
"1177",1207960,"NE","MAINE","specimen","Chelone glabra","Chelone","glabra","8/23/1973",1973,8,23,235,1973235,NA,"unknown","unknown","unknown"," "," ","","","Maine","Oxford","Batchelders Grant","",44.131746,-70.493156,NA,"N",NA,"Y","Not Scorable","","","","","provided","","JA"
"1178",1207961,"NE","MAINE","specimen","Chelone glabra","Chelone","glabra","8/11/1953",1953,8,11,223,1953223,NA,"unknown","unknown","unknown"," "," ","","","Maine","Piscataquis","","Baxter State Park. North South Branch Pond",46.061251,-68.936772,NA,"N",NA,"Y","Not Scorable","","","","","provided","","JA"
"1179",1207966,"NE","MAINE","specimen","Chelone glabra","Chelone","glabra","9/1/1932",1932,9,1,245,1932245,NA,"unknown","unknown","unknown"," "," ","","","Maine","Somerset","Skowhegan","",44.75535,-69.66573,9316,"N",NA,"Y","Not Scorable","","","","","provided","provided","JA"
"1180",1207967,"NE","MAINE","specimen","Chelone glabra","Chelone","glabra","9/1/1932",1932,9,1,245,1932245,NA,"unknown","unknown","unknown"," "," ","","","Maine","Somerset","Parlin Pond TWP","Shore of Pond",45.53939,-70.08077,5961,"N",NA,"Y","Not Scorable","","","","","provided","provided","JA"
"1181",1207968,"NE","MAINE","specimen","Chelone glabra","Chelone","glabra","8/10/1960",1960,8,10,223,1960223,"flowering","unknown","Y","N"," "," ","","","Maine","Knox","Matinicus Isle","Near Old Cove, e. Matinicus.",43.867719,-68.8855,NA,"N",NA,"Y","Yes","Flowering","","","","provided","","JA"
"1182",1207969,"NE","MAINE","specimen","Chelone glabra","Chelone","glabra","8/24/1962",1962,8,24,236,1962236,NA,"unknown","unknown","unknown"," "," ","","","Maine","Knox","Matinicus Isle","Central Matinicus, e. of Burgess Cove.",44.517294,-69.213375,NA,"N",NA,"Y","Not Scorable","","","","","provided","","JA"
"1183",15478743,"MW","MARY","specimen","Chelone glabra","Chelone","glabra","9/16/2014",2014,9,16,259,2014259,"flowering","unknown","Y","N"," "," ","","","Maryland","Prince Georges","","Greenbelt; Greenbelt Lake at Buddy Attick Park",39.002102,-76.890885,NA,"Y","?","Y","Yes","Flowering","","","","provided","","JA"
"1184",15485451,"MW","MARY","specimen","Chelone glabra","Chelone","glabra","10/11/2015",2015,10,11,284,2015284,"flowering","unknown","Y","N"," "," ","","","Maryland","Howard","","Patuxent River State Park",39.265513,-77.114302,NA,"Y","?","Y","Yes","Flowering","","","","provided","","JA"
"1185",15485453,"MW","MARY","specimen","Chelone glabra","Chelone","glabra","10/25/2015",2015,10,25,298,2015298,"flowering and fruit?","unknown","Y","Y"," "," ","recheck phenology: unsure","","Maryland","Wicomico","","Along Athol Road at Rewastico Pond",38.410713,-75.753733,NA,"Y","?","Y","Yes","Both","","","","provided","","JA"
"1186",15503131,"MW","MARY","specimen","Chelone glabra","Chelone","glabra","9/29/1952",1952,9,29,273,1952273,NA,"unknown","unknown","unknown"," "," ","","","Maryland","Prince Georges","","College Park; Agronomy Farm, University of Maryland",38.985983,-76.9425,14484,"Y","?","Y","Not Scorable","","","","","provided","provided","JA"
"1187",15574580,"MW","MARY","specimen","Chelone glabra","Chelone","glabra","9/14/1994",1994,9,14,257,1994257,"flowering","unknown","Y","N"," "," ","","","Maryland","Carroll","","on liberty reservior property, trail head parking at the end of bollinger mill road, growing near the edge of the lake ca 1/8 mile southeast of the parking area",39.439904,-76.900821,400,"Y","Y","Y","Yes","Flowering","","","","locality","best estimate","JA"
"1188",15581575,"MW","MARY","specimen","Chelone glabra","Chelone","glabra","9/11/2013",2013,9,11,254,2013254,"flowering","unknown","Y","N"," "," ","","","Delaware","Kent","Milford","along tub mill road (road 119) at millwood road. 38?56'36.22N, 75?25'42.67W",38.94333333,-75.42861111,NA,"Y","Y","Y","Yes","Flowering","","","","provided by observer","","JA"
"1189",15668717,"MW","MARY","specimen","Chelone glabra","Chelone","glabra","9/14/2014",2014,9,14,257,2014257,"flowering","unknown","Y","N"," "," ","","","Maryland","Harford","Darlington","broad creek public landing, MD rt 623, flintville rd, 39?41'41.96""N, 76?14'26.96W",39.695,-76.24083333,NA,"Y","Y","Y","Yes","Flowering","","","","provided by observer","","JA"
"1190",15805505,"MW","MARY","specimen","Chelone glabra","Chelone","glabra","9/11/1997",1997,9,11,254,1997254,"flowering","unknown","Y","N"," "," ","","","Maryland","Prince Georges","","beltsville agricultural research center, east farm. Meadow at the east end of beck lake (plot 35) and the adjacent coniferous research forest (plot 34) south of beaver dam road and east of soil conservation road",39.0091,-76.838024,1000,"Y","Y","Y","Yes","Flowering","","","","locality","best estimate","JA"
"1191",15821675,"MW","MARY","specimen","Chelone glabra","Chelone","glabra","10/5/2015",2015,10,5,278,2015278,"flowering","unknown","Y","N"," "," ","","","Maryland","Dorchester","","between the towns of eldorado and brookview along MD rt 14 at marshyhope creek on the east side of creek. 38?34'42.72""N, 75?47'32.36""W",38.57861111,-75.79222222,NA,"Y","Y","Y","Yes","Flowering","","","","provided by observer","","JA"
"1192",1988254,"NE","MASS","specimen","Chelone glabra","Chelone","glabra","8/27/1931",1931,8,27,239,1931239,"flowering and fruit","unknown","Y","Y"," "," ","","same day/place, different phenology","Massachusetts","Franklin","Whately","",42.4398117,-72.6348152,5000,"Y","?","Y","Yes","Both","","","","provided","provided","JA"
"1193",1991188,"NE","MASS","specimen","Chelone glabra","Chelone","glabra","7/31/1932",1932,7,31,213,1932213,"flowering","unknown","Y","N"," "," ","","","Massachusetts","Hampshire","Amherst","",42.36447,-72.50686,7831,"Y","?","Y","Yes","Flowering","","","","provided","provided","JA"
"1194",1992272,"NE","MASS","specimen","Chelone glabra","Chelone","glabra","8/24/1929",1929,8,24,236,1929236,"flowering","unknown","Y","N"," "," ","","","Massachusetts","Worcester","Dana","below altitude of 520 ft, later innundated by the metropolitan water supply lake",42.421944,-72.2275,NA,"Y","?","Y","Yes","Flowering","","","","town","","JA"
"1195",1993170,"NE","MASS","specimen","Chelone glabra","Chelone","glabra","8/29/1930",1930,8,29,241,1930241,"flowering","unknown","Y","N"," "," ","","","Massachusetts","Hampden","Springfield","",42.1014843,-72.5898094,5500,"Y","?","Y","Yes","Flowering","","","","provided","provided","JA"
"1196",1993279,"NE","MASS","specimen","Chelone glabra","Chelone","glabra","9/7/1929",1929,9,7,250,1929250,"flowering","unknown","Y","N"," "," ","","","Massachusetts","Franklin","Leverett","",42.47361,-72.48746,6364,"Y","?","Y","Yes","Flowering","","","","provided","provided","JA"
"1197",1996580,"NE","MASS","specimen","Chelone glabra","Chelone","glabra","8/11/1931",1931,8,11,223,1931223,"flowering","unknown","Y","N"," "," ","","","New Hampshire","Merrimack","Danbury","",43.52563,-71.861748,3036,"Y","?","Y","Yes","Flowering","","","","town","geolocate","JA"
"1198",1996606,"NE","MASS","specimen","Chelone glabra","Chelone","glabra","9/4/1889",1889,9,4,247,1889247,"flowering","unknown","Y","N"," "," ","","","Massachusetts","Middlesex","Wayland","",42.35854,-71.35937,6050,"Y","?","Y","Yes","Flowering","","","","provided","provided","JA"
"1199",1997113,"NE","MASS","specimen","Chelone glabra","Chelone","glabra","9/1/1928",1928,9,1,245,1928245,"flowering","unknown","Y","N"," "," ","","","Massachusetts","Franklin","Leyden","",42.69348,-72.6300926,5000,"Y","?","Y","Yes","Flowering","","","","provided","provided","JA"
"1200",1997155,"NE","MASS","specimen","Chelone glabra","Chelone","glabra","9/2/2005",2005,9,2,245,2005245,"buds","Y","N","N"," "," ","","","Massachusetts","Hampshire","South Hadley","Mount Holyoke Range. Headwater of Elmer Brook.",42.29828036,-72.54470203,200,"Y","?","Y","Yes","Flowering","Early","","","provided","provided","JA"
"1201",1997351,"NE","MASS","specimen","Chelone glabra","Chelone","glabra","10/23/1966",1966,10,23,296,1966296,"flowering","unknown","Y","N"," "," ","","","Connecticut","Hartford","Windsor","",41.87129,-72.67366,7828,"Y","?","Y","Yes","Flowering","","","","provided","provided","JA"
"1202",1998662,"NE","MASS","specimen","Chelone glabra","Chelone","glabra","11/30/1848",1848,11,30,335,1848335,NA,"unknown","unknown","unknown"," "," ","","","Massachusetts","Berkshire","Adams","Saddle Mountain (possibly Mt. Graylock)",42.61765,-73.18965,NA,"N",NA,"Y","Not Scorable","","","","","locality","","JA"
"1203",1998725,"NE","MASS","specimen","Chelone glabra","Chelone","glabra","8/14/1930",1930,8,14,226,1930226,"flowering","unknown","Y","N"," "," ","","","Massachusetts","Hampshire","Worthington","",42.39536,-72.94243,8415,"Y","?","Y","Yes","Flowering","","","","provided","provided","JA"
"1204",1999321,"NE","MASS","specimen","Chelone glabra","Chelone","glabra","8/21/1875",1875,8,21,233,1875233,"flowering","unknown","Y","N"," "," ","","","Massachusetts","Worcester","","",42.351396,-71.907727,61109,"Y","?","Y","Yes","Flowering","","","","county","geolocate","JA"
"1205",1999504,"NE","MASS","specimen","Chelone glabra","Chelone","glabra","8/20/1930",1930,8,20,232,1930232,"flowering","unknown","Y","N"," "," ","","","Vermont","Windham","Dover","",42.95779,-72.84308,7925,"Y","?","Y","Yes","Flowering","","","","provided","provided","JA"
"1206",2000149,"NE","MASS","specimen","Chelone glabra","Chelone","glabra","8/19/1930",1930,8,19,231,1930231,"flowering","unknown","Y","N"," "," ","","","Vermont","Windham","Whitingham","",42.789249,-72.885098,3036,"Y","?","Y","Yes","Flowering","","","","town","geolocate","JA"
"1207",2001266,"NE","MASS","specimen","Chelone glabra","Chelone","glabra","8/22/1911",1911,8,22,234,1911234,"flowering","unknown","Y","N"," "," ","","","Massachusetts","Essex","Haverhill","",42.776202,-71.07728,9078,"Y","?","Y","Yes","Flowering","","","","town","geolocate","JA"
"1208",2002276,"NE","MASS","specimen","Chelone glabra","Chelone","glabra","8/14/1930",1930,8,14,226,1930226,"flowering","unknown","Y","N"," "," ","","","Massachusetts","Hampshire","Chesterfield","",42.3917522,-72.839817,4000,"Y","?","Y","Yes","Flowering","","","","provided","provided","JA"
"1209",2004747,"NE","MASS","specimen","Chelone glabra","Chelone","glabra","8/8/1895",1895,8,8,220,1895220,"flowering","unknown","Y","N"," "," ","","same day/place, same phenology?","Maine","Piscataquis","Dover","",NA,NA,NA,"Y","Y","Y","Yes","Flowering","","","","","","JA"
"1210",2006417,"NE","MASS","specimen","Chelone glabra","Chelone","glabra","10/18/1966",1966,10,18,291,1966291,"fruit","N","N","Y"," "," ","","","Massachusetts","Worcester","West Brookfield","",42.25409,-72.16004,8451,"Y","?","Y","Yes","Fruiting","","","","provided","provided","JA"
"1211",2007155,"NE","MASS","specimen","Chelone glabra","Chelone","glabra","9/11/1938",1938,9,11,254,1938254,"flowering","unknown","Y","N"," "," ","","","Massachusetts","Hampshire","Northampton","",42.32664,-72.67454,7473,"Y","?","Y","Yes","Flowering","","","","provided","provided","JA"
"1212",2009995,"NE","MASS","specimen","Chelone glabra","Chelone","glabra","7/31/1980",1980,7,31,213,1980213,"buds","Y","N","N"," "," ","","","New Hampshire","Belknap","Tilton","Lochmere",43.46707,-71.5748,6547,"Y","?","Y","Yes","Flowering","Early","","","provided","provided","JA"
"1213",2015362,"NE","MASS","specimen","Chelone glabra","Chelone","glabra","9/9/1930",1930,9,9,252,1930252,"flowering","unknown","Y","N"," "," ","","","Massachusetts","Hampshire","Northampton","",42.32664,-72.67454,7473,"Y","?","Y","Yes","Flowering","","","","provided","provided","JA"
"1214",2016135,"NE","MASS","specimen","Chelone glabra","Chelone","glabra","8/23/1929",1929,8,23,235,1929235,"flowering","unknown","Y","N"," "," ","","","Massachusetts","Hampshire","Enfield","below altitude of 520 ft, later innundated by the metropolitan water supply lake",42.316667,-72.332778,NA,"Y","?","Y","Yes","Flowering","","","","town","","JA"
"1215",2016537,"NE","MASS","specimen","Chelone glabra","Chelone","glabra","8/26/1929",1929,8,26,238,1929238,"flowering","unknown","Y","N"," "," ","","same day/place, same phenology","Massachusetts","Franklin","New Salem","",42.5042553,-72.3320274,4000,"Y","?","Y","Yes","Flowering","","","","provided","provided","JA"
"1216",2017694,"NE","MASS","specimen","Chelone glabra","Chelone","glabra","9/2/1928",1928,9,2,246,1928246,"flowering and fruit???","unknown","Y","Y"," "," ","recheck phenology: very unsure","","Massachusetts","Worcester","Hubbardston","",42.4736996,-72.0061913,5050,"Y","?","Y","Yes","Both","","","","provided","provided","JA"
"1217",2019017,"NE","MASS","specimen","Chelone glabra","Chelone","glabra","8/14/1927",1927,8,14,226,1927226,"flowering","unknown","Y","N"," "," ","","","Massachusetts","Worcester","Holden","",42.35614,-71.86077,8745,"Y","?","Y","Yes","Flowering","","","","provided","provided","JA"
"1218",2019870,"NE","MASS","specimen","Chelone glabra","Chelone","glabra","8/3/1991",1991,8,3,215,1991215,"flowering","unknown","Y","N"," "," ","","","Massachusetts","Worcester","Lancaster","",42.4556484,-71.6731224,4500,"Y","?","Y","Yes","Flowering","","","","provided","provided","JA"
"1219",2020467,"NE","MASS","specimen","Chelone glabra","Chelone","glabra","7/31/1932",1932,7,31,213,1932213,"flowering","unknown","Y","N"," "," ","","","Massachusetts","Hampshire","Huntington","",42.2362003,-72.875927,4500,"Y","?","Y","Yes","Flowering","","","","provided","provided","JA"
"1220",2022300,"NE","MASS","specimen","Chelone glabra","Chelone","glabra","9/19/1933",1933,9,19,262,1933262,"flowering","unknown","Y","N"," "," ","","","Massachusetts","Hampden","Wilbraham","",42.1237068,-72.431469,4000,"Y","?","Y","Yes","Flowering","","","","provided","provided","JA"
"1221",2022774,"NE","MASS","specimen","Chelone glabra","Chelone","glabra","8/15/1967",1967,8,15,227,1967227,"buds","Y","N","N"," "," ","","","New Hampshire","Hillsborough","Peterborough","",42.870639,-71.951746,3700,"Y","?","Y","Yes","Flowering","Early","","","town","best estimate","JA"
"1222",2022870,"NE","MASS","specimen","Chelone glabra","Chelone","glabra","8/31/1991",1991,8,31,243,1991243,"flowering","unknown","Y","N"," "," ","","","Massachusetts","Worcester","Lancaster","",42.4556484,-71.6731224,4500,"Y","?","Y","Yes","Flowering","","","","provided","provided","JA"
"1223",2023739,"NE","MASS","specimen","Chelone glabra","Chelone","glabra","8/8/1967",1967,8,8,220,1967220,"flowering","unknown","Y","N"," "," ","","","Vermont","Windsor","Cavendish","",43.382017,-72.608149,3036,"Y","?","Y","Yes","Flowering","","","","town","geolocate","JA"
"1224",2025552,"NE","MASS","specimen","Chelone glabra","Chelone","glabra","8/28/1904",1904,8,28,241,1904241,"flowering","unknown","Y","N"," "," ","","","Massachusetts","Hampshire","Amherst","North Amherst",42.36447,-72.50686,7831,"Y","?","Y","Yes","Flowering","","","","provided","provided","JA"
"1225",2027587,"NE","MASS","specimen","Chelone glabra","Chelone","glabra","9/8/1970",1970,9,8,251,1970251,"flowering and ?","maybe","Y","maybe"," "," ","recheck phenology: unsure","","New Hampshire","Coos","Carroll","",44.29975,-71.50513,12924,"Y","?","Y","Yes","Flowering","","","","provided","provided","JA"
"1226",2028029,"NE","MASS","specimen","Chelone glabra","Chelone","glabra","8/9/1979",1979,8,9,221,1979221,"flowering","unknown","Y","N"," "," ","","","Vermont","Bennington","Dorset","",43.25879,-73.05147,8006,"Y","?","Y","Yes","Flowering","","","","provided","provided","JA"
"1227",2028435,"NE","MASS","specimen","Chelone glabra","Chelone","glabra","8/31/1974",1974,8,31,243,1974243,"flowering","unknown","Y","N"," "," ","","","Vermont","Addison","Orwell","",43.80625,-73.29317,8251,"Y","?","Y","Yes","Flowering","","","","provided","provided","JA"
"1228",2028597,"NE","MASS","specimen","Chelone glabra","Chelone","glabra","8/19/1968",1968,8,19,232,1968232,"flowering","unknown","Y","N"," "," ","","","Maine","Oxford","Denmark","",43.970349,-70.803397,3036,"Y","?","Y","Yes","Flowering","","","","town","geolocate","JA"
"1229",2029220,"NE","MASS","specimen","Chelone glabra","Chelone","glabra","8/22/1911",1911,8,22,234,1911234,"flowering","unknown","Y","N"," "," ","","","Massachusetts","Hampshire","Amherst","",42.36447,-72.50686,7831,"Y","?","Y","Yes","Flowering","","","","provided","provided","JA"
"1230",2029965,"NE","MASS","specimen","Chelone glabra","Chelone","glabra","8/27/1931",1931,8,27,239,1931239,"flowering","unknown","Y","N"," "," ","","","Maine","Hancock","Brooksville","",44.35668,-68.74437,8276,"Y","?","Y","Yes","Flowering","","","","provided","provided","JA"
"1231",2030842,"NE","MASS","specimen","Chelone glabra","Chelone","glabra","10/17/1972",1972,10,17,291,1972291,"fruit","N","N","Y"," "," ","","","Massachusetts","Bristol","Acushnet","",41.6807451,-70.9078178,5050,"Y","?","Y","Yes","Fruiting","","","","provided","provided","JA"
"1232",2033558,"NE","MASS","specimen","Chelone glabra","Chelone","glabra","8/15/1974",1974,8,15,227,1974227,"flowering","unknown","Y","N"," "," ","","","Maine","Waldo","Belmont","near se shore of tilden pond",44.3795,-69.11428,5074,"Y","Y","Y","Yes","Flowering","","","""Coordinates are for the centroid of the town polygon. The uncertainty is the largest possible distance between the centroid and the polygon edge.""","provided (town level)","provided","JA"
"1233",2035121,"NE","MASS","specimen","Chelone glabra","Chelone","glabra","8/28/1925",1925,8,28,240,1925240,"flowering","unknown","Y","N"," "," ","","same day/place, same phenology","Massachusetts","Hampden","Ludlow","",42.1921,-72.45805,6281,"Y","?","Y","Yes","Flowering","","","","provided","provided","JA"
"1234",2035254,"NE","MASS","specimen","Chelone glabra","Chelone","glabra","8/28/1929",1929,8,28,240,1929240,"flowering","unknown","Y","N"," "," ","","","Massachusetts","Franklin","New Salem","",42.5042553,-72.3320274,4000,"Y","?","Y","Yes","Flowering","","","","provided","provided","JA"
"1235",2035349,"NE","MASS","specimen","Chelone glabra","Chelone","glabra","9/15/1952",1952,9,15,259,1952259,"flowering","unknown","Y","N"," "," ","","","Massachusetts","Hampshire","Amherst","",42.36447,-72.50686,7831,"Y","?","Y","Yes","Flowering","","","","provided","provided","JA"
"1236",2035784,"NE","MASS","specimen","Chelone glabra","Chelone","glabra","11/30/1863",1863,11,30,334,1863334,"flowering","unknown","Y","N"," "," ","","","Connecticut","New Haven","New Haven","",41.3082729,-72.9281578,5080,"Y","?","Y","Yes","Flowering","","","","provided","provided","JA"
"1237",2037586,"NE","MASS","specimen","Chelone glabra","Chelone","glabra","9/8/1930",1930,9,8,251,1930251,"flowering and ?","maybe","Y","maybe"," "," ","recheck phenology: unsure","","Massachusetts","Hampshire","South Hadley","",42.2584267,-72.5745354,5000,"Y","?","Y","Yes","Flowering","","","","provided","provided","JA"
"1238",2039910,"NE","MASS","specimen","Chelone glabra","Chelone","glabra","8/6/1929",1929,8,6,218,1929218,"flowering","unknown","Y","N"," "," ","","","Massachusetts","Hampshire","Prescott","below altitude of 520 ft, later innundated by the metropolitan water supply lake",42.391667,-72.344722,NA,"Y","?","Y","Yes","Flowering","","","","town","","JA"
"1239",2040061,"NE","MASS","specimen","Chelone glabra","Chelone","glabra","8/8/1967",1967,8,8,220,1967220,"flowering","unknown","Y","N"," "," ","","","Vermont","Rutland","Poultney","",43.53265,-73.19201,9109,"Y","?","Y","Yes","Flowering","","","","provided","provided","JA"
"1240",2040546,"NE","MASS","specimen","Chelone glabra","Chelone","glabra","8/31/1871",1871,8,31,243,1871243,"flowering","unknown","Y","N"," "," ","","","Massachusetts","Hampshire","Belchertown","",42.27875,-72.40038,10475,"Y","?","Y","Yes","Flowering","","","","provided","provided","JA"
"1241",2041673,"NE","MASS","specimen","Chelone glabra","Chelone","glabra","8/17/2011",2011,8,17,229,2011229,"flowering","unknown","Y","N"," "," ","","","Massachusetts","Franklin","Ashfield","25 m southeast of Ashfield Pond adjacent to South River;",42.5288,-72.79796,NA,"Y","?","Y","Yes","Flowering","","","","provided","","JA"
"1242",2043021,"NE","MASS","specimen","Chelone glabra","Chelone","glabra","8/18/1926",1926,8,18,230,1926230,"flowering","unknown","Y","N"," "," ","","","Vermont","Orange","Orange","",44.15594,-72.3747,8037,"Y","?","Y","Yes","Flowering","","","","provided","provided","JA"
"1243",2043095,"NE","MASS","specimen","Chelone glabra","Chelone","glabra","8/29/1891",1891,8,29,241,1891241,"flowering","unknown","Y","N"," "," ","","","Massachusetts","Barnstable","Sandwich","",41.7551942,-70.4944913,5400,"Y","?","Y","Yes","Flowering","","","","provided","provided","JA"
"1244",2044010,"NE","MASS","specimen","Chelone glabra","Chelone","glabra","8/9/1908",1908,8,9,222,1908222,"flowering","unknown","Y","N"," "," ","","","Vermont","Rutland","Wallingford","",43.44037,-72.94496,7712,"Y","?","Y","Yes","Flowering","","","","provided","provided","JA"
"1245",2044618,"NE","MASS","specimen","Chelone glabra","Chelone","glabra","9/18/1930",1930,9,18,261,1930261,"flowering","unknown","Y","N"," "," ","","","Massachusetts","Hampshire","Easthampton","",42.26514,-72.67205,5742,"Y","?","Y","Yes","Flowering","","","","provided","provided","JA"
"1246",2050543,"NE","MASS","specimen","Chelone glabra","Chelone","glabra","7/20/2012",2012,7,20,202,2012202,"flowering","unknown","Y","N"," "," ","","","Massachusetts","Franklin","Hawley","wetland northeast of East Hawley Road just northwest of its intersection with Grout Road",42.58023,-72.88728,NA,"Y","?","Y","Yes","Flowering","","","","provided","","JA"
"1247",2051069,"NE","MASS","specimen","Chelone glabra","Chelone","glabra","9/8/1974",1974,9,8,251,1974251,"flowering","unknown","Y","N"," "," ","","same day/place, some have different phenology","Massachusetts","Hampshire","Northampton","Swampy woodland border, off bridge rd, northampton.",42.3385586,-72.65643,2000,"Y","?","Y","Yes","Flowering","","","","locality","best estimate","JA"
"1248",2053388,"NE","MASS","specimen","Chelone glabra","Chelone","glabra","8/3/1923",1923,8,3,215,1923215,"flowering and fruit???","unknown","Y","Y"," "," ","recheck phenology: very unsure","","New Hampshire","Coos","","glen house",44.288398,-71.225352,3036,"Y","Y","Y","Yes","Both","",""," assuming glen house is name of place in coos county","town","geolocate","JA"
"1249",2053688,"NE","MASS","specimen","Chelone glabra","Chelone","glabra","8/28/1974",1974,8,28,240,1974240,"flowering and fruit???","unknown","Y","Y"," "," ","recheck phenology: very unsure","","Connecticut","Litchfield","Torrington","",41.83494,-73.12807,8490,"Y","?","Y","Yes","Both","","","","provided","provided","JA"
"1250",2055406,"NE","MASS","specimen","Chelone glabra","Chelone","glabra","8/16/1929",1929,8,16,228,1929228,"flowering","unknown","Y","N"," "," ","","same day/place, same phenology","Massachusetts","Hampshire","Greenwich","swift river vally, later inundated by metropolitan water supply lake",NA,NA,NA,"Y","Y","Y","Yes","Flowering","","","","","","JA"
"1251",2057595,"NE","MASS","specimen","Chelone glabra","Chelone","glabra","9/1/1931",1931,9,1,244,1931244,"flowering","unknown","Y","N"," "," ","","","Massachusetts","Worcester","Dana","shore of lake neeseponset",42.421944,-72.2275,NA,"Y","?","Y","Yes","Flowering","","","","town","","JA"
"1252",2057655,"NE","MASS","specimen","Chelone glabra","Chelone","glabra","7/31/1876",1876,7,31,213,1876213,"flowering","unknown","Y","N"," "," ","","","Massachusetts","Hampshire","Pelham","",42.3931446,-72.403698,5050,"Y","?","Y","Yes","Flowering","","","","provided","provided","JA"
"1253",2057772,"NE","MASS","specimen","Chelone glabra","Chelone","glabra","8/25/1974",1974,8,25,237,1974237,"flowering","unknown","Y","N"," "," ","","","Connecticut","Tolland","Stafford","",41.98754,-72.31232,10116,"Y","?","Y","Yes","Flowering","","","","provided","provided","JA"
"1254",2058319,"NE","MASS","specimen","Chelone glabra","Chelone","glabra","9/11/1930",1930,9,11,254,1930254,"flowering","unknown","Y","N"," "," ","","","Massachusetts","Hampshire","Westhampton","",42.3028641,-72.7745399,5000,"Y","?","Y","Yes","Flowering","","","","provided","provided","JA"
"1255",2058721,"NE","MASS","specimen","Chelone glabra","Chelone","glabra","8/22/1930",1930,8,22,234,1930234,"flowering","unknown","Y","N"," "," ","","same day/place, same phenology","Massachusetts","Hampshire","Amherst","",42.36447,-72.50686,7831,"Y","?","Y","Yes","Flowering","","","","provided","provided","JA"
"1256",2059464,"NE","MASS","specimen","Chelone glabra","Chelone","glabra","6/30/1893",1893,6,30,181,1893181,"buds","Y","N","N"," "," ","","","Massachusetts","Worcester","Petersham","",42.4875889,-72.1870232,5000,"Y","?","Y","Yes","Flowering","Early","","","provided","provided","JA"
"1257",2060224,"NE","MASS","specimen","Chelone glabra","Chelone","glabra","9/5/1931",1931,9,5,248,1931248,"flowering","unknown","Y","N"," "," ","","","Massachusetts","Hampshire","Easthampton","",42.26514,-72.67205,5742,"Y","?","Y","Yes","Flowering","","","","provided","provided","JA"
"1258",2062076,"NE","MASS","specimen","Chelone glabra","Chelone","glabra","9/7/1977",1977,9,7,250,1977250,"flowering and fruit???","unknown","Y","Y"," "," ","recheck phenology: very unsure","","Massachusetts","Franklin","Deerfield","roadside swampy area north side of Hillside Road",42.52202,-72.60972,7304,"Y","?","Y","Yes","Both","","","","provided","provided","JA"
"1259",2062146,"NE","MASS","specimen","Chelone glabra","Chelone","glabra","9/3/1902",1902,9,3,246,1902246,"flowering","unknown","Y","N"," "," ","","","Massachusetts","Essex","Amesbury","",42.8497627,-70.9300575,5400,"Y","?","Y","Yes","Flowering","","","","provided","provided","JA"
"1260",2062239,"NE","MASS","specimen","Chelone glabra","Chelone","glabra","8/28/1925",1925,8,28,240,1925240,"flowering","unknown","Y","N"," "," ","","same day/place, same phenology","Massachusetts","Hampden","Ludlow","higher brook",42.1921,-72.45805,6281,"Y","Y","Y","Yes","Flowering","","","""Coordinates are for the centroid of the town polygon. The uncertainty is the largest possible distance between the centroid and the polygon edge.""","provided (town level)","provided","JA"
"1261",2062532,"NE","MASS","specimen","Chelone glabra","Chelone","glabra","8/24/1929",1929,8,24,236,1929236,"flowering","unknown","Y","N"," "," ","","","Massachusetts","Worcester","Petersham","",42.4875889,-72.1870232,5000,"Y","?","Y","Yes","Flowering","","","","provided","provided","JA"
"1262",2063860,"NE","MASS","specimen","Chelone glabra","Chelone","glabra","8/13/1968",1968,8,13,226,1968226,"flowering","unknown","Y","N"," "," ","","","Maine","Somerset","Fairfield","",44.63722,-69.67516,9461,"Y","?","Y","Yes","Flowering","","","","provided","provided","JA"
"1263",2064009,"NE","MASS","specimen","Chelone glabra","Chelone","glabra","8/25/1907",1907,8,25,237,1907237,"flowering","unknown","Y","N"," "," ","","","Massachusetts","Franklin","Buckland","",42.5923061,-72.7917595,5000,"Y","?","Y","Yes","Flowering","","","","provided","provided","JA"
"1264",2067140,"NE","MASS","specimen","Chelone glabra","Chelone","glabra","8/10/1978",1978,8,10,222,1978222,"flowering","unknown","Y","N"," "," ","","","Vermont","Lamoille","Eden","",44.707272,-72.545669,3036,"Y","?","Y","Yes","Flowering","","","","town","geolocate","JA"
"1265",2070478,"NE","MASS","specimen","Chelone glabra","Chelone","glabra","8/12/1928",1928,8,12,225,1928225,"flowering","unknown","Y","N"," "," ","","","Massachusetts","Hampshire","Chesterfield","",42.3917522,-72.839817,4000,"Y","?","Y","Yes","Flowering","","","","provided","provided","JA"
"1266",2072771,"NE","MASS","specimen","Chelone glabra","Chelone","glabra","8/31/1899",1899,8,31,243,1899243,"flowering","unknown","Y","N"," "," ","","","Massachusetts","Norfolk","Brookline","",42.32426,-71.1408,4005,"Y","?","Y","Yes","Flowering","","","","provided","provided","JA"
"1267",2073024,"NE","MASS","specimen","Chelone glabra","Chelone","glabra","9/8/1890",1890,9,8,251,1890251,"flowering and fruit","unknown","Y","Y"," "," ","","","Massachusetts","Hampshire","Northampton","",42.32664,-72.67454,7473,"Y","?","Y","Yes","Both","","","","provided","provided","JA"
"1268",2076945,"NE","MASS","specimen","Chelone glabra","Chelone","glabra","8/9/1926",1926,8,9,221,1926221,"flowering","unknown","Y","N"," "," ","","","Massachusetts","Berkshire","Florida","",42.68035,-73.01449,7357,"Y","?","Y","Yes","Flowering","","","","provided","provided","JA"
"1269",2077923,"NE","MASS","specimen","Chelone glabra","Chelone","glabra","8/14/1930",1930,8,14,226,1930226,"flowering","unknown","Y","N"," "," ","","","Massachusetts","Hampshire","Westhampton","",42.3028641,-72.7745399,5000,"Y","?","Y","Yes","Flowering","","","","provided","provided","JA"
"1270",2077955,"NE","MASS","specimen","Chelone glabra","Chelone","glabra","8/14/1930",1930,8,14,226,1930226,"flowering","unknown","Y","N"," "," ","","","Massachusetts","Hampshire","Williamsburg","",42.3931446,-72.7300911,4000,"Y","?","Y","Yes","Flowering","","","","provided","provided","JA"
"1271",2079000,"NE","MASS","specimen","Chelone glabra","Chelone","glabra","9/8/1930",1930,9,8,251,1930251,"flowering and fruit?","unknown","Y","Y"," "," ","recheck phenology: unsure","","Massachusetts","Hampshire","Hadley","",42.3417568,-72.5884247,4500,"Y","?","Y","Yes","Both","","","","provided","provided","JA"
"1272",2080620,"NE","MASS","specimen","Chelone glabra","Chelone","glabra","9/8/1930",1930,9,8,251,1930251,"flowering","unknown","Y","N"," "," ","","","Massachusetts","Hampden","Ludlow","",42.1921,-72.45805,6281,"Y","?","Y","Yes","Flowering","","","","provided","provided","JA"
"1273",2081146,"NE","MASS","specimen","Chelone glabra","Chelone","glabra","9/6/1996",1996,9,6,250,1996250,"flowering","unknown","Y","N"," "," ","","","Massachusetts","Worcester","Worcester","Broad Meadow Brook NW of Route 20, E of Granite St., S of Hampton St., W of Massasoit Rd.",42.27054,-71.80794,8059,"Y","?","Y","Yes","Flowering","","","","provided","provided","JA"
"1274",2082521,"NE","MASS","specimen","Chelone glabra","Chelone","glabra","8/19/1972",1972,8,19,232,1972232,"flowering","unknown","Y","N"," "," ","","same day/place, same phenology","Rhode Island","Newport","Little Compton","Nr Quicksand Pond.",41.507054,-71.130322,1600,"Y","?","Y","Yes","Flowering","","","","locality","best estimate","JA"
"1275",15883485,"MW","MCA","specimen","Chelone glabra","Chelone","glabra","9/3/1960",1960,9,3,247,1960247,"flowering","unknown","Y","N"," "," ","","","Pennsylvania","Luzerne","","1/2 mile SW of White Haven",41.055516,-75.780877,1747,"Y","Y","Y","Yes","Flowering","","","","town+direction+distance","geolocate","JA"
"1276",15883486,"MW","MCA","specimen","Chelone glabra","Chelone","glabra","8/6/1960",1960,8,6,219,1960219,"flowering","unknown","Y","N"," "," ","","","Pennsylvania","Luzerne","","1/2 mile W of Lehigh Tannery",41.038247,-75.76999,300,"Y","Y","Y","Yes","Flowering","","","","locality","best estimate","JA"
"1277",15883487,"MW","MCA","specimen","Chelone glabra","Chelone","glabra","8/13/1971",1971,8,13,225,1971225,"flowering","unknown","Y","N"," "," ","","","Pennsylvania","Monroe","","2 mi W of Dottersville",40.898386,-75.536594,4000,"Y","Y","Y","Yes","Flowering","","","","town+direction+distance","best estimate","JA"
"1278",15883488,"MW","MCA","specimen","Chelone glabra","Chelone","glabra","8/17/1963",1963,8,17,229,1963229,"flowering","unknown","Y","N"," "," ","","","Pennsylvania","Monroe","","Poplar Gap",41.001756,-75.461853,301,"Y","Y","Y","Yes","Flowering","","","","town","geolocate","JA"
"1279",15883489,"MW","MCA","specimen","Chelone glabra","Chelone","glabra","8/29/1964",1964,8,29,242,1964242,"flowering","unknown","Y","N"," "," ","","","Pennsylvania","Monroe","","1 1/2 miles S of Beaver Brook School",41.05362,-75.44089,700,"Y","Y","Y","Yes","Flowering","","","","locality","best estimate","JA"
"1280",15883490,"MW","MCA","specimen","Chelone glabra","Chelone","glabra","9/12/1964",1964,9,12,256,1964256,"fruit","N","N","Y"," "," ","","","Pennsylvania","Monroe","","2 miles NW of Pocono Lake",41.12722,-75.503085,8000,"Y","Y","Y","Yes","Fruiting","",""," could be name of lake or of town","town+direction+distance","best estimate","JA"
"1281",15883491,"MW","MCA","specimen","Chelone glabra","Chelone","glabra","8/31/1963",1963,8,31,243,1963243,"flowering","unknown","Y","N"," "," ","","same day/place, same phenology","Pennsylvania","Carbon","","1.5 mi W of Hauto",40.844252,-75.919767,4260,"Y","Y","Y","Yes","Flowering","","","","town+direction+distance","geolocate","JA"
"1282",15883492,"MW","MCA","specimen","Chelone glabra","Chelone","glabra","8/27/1968",1968,8,27,240,1968240,"flowering","unknown","Y","N"," "," ","","","Pennsylvania","Carbon","","2 miles E of Big Creek",40.845641,-75.609652,6033,"Y","Y","Y","Yes","Flowering","","","","town+direction+distance","geolocate","JA"
"1283",15883493,"MW","MCA","specimen","Chelone glabra","Chelone","glabra","8/20/1980",1980,8,20,233,1980233,"flowering","unknown","Y","N"," "," ","","","Pennsylvania","Carbon","","S of Palmerton",40.801483,-75.610187,4243,"Y","Y","Y","Yes","Flowering","","","","town","geolocate","JA"
"1284",15883494,"MW","MCA","specimen","Chelone glabra","Chelone","glabra","8/13/1970",1970,8,13,225,1970225,"buds","Y","N","N"," "," ","","","Pennsylvania","Carbon","","1/2 mile E of Big Creek",40.845647,-75.638387,3479,"Y","Y","Y","Yes","Flowering","Early","","","town+direction+distance","geolocate","JA"
"1285",15883495,"MW","MCA","specimen","Chelone glabra","Chelone","glabra","8/12/1971",1971,8,12,224,1971224,"flowering","unknown","Y","N"," "," ","","","Pennsylvania","Carbon","","4 miles NW of Trachsville",40.921901,-75.583565,5695,"Y","Y","Y","Yes","Flowering","","","","town+direction+distance","geolocate","JA"
"1286",15883496,"MW","MCA","specimen","Chelone glabra","Chelone","glabra","8/21/1970",1970,8,21,233,1970233,"flowering","unknown","Y","N"," "," ","","","Pennsylvania","Carbon","","1 mile NE of Beltzville",40.850339,-75.621921,4807,"Y","Y","Y","Yes","Flowering","","","","town+direction+distance","geolocate","JA"
"1287",15883497,"MW","MCA","specimen","Chelone glabra","Chelone","glabra","8/19/1964",1964,8,19,232,1964232,"buds","Y","N","N"," "," ","","","Pennsylvania","Carbon","","just E of Lehighton",40.833703,-75.713801,1743,"Y","Y","Y","Yes","Flowering","Early","","","town","geolocate","JA"
"1288",15883498,"MW","MCA","specimen","Chelone glabra","Chelone","glabra","9/10/1963",1963,9,10,253,1963253,"flowering","unknown","Y","N"," "," ","","","Pennsylvania","Carbon","","2 miles SE of Lehighton",40.813205,-75.686713,3802,"Y","Y","Y","Yes","Flowering","","","","town+direction+distance","geolocate","JA"
"1289",15883499,"MW","MCA","specimen","Chelone glabra","Chelone","glabra","8/31/1971",1971,8,31,243,1971243,"flowering","unknown","Y","N"," "," ","","","Pennsylvania","Carbon","","1/4 mi W of Trachsville",40.880925,-75.534144,NA,"Y","Y","Y","Yes","Flowering","","","need to change latlon based on new locality info","town+direction+distance","","JA"
"1290",15883500,"MW","MCA","specimen","Chelone glabra","Chelone","glabra","8/31/1963",1963,8,31,243,1963243,"flowering","unknown","Y","N"," "," ","","same day/place, same phenology","Pennsylvania","Carbon","","1 1/2 miles W of Hauto",NA,NA,NA,"Y","Y","Y","Yes","Flowering","","","","","","JA"
"1291",15883501,"MW","MCA","specimen","Chelone glabra","Chelone","glabra","8/10/1963",1963,8,10,222,1963222,"flowering","unknown","Y","N"," "," ","","","Pennsylvania","Carbon","","Leslie Run",40.996833,-75.727354,210,"Y","Y","Y","Yes","Flowering","","","","town","geolocate","JA"
"1292",15883502,"MW","MCA","specimen","Chelone glabra","Chelone","glabra","8/21/1960",1960,8,21,234,1960234,"flowering","unknown","Y","N"," "," ","","","Pennsylvania","Carbon","","1 mile SE of Leslie Run",40.985675,-75.715655,NA,"Y","Y","Y","Yes","Flowering","",""," unsure about accuracy","town+direction+distance","","JA"
"1293",15883503,"MW","MCA","specimen","Chelone glabra","Chelone","glabra","8/28/1954",1954,8,28,240,1954240,"flowering","unknown","Y","N"," "," ","","","Pennsylvania","Carbon","","2.5 mi NE of Nesquehoning",40.890147,-75.777153,10206,"Y","Y","Y","Yes","Flowering","","","","town+direction+distance","geolocate","JA"
"1294",15883504,"MW","MCA","specimen","Chelone glabra","Chelone","glabra","8/16/1966",1966,8,16,228,1966228,"buds","Y","N","N"," "," ","","","Pennsylvania","Northampton","","1/2 mile SE of Stoke Park",40.656085,-75.369259,3272,"Y","Y","Y","Yes","Flowering","Early","","","town+direction+distance","geolocate","JA"
"1295",15883505,"MW","MCA","specimen","Chelone glabra","Chelone","glabra","8/20/1953",1953,8,20,232,1953232,"flowering","unknown","Y","N"," "," ","","","Pennsylvania","Northampton","","1 mile SE of North Bangor",40.89457,-75.18051,4807,"Y","Y","Y","Yes","Flowering","","","","town+direction+distance","geolocate","JA"
"1296",15883506,"MW","MCA","specimen","Chelone glabra","Chelone","glabra","8/28/1957",1957,8,28,240,1957240,"flowering","unknown","Y","N"," "," ","","","Pennsylvania","Lehigh","Allentown","1 1/4 miles SE of center square",40.589581,-75.453584,1000,"Y","Y","Y","Yes","Flowering","","","","locality+direction+distance","best estimate","JA"
"1297",15883507,"MW","MCA","specimen","Chelone glabra","Chelone","glabra","9/18/1954",1954,9,18,261,1954261,"fruit","N","N","Y"," "," ","","","Pennsylvania","Lehigh","","1 mile N of Lynnport",40.689864,-75.804917,5241,"Y","Y","Y","Yes","Fruiting","","","","town+direction+distance","geolocate","JA"
"1298",15883508,"MW","MCA","specimen","Chelone glabra","Chelone","glabra","8/28/1979",1979,8,28,240,1979240,"flowering","unknown","Y","N"," "," ","","","Pennsylvania","Lehigh","","3 miles SE of Dorneyville",40.544347,-75.479153,5342,"Y","Y","Y","Yes","Flowering","","","","town+direction+distance","geolocate","JA"
"1299",15883509,"MW","MCA","specimen","Chelone glabra","Chelone","glabra","9/3/1954",1954,9,3,246,1954246,"flowering and ?","maybe","Y","maybe"," "," ","recheck phenology: unsure","","Pennsylvania","Lehigh","","1 1/2 miles SW of Schnecksville",40.6525,-75.627397,3504,"Y","Y","Y","Yes","Flowering","","","","town+direction+distance","geolocate","JA"
"1300",15883510,"MW","MCA","specimen","Chelone glabra","Chelone","glabra","9/1/1977",1977,9,1,244,1977244,"flowering","unknown","Y","N"," "," ","","","Pennsylvania","Lehigh","","1 1/2 mi S of Catasauqua",40.633081,-75.474627,2938,"Y","Y","Y","Yes","Flowering","","","","town+direction+distance","geolocate","JA"
"1301",15883707,"MW","MCA","specimen","Chelone glabra","Chelone","glabra","9/1/1971",1971,9,1,244,1971244,"flowering and ???","maybe","Y","maybe"," "," ","recheck phenology: very unsure","","Pennsylvania","Lehigh","","1 mile NW of Jacksonville",40.681173,-75.842041,4807,"Y","Y","Y","Yes","Flowering","","","","town+direction+distance","geolocate","JA"
"1302",15883708,"MW","MCA","specimen","Chelone glabra","Chelone","glabra","8/25/1975",1975,8,25,237,1975237,"flowering","unknown","Y","N"," "," ","","","Pennsylvania","Lehigh","","West Bethlehem, canal bank",40.625932,-75.370458,7235,"Y","Y","Y","Yes","Flowering","","","","town","geolocate","JA"
"1303",15883709,"MW","MCA","specimen","Chelone glabra","Chelone","glabra","8/28/1972",1972,8,28,241,1972241,"flowering","unknown","Y","N"," "," ","","","Pennsylvania","Lehigh","","just E of Coplay",40.670096,-75.495461,1050,"Y","Y","Y","Yes","Flowering","","","","town","geolocate","JA"
"1304",15883710,"MW","MCA","specimen","Chelone glabra","Chelone","glabra","8/21/1973",1973,8,21,233,1973233,"flowering","unknown","Y","N"," "," ","","","Pennsylvania","Lehigh","Allentown","1 mile SW of center square",40.590645,-75.484406,1000,"Y","Y","Y","Yes","Flowering","","","","locality+direction+distance","best estimate","JA"
"1305",15883711,"MW","MCA","specimen","Chelone glabra","Chelone","glabra","9/6/1971",1971,9,6,249,1971249,"flowering","unknown","Y","N"," "," ","","","Pennsylvania","Lehigh","","1.5 miles SE of Claussville",40.598889,-75.63355,3504,"Y","Y","Y","Yes","Flowering","","","","town+direction+distance","geolocate","JA"
"1306",15883712,"MW","MCA","specimen","Chelone glabra","Chelone","glabra","8/25/1966",1966,8,25,237,1966237,"flowering","unknown","Y","N"," "," ","","","Pennsylvania","Lehigh","","1 1/2 miles SW of Deibertsville",40.683606,-75.671025,3000,"Y","Y","Y","Yes","Flowering","",""," may not be right town location","town+direction+distance","best estimate","JA"
"1307",15883713,"MW","MCA","specimen","Chelone glabra","Chelone","glabra","8/12/1962",1962,8,12,224,1962224,"flowering","unknown","Y","N"," "," ","","","Pennsylvania","Lehigh","","1/4 mile SE of Cementon",40.686701,-75.504305,3086,"Y","Y","Y","Yes","Flowering","","","","town+direction+distance","geolocate","JA"
"1308",15883714,"MW","MCA","specimen","Chelone glabra","Chelone","glabra","9/1/1966",1966,9,1,244,1966244,"flowering","unknown","Y","N"," "," ","","","Pennsylvania","Lehigh","","1 mile S of Deibertsville",40.686382,-75.650622,3000,"Y","Y","Y","Yes","Flowering","",""," may not be right town location","town+direction+distance","best estimate","JA"
"1309",15883715,"MW","MCA","specimen","Chelone glabra","Chelone","glabra","10/26/1963",1963,10,26,299,1963299,"fruit","N","N","Y"," "," ","","","Pennsylvania","Lehigh","Allentown","2 - 3 mi E of Center Square. Tow path",40.603579,-75.423243,2500,"Y","Y","Y","Yes","Fruiting","","","need to change latlon based on new locality info?","locality+direction+distance","best estimate","JA"
"1310",15883716,"MW","MCA","specimen","Chelone glabra","Chelone","glabra","8/24/1965",1965,8,24,236,1965236,"flowering","unknown","Y","N"," "," ","","","Pennsylvania","Lehigh","","1 mile S of Shoenersville",40.648938,-75.424626,5241,"Y","Y","Y","Yes","Flowering","","","","town+direction+distance","geolocate","JA"
"1311",15883717,"MW","MCA","specimen","Chelone glabra","Chelone","glabra","8/27/1963",1963,8,27,239,1963239,"flowering","unknown","Y","N"," "," ","","","Pennsylvania","Lehigh","Allentown","2 miles E of Center Square. Tow path",40.60297,-75.433341,1000,"Y","Y","Y","Yes","Flowering","","","need to change latlon based on new locality info?","locality+direction+distance","best estimate","JA"
"1312",15883723,"MW","MCA","specimen","Chelone glabra","Chelone","glabra","8/30/1898",1898,8,30,242,1898242,"flowering","unknown","Y","N"," "," ","","","Pennsylvania","Lehigh","","Fountain House, Little Lehigh, in the vicinity of Allentown",40.591356,-75.484467,300,"Y","Y","Y","Yes","Flowering","","","","locality","best estimate","JA"
"1313",15883724,"MW","MCA","specimen","Chelone glabra","Chelone","glabra","9/14/1946",1946,9,14,257,1946257,"flowering","unknown","Y","N"," "," ","","","Pennsylvania","Lehigh","Allentown","along little lehigh river; along E side of stream about 2-1/2 to 2-5/8 miles SW by S of Centre Square",40.568709,-75.499423,400,"Y","Y","Y","Yes","Flowering","","","","locality","best estimate","JA"
"1314",11070555,"MW","MEM","specimen","Chelone glabra","Chelone","glabra","9/30/1978",1978,9,30,273,1978273,NA,"unknown","unknown","unknown"," "," ","","","Tennessee","Lewis","","",35.527281,-87.493096,24485,"Y",NA,"Y","Not Scorable","","","","","county","geolocate","JA"
"1315",11070566,"MW","MEM","specimen","Chelone glabra","Chelone","glabra","7/30/1968",1968,7,30,212,1968212,NA,"unknown","unknown","unknown"," "," ","","","Minnesota","Saint Louis","","",47.739462,-92.362754,120000,"N",NA,"Y","Not Scorable","","","","","county","geolocate","JA"
"1316",11070568,"MW","MEM","specimen","Chelone glabra","Chelone","glabra","10/2/1967",1967,10,2,275,1967275,NA,"unknown","unknown","unknown"," "," ","","","Kentucky","Trigg","","",36.80632,-87.873371,29287,"N",NA,"Y","Not Scorable","","","","","county","geolocate","JA"
"1317",11070569,"MW","MEM","specimen","Chelone glabra","Chelone","glabra","9/29/1968",1968,9,29,273,1968273,NA,"unknown","unknown","unknown"," "," ","","","Kentucky","Livingston","","",37.209703,-88.353814,31076,"N",NA,"Y","Not Scorable","","","","","county","geolocate","JA"
"1318",7491276,"MW","MICH","specimen","Chelone glabra","Chelone","glabra","9/27/1958",1958,9,27,270,1958270,NA,"unknown","unknown","unknown"," "," ","","","Michigan","Washtenaw","Superior","Superior Twp. 4.5 miles NE of Ann Arbor, UofM Botanical Gardens, Dixboro site. N of Gate 10, SE corner of gardens, in Cornus bog.",42.300956,-83.661936,200,"N",NA,"Y","Not Scorable","","","","","locality","best estimate","JA"
"1319",7494561,"MW","MICH","specimen","Chelone glabra","Chelone","glabra","9/10/1891",1891,9,10,253,1891253,NA,"unknown","unknown","unknown"," "," ","","","Michigan","Kent","Grand Rapids","",42.96336,-85.668086,10661,"N",NA,"Y","Not Scorable","","","","","town","geolocate","JA"
"1320",7494770,"MW","MICH","specimen","Chelone glabra","Chelone","glabra","8/11/2008",2008,8,11,224,2008224,"flowering","unknown","Y","N"," "," ","","","Michigan","Menominee","","Escanaba River State Forest. Approximately 1.4 miles (by air) northwest of the jct. of County Hwy 551 and County Hwy 336, and 11.5 miles (by air) south of Houle, along an east-west gravel road",45.53333,-87.38333,NA,"N",NA,"Y","Yes","Flowering","","","","provided","","JA"
"1321",7494967,"MW","MICH","specimen","Chelone glabra","Chelone","glabra","8/22/1960",1960,8,22,235,1960235,NA,"unknown","unknown","unknown"," "," ","","","Michigan","Washtenaw","","University of Michigan Botanical Gardens, Dixboro Site, 4.5 miles northeast of Ann Arbor, at southwest end of Gardens",42.300442,-83.664938,200,"N",NA,"Y","Not Scorable","","","","","provided","provided","JA"
"1322",7497280,"MW","MICH","specimen","Chelone glabra","Chelone","glabra","8/20/1970",1970,8,20,232,1970232,NA,"unknown","unknown","unknown"," "," ","","","Michigan","Washtenaw","","Horner Woods, swamp at N corner of tract",42.324,-83.6681,NA,"N",NA,"Y","Not Scorable","","","","","provided","","JA"
"1323",7502239,"MW","MICH","specimen","Chelone glabra","Chelone","glabra","9/28/1968",1968,9,28,272,1968272,NA,"unknown","unknown","unknown"," "," ","","","Michigan","Washtenaw","Ann Arbor","Ann Arbor, Matthaei Botanical Gardens",42.302511,-83.663126,400,"N",NA,"Y","Not Scorable","","","","","locality","best estimate","JA"
"1324",7502371,"MW","MICH","specimen","Chelone glabra","Chelone","glabra","8/28/1891",1891,8,28,240,1891240,NA,"unknown","unknown","unknown"," "," ","","","Michigan","Kent","Grand Rapids","Reed's Lake",42.953132,-85.598391,1250,"N",NA,"Y","Not Scorable","","","","","provided","provided","JA"
"1325",7502372,"MW","MICH","specimen","Chelone glabra","Chelone","glabra","8/15/1868",1868,8,15,228,1868228,NA,"unknown","unknown","unknown"," "," ","","","Michigan","Keweenaw","","Isle Royale, L. Superior",48.004115,-88.800453,40557,"N",NA,"Y","Not Scorable","","","","","provided","provided","JA"
"1326",7502544,"MW","MICH","specimen","Chelone glabra","Chelone","glabra","8/1/1981",1981,8,1,213,1981213,NA,"unknown","unknown","unknown"," "," ","","","Michigan","Antrim","","south end of Clam Lake, sec. 13, T29N R8W, Grass River.",44.916733,-85.225711,500,"N",NA,"Y","Not Scorable","","","","","PLSS/locality","best estimate","JA"
"1327",7502545,"MW","MICH","specimen","Chelone glabra","Chelone","glabra","8/21/1906",1906,8,21,233,1906233,NA,"unknown","unknown","unknown"," "," ","","","Michigan","Marquette","","Little Lake",46.277358,-87.350394,1662,"N",NA,"Y","Not Scorable","","","","","provided","provided","JA"
"1328",7502546,"MW","MICH","specimen","Chelone glabra","Chelone","glabra","8/18/1933",1933,8,18,230,1933230,NA,"unknown","unknown","unknown"," "," ","","","Michigan","Menominee","","7 mi. up Bay Shore Drive",45.216197,-87.522341,800,"N",NA,"Y","Not Scorable","","","","","provided","provided","JA"
"1329",7502547,"MW","MICH","specimen","Chelone glabra","Chelone","glabra","9/18/1860",1860,9,18,262,1860262,"flowering","unknown","Y","N"," "," ","","","Michigan","Washtenaw","Ann Arbor","",42.270872,-83.726329,7236,"N",NA,"Y","Yes","Flowering","","","","town","geolocate","JA"
"1330",7502548,"MW","MICH","specimen","Chelone glabra","Chelone","glabra","8/20/1924",1924,8,20,233,1924233,NA,"unknown","unknown","unknown"," "," ","","","Michigan","Washtenaw","Ann Arbor","just west of city beach Ann Arbor.",42.270872,-83.726329,7236,"N",NA,"Y","Not Scorable","","","","couldn't find locality, used town","town","geolocate","JA"
"1331",7502549,"MW","MICH","specimen","Chelone glabra","Chelone","glabra","8/25/1962",1962,8,25,237,1962237,NA,"unknown","unknown","unknown"," "," ","","","Michigan","Van Buren","Lawton","",42.167263,-85.846954,2075,"N",NA,"Y","Not Scorable","","","","","town","geolocate","JA"
"1332",7502550,"MW","MICH","specimen","Chelone glabra","Chelone","glabra","9/12/1980",1980,9,12,256,1980256,NA,"unknown","unknown","unknown"," "," ","","","Michigan","Monroe","Exeter","Section 5, Exeter Twp., Capernall Road near Colf Road",42.072125,-83.499794,500,"N",NA,"Y","Not Scorable","","","","","locality","best estimate","JA"
"1333",7502551,"MW","MICH","specimen","Chelone glabra","Chelone","glabra","8/28/1919",1919,8,28,240,1919240,NA,"unknown","unknown","unknown"," "," ","","","Michigan","Mackinac","","Scotty Bay",45.975853,-84.194464,647,"N",NA,"Y","Not Scorable","","","","","provided","provided","JA"
"1334",7502576,"MW","MICH","specimen","Chelone glabra","Chelone","glabra","8/4/1933",1933,8,4,216,1933216,NA,"unknown","unknown","unknown"," "," ","","","Michigan","Menominee","","near City of Menominee",45.107763,-87.614274,4359,"N",NA,"Y","Not Scorable","","","","","town","geolocate","JA"
"1335",7502577,"MW","MICH","specimen","Chelone glabra","Chelone","glabra","10/8/1890",1890,10,8,281,1890281,"fruit","N","N","Y"," "," ","","same day/place, different phenology","Michigan","Gratiot","","Alma",NA,NA,NA,"N",NA,"Y","Yes","Fruiting","","","","","","JA"
"1336",7502578,"MW","MICH","specimen","Chelone glabra","Chelone","glabra","8/16/1894",1894,8,16,228,1894228,NA,"unknown","unknown","unknown"," "," ","","","Michigan","Emmet","","Vicinity of Bay View Page",45.385565,-84.930329,43000,"N",NA,"Y","Not Scorable","","","","used coordinates for bay view but uncertainty for county","town","geolocate","JA"
"1337",7502579,"MW","MICH","specimen","Chelone glabra","Chelone","glabra","8/24/1973",1973,8,24,236,1973236,NA,"unknown","unknown","unknown"," "," ","","","Michigan","Roscommon","","Michigan Department of Natural Resources Houghton Lake Wildlife Research Area (Porter Ranch) ca. 6 km. sw of Houghton Lake.",44.285909,-84.831812,2400,"N",NA,"Y","Not Scorable","","","","","provided","provided","JA"
"1338",7502580,"MW","MICH","specimen","Chelone glabra","Chelone","glabra","8/6/1883",1883,8,6,218,1883218,NA,"unknown","unknown","unknown"," "," ","","","Michigan","Keweenaw","","Phoenix",47.388806,-88.277605,337,"N",NA,"Y","Not Scorable","","","","","provided","provided","JA"
"1339",7502581,"MW","MICH","specimen","Chelone glabra","Chelone","glabra","8/27/1922",1922,8,27,239,1922239,NA,"unknown","unknown","unknown"," "," ","","","Michigan","Washtenaw","Ann Arbor","Arboretum, Ann Arbor",42.281348,-83.720218,700,"N",NA,"Y","Not Scorable","","","","","locality","best estimate","JA"
"1340",7502582,"MW","MICH","specimen","Chelone glabra","Chelone","glabra","9/14/1958",1958,9,14,257,1958257,NA,"unknown","unknown","unknown"," "," ","","","Michigan","Berrien","Benton","near Blue Creek, center E 1/2 sec. 14, Benton Tp., ca. 1 mi. W of Millburg.",42.122267,-86.361324,5241,"N",NA,"Y","Not Scorable","","","","PLSS","town+direction+distance+locality","geolocate","JA"
"1341",7502620,"MW","MICH","specimen","Chelone glabra","Chelone","glabra","7/30/1985",1985,7,30,211,1985211,"flowering","unknown","Y","N"," "," ","","","Michigan","Marquette","","(T.42 N; R.26W ; Sect.12)",46.048897,-87.503384,841,"N",NA,"Y","Yes","Flowering","","","PLSS","provided","provided","JA"
"1342",7502622,"MW","MICH","specimen","Chelone glabra","Chelone","glabra","8/9/1934",1934,8,9,221,1934221,NA,"unknown","unknown","unknown"," "," ","","","Michigan","Iron","","Deer Lake, [10 m. N.E. of Crystal Falls]",46.20029,-88.186383,8720,"N",NA,"Y","Not Scorable","","","","couldn't find exact locality","town+direction+distance","geolocate","JA"
"1343",7502640,"MW","MICH","specimen","Chelone glabra","Chelone","glabra","8/30/1982",1982,8,30,242,1982242,NA,"unknown","unknown","unknown"," "," ","","","Michigan","Iosco","","T23N R8E Sec 12, along Old US-23, 4 1/2 mi. W of Oscoda.",44.40295,-83.411208,1200,"N",NA,"Y","Not Scorable","","","","","PLSS/locality","best estimate","JA"
"1344",7502679,"MW","MICH","specimen","Chelone glabra","Chelone","glabra","8/31/1837",1837,8,31,243,1837243,NA,"unknown","unknown","unknown"," "," ","","","Michigan","Kalamazoo","","Kal. [Kalamazoo]",42.2916,-85.5875,NA,"N",NA,"Y","Not Scorable","","","","","provided","","JA"
"1345",7502693,"MW","MICH","specimen","Chelone glabra","Chelone","glabra","9/8/1918",1918,9,8,251,1918251,NA,"unknown","unknown","unknown"," "," ","","","Michigan","Saint Clair","Port Huron","",42.970863,-82.424914,6961,"N",NA,"Y","Not Scorable","","","","","town","geolocate","JA"
"1346",7502707,"MW","MICH","specimen","Chelone glabra","Chelone","glabra","8/22/1959",1959,8,22,234,1959234,NA,"unknown","unknown","unknown"," "," ","","","Michigan","Keweenaw","","Isle Royale Nat'l Park, Grace Creek, at end of trail from Washington Harbor.",47.905367,-89.132961,6000,"N",NA,"Y","Not Scorable","","","","","locality","best estimate","JA"
"1347",7502709,"MW","MICH","specimen","Chelone glabra","Chelone","glabra","10/8/1890",1890,10,8,281,1890281,"flowering and fruit","unknown","Y","Y"," "," ","","same day/place, different phenology","Michigan","Gratiot","Alma","",43.37892,-84.659727,3201,"N",NA,"Y","Yes","Both","","","","town","geolocate","JA"
"1348",7502740,"MW","MICH","specimen","Chelone glabra","Chelone","glabra","7/29/1930",1930,7,29,210,1930210,NA,"unknown","unknown","unknown"," "," ","","","Michigan","Keweenaw","","Isle Royale, at Sargent Lake",48.095837,-88.656451,2657,"N",NA,"Y","Not Scorable","","","","","provided","provided","JA"
"1349",7502741,"MW","MICH","specimen","Chelone glabra","Chelone","glabra","9/20/1986",1986,9,20,263,1986263,"flowering","unknown","Y","N"," "," ","","","Michigan","Benzie","","Along Platte River between M-22 and Loon Lake.",44.712893,-86.123119,414,"N",NA,"Y","Yes","Flowering","","","","provided","provided","JA"
"1350",7502742,"MW","MICH","specimen","Chelone glabra","Chelone","glabra","8/15/1988",1988,8,15,228,1988228,"flowering","unknown","Y","N"," "," ","","","Michigan","Montmorency","Hillman","Hillman Twp. T31N, R4E, Sec. 23 SE 1/4; S.W. side of dam, E. end of Emrick Park in village of Hillman.",45.061536,-83.903618,400,"N",NA,"Y","Yes","Flowering","","","","locality","best estimate","JA"
"1351",7502743,"MW","MICH","specimen","Chelone glabra","Chelone","glabra","8/27/1988",1988,8,27,240,1988240,NA,"unknown","unknown","unknown"," "," ","","","Michigan","Alcona","","Harrisville Twp, ca 1/2 mi NW village of Harrisville on the Swamp Rd.TRS: T26N R9E sec 11 NW 1/4",44.664692,-83.309928,200,"N",NA,"Y","Not Scorable","","","","","PLSS/locality","best estimate","JA"
"1352",7502744,"MW","MICH","specimen","Chelone glabra","Chelone","glabra","8/22/1950",1950,8,22,234,1950234,NA,"unknown","unknown","unknown"," "," ","","","Michigan","Baraga","","South end of Pequaming Peninsula.",46.84624,-88.382209,1600,"N",NA,"Y","Not Scorable","","","","","provided","provided","JA"
"1353",7502745,"MW","MICH","specimen","Chelone glabra","Chelone","glabra","9/1/1974",1974,9,1,244,1974244,NA,"unknown","unknown","unknown"," "," ","","","Michigan","Oscoda","","Ca. 4 miles northeast of Mio, T27N, R3E, Sect. 28., Swampy ground along Perry Creek",44.703305,-84.08088,1000,"N",NA,"Y","Not Scorable","","","","","PLSS/locality","best estimate","JA"
"1354",7502746,"MW","MICH","specimen","Chelone glabra","Chelone","glabra","8/9/1948",1948,8,9,222,1948222,"flowering","unknown","Y","N"," "," ","","","Michigan","Chippewa","","2.5 miles north of Eckerman.",46.401251,-85.048404,1200,"N",NA,"Y","Yes","Flowering","","","","provided","provided","JA"
"1355",7502747,"MW","MICH","specimen","Chelone glabra","Chelone","glabra","9/14/1937",1937,9,14,257,1937257,NA,"unknown","unknown","unknown"," "," ","","","Michigan","Washtenaw","","5.3 miles N. Ann Arbor",42.347659,-83.726329,11587,"N",NA,"Y","Not Scorable","","","","","town+direction+distance","geolocate","JA"
"1356",7502748,"MW","MICH","specimen","Chelone glabra","Chelone","glabra","9/2/1950",1950,9,2,245,1950245,"flowering","unknown","Y","N"," "," ","","","Michigan","Branch","","Section 24, R 6 W, T 5 S; 2 miles east and one-half mile south of Girard; at crossing of Hog Creek.",42.019879,-84.951997,900,"N",NA,"Y","Yes","Flowering","","","","PLSS/locality","best estimate","JA"
"1357",7502749,"MW","MICH","specimen","Chelone glabra","Chelone","glabra","9/3/1929",1929,9,3,246,1929246,NA,"unknown","unknown","unknown"," "," ","","","Michigan","Schoolcraft","","Dune region between Gulliver Lake and Lake Michigan",45.966032,-86.023479,1175,"N",NA,"Y","Not Scorable","","","","","provided","provided","JA"
"1358",7502751,"MW","MICH","specimen","Chelone glabra","Chelone","glabra","7/31/1949",1949,7,31,212,1949212,NA,"unknown","unknown","unknown"," "," ","","","Michigan","Keweenaw","","south of Eagle Harbor Light House.",47.458999,-88.159107,63,"N",NA,"Y","Not Scorable","","","","","provided","provided","JA"
"1359",7502752,"MW","MICH","specimen","Chelone glabra","Chelone","glabra","8/30/1950",1950,8,30,242,1950242,NA,"unknown","unknown","unknown"," "," ","","","Michigan","Keweenaw","","Outlet to Lake Medora.",47.430939,-87.983481,327,"N",NA,"Y","Not Scorable","","","","","provided","provided","JA"
"1360",7502771,"MW","MICH","specimen","Chelone glabra","Chelone","glabra","7/11/1930",1930,7,11,192,1930192,NA,"unknown","unknown","unknown"," "," ","","","Michigan","Keweenaw","","Isle Royale, Moose Lake, Tobin Harbor",48.142795,-88.512702,166,"N",NA,"Y","Not Scorable","","","","","provided","provided","JA"
"1361",7502773,"MW","MICH","specimen","Chelone glabra","Chelone","glabra","8/18/1981",1981,8,18,230,1981230,NA,"unknown","unknown","unknown"," "," ","","","Michigan","Delta","","Sec 32 T41N-R23W Growing along the bank of the Escanaba River.",44.846231,-84.490829,600,"N",NA,"Y","Not Scorable","","","","","PLSS","best estimate","JA"
"1362",7502774,"MW","MICH","specimen","Chelone glabra","Chelone","glabra","8/20/1961",1961,8,20,232,1961232,NA,"unknown","unknown","unknown"," "," ","","","Michigan","Oscoda","","McKinley Bridge near Mio",44.643352,-83.940669,200,"N",NA,"Y","Not Scorable","","","","","locality","best estimate","JA"
"1363",7502775,"MW","MICH","specimen","Chelone glabra","Chelone","glabra","8/20/1893",1893,8,20,232,1893232,NA,"unknown","unknown","unknown"," "," ","","","Michigan","Kent","Vergennes","",42.988226,-85.372894,4793,"N",NA,"Y","Not Scorable","","","","","provided","provided","JA"
"1364",7502776,"MW","MICH","specimen","Chelone glabra","Chelone","glabra","8/18/1895",1895,8,18,230,1895230,NA,"unknown","unknown","unknown"," "," ","","","Michigan","Ottawa","","Bridge St. Ferry",42.952333,-86.097186,38000,"N",NA,"Y","Not Scorable","","","","","locality","best estimate","JA"
"1365",7502777,"MW","MICH","specimen","Chelone glabra","Chelone","glabra","8/29/1982",1982,8,29,241,1982241,NA,"unknown","unknown","unknown"," "," ","","","Michigan","Alpena","","T29N R9E Sec 24, along Brusseau Rd., public land.",44.885499,-83.36089,5000,"N",NA,"Y","Not Scorable","","",""," Section 24 doesn't exist (lake in the way)","PLSS/locality","best estimate","JA"
"1366",7502778,"MW","MICH","specimen","Chelone glabra","Chelone","glabra","9/22/1915",1915,9,22,265,1915265,NA,"unknown","unknown","unknown"," "," ","","","Michigan","Washtenaw","Ann Arbor","German Park Woods, Ann Arbor",42.357869,-83.677003,200,"N",NA,"Y","Not Scorable","","","","","locality","best estimate","JA"
"1367",7502790,"MW","MICH","specimen","Chelone glabra","Chelone","glabra","8/28/1916",1916,8,28,241,1916241,NA,"unknown","unknown","unknown"," "," ","","","Michigan","Washtenaw","","Near Ypsi. [vicinity of Ypsilanti]",42.24115,-83.612994,3530,"N",NA,"Y","Not Scorable","","","","","town","geolocate","JA"
"1368",7502791,"MW","MICH","specimen","Chelone glabra","Chelone","glabra","8/19/1954",1954,8,19,231,1954231,"flowering","unknown","Y","N"," "," ","","","Michigan","Grand Traverse","","near fork of Boardman River (Sect. 3 & 4, T 26 N, R 9 W)",44.674778,-85.395784,210,"N",NA,"Y","Yes","Flowering","","","PLSS","provided","provided","JA"
"1369",7502792,"MW","MICH","specimen","Chelone glabra","Chelone","glabra","8/21/1984",1984,8,21,234,1984234,"flowering","unknown","Y","N"," "," ","","","Michigan","Marquette","","SW36,T46N,R27W; 12 mi sou of Ishpeming-on Flopper Ck",46.337113,-87.626353,900,"N",NA,"Y","Yes","Flowering","","","","PLSS/locality","best estimate","JA"
"1370",7502793,"MW","MICH","specimen","Chelone glabra","Chelone","glabra","7/1/1910",1910,7,1,182,1910182,NA,"unknown","unknown","unknown"," "," ","","","Michigan","Van Buren","South Haven","",42.403086,-86.273641,3472,"N",NA,"Y","Not Scorable","","","","","town","geolocate","JA"
"1371",7502794,"MW","MICH","specimen","Chelone glabra","Chelone","glabra","9/18/1958",1958,9,18,261,1958261,NA,"unknown","unknown","unknown"," "," ","","","Michigan","Lapeer","Oregon","near South Branch Flint River, NE 1/4 sec. 1, Oregon Tp., ca. 3 mi. SE of Columbiaville.",43.12267,-83.367654,4356,"N",NA,"Y","Not Scorable","","","","PLSS","town+direction+distance+locality","geolocate","JA"
"1372",7502795,"MW","MICH","specimen","Chelone glabra","Chelone","glabra","8/26/1931",1931,8,26,238,1931238,NA,"unknown","unknown","unknown"," "," ","","","Michigan","Keweenaw","","Isle Royale, near Lake Feldman",47.854955,-89.169316,1600,"N",NA,"Y","Not Scorable","","","","","locality","best estimate","JA"
"1373",7502796,"MW","MICH","specimen","Chelone glabra","Chelone","glabra","9/1/1985",1985,9,1,244,1985244,"flowering","unknown","Y","N"," "," ","","","Michigan","Hillsdale","","Adjacent to a gravel driveway on the the right-hand-side of Jerome Road going South (just past the sharp left-hand turn) T5S, R1W, section 19., 80 km SW of Ann Arbor.",42.022047,-84.470058,800,"N",NA,"Y","Yes","Flowering","","","","PLSS/locality","best estimate","JA"
"1374",7502797,"MW","MICH","specimen","Chelone glabra","Chelone","glabra","9/3/1984",1984,9,3,247,1984247,NA,"unknown","unknown","unknown"," "," ","","","Michigan","Lenawee","Raisin","e. of Raisin Center Hwy., s. of golf course, Raisin Twp. R4E, T6S, S10, sw 1/4 of nw 1/4",41.972819,-83.943219,300,"N",NA,"Y","Not Scorable","","","","","PLSS","best estimate","JA"
"1375",7502798,"MW","MICH","specimen","Chelone glabra","Chelone","glabra","8/26/1983",1983,8,26,238,1983238,NA,"unknown","unknown","unknown"," "," ","","","Michigan","Alcona","","T28N R7E Sec 6",44.850369,-83.636406,800,"N",NA,"Y","Not Scorable","","","","","PLSS","best estimate","JA"
"1376",7502799,"MW","MICH","specimen","Chelone glabra","Chelone","glabra","8/18/1950",1950,8,18,230,1950230,"flowering","unknown","Y","N"," "," ","","","Michigan","Houghton","","at Sturgeon Slough east of Chassell.",47.023405,-88.491672,3000,"N",NA,"Y","Yes","Flowering","","","","locality","best estimate","JA"
"1377",7502800,"MW","MICH","specimen","Chelone glabra","Chelone","glabra","9/22/1935",1935,9,22,265,1935265,NA,"unknown","unknown","unknown"," "," ","","","Michigan","Midland","Averill","",43.66568,-84.341937,3000,"N",NA,"Y","Not Scorable","","","","","locality","best estimate","JA"
"1378",7502896,"MW","MICH","specimen","Chelone glabra","Chelone","glabra","9/3/1942",1942,9,3,246,1942246,NA,"unknown","unknown","unknown"," "," ","","","Michigan","Clinton","","vicinity of the Rose Lake Wildlife Experiment Station 13-14-3",42.806638,-84.380085,4300,"N",NA,"Y","Not Scorable","","","","PLSS?","locality","best estimate","JA"
"1379",7502916,"MW","MICH","specimen","Chelone glabra","Chelone","glabra","8/17/1973",1973,8,17,229,1973229,NA,"unknown","unknown","unknown"," "," ","","","Michigan","Alger","","Sec. 15 T47N R18W Pictured Rocks National Lakeshore",46.470364,-86.542497,969,"N",NA,"Y","Not Scorable","","","","PLSS","provided","provided","JA"
"1380",7502917,"MW","MICH","specimen","Chelone glabra","Chelone","glabra","8/1/1989",1989,8,1,213,1989213,NA,"unknown","unknown","unknown"," "," ","","","Michigan","Wexford","Henderson","Henderson Twp. T21N, R11W, Sec. 28 SW 1/4; in Ravine Campground ca. 3 miles S. M-55 and 8 miles E. of Manistee Co. line.",44.18053,-85.65714,300,"N",NA,"Y","Not Scorable","","","","","PLSS/locality","best estimate","JA"
"1381",7502918,"MW","MICH","specimen","Chelone glabra","Chelone","glabra","8/26/1931",1931,8,26,238,1931238,"flowering","unknown","Y","N"," "," ","","","Michigan","Chippewa","","Prentis Bay, L. Huron",45.989628,-84.227586,NA,"N",NA,"Y","Yes","Flowering","","","","provided","","JA"
"1382",7502919,"MW","MICH","specimen","Chelone glabra","Chelone","glabra","8/4/1906",1906,8,4,216,1906216,NA,"unknown","unknown","unknown"," "," ","","","Michigan","Marquette","","Marquette Along railroad toward Mt. Mesnard",46.525848,-87.403532,1150,"N",NA,"Y","Not Scorable","","","","","provided","provided","JA"
"1383",7502920,"MW","MICH","specimen","Chelone glabra","Chelone","glabra","8/5/1918",1918,8,5,217,1918217,NA,"unknown","unknown","unknown"," "," ","","","Michigan","Washtenaw","Superior","Shanghai Pit. Superior Twp",42.273256,-83.646987,525,"N",NA,"Y","Not Scorable","","","","","provided","provided","JA"
"1384",7502921,"MW","MICH","specimen","Chelone glabra","Chelone","glabra","8/22/1922",1922,8,22,234,1922234,NA,"unknown","unknown","unknown"," "," ","","","Michigan","Mackinac","","Whitefish L.",46.176789,-85.762868,4000,"N",NA,"Y","Not Scorable","","","","","locality","best estimate","JA"
"1385",7502922,"MW","MICH","specimen","Chelone glabra","Chelone","glabra","9/15/1933",1933,9,15,258,1933258,NA,"unknown","unknown","unknown"," "," ","","","Michigan","Washtenaw","Ann Arbor","Huron River Drive, Cascade Glen, Ann Arbor",42.301608,-83.756942,200,"N",NA,"Y","Not Scorable","","","","","provided","provided","JA"
"1386",7502923,"MW","MICH","specimen","Chelone glabra","Chelone","glabra","8/4/1926",1926,8,4,216,1926216,NA,"unknown","unknown","unknown"," "," ","","","Michigan","Houghton","","Trillium Swamp [near Laurium]",47.237426,-88.443172,6000,"N",NA,"Y","Not Scorable","","","","","town","geolocate","JA"
"1387",7502924,"MW","MICH","specimen","Chelone glabra","Chelone","glabra","9/11/1838",1838,9,11,254,1838254,NA,"unknown","unknown","unknown"," "," ","","","Michigan","Saint Joseph","","Centreville (Margin of Hog Creek)",41.9286,-85.5286,NA,"N",NA,"Y","Not Scorable","","","","","provided","","JA"
"1388",7502938,"MW","MICH","specimen","Chelone glabra","Chelone","glabra","9/17/1926",1926,9,17,260,1926260,NA,"unknown","unknown","unknown"," "," ","","","Michigan","Branch","Quincy","",41.944214,-84.883852,1659,"N",NA,"Y","Not Scorable","","","","","town","geolocate","JA"
"1389",7502939,"MW","MICH","specimen","Chelone glabra","Chelone","glabra","8/27/1965",1965,8,27,239,1965239,NA,"unknown","unknown","unknown"," "," ","","","Michigan","Marquette","","south side of Tamarack Street, Gwynn.",46.278974,-87.444759,89,"N",NA,"Y","Not Scorable","","","","","provided","provided","JA"
"1390",7502940,"MW","MICH","specimen","Chelone glabra","Chelone","glabra","8/21/1965",1965,8,21,233,1965233,NA,"unknown","unknown","unknown"," "," ","","","Michigan","Schoolcraft","Manistique","between Hwy. 2 and shore of Lake Michigan at eastern city limits of Manistique, Sec. 7, T41N R15W.",45.957705,-86.222442,500,"N",NA,"Y","Not Scorable","","","","","PLSS/locality","best estimate","JA"
"1391",7502941,"MW","MICH","specimen","Chelone glabra","Chelone","glabra","8/20/1892",1892,8,20,233,1892233,NA,"unknown","unknown","unknown"," "," ","","","Michigan","Saint Clair","","Near Port Huron",42.970863,-82.424914,6961,"N",NA,"Y","Not Scorable","","","","","town","geolocate","JA"
"1392",7502942,"MW","MICH","specimen","Chelone glabra","Chelone","glabra","9/1/1896",1896,9,1,245,1896245,NA,"unknown","unknown","unknown"," "," ","","","Michigan","Saint Clair","","",43.016137,-82.648468,52000,"N",NA,"Y","Not Scorable","","","","","county","geolocate","JA"
"1393",7503048,"MW","MICH","specimen","Chelone glabra","Chelone","glabra","8/13/1948",1948,8,13,226,1948226,NA,"unknown","unknown","unknown"," "," ","","","Michigan","Cheboygan","Benton","Sec. 35, Benton Township, Wet ground by Elliott Creek",45.638634,-84.393411,3100,"N",NA,"Y","Not Scorable","","","","PLSS","locality","best estimate","JA"
"1394",7503049,"MW","MICH","specimen","Chelone glabra","Chelone","glabra","8/24/1949",1949,8,24,236,1949236,NA,"unknown","unknown","unknown"," "," ","","","Michigan","Schoolcraft","","Seul Choix Point",45.932172,-85.931451,3000,"N",NA,"Y","Not Scorable","","","","","locality","best estimate","JA"
"1395",7504143,"MW","MICH","specimen","Chelone glabra","Chelone","glabra","7/30/1982",1982,7,30,211,1982211,NA,"unknown","unknown","unknown"," "," ","","","Michigan","Schoolcraft","","Creighton Marsh, T46N, R16W, NE 1/4 SW 1/4 NE 1/4 sec. 12",46.39958,-86.247494,200,"N",NA,"Y","Not Scorable","","","","","PLSS","best estimate","JA"
"1396",7504219,"MW","MICH","specimen","Chelone glabra","Chelone","glabra","7/31/1991",1991,7,31,212,1991212,NA,"unknown","unknown","unknown"," "," ","","","Michigan","Mecosta","Green","on W. side of US-131 at roadside park 1 1/2 mi. N. of village of Paris. Green Twp. T16N, R10W, Sec.9, NE1/4",43.797203,-85.535839,3000,"N",NA,"Y","Not Scorable","","","","PLSS and locality don't match up exactly, used locality","PLSS/locality","best estimate","JA"
"1397",7514948,"MW","MICH","specimen","Chelone glabra","Chelone","glabra","8/30/1994",1994,8,30,242,1994242,NA,"unknown","unknown","unknown"," "," ","","","Michigan","Kalamazoo","","0.7 mi S of Territorial Rd. and 0.2 mi E of 42nd Rd. T2S R9W Sec. 16, SE1/4 SE1/4",42.292142,-85.360004,200,"N",NA,"Y","Not Scorable","","","","","PLSS/locality","best estimate","JA"
"1398",7515999,"MW","MICH","specimen","Chelone glabra","Chelone","glabra","9/10/1996",1996,9,10,254,1996254,NA,"unknown","unknown","unknown"," "," ","","","Michigan","Washtenaw","Ann Arbor","Furstenberg Park in Ann Arbor; north bank of Huron River along boardwalk. Sec. 27, T2S, R6E.",42.278709,-83.707903,500,"N",NA,"Y","Not Scorable","","","","","locality","best estimate","JA"
"1399",7516986,"MW","MICH","specimen","Chelone glabra","Chelone","glabra","9/12/1998",1998,9,12,255,1998255,NA,"unknown","unknown","unknown"," "," ","","","Michigan","Lenawee","Medina","n. of Canandaigua Rd., e. of Bean Cr., Medina Twp. T8S R1E S1, sw qtr of se qtr",41.799718,-84.241802,300,"N",NA,"Y","Not Scorable","","","","","PLSS/locality","best estimate","JA"
"1400",7520223,"MW","MICH","specimen","Chelone glabra","Chelone","glabra","8/14/2002",2002,8,14,226,2002226,NA,"unknown","unknown","unknown"," "," ","","","Michigan","Schoolcraft","Doyle","Doyle Twp., 20' E. of Kelly Road, 4600' N. of U.S. 2. T 42N, R14W, SW 1/4 of NW 1/4 of SW 1/4 of Sec. 28.",46.002021,-86.068633,400,"N",NA,"Y","Not Scorable","","","","PLSS and locality don't match up exactly, used PLSS","PLSS/locality","best estimate","JA"
"1401",7520224,"MW","MICH","specimen","Chelone glabra","Chelone","glabra","9/4/2002",2002,9,4,247,2002247,"flowering","unknown","Y","N"," "," ","","","Michigan","Manistee","Norman","Manistee National Forest: Norman Twp., 1300 feet upstream from old dam on s. side of Pine River; 0.8 mi. s of S.R. 55 and 1.85 mi. e. of Snyder Rd; SE 1/4 of SW 1/4 Sec 16.",44.211618,-85.894553,600,"N",NA,"Y","Yes","Flowering","","","PLSS","locality","best estimate","JA"
"1402",7520440,"MW","MICH","specimen","Chelone glabra","Chelone","glabra","8/21/1947",1947,8,21,233,1947233,NA,"unknown","unknown","unknown"," "," ","","","Michigan","Gogebic","","Island, Big Lake,",46.207963,-89.441535,600,"N",NA,"Y","Not Scorable","","","","","locality","best estimate","JA"
"1403",7521024,"MW","MICH","specimen","Chelone glabra","Chelone","glabra","7/24/1927",1927,7,24,205,1927205,NA,"unknown","unknown","unknown"," "," ","","","Michigan","Oakland","Pontiac","Ox-bow Lake?",42.638922,-83.291047,6819,"N",NA,"Y","Not Scorable","","","","couldn't find locality, used town","town","geolocate","JA"
"1404",7521056,"MW","MICH","specimen","Chelone glabra","Chelone","glabra","9/4/1926",1926,9,4,247,1926247,NA,"unknown","unknown","unknown"," "," ","","","Michigan","Genesee","","Glenwood cemetery, Flint",43.008644,-83.720834,400,"N",NA,"Y","Not Scorable","","","","","locality","best estimate","JA"
"1405",6226428,"MW","MISS","specimen","Chelone glabra","Chelone","glabra","9/11/1967",1967,9,11,254,1967254,NA,"unknown","unknown","unknown"," "," ","","","Mississippi","Marshall","","Wall Doxey State Park.",34.666213,-89.459842,2300,"N",NA,"Y","Not Scorable","","","","","locality","best estimate","JA"
"1406",6243386,"MW","MISS","specimen","Chelone glabra","Chelone","glabra","10/10/1975",1975,10,10,283,1975283,NA,"unknown","unknown","unknown"," "," ","","","Mississippi","Tishomingo","","Tishomingo State Park. Around old CCC pond.",34.605177,-88.194311,400,"N",NA,"Y","Not Scorable","","","","","locality","best estimate","JA"
"1407",6245851,"MW","MISS","specimen","Chelone glabra","Chelone","glabra","9/19/1990",1990,9,19,262,1990262,NA,"unknown","unknown","unknown"," "," ","","","Mississippi","Marshall","","ca 50M from Coldwater River, 4 mi N of Holly Springs, E of Hwy 7",34.844913,-89.417987,2000,"N",NA,"Y","Not Scorable","","","","","town+direction+distance+locality","best estimate","JA"
"1408",6246686,"MW","MISS","specimen","Chelone glabra","Chelone","glabra","9/15/1993",1993,9,15,258,1993258,NA,"unknown","unknown","unknown"," "," ","","","Mississippi","Marshall","","4 mi N of Holly Springs, ca 1 mi east of duck pond, Alluvium on oxbows on Coldwater River",34.825624,-89.448689,9869,"N",NA,"Y","Not Scorable","","","","","town+direction+distance","geolocate","JA"
"1409",6248193,"MW","MISS","specimen","Chelone glabra","Chelone","glabra","10/5/1994",1994,10,5,278,1994278,NA,"unknown","unknown","unknown"," "," ","","","Mississippi","Tippah","","Dumas Lake, Pontotoc Ridge",34.643444,-88.874001,400,"N",NA,"Y","Not Scorable","","","","couldn't find exact locality","locality","best estimate","JA"
"1410",6248593,"MW","MISS","specimen","Chelone glabra","Chelone","glabra","9/5/1995",1995,9,5,248,1995248,NA,"unknown","unknown","unknown"," "," ","","","Mississippi","Chickasaw","","Davis lake, Upper end (W end) of lake.",34.046472,-88.939346,1200,"N",NA,"Y","Not Scorable","","","","","locality","best estimate","JA"
"1411",6248798,"MW","MISS","specimen","Chelone glabra","Chelone","glabra","10/19/1995",1995,10,19,292,1995292,NA,"unknown","unknown","unknown"," "," ","","","Mississippi","Chickasaw","","SE side of Davis Lake., Tombigbee National Forest",34.042694,-88.935551,1500,"N",NA,"Y","Not Scorable","","","","","locality","best estimate","JA"
"1412",6248907,"MW","MISS","specimen","Chelone glabra","Chelone","glabra","5/23/1995",1995,5,23,143,1995143,NA,"unknown","unknown","unknown"," "," ","","","Mississippi","Chickasaw","","W of Oil Well Rd., Tombigbee National Forest",33.99418,-88.945262,14000,"N",NA,"Y","Not Scorable","","","","couldn't find exact locality","locality","best estimate","JA"
"1413",6251669,"MW","MISS","specimen","Chelone glabra","Chelone","glabra","10/12/1966",1966,10,12,285,1966285,NA,"unknown","unknown","unknown"," "," ","","","Mississippi","Lafayette","","Tallahatchie Experimental Forest",34.542225,-89.493219,NA,"N",NA,"Y","Not Scorable","","","","","provided","","JA"
"1414",6256816,"MW","MISS","specimen","Chelone glabra","Chelone","glabra","9/21/1991",1991,9,21,264,1991264,"buds","Y","N","N"," "," ","","","Mississippi","Calhoun","","4 mi NE of Derma. T13S, R1W, S36, NE/4 of the SW/4; just S of S line (qtr section line) of NW/4 along spring branch .",33.912,-89.259,300,"N",NA,"Y","Yes","Flowering","Early","","PLSS","provided","provided","JA"
"1415",6261797,"MW","MISS","specimen","Chelone glabra","Chelone","glabra","9/16/2000",2000,9,16,260,2000260,NA,"unknown","unknown","unknown"," "," ","","","Mississippi","Yalobusha","","Near Haven Hill Baptist Church, 2.1 mi W from CR 141 on CR 222.T24N, R7E, border of S4 &9.",NA,NA,NA,"N",NA,"Y","Not Scorable","","","","PLSS","","","JA"
"1416",6261798,"MW","MISS","specimen","Chelone glabra","Chelone","glabra","10/2/1999",1999,10,2,275,1999275,NA,"unknown","unknown","unknown"," "," ","","","Mississippi","Yalobusha","","Behind Dividing Ridge Church, part of Calhoun Co Wildlife Management Land, T23/24N, border, R7E, NE/4, NE/4, S2 and NW/4, NW/4, S1.",NA,NA,NA,"N",NA,"Y","Not Scorable","","","","PLSS","","","JA"
"1417",6266137,"MW","MISS","specimen","Chelone glabra","Chelone","glabra","10/23/1978",1978,10,23,296,1978296,"fruit","N","N","Y"," "," ","","same day/place, different phenology","Mississippi","Tishomingo","","Tish. St. Park around spring-fed rivulet & pond. T5S R10E S36 NE/4.;Rare and local in moist places around margin of rivulet and pond. Tishomingo State Park",NA,NA,NA,"Y","Y","Y","Yes","Fruiting","","","","","","JA"
"1418",6266361,"MW","MISS","specimen","Chelone glabra","Chelone","glabra","10/3/1998",1998,10,3,276,1998276,"flowering","unknown","Y","N"," "," ","","","Alabama","Barbour","","Barbour County Lake, ca 7 mi S of Comer on Hwy 49; T12N R26E S33 SW/4 of SW/4.;Local colony along drainage area on N shore of lake, corollas white with some pink on opening of corolla, 31.96806, -85.44639",31.96806,-85.44639,NA,"Y","Y","Y","Yes","Flowering","","","check if coords were provided","","","JA"
"1419",5796612,"MW","MISSA","specimen","Chelone glabra","Chelone","glabra","10/5/1996",1996,10,5,279,1996279,"flowering","unknown","Y","N"," "," ","","","Mississippi","Winston","","Tombigbee National Forest; T16N, R12E, S17, the NE/4 of the NE/4 of the SW/4.",34.072,-88.854,NA,"Y","Y","Y","Yes","Flowering","","","PLSS","provided","","JA"
"1420",5796614,"MW","MISSA","specimen","Chelone glabra","Chelone","glabra","9/16/1965",1965,9,16,259,1965259,"flowering","unknown","Y","N"," "," ","","same day/close together, some have different phenology","Tennessee","Blount","","Along Flat Creek between Wolfpen Gap and Emerine Gap.",35.675156,-83.893128,700,"Y","?","Y","Yes","Flowering","","","","locality","best estimate","JA"
"1421",6341639,"MW","MMNS","specimen","Chelone glabra","Chelone","glabra","9/12/1978",1978,9,12,255,1978255,"buds","Y","N","N"," "," ","","","Mississippi","Tishomingo","","W side of Pickwick Reservoir, ca 0.4 mi N of Yellow Creek Port.;;T1S R10E SEC.16",34.99125,-88.25229,100,"Y","?","Y","Yes","Flowering","Early","","PLSS","provided","provided","JA"
"1422",6342067,"MW","MMNS","specimen","Chelone glabra","Chelone","glabra","5/25/1979",1979,5,25,145,1979145,"vegetative","N","N","N","Y"," ","","","Mississippi","Montgomery","","Pine Bluff, Mesic 2nd growth hardwood forest and boggy area, in bogs and seeps.;;T17N R6E SEC. 13",33.341,-89.627,NA,"Y","?","Y","No","","","","PLSS","provided","","JA"
"1423",6342642,"MW","MMNS","specimen","Chelone glabra","Chelone","glabra","4/11/1979",1979,4,11,101,1979101,"vegetative","N","N","N","Y"," ","","","Mississippi","Tishomingo","","Meat Hollow Area;;T1S R10E Sec 24 NW/4 & 23 SE/4",34.98278,-88.20073,100,"Y","?","Y","No","","","","PLSS","provided","provided","JA"
"1424",6343011,"MW","MMNS","specimen","Chelone glabra","Chelone","glabra","5/6/1980",1980,5,6,127,1980127,"vegetative","N","N","N","Y"," ","","","Mississippi","Tippah","","Ca 9 mi E of Ripley. Steep deciduous bluffs and seeps on N-facing slope.;;T4S R5E SEC. 29",34.707,-88.8,NA,"Y","?","Y","No","","","","PLSS","provided","","JA"
"1425",6345370,"MW","MMNS","specimen","Chelone glabra","Chelone","glabra","10/23/1978",1978,10,23,296,1978296,"flowering","unknown","Y","N"," "," ","","same day/place, different phenology","Mississippi","Tishomingo","","Tishomingo State Park (MDWFP).;;SW/4 NE/4 SEC 36 T5S R10E.",34.60569,-88.19376,100,"Y",NA,"Y","Yes","Flowering","","","PLSS","provided","provided","JA"
"1426",6346236,"MW","MMNS","specimen","Chelone glabra","Chelone","glabra","10/1/1966",1966,10,1,274,1966274,"flowering","unknown","Y","N"," "," ","","","Mississippi","Tishomingo","","Rich deciduous woods overlapping Bear Creek in Tishomingo State Park (MDWFP).;;T5S R11E SEC. 31",34.60776,-88.17666,100,"N",NA,"Y","Yes","Flowering","","","PLSS","provided","provided","JA"
"1427",6347200,"MW","MMNS","specimen","Chelone glabra","Chelone","glabra","6/26/1980",1980,6,26,178,1980178,"vegetative","N","N","N","Y"," ","","","Mississippi","Choctaw","","Rich deciduous woods and seeps along steep bluff. On edge of seep.;;T18N R9E S20 SW/4 NE/4",33.40476,-89.37129,NA,"N",NA,"Y","No","","","","PLSS","provided","","JA"
"1428",6348488,"MW","MMNS","specimen","Chelone glabra","Chelone","glabra","10/11/1993",1993,10,11,284,1993284,"flowering","unknown","Y","N"," "," ","","","Mississippi","Monroe","","Amory, Amory boat landing N of Lock A of TN/Tombigbee Waterway; Hwy. 25, 2.5 mi. N of junction w/ US Hwy. 278;;T12S R8E SEC. 29",34.0091,-88.4774,100,"N",NA,"Y","Yes","Flowering","","","PLSS","provided","provided","JA"
"1429",6353043,"MW","MMNS","specimen","Chelone glabra","Chelone","glabra","9/18/1994",1994,9,18,261,1994261,"flowering","unknown","Y","N"," "," ","","","Mississippi","Monroe","","Amory, Boat Landing on N side of town along Tenn./Tom. Waterway;;;T12S R19W S29",34.00884,-88.47674,100,"N",NA,"Y","Yes","Flowering","","","PLSS","provided","provided","JA"
"1430",6362021,"MW","MMNS","specimen","Chelone glabra","Chelone","glabra","10/14/1980",1980,10,14,288,1980288,"flowering","unknown","Y","N"," "," ","","","Mississippi","Tippah","","Roadside park, seeps at base of steep deciduous bluffs ca. 9 mi. E of Ripley;;T4S R5E S29",34.707,-88.8,NA,"N",NA,"Y","Yes","Flowering","","","PLSS","provided","","JA"
"1431",6362365,"MW","MMNS","specimen","Chelone glabra","Chelone","glabra","11/15/2003",2003,11,15,319,2003319,"flowering","unknown","Y","N"," "," ","","","Mississippi","Tishomingo","","Tishomingo State Park. One clump of plants growing at the base of the northern retaining wall on the dam of CCC pond.",34.605177,-88.194311,400,"N",NA,"Y","Yes","Flowering","","","","locality","best estimate","JA"
"1432",6371678,"MW","MMNS","specimen","Chelone glabra","Chelone","glabra","9/19/1985",1985,9,19,262,1985262,"flowering","unknown","Y","N"," "," ","","","Mississippi","Alcorn","","0.2 mi W of Glens on gravel road; wet area in railroad ROW.",34.868,-88.418,NA,"N",NA,"Y","Yes","Flowering","","","","provided","","JA"
"1433",6374291,"MW","MMNS","specimen","Chelone glabra","Chelone","glabra","8/10/2011",2011,8,10,222,2011222,"vegetative","N","N","N","Y"," ","","","Mississippi","Prentiss","","CR at Little Brown Creek, hunting club land.",34.49416667,-88.42305556,NA,"N",NA,"Y","No","","","","","provided","","JA"
"1434",15805229,"MW","MMNS","specimen","Chelone glabra","Chelone","glabra","6/8/2010",2010,6,8,159,2010159,"vegetative","N","N","N","Y"," ","","","Mississippi","Alcorn","","Hwy 350 at Waldrop Creek, north side of road.",34.99022,-88.368099,10,"Y","?","Y","No","","","","","provided","provided","JA"
"1435",10499876,"MW","MO","specimen","Chelone glabra","Chelone","glabra","8/4/1992",1992,8,4,217,1992217,NA,"unknown","unknown","unknown"," "," ","","","New York","Franklin","","South end of Upper St. Regis Lake.",NA,NA,NA,"N",NA,"Y","Not Scorable","","","","","provided","","JA"
"1436",10548413,"MW","MO","specimen","Chelone glabra","Chelone","glabra","9/7/1925",1925,9,7,250,1925250,NA,"unknown","unknown","unknown"," "," ","","","Wisconsin","Sauk","","Open swampy ground, bordering devil's lake, near baraboo.",NA,NA,NA,"N",NA,"Y","Not Scorable","","","","","","","JA"
"1437",10548414,"MW","MO","specimen","Chelone glabra","Chelone","glabra","9/17/1954",1954,9,17,260,1954260,NA,"unknown","unknown","unknown"," "," ","","","Missouri","Madison","","Swampy places in alder thickets along spring branch of wash creek in narrow Valley at base of nw facing sandstone chert wooded slopes, t32n, r8e, sec 27, 1 1/4 Mi e of marquand.",37.428088,-90.148552,900,"N",NA,"Y","Not Scorable","","","","","PLSS/locality","best estimate","JA"
"1438",10548415,"MW","MO","specimen","Chelone glabra","Chelone","glabra","9/5/1925",1925,9,5,248,1925248,NA,"unknown","unknown","unknown"," "," ","","","Illinois","Lake","","In tamarack swamp, near long lake.",42.376327,-88.126792,1600,"N",NA,"Y","Not Scorable","","","","","locality","best estimate","JA"
"1439",10548416,"MW","MO","specimen","Chelone glabra","Chelone","glabra","10/28/1956",1956,10,28,302,1956302,NA,"unknown","unknown","unknown"," "," ","","","Missouri","Butler","","In valley of meander tributary to black river at base of n jutting hills, e and Ne of poplar bluff co club, t25n, r6e, 1 1/2-2 1/2 mi nw of poplar bluff.",36.810855,-90.409949,7000,"N",NA,"Y","Not Scorable","","","","","PLSS/locality","best estimate","JA"
"1440",10548417,"MW","MO","specimen","Chelone glabra","Chelone","glabra","8/31/1993",1993,8,31,243,1993243,NA,"unknown","unknown","unknown"," "," ","","","Michigan","Menominee","","3 miles S on state road 579 from the junction with US highway 2. Ca. 4 miles W of Cunard.",45.697817,-87.666435,1000,"N",NA,"Y","Not Scorable","","","","","locality","best estimate","JA"
"1441",10548418,"MW","MO","specimen","Chelone glabra","Chelone","glabra","9/22/1980",1980,9,22,266,1980266,NA,"unknown","unknown","unknown"," "," ","","","Missouri","Reynolds","","Calcareous wet meadow bordering state hwy 106, t30n, r1e, sw 1/4, sec 29, w part Of ellington.",37.241867,-90.972951,1500,"N",NA,"Y","Not Scorable","","",""," ","locality","best estimate","JA"
"1442",10548420,"MW","MO","specimen","Chelone glabra","Chelone","glabra","9/11/1941",1941,9,11,254,1941254,NA,"unknown","unknown","unknown"," "," ","","","Massachusetts","Suffolk","","Boggy ground about spring, se side of peters hill.",42.29161,-71.127055,NA,"N",NA,"Y","Not Scorable","","","","","locality","","JA"
"1443",10548421,"MW","MO","specimen","Chelone glabra","Chelone","glabra","8/20/1954",1954,8,20,232,1954232,NA,"unknown","unknown","unknown"," "," ","","","Missouri","Stoddard","","Sandy wooded slopes bordering ravines, along and tributary to spring fed creek Near junction of crowley ridge and lowland, on property of mr. Martin, t25n, R11e, nw 1/4 sec 6, 3 1/2 mi se of bloomfield.",36.841755,-89.902003,600,"N",NA,"Y","Not Scorable","","","","","PLSS","best estimate","JA"
"1444",10548422,"MW","MO","specimen","Chelone glabra","Chelone","glabra","8/10/1922",1922,8,10,222,1922222,NA,"unknown","unknown","unknown"," "," ","","","Massachusetts","Suffolk","Jamaica Plain","Wet open ground along bussy brook, arnold arboretum jamaiaca plain.",42.297623,-71.124082,500,"N",NA,"Y","Not Scorable","","","","","locality","best estimate","JA"
"1445",10548423,"MW","MO","specimen","Chelone glabra","Chelone","glabra","8/2/1959",1959,8,2,214,1959214,NA,"unknown","unknown","unknown"," "," ","","","Manitoba","Eastman","","Collected 7 mi w of rennie. Along hwy 4.",49.886374,-95.684857,5000,"N",NA,"Y","Not Scorable","","",""," assuming hwy 4 is hwy 44","town+direction+distance+locality","best estimate","JA"
"1446",10548424,"MW","MO","specimen","Chelone glabra","Chelone","glabra","8/20/1886",1886,8,20,232,1886232,NA,"unknown","unknown","unknown"," "," ","","","Missouri","Jefferson","","",38.261071,-90.537689,35345,"N",NA,"Y","Not Scorable","","","","","county","geolocate","JA"
"1447",10548425,"MW","MO","specimen","Chelone glabra","Chelone","glabra","9/2/1936",1936,9,2,246,1936246,NA,"unknown","unknown","unknown"," "," ","","","Vermont","Chittenden","","About 300 m above sea level on camel's hump, green mts. Near burlington.",44.319547,-72.886328,10000,"N",NA,"Y","Not Scorable","","","","","locality","best estimate","JA"
"1448",10548426,"MW","MO","specimen","Chelone glabra","Chelone","glabra","8/30/1925",1925,8,30,242,1925242,NA,"unknown","unknown","unknown"," "," ","","","Massachusetts","Suffolk","","Arnold arboretum. Borders of pond.",42.302422,-71.119816,NA,"N",NA,"Y","Not Scorable","","","","","locality","","JA"
"1449",10548427,"MW","MO","specimen","Chelone glabra","Chelone","glabra","8/13/1931",1931,8,13,225,1931225,NA,"unknown","unknown","unknown"," "," ","","","New Brunswick","","","Reed's Point, Clifton.",45.355688,-66.019954,14000,"N",NA,"Y","Not Scorable","","",""," couldn’t find exact locality","locality","best estimate","JA"
"1450",10582542,"MW","MO","specimen","Chelone glabra","Chelone","glabra","5/13/1995",1995,5,13,133,1995133,NA,"unknown","unknown","unknown"," "," ","","","Mississippi","Itawamba","","Ca. 1/2 miles south of Turon; Property of John Scwartzendruber; T11S, R9E, S26, E/2 & S25, W/2. Small local population along creek.",34.097019,-88.325042,3479,"N",NA,"Y","Not Scorable","","","","PLSS, couldn't find exact locality","town+direction+distance","geolocate","JA"
"1451",10582543,"MW","MO","specimen","Chelone glabra","Chelone","glabra","9/22/1976",1976,9,22,266,1976266,NA,"unknown","unknown","unknown"," "," ","","","Mississippi","Tishomingo","","25 miles N of Belmont, Bishop bottom, in wet roadside ditch off Hwy. 72.",34.794896,-88.213842,33315,"N",NA,"Y","Not Scorable","","","","couldn't find exact locality","town+direction+distance+locality","geolocate","JA"
"1452",10582544,"MW","MO","specimen","Chelone glabra","Chelone","glabra","9/9/1994",1994,9,9,252,1994252,NA,"unknown","unknown","unknown"," "," ","","","Missouri","Madison","","T32N, R8E, E2, NE4, Sec.27. Smallpox Hollow; north tributary of Wash Creek north of County Rd. 330 paralleling the Madison-Bollinger Co. line and passing into Bollinger County on the north end. Fen along E side of Smallpox Creek.",37.43333,-90.15,NA,"N",NA,"Y","Not Scorable","","","","PLSS","provided","","JA"
"1453",10640827,"MW","MO","specimen","Chelone glabra","Chelone","glabra","9/19/1938",1938,9,19,262,1938262,NA,"unknown","unknown","unknown"," "," ","","","Missouri","Miller","","Along Mill Branch, a tributary of Barren Fork, 4 mi W of Iberia along limestone outcrops at base of small bluffs",38.1,-92.35777,NA,"N",NA,"Y","Not Scorable","","","","","provided","","JA"
"1454",10640828,"MW","MO","specimen","Chelone glabra","Chelone","glabra","6/10/1941",1941,6,10,161,1941161,NA,"unknown","unknown","unknown"," "," ","","","Missouri","Franklin","","1-2 mi NW of Spring Bluff common in wet alluvial thickets at base of dripping N-facing limestone bluffs along Bourbeuse",38.30722,-91.24694,NA,"N",NA,"Y","Not Scorable","","","","","provided","","JA"
"1455",10640829,"MW","MO","specimen","Chelone glabra","Chelone","glabra","8/26/1977",1977,8,26,238,1977238,NA,"unknown","unknown","unknown"," "," ","","","Michigan","Livingston","Marion","Gale Lake. 2 mi. E of Chilson. Marion township.",42.537131,-83.911481,8000,"N",NA,"Y","Not Scorable","","","","gale lake is 2 mi w of chilson","locality","best estimate","JA"
"1456",10640831,"MW","MO","specimen","Chelone glabra","Chelone","glabra","9/28/1975",1975,9,28,271,1975271,NA,"unknown","unknown","unknown"," "," ","","","Missouri","Crawford","","Near Cook Station swampy meadow",37.812822,-91.437925,3036,"N",NA,"Y","Not Scorable","","","","","town","geolocate","JA"
"1457",10640832,"MW","MO","specimen","Chelone glabra","Chelone","glabra","10/31/1988",1988,10,31,305,1988305,NA,"unknown","unknown","unknown"," "," ","","","Missouri","Ripley","","Ca. 2 mi S of U.S. Highway 160 and E of Doniphan on E side of Logan Creek, Thomason Farm swampy area, with royal fern and lizard tail",36.636973,-90.72328,1600,"N",NA,"Y","Not Scorable","","","","couldn't find exact locality","locality","best estimate","JA"
"1458",10701563,"MW","MO","specimen","Chelone glabra","Chelone","glabra","9/6/1993",1993,9,6,249,1993249,NA,"unknown","unknown","unknown"," "," ","","","Missouri","Butler","","Ca. 2 mi N of Highway 160 in Little Black River Valley wet bottomland forest",36.68666,-90.58305,NA,"N",NA,"Y","Not Scorable","","","","","provided","","JA"
"1459",10701564,"MW","MO","specimen","Chelone glabra","Chelone","glabra","9/9/1986",1986,9,9,252,1986252,"flowering","unknown","Y","N"," "," ","","","Missouri","Wayne","","12.0 mi. SE of Greenville Lower Ozark Natural Division; Lake Wappapello State Wildlife Management Area; SW side of Hwy. D just N of parking area for Hattie's Ford access to management area; deep muck fen of ca. 0.4 acre corollas white; some plants sprawling, others erect; abundant; lower stem bare",37.029183,-90.291841,16000,"N",NA,"Y","Yes","Flowering","","","couldn't find exact locality","locality","best estimate","JA"
"1460",10701566,"MW","MO","specimen","Chelone glabra","Chelone","glabra","9/23/1976",1976,9,23,267,1976267,NA,"unknown","unknown","unknown"," "," ","","","Mississippi","Tishomingo","","25 miles N of Belmont, Bishop bottom, in wet roadside ditch off Hwy. 72.",34.794896,-88.213842,33315,"N",NA,"Y","Not Scorable","","","","couldn't find exact locality","town+direction+distance+locality","geolocate","JA"
"1461",10744606,"MW","MO","specimen","Chelone glabra","Chelone","glabra","9/9/2013",2013,9,9,252,2013252,NA,"unknown","unknown","unknown"," "," ","","","Missouri","Saint Louis City","","Grounds of the Missouri Botanical Garden, around Carpenter Butterfly Pavilion.",38.6122222,-90.2611111,NA,"N",NA,"Y","Not Scorable","","","","","provided","","JA"
"1462",10782155,"MW","MO","specimen","Chelone glabra","Chelone","glabra","9/4/1927",1927,9,4,247,1927247,"fruit","N","N","Y"," "," ","","same day/place, different phenology","Indiana","Spencer","","springhead in woods, 2 mi NE of grandview",37.954165,-86.955108,3794,"N",NA,"Y","Yes","Fruiting","","","","town+direction+distance","geolocate","JA"
"1463",10782531,"MW","MO","specimen","Chelone glabra","Chelone","glabra","8/15/2000",2000,8,15,228,2000228,NA,"unknown","unknown","unknown"," "," ","","","Missouri","Franklin","","Ca. 1.0 mi NW of Spring Bluff (T41N R03W S10 Center of SW4) Mississippi River Section of Ozark Border Natural Division; N-facing seepy dolomite bluff on S side of Bourbeuse River, just E of confluence of Hecht Creek; occasional on moist bluff.",38.303887,-91.249792,600,"N",NA,"Y","Not Scorable","","","","","PLSS/locality","best estimate","JA"
"1464",10782568,"MW","MO","specimen","Chelone glabra","Chelone","glabra","8/7/2010",2010,8,7,219,2010219,NA,"unknown","unknown","unknown"," "," ","","","Vermont","Washington","","SW of Waitsfield, E of Sugarbush Village, 3.1 miles S of junction with Mill Brook Road (= VT 17) on VT 100, near trailhead of Mid River Path, then up to ca 1/4 mile N & W off 100, SSW of large reservoir.",44.1438,-72.8447,NA,"N",NA,"Y","Not Scorable","","","","","provided","","JA"
"1465",10782569,"MW","MO","specimen","Chelone glabra","Chelone","glabra","9/19/1893",1893,9,19,262,1893262,NA,"unknown","unknown","unknown"," "," ","","","Missouri","Butler","","Swamps near [Haverville].",36.716417,-90.406556,37864,"N",NA,"Y","Not Scorable","","","","couldn't find locality, used county","county","geolocate","JA"
"1466",10782572,"MW","MO","specimen","Chelone glabra","Chelone","glabra","9/19/1893",1893,9,19,262,1893262,NA,"unknown","unknown","unknown"," "," ","","","Missouri","Saint Louis","","Poplar Bluff.",36.7569444,-90.3927777,NA,"N",NA,"Y","Not Scorable","","","","","provided","","JA"
"1467",10782573,"MW","MO","specimen","Chelone glabra","Chelone","glabra","9/18/1886",1886,9,18,261,1886261,NA,"unknown","unknown","unknown"," "," ","","","Missouri","Jefferson","","Bad rocks appos. Pacific.",38.261071,-90.537689,35345,"N",NA,"Y","Not Scorable","","","","couldn't find locality, used county","county","geolocate","JA"
"1468",10782574,"MW","MO","specimen","Chelone glabra","Chelone","glabra","9/11/1949",1949,9,11,254,1949254,NA,"unknown","unknown","unknown"," "," ","","","Missouri","Wayne","","Swampy meadow in valley of Stanley Creek, T27N, R7E, sect. 18, 6-7 mi. northeast of Wappapello.",36.985341,-90.21033,5653,"N",NA,"Y","Not Scorable","","","","PLSS and locality don't match up, used locality","town+direction+distance+locality","geolocate","JA"
"1469",10782575,"MW","MO","specimen","Chelone glabra","Chelone","glabra","5/27/2014",2014,5,27,147,2014147,NA,"unknown","unknown","unknown"," "," ","","","Missouri","Sainte Genevieve","","Minnith Quadrangle. T35N, R8E, SE, NW, Sec. 12. Ozark Fen along east side of Johns Creek, Mark Twain National Forest Seed Bank vouchers.",37.75097,-90.10552,NA,"N",NA,"Y","Not Scorable","","","","PLSS","provided","","JA"
"1470",10782970,"MW","MO","specimen","Chelone glabra","Chelone","glabra","9/2/2015",2015,9,2,245,2015245,"flowering","unknown","Y","N"," "," ","","picture is of the plant in the wild","Missouri","Franklin","","Shaw Nature Reserve, in wetland 0.2 mi east of wetland trail parking.",38.475,-90.8086,NA,"Y","Y","Y","Yes","Flowering","","","","provided","","JA"
"1471",10782971,"MW","MO","specimen","Chelone glabra","Chelone","glabra","11/4/1987",1987,11,4,308,1987308,NA,"unknown","unknown","unknown"," "," ","","","Mississippi","Clay","","T15S R4E sec. 8 W 1/2, approx. 4.5 mi NE of Montpelier, very rich wooded ravines and bog areas, large sphagnum bog on W side of logging road, infrequent.",33.764051,-88.89233,4661,"N",NA,"Y","Not Scorable","","","","PLSS","town+direction+distance","geolocate","JA"
